title,company,location,site,description,job_url
AWS DevOps Engineer – Dublin (2 days pw onsite),IT Search,"Dublin, County Dublin, Ireland",linkedin,"**AWS DevOps Engineer – Dublin (2 days pw onsite)** My client of mine is a SaaS multinational and has engaged IT Search to speak to a mid level AWS Engineer. * 6\+ years of experience * Knowledge of AWS Services * Exposure to Terraform and Kubernetes * Strong Python coding ability * CI/CD and Pipeline creation Happy to share more detail but the existing team has a high standard of engineer and the role comes with a very strong benefits package and work environment. Please note, we can only accept applications from candidates eligible to work in the EU as our client is unable to offer sponsorship.",https://www.linkedin.com/jobs/view/4413455950
Aircraft Leasing IT Support (On-site),GKR Search and Selection,"Dublin 4, County Dublin, Ireland",linkedin,"We are exclusively recruiting for an aircraft leasing firm which is looking to appoint an IT Support Executive to support the opening and day\-to\-day running of its new Dublin office. The successful candidate will play a key role in providing daily IT support across the office environment while also assisting with broader infrastructure, compliance and technology\-related initiatives. **Responsibilities** * Provide day\-to\-day IT support to office users across hardware, software and connectivity issues * Troubleshoot desktop, laptop and general office technology problems * Manage helpdesk\-style support requests and ensure timely issue resolution * Support the setup and ongoing operation of the Dublin office from an IT perspective * Work closely with the external IT consultant on escalations and project\-related work * Assist with broader IT, compliance and regulatory initiatives across the business * Support technology and infrastructure requirements linked to ongoing business growth * Maintain a proactive and solutions\-focused approach to office IT support Requirements * At least 3 years’ experience within an IT support, desktop support or helpdesk environment * Previous experience supporting users within a corporate office setting * Comfortable working independently and managing day\-to\-day IT issues with minimal supervision * Strong troubleshooting and problem\-solving skills * Excellent communication and interpersonal skills * Ability to prioritise tasks and work effectively within a fast\-paced environment * Experience supporting regulated or financial services environments would be advantageous **The Opportunity** This role offers the opportunity to join a growing international platform at an exciting stage of expansion as it establishes its first Dublin office. The successful candidate will gain exposure to both daily operational support and broader technology, infrastructure and regulatory projects within a collaborative and entrepreneurial environment. The position offers a competitive salary and benefits package, along with strong long\-term career development opportunities. **Application Process** If you are interested in discussing this opportunity further, please apply online or contact GKR Search \& Selection for a confidential conversation. \#ITSupport \#Helpdesk \#DesktopSupport \#TechnologyJobs \#DublinJobs \#IrelandJobs \#OfficeSupport \#InfrastructureSupport \#GKRSearchAndSelection",https://www.linkedin.com/jobs/view/4413702259
Apple Sales Team Member - Dundrum,Select Tech Group,"Dublin, D, IE",indeed,"**Dublin \- Dundrum** **Part\-time role (20 hours per week)** **€14\.15 per hour plus performance related commission** **Full flexibility \- due to store operating hours, we need someone who is available to work during the week, weekends and work late shifts** What **benefits** do you get from working with us? * Passion and drive to succeed and meet required standards and targets. * Commission on Sales * Pension Scheme * Fantastic Employee discounts * Cycle to Work Scheme * Employee Incentives and Discount Schemes * Employee Assistance Programme (EAP) * Extensive Training and Development Programme * Recognition of Long Service The Select Tech Group operates the Select and Blink24 brands in Ireland and the UK. Select is the approved Premium reseller of Apple in Ireland and the UK. We have 19 retail stores across Ireland, England, Scotland and Wales. Our business has a very strong presence in the B2B sector in both the UK and Ireland and in the Education sector in Ireland. We are looking for a dynamic **Part\-time** salesperson in Dundrum store. Showcasing the full Apple product line in a customer\-friendly environment, Select is renowned for providing outstanding customer service. Whether you are a consumer or professional customer, you will enjoy friendly, knowledgeable advice and support at a store conveniently located near you. The training you will receive will give you the enviable position of being the first to hear about new Apple products and initiatives. You will be there to provide the excitement about the products which will naturally drive you to share your knowledge with your team members and customers alike. You will be joining a Team which is extremely driven to not only meet but exceed all sales and service performance goals, all whilst demonstrating your personal ethos of 'no limits'. Above all else you are there to ensure that every customer receives the best experience of shopping with Select from the minute they walk into your store. Your role will be diverse and not just restricted to customer interaction. As an ambitious individual you will welcome opportunities to gain knowledge regarding visual merchandising, product and service knowledge, as well as opportunities to earn and improve sales techniques. With opportunities to further your career, your success will not only be measured by individual productivity and overall store performance, but also by your attitude and attention to detail. If this sounds like a place you would like to work, you are aged 18 or over, have the Right To Work in Ireland, and you can demonstrate your passion, knowledge and determination, then we would like to hear from you. To apply for the role of Store Sales Team Member, please submit you CV. A full\-time position is available and we are looking for full flexiblity in availability due to the store's extended trading hours. **IND1**",https://ie.indeed.com/viewjob?jk=ac331db57c26be3a
Apple Sales Team Member - Dundrum,Select Tech Group,"Dublin, County Dublin, Ireland",linkedin,"**Dublin \- Dundrum** **Part\-time role (20 hours per week)** **€14\.15 per hour plus performance related commission** **Full flexibility \- due to store operating hours, we need someone who is available to work during the week, weekends and work late shifts** What **benefits** do you get from working with us? * Passion and drive to succeed and meet required standards and targets. * Commission on Sales * Pension Scheme * Fantastic Employee discounts * Cycle to Work Scheme * Employee Incentives and Discount Schemes * Employee Assistance Programme (EAP) * Extensive Training and Development Programme * Recognition of Long Service The Select Tech Group operates the Select and Blink24 brands in Ireland and the UK. Select is the approved Premium reseller of Apple in Ireland and the UK. We have 19 retail stores across Ireland, England, Scotland and Wales. Our business has a very strong presence in the B2B sector in both the UK and Ireland and in the Education sector in Ireland. We are looking for a dynamic **Part\-time** salesperson in Dundrum store. Showcasing the full Apple product line in a customer\-friendly environment, Select is renowned for providing outstanding customer service. Whether you are a consumer or professional customer, you will enjoy friendly, knowledgeable advice and support at a store conveniently located near you. The training you will receive will give you the enviable position of being the first to hear about new Apple products and initiatives. You will be there to provide the excitement about the products which will naturally drive you to share your knowledge with your team members and customers alike. You will be joining a Team which is extremely driven to not only meet but exceed all sales and service performance goals, all whilst demonstrating your personal ethos of 'no limits'. Above all else you are there to ensure that every customer receives the best experience of shopping with Select from the minute they walk into your store. Your role will be diverse and not just restricted to customer interaction. As an ambitious individual you will welcome opportunities to gain knowledge regarding visual merchandising, product and service knowledge, as well as opportunities to earn and improve sales techniques. With opportunities to further your career, your success will not only be measured by individual productivity and overall store performance, but also by your attitude and attention to detail. If this sounds like a place you would like to work, you are aged 18 or over, have the Right To Work in Ireland, and you can demonstrate your passion, knowledge and determination, then we would like to hear from you. To apply for the role of Store Sales Team Member, please submit you CV. A full\-time position is available and we are looking for full flexiblity in availability due to the store's extended trading hours. **IND1**",https://www.linkedin.com/jobs/view/4413813520
Apprentice Electrician (4th year),Churchfield Home Services,"Dublin, D, IE",indeed,"**Competitive Hourly Rate \| Full\-Time \| Weekly Pay \| Excellent Benefits** Churchfield Home Services is seeking an **Apprentice Electrician** to join our retrofit and renewable energy delivery team in the **Dublin** area. This role offers a structured and hands\-on pathway to becoming a qualified electrician, working alongside experienced professionals on heat pumps, solar PV, ventilation, and general domestic electrical upgrades. You’ll learn the trade properly — safely, compliantly, and to a high standard. At Churchfield, apprentices are supported with real on\-site experience, clear supervision, and training — giving you the skills and confidence to build a long\-term career in the electrical trade. **What You’ll Do** * Assist qualified electricians with electrical installation, testing, and commissioning works * Prepare tools, materials, and work areas for daily site activities * Observe and learn safe isolation, lockout, and testing procedures * Carry out basic electrical tasks under supervision (cable pulling, containment, fixings, terminations) * Maintain clean, tidy, and safe work areas at all times * Support coordinated works with plumbing and solar PV teams * Follow CHS electrical SOPs, site RAMS, and work instructions * Assist with completion of test documentation under supervision * Participate in toolbox talks, site inductions, and on\-the\-job training **What You’ll Need** * Registered SOLAS Electrical Apprenticeship (or in the process of registering) * Willingness to learn, follow instructions, and develop technical skills * Strong safety awareness and responsible attitude * Reliable, punctual, and team\-focused approach * Valid Safe Pass and Manual Handling (or willingness to complete) * Full, clean B driving licence * Fluent English (spoken and written) **Pay \& Benefits** * Competitive hourly rate * Pension (CWPS): Includes Income Protection \+ €150,000 Death\-in\-Service * Annual Leave: 20 days \+ 10 public holidays * Meal Allowance: €5/day (revenue\-compliant) * Sick, Maternity \& Paternity Pay, Bereavement Leave * Service Awards and Bonus Vouchers * Bike\-to\-Work Scheme, Employee Referral Bonus, and Team Events **Career Growth** Clear progression through the full SOLAS apprenticeship programme to **Qualified Electrician**, with future opportunities to develop into Electrical Supervisor, or Senior Electrical Supervisor roles. **Why Join Us** Join one of Ireland’s leading retrofit contractors delivering safe, modern, and energy\-efficient electrical solutions. You’ll work in a professional, supportive team that values proper training, safety, and quality — helping build the skills needed for a secure and respected trade career. Job Types: Full\-time, Apprenticeship Pay: €21\.65 per hour Application question(s): * Do you have valid a Safe Pass? * Do you have a valid Manual Handling certificate? Licence/Certification: * Driving Licence (preferred) Work Location: In person",https://ie.indeed.com/viewjob?jk=90b45246772a7a8c
Assistant / Graduate Quantity Surveyor – Rail,AtkinsRéalis,"Dublin, County Dublin, Ireland",linkedin,"**Overview** Join us in our Rail team on some of the most exciting and prestigious rail projects in Ireland. Work with us and play a central role in making exciting projects and programmes a reality. As part of a friendly, collaborative team, you'll be valued equally – and together, we'll deliver excellence for people and the environment. You'll also enjoy all the training and progression you need to take you through the glass ceiling. We encourage our people to find a work\-life balance that helps them thrive. So, ask us how our flexible and remote working policies can support your priorities. We hear and recognise all our people's different perspectives. Some of our recent pledges have been for Women's'Equality and being a 'Disability Confident' and 'Inclusive Employer.' Having achieved exciting and sustained growth and with further growth potential, we are looking to recruit more talent to bolster our client development and delivery teams in Ireland. We are looking for an Assistant / Graduate Quantity Surveyor to support the continued growth of our Rail business in Ireland. Based in Dublin, the successful candidate will play a key role in the commercial management and delivery of major rail infrastructure projects, working collaboratively with multidisciplinary teams and key clients across the transport sector. This role offers the opportunity to contribute to some of Ireland's most significant rail and public transport programmes while progressing your career within a global engineering and professional services organisation. The individual must be ambitious, wanting to progress within our business and will play a key role in supporting the growth of our Business Unit. The role will involve the commercial and contractual delivery of complex rail projects in Ireland. This is a hands‑on role where you develop core Quantity Surveying skills such as reporting, valuation, change control and contract administration whilst getting key NEC4 contract experience in a live and complex environment. The position is ideally suited to a recent graduate or an assistant\-level quantity surveyor looking to develop technical, commercial, and project delivery skills while progressing toward professional chartership. Your role * Support the commercial and cost management of rail projects across various stages of the project lifecycle. * Assist with the preparation of cost estimates, budgets, financial reports, and forecasts. * Contribute to CVRs, cash‑flow, earned value, and monthly project commercial reports; keep data quality high for internal and client reporting. * Support procurement activities, including preparation of tender documentation and tender evaluations. * Assist with contract administration, including valuations, EWNs, change control, maintaining registers, and final accounts. * Assist with subcontract administration including drafting instructions, scope, review subcontractor applications, and maintaining contract correspondence. * Maintain accurate commercial records and contribute to project reporting requirements. * Support Senior Commercial staff and Project Managers in day\-to\-day cost control and commercial activities. * Attend project meetings and liaise with internal teams, Clients, and Contractors as required. * Contribute to risk management, value engineering, and cost assurance processes. * Actively engage in learning, training, and development opportunities, including progress toward professional accreditation. **About You** * Degree (or near completion) in Quantity Surveying, Construction Economics, Commercial Management, or a related discipline. * Strong interest in infrastructure and transportation projects, ideally Rail. * Good numerical, analytical, and organisational skills. * Ability to work collaboratively within a team environment. * Strong written and verbal communication skills. * Strong IT skills including competency in Microsoft Office applications (Excel, Word, etc.). * A Commercial acumen and mindset. * A flexible approach with ability to be able to multi task and prioritise when necessary. * Hold a full driving licence. * Right to work in Ireland. **Desirable Attributes** * Relevant work placement or post\-graduate experience within a consultancy or contractor environment. * Familiarity with construction contracts (e.g. NEC, FIDIC, GCCC PWC). * Knowledge of the Irish construction and infrastructure markets. * Interest in working toward SCSI / RICS chartership. **Personal qualities** * Excellent interpersonal, verbal and written communication skills. * Flexible approach with ability to be able to multi‑task and prioritise when necessary. * Positive outlook and approachable manner. * Well‑motivated, able to work alone or as part of a team when required. Rewards \& benefits Explore the rewards and benefits that help you thrive – at every stage of your life and your career. Enjoy competitive salaries and a brilliant range of health, wellbeing, financial and lifestyle benefits. Make the most of a myriad of opportunities for training and professional development to grow your skills and expertise. And combine our hybrid working culture, international remote working opportunities, and flexible holiday allowances to balance a great job and fulfilling personal life. Be rewarded. Find out more. **About AtkinsRéalis** We're AtkinsRéalis, a world\-class engineering services and nuclear organization. We connect people, data and technology to transform the world's'infrastructure and energy systems. Together, with our industry partners and clients, and our global team of consultants, designers, engineers and project managers, we can change the world. We're committed to leading our clients across our various end markets to engineer a better future for our planet and its people. Find out more. Additional information We are committed to creating a culture where everyone feels that they belong \- a place where we can all be ourselves, thrive and develop to be the best we can be. So, we offer a range of family friendly, inclusive employment policies, flexible working arrangements and employee resource groups to support all employees. As an Equal Opportunities Employer, we value applications from all backgrounds, cultures and ability.",https://www.linkedin.com/jobs/view/4409919604
