title,company,location,site,description,job_url
Enterprise Solution Architect,Vanta,"Dublin, County Dublin, Ireland",linkedin,"At Vanta, our mission is to help businesses earn and prove trust. We believe that security should be monitored and verified continuously, and we empower companies to practice better security and prove it with ease. Vanta has a kind and talented team, and while some have prior security experience, many have been successful at Vanta without it. As a Solution Architect at Vanta, you will play a pivotal role in securing the technical win and designing a solutions blueprint for our largest and most strategic global Enterprise prospects. Our team is dedicated to ensuring our Enterprise prospects can achieve seamless and successful implementations by validating their technical fit, identifying technical risks, and capitalising on opportunities for custom technical solutions. We strive to provide exceptional technical guidance and support to unblock deals and drive revenue growth. You will be the technical lead for our Enterprise deals, working closely with the Solutions Engineering team to understand their requirements, design solutions, and oversee technical validation. You will collaborate with cross\-functional teams, including Sales, Product, Engineering, and Customer Success, to ensure our clients’ success. **What you’ll do as a Solutions Architect at Vanta:** * Partner with Enterprise AEs and AMs to secure the technical win on Vanta’s most complex, strategic deals. * Lead Discovery and Architecture Workshops to deep\-dive into prospect tech stacks and identify technical blockers. * Collaborate with account teams to prove technical feasibility and eliminate risk. * Provide expert guidance on Vanta’s platform and API capabilities, best practices, and integration strategies. * Design comprehensive Technical Success Plans that map Vanta’s platform to complex customer architectures. * Act as the ‘Voice of the CISO’ by consolidating strategic product gaps and collaborating with Product and Engineering teams to influence product enhancements and address strategic feedback. **How to be successful in this role:** * Minimum of 5\+ years of technical experience, as well as 3\+ years being in a pre\-sales role as a Solution Architect, Sales Engineer, or similar pre\-sales technical role, preferably within the security or compliance industry supporting large Enterprise customers. * You have a solid understanding of the application development lifecycle and RESTful API design concepts, with considerable experience in scripting against APIs or building API\-based integrations. * Strong technical background, with proficiency in security protocols, cloud infrastructure, and software integration. * You thrive in dynamic environments where ambiguity is common * Excellent communication and interpersonal skills, with the ability to articulate complex technical concepts to non\-technical stakeholders. * Excellent project management skills and proven track record of successfully managing complex technical sales cycles, running Proof of Concepts (POCs), and driving technical validation. * Understanding of sales methodologies (e.g., MEDDPICC) and how to map technical solutions to business value. * Ability to work collaboratively with cross\-functional teams and manage multiple projects simultaneously. * Experience in GRC (Governance, Risk, and Compliance) is a strong plus. * Relevant certifications (e.g., CISSP, CISM, AWS Certified Solutions Architect/Azure Solution Architect Professional/Google Professional Cloud Architect) are a plus. * Proficiency in one or more of the following languages is a plus: Python, Java, C\#, Ruby, or .NET. * Open to using AI to amplify their skills and strengthen their work \- demonstrating curiosity, a willingness to learn, and sound judgment in applying AI responsibly to improve efficiency and impact. **What you can expect as a Vanta’n:** * Industry\-competitive salary and equity * 100% covered medical, dental, and vision benefits with dependents coverage * 16 weeks paid Parental Leave for all new parents * Health \& wellness stipend * Remote workspace, internet, and mobile phone stipend * Commuter benefits for team members who attend the office * Pension matching * 25 days of Annual Leave per year and unlimited sick time * 8 company\-paid holidays * Virtual team building activities, lunch and learns, and other company\-wide events! * Offices in SF, NYC, London, Dublin, Tel Aviv, and Sydney *At Vanta, we are committed to hiring diverse talent of different backgrounds and as such, it is important to us to provide an inclusive work environment for all. We do not discriminate on the basis of race, gender identity, age, religion, sexual orientation, veteran or disability status, or any other protected class. As an equal opportunity employer, we encourage and welcome people of all backgrounds to apply.* **About Vanta** We started in 2018, in the wake of several high\-profile data breaches. Online security was only becoming more important, but we knew firsthand how hard it could be for fast\-growing companies to invest the time and manpower it takes to build a solid security foundation. Vanta was inspired by a vision to restore trust in internet businesses by enabling companies to improve and prove their security. From our early days automating security monitoring for compliance standards like SOC 2, HIPAA and ISO 27001 to creating the world's leading Trust Management Platform, our vision remains unchanged. Now more than ever, making security continuous—not just a point\-in\-time check— is essential. Thousands of companies rely on Vanta to build, maintain and demonstrate their trust— all in a way that's real\-time and transparent. **Referral Instructions** If you are being referred for the role, please contact that person to apply on your behalf.",https://www.linkedin.com/jobs/view/4390952626
Financial and Regulatory Reporting Analyst,BNP Paribas,"Dublin, County Dublin, Ireland",linkedin,"**Job Title** : Financial and Regulatory Reporting Analyst **Business Unit** : BNP Paribas Security (BP2S) Operations **Contract Type** : Permanent **Location** : Sandyford, Dublin/Parkmore, Galway (Hybrid) **Why work with us?** We are the bank for a changing world and we aim to build positive change together: * We are a team of colleagues who are enthusiastic about what we do and the impact our work has on our clients. We work in a highly collaborative, open\-minded environment that embraces innovation and creativity + We offer competitive remuneration and a comprehensive benefits package, including a discretionary bonus scheme, company pension contribution, comprehensive private healthcare packages, health and fitness subsidy, work\-from\-home subsidy, above statutory days of annual leave and numerous other benefits. + We are strongly committed to wellbeing and work\-life balance, including a 50% hybrid work model (where the role allows), paid family leave, fertility and menopause support — available to support all life stage needs. + Equality, diversity and inclusion are at the core of our culture, and we actively promote equal opportunities through creating or being part of initiatives and programmes: + Aspire Female Leadership Programme, provides development and exposure to high\-potential women in the bank, through targeted workshops, executive coaching and formal mentoring + Proud members of 100 Women in Finance and among the first signatories of Ireland’s Women in Finance charter + Joined the \#JamaisSansElles (Never Without Her) Charter, committing its executive committee to only join public or media events with panels of three or more speakers, if at least one of those speakers is a woman + Development and mobility are actively encouraged. BNP Paribas’ culture is built on purposeful talent development and recognition programmes that foster engagement, inclusive leadership and continuous growth. A few of our programmes include: + Leaders for Tomorrow, a programme that fast\-tracks high\-potential talent through training, development and cross\-functional projects, preparing them for future leadership positions + Local and Global Mentoring initiatives, that pair employees with senior leaders, providing staff with platforms to gain advice on career growth topics + Ambassador Awards employee recognition scheme provides rewards to those who have embodied the Bank’s core values + Local Experts (Champions) Programme, identifying internal subject\-matter experts from specific business areas, who excel at their craft + We are a global company operating in over 60 countries with over 180,000 employees from over 150 nationalities. In Ireland we have approximately 550 employees across Dublin and Galway, working in Corporate Institutional Banking (CIB) and BNP Paribas Security Services (BP2S) and Greenval **Equality and Diversity** BNP Paribas is an equal opportunities employer and proudly cultivates a diverse workforce. We believe that diversity of experience enhances our service offering to clients and leads to a better working environment. We welcome applications from the best candidates regardless of age, ethnicity, gender, gender identity, nationality, disability, sexual orientation, socio\-economic background, parental and caring status, or religious belief. Our Employee Resource Groups (ERGs) play a key role in promoting diversity and inclusion through initiatives, events and advocacy programmes that foster a sense of belonging for all colleagues. In BNP Paribas Ireland, we have dedicated networks for parents and caregivers, LGBTQA\+, staff from diverse cultural and religious backgrounds, alongside forums to discuss CSR and gender related topics. **Sustainable Finance** BNP continues to demonstrate the Bank’s steadfast commitment to supporting its clients in their growth ambitions by expanding market reach across assets, delivering excellence in bond markets, and showing the way in sustainable financing. **Role** * This role sits in the BNP Paribas Securities Services division (BP2S) * As a key member of the team, the objective of this role is to assist in the production of the financial and regulatory reporting obligations of the funds we administer * The core responsibilities require some subject matter expertise with attention to detail, quality control and excellent service delivery * The team works closely with the Operations functions to ensure successful delivery of financial and regulatory reporting deliverables * It is an exciting opportunity for someone with experience in fund administration and an interest in financial/regulatory reporting to be involved with a growing service within our Fund Administration business **K** **ey Responsibilities** * To assist in production of financial and regulatory reporting team obligations (Financial Reporting and Regulatory Reporting) * Ensure all financial reporting procedures are adhered to and ensure compliance with internal and external regulations * To assist in efficiently planning the financial statement preparation and audit process in conjunction with all relevant parties, ensuring that agreed timelines are achieved * Assist with the workflows for all audit engagements, act as both an internal reference and escalation point for audit issues * To keep up to date with all relevant regulatory and accounting changes and assist with re\-engineering of processes where necessary * To liaise with clients and auditors to ensure that the financial statements are audited and filed with the relevant regulatory bodies and Stock Exchanges on a timely basis * Assist with ensuring effective oversight of outsourcing vendors in accordance with Outsourcing Policy and to ensure high service levels are maintained * Preparation and review of client CBI regulatory returns (DIFR, MMIF, Monthly NAV return etc.) * Other ad hoc projects **Qualifications \& Experience Required For This Role** * Finance/Business graduate, Qualified/Part qualified Accountant (ACA, ACCA, CPA or CIMA) an advantage * Minimum of 3 years’ experience working in a financial reporting department, audit experience or fund administration roles * Understanding of accounting standards, primarily IFRS, US GAAP and FRS 102 a benefit * Be able to take responsibility and resolve issues as they arise * Ability to work to tight deadlines * Excellent organisational and Microsoft office skills * Knowledge of Fund Accounting/Investor Services or other accounting platforms an advantage * Excellent communication skills **About BNP Paribas** At BNP Paribas, we center our values on what drives the company forward. Our driving forces are: * Agility: we want to behave more simply to embrace useful innovation and digital transformation * Client Satisfaction: we believe that our success lies in being the customers’ and clients’ preferred choice. We seek to listen carefully to them and work closely with them * Compliance Culture: We believe in promoting clear rules to foster a strong culture of compliance and ethics * Openness: We promote open\-minded attitudes towards our stakeholders. We aim for everyone in Group to feel included, to have their say and be empowered **Our Strengths Are Based On Four Key Areas** * Stability: we build upon our solid, long\-term oriented management, our diversified and integrated business model and our international footprint * Expertise: We build upon our recognized and expanding knowledge of our teams * Responsibility: We build upon our culture of responsibility and integrity to ever better serve the interest of our customers * Good Place to Work: We foster a stimulating workplace where people are treated fairly and with respect **Management excellence** BNP continues to foster top\-class people management practices within our strong people focused culture. BNP Paribas managers follow the Group’s Management Charter, which emphasises a positive, empowering team culture, encouraging open communication and supporting development and wellbeing. **Compliance Culture** We believe in promoting clear rules to foster a strong culture of compliance and ethics. We would expect any incoming member of staff to respect all financial security related legislation, including anti\-money laundering (AML); countering the financing of terrorism (CFT); international financial sanctions and embargoes (IFS); anti\-bribery and corruption (ABC); KYC; ongoing client related data screening; and transaction monitoring. BNP Paribas have clear policies on these topics which all staff are expected to familiarise themselves with upon successful entry to the Group. Should you require any reasonable accommodation for the interview process, please let us know. By submitting your application, you agree to BNP Paribas completing a background check and screening in advance of any potential offer being made.",https://www.linkedin.com/jobs/view/4349038072
Full Stack Software Engineer II - Guest Engagement,Toast,"Dublin, County Dublin, Ireland",linkedin,"Toast creates technology to help restaurants and local businesses succeed in a digital world, helping business owners operate, increase sales, engage customers, and keep employees happy. We’re seeking a Software Engineer to work within our team focused on building impactful capabilities that empower restaurants to drive Guest engagement, retention and growth. The team will help shape the future of how restaurants use technology to connect with their guests \- increasingly through AI\-powered tools and experiences that drive automation, personalization and smarter decision\-making. You will be a key part of a high\-impact, high\-ownership engineering team solving complex challenges in a fast\-moving product space. Your role will balance technical excellence alongside a strong product mindset to solve for continuous growth within both the team and our product space. **A Day In The Life (Responsibilities)** * Deliver projects that deeply connect restaurants with their guests within a cross\-functional collaborative and supportive environment. * Design, build, deploy and maintain highly resilient and scalable systems critical to our customers’ success. * Collaborate with team members and other engineers across the company. * Monitor feature rollouts to ensure customer success, iterating and improving when necessary. * Advocate for best coding practices, raising the bar for yourself, your team and the company. * Leverage cutting edge AI tools to enhance your development workflow, improve velocity, and help pioneer new approaches to building \- contributing to a culture of innovation and productivity across the team. **What You'll Need To Thrive (Requirements)** * Driven by impact and solving for the customer * Proficient in Java, Kotlin, or similar object\-oriented languages * Experience with modern web technologies and UI frameworks (e.g., React, Javascript , TypeScript, REST, GraphQL) * Enjoys building well\-engineered, usable and accessible systems * Ability to break down problems and communicate solutions clearly throughout cross\-functional teams. * Values personal and team growth, balancing task completion with platform stability. **Our Tech Stack** * A core of Java \& Kotlin based backend services. * React SPAs leveraging Tailwind, GraphQL and Storybook. * Android app built in Java \& Kotlin running in the restaurant. * PostgreSQL, Dynamodb for persistence. * Pulsar, Camel and RabbitMQ for message\-based integrations. * And many more technologies that help us build a top class platform. * This role requires a minimum of two days per week in our Dublin office\*\* **\#BI\-Hybrid** **AI at Toast** At Toast, one of our company values is that we're hungry to build and learn. We believe learning new AI tools empowers us to build for our customers faster, more independently, and with higher quality. We provide these tools across all disciplines, from Engineering and Product to Sales and Support, and are inspired by how our Toasters are already driving real value with them. The people who thrive here are those who embrace changes that let us build more for our customers; it’s a core part of our culture. **Our Total Rewards Philosophy** We strive to provide competitive compensation and benefits programs that help to attract, retain, and motivate the best and brightest people in our industry. Our total rewards package goes beyond great earnings potential and provides the means to a healthy lifestyle with the flexibility to meet Toasters’ changing needs. Learn more about our benefits at https://careers.toasttab.com/toast\-benefits. **How Toast Uses AI In Its Hiring Process** Throughout the hiring process, our goal is to get to know you. We use AI tools to support our recruiters and interviewers with tasks like note\-taking, summarization, and documentation of interviews to ensure they can be fully focused on your conversation. All hiring decisions are made by people. To learn more: https://careers.toasttab.com/ai\-in\-hiring ****Diversity, Equity, and Inclusion is Baked into our Recipe for Success**** At Toast, our employees are our secret ingredient—when they thrive, we thrive. The restaurant industry is one of the most diverse, and we embrace that diversity with authenticity, inclusivity, respect, and humility. By embedding these principles into our culture and design, we create equitable opportunities for all and raise the bar in delivering exceptional experiences. **We Thrive Together** We embrace a hybrid work model that fosters in\-person collaboration while valuing individual needs. Our goal is to build a strong culture of connection as we work together to empower the restaurant community. To learn more about how we work globally and regionally, check out: https://careers.toasttab.com/locations\-toast. **Apply today!** Toast is committed to creating an accessible and inclusive hiring process. As part of this commitment, we strive to provide reasonable accommodations for persons with disabilities to enable them to access the hiring process. If you need an accommodation to access the job application or interview process, please contact candidateaccommodations@toasttab.com. - *For roles in the United States, it is unlawful in Massachusetts to require or administer a lie detector test as a condition of employment or continued employment. An employer who violates this law shall be subject to criminal penalties and civil liability.*",https://www.linkedin.com/jobs/view/4391786362
