title,company,location,site,description,job_url
Engineering Resource Coordinator,Ethos Engineering,"Dublin, County Dublin, Ireland",linkedin,"**About The Job** The Engineering Resource Coordinator plays a key operational support role within the Engineering Studio, helping to coordinate employee, resource and development activities across a fast\-paced, project\-based environment. The role works closely with employees, studio leadership, HR and operational stakeholders to support the smooth coordination of people, onboarding, training and resource activities within a rapidly evolving business environment. This role is best suited to someone who enjoys working in a dynamic, collaborative and highly coordinated environment, is comfortable managing changing priorities, and values regular in\-person collaboration as part of day\-to\-day team operations. **About You** * Minimum 3 years’ experience in resource coordination, workforce planning, project coordination, operations support, or a similar role within a fast\-paced and dynamic environment. * Experience working within a matrix or project\-based organisation, where priorities, teams and business demands regularly shift. * Strong organisational and coordination skills, with the ability to manage multiple competing priorities and maintain structure in a fast\-moving environment. * Excellent verbal and written English communication skills, with the ability to build effective working relationships across multiple stakeholders, teams and levels of the organisation. * Comfortable working in a highly collaborative environment with regular in\-office interaction and cross\-functional coordination. * Proactive and solutions\-focused, with strong attention to detail and the ability to work independently within established processes and frameworks. * Comfortable managing a high level of coordination activity, employee interaction and changing operational requirements. * Experience supporting onboarding, training coordination, people operations or employee development activities would be an advantage. * Proficiency in Microsoft Office and resource planning systems preferred. * A degree in a related discipline is beneficial but not essential. Relevant experience and capability will also be considered. **Your Key Day\-to\-Day Activities** * Coordinate day\-to\-day resource and employee coordination activities across the Engineering Studio, helping to maintain visibility, organisation and consistency across teams. * Act as a key operational point of contact for employees within the Engineering Studio, supporting communication, coordination and employee queries. * Coordinate talent processes, including performance and reward cycles, ensuring activities are organised, tracked and completed in a timely and consistent manner. * Support onboarding activities for new employees in Ireland and internationally, helping to ensure a smooth and well\-coordinated employee experience. * Coordinate training and development activities for junior engineers, liaising with managers and stakeholders to support learning needs and scheduling requirements. * Maintain accurate employee, resource and coordination records across relevant systems and trackers. * Work closely with studio leadership, HR, Talent Acquisition and operational stakeholders to support changing business and resource requirements. * Support the implementation of people and resource initiatives across the Engineering Studio. * Assist in identifying coordination issues, scheduling conflicts or resource challenges and escalate where appropriate. * Contribute to continuous improvement of coordination, onboarding and people support processes. * Support a collaborative and engaged studio environment through regular in\-person interaction and day\-to\-day coordination with teams across the business. ****Why Join Us?**** At Ethos, we’re dedicated to fostering an environment that encourages both **technical excellence and personal wellbeing** . **We offer:** * Flexible Fridays and a 9\-day fortnight working schedule — enjoy every second Friday off to maintain work–life balance. * A culture that values flexibility, learning, and teamwork, with clear progression pathways and support toward professional accreditation. * Opportunities to work alongside some of the most experienced engineers in the industry, within a forward\-thinking, technology\-driven consultancy. **Benefits:** * Flexible working times * 20 Days holidays up to 25 days * Pension Scheme * Working travel out\-of\-pocket expenses * Travel tax scheme or bike\-to\-work scheme * Regular training/mentoring / further college support * Support for Chartership * Subsidised Health Insurance Allowance * A Professional Subscription Fee paid by the company * Paid Statutory Leaves * Healthcare check\-ups and flu vaccinations * Gym / Fitness membership * Heavily subsidised social committee (5 a side, golf society, climbing club and regular social events) Our vision is to: “ **Be the company people want to work with, and for** ” Our values differentiate and focus us every day to be EPIC \- for our people and our customers.",https://www.linkedin.com/jobs/view/4410352282
Enterprise Account Executive,Protex AI,"Dublin, County Dublin, Ireland",linkedin,"**Protex AI is the AI Safety and Operations Intelligence Company.** At Protex AI, we are at the forefront of AI\-driven computer vision, building a safer, smarter industrial workplace with an intelligent operating system that redefines how facilities operate. Backed by top\-tier global investors, we recently secured a $36 million Series B to accelerate our mission. Industry leaders like DHL, Amazon, and Tesla trust Protex AI to drive measurable safety improvements, achieving an average 64% risk reduction within just three months of deployment. Operating in 20\+ countries, Protex is the go\-to safety partner for Fortune 500 manufacturing and logistics enterprises, transforming workplace safety with real\-time, AI\-powered insights. **The Opportunity** We're looking for a driven and results\-oriented **Enterprise Account Executive** to join our growing team. This isn't just a sales role; it's a chance to make a tangible impact by introducing our innovative solution to new enterprise clients while also nurturing and expanding relationships within our existing customer base. You'll be a key player in accelerating our growth, owning the full sales cycle from initial engagement to successful close, and identifying opportunities for expansion within accounts. **What You'll Do** * Drive New Business Acquisition: Own the entire sales process for enterprise accounts, from strategic prospecting and lead generation to contract negotiation and closing. You'll work closely with our marketing team to develop and execute targeted outbound campaigns that resonate with key safety stakeholders. * Cultivate and Expand Existing Relationships: Collaborate with our Customer Success team to foster strong, lasting partnerships with current clients. Identify and capitalize on upsell and cross\-sell opportunities, ensuring high customer satisfaction and maximizing lifetime value. * Engage Key Stakeholders: Connect with multiple decision\-makers responsible for health and safety in large industrial, manufacturing, and production environments. You'll skillfully navigate complex organizational structures to build consensus and drive deals forward. * Achieve and Exceed Targets: Consistently meet and exceed quarterly new business and expansion revenue goals, demonstrating your ability to close significant deals. * Represent Protex AI: Attend and actively participate in relevant Health and Safety conferences and expos across Europe, showcasing our platform and generating new business opportunities. * Leverage Sales Technology: Utilize tools like HubSpot and LinkedIn Sales Navigator to optimize your sales process, manage your pipeline efficiently, and ensure a data\-driven approach to your work. **What You'll Bring** * Proven Sales Acumen: 5\+ years of experience in a full\-cycle sales role, ideally selling B2B software to enterprise clients. While experience selling Health and Safety software into industrial or manufacturing sectors is a plus, your track record of success is paramount. * Consistent Overperformance: A demonstrated history of exceeding sales targets and outperforming peers. You're motivated by results and have a relentless drive to win. * Exceptional Closing Skills: You're a natural closer, energized by the pursuit and successful sealing of new business deals. You're tenacious, resourceful, and committed to achieving your objectives. * Entrepreneurial Mindset: You're a self\-starter who thrives in a fast\-paced, dynamic environment. You don't wait to be ""spoon\-fed"" and are proactive in developing and refining your own sales strategies. * Outstanding Communication \& Collaboration: Excellent verbal and written communication skills. You're a genuine ""people person"" who quickly builds rapport and seamlessly collaborates with internal teams (marketing, customer success, product) to deliver an exceptional customer experience. * Tech\-Savvy: Comfortable and proficient with modern sales tools and CRM systems like HubSpot and LinkedIn Sales Navigator. **Our Perks \& Benefits** * Competitive Compensation \& Equity: Participate in our Employee Share Option Programme and truly share in our success. * Work\-Life Balance: Enjoy Truly Unlimited Holidays and the flexibility of Nomad Working for 20 Days each year. * Comprehensive Well\-being: Access a dedicated Wellbeing Allowance to support your personal health. * Future Planning: Secure your future with our Pension Scheme. * Team Fun: Join us for Monthly Company Events to connect and celebrate successes. * Tools for Success: Company Laptop \& Company Swag to get you set up right. Ready to help us build a safer future? If you're an ambitious and strategic sales professional who thrives on both hunting new logos and expanding existing partnerships, we want to hear from you! Protex AI is an inclusive and equal opportunities employer. We are committed to creating an equitable workplace for everyone regardless of gender, civil status, family status, sexual orientation, religion, age, disability, education level, or race.",https://www.linkedin.com/jobs/view/4401767274
Environmental Officer,Gaia Talent,"Dublin, County Dublin, Ireland",linkedin,"**Title:** Environmental Officer **Location:** Dublin 12 (Parkwest Business Park) **Schedule:** Monday to Friday \| Fully onsite (5 days per week) **Salary:** €35,000 – €45,000 \+ benefits (depending on experience) We are currently looking for an Environmental Officer to join a growing and supportive company based in Dublin 12\. This is a hands\-on role offering excellent exposure across multiple operational sites, combining office\-based environmental compliance work with regular fieldwork and travel. It’s a great opportunity for someone early in their environmental career who is keen to build practical experience in waste management, environmental compliance, permitting, monitoring, and regulatory engagement. The successful candidate will work closely with operations and management teams to help maintain high environmental standards and ensure compliance with licences, permits, and environmental legislation. **What You’ll Be Doing:** * Supporting environmental compliance activities across multiple operational sites * Carrying out environmental monitoring, inspections, sampling, and reporting * Assisting with EPA licence compliance and permit management * Preparing monthly, quarterly, and annual environmental reports * Liaising with regulatory bodies including the EPA and local authorities * Supporting waste permit administration and environmental documentation updates * Assisting with environmental audits and ISO 14001 compliance activities * Investigating environmental complaints and supporting corrective actions * Coordinating contractor reports and environmental assessments * Working closely with operations teams to ensure environmental best practice is maintained * Contributing ideas and improvements to environmental systems and procedures **What You’ll Gain:** * Hands\-on environmental compliance experience across multiple active sites * Strong exposure to waste management operations and environmental legislation * Opportunity to work on varied environmental projects and initiatives * Supportive team environment with opportunities for development and progression * Practical field experience combined with office\-based environmental reporting and compliance work **What We’re Looking For:** * Degree or diploma in Environmental Science, Engineering, or a related discipline * 1–3 years’ experience in an environmental compliance or environmental operations role * Strong knowledge or experience within waste management, waste permitting, environmental compliance, or related environmental operations * Good understanding of environmental legislation and compliance processes * Strong organisational and communication skills * Positive, proactive approach with the ability to work independently and as part of a team * Comfortable working both onsite and travelling to operational locations as required **Essential Requirements:** * Full Irish driving licence * Own vehicle required (all business travel expenses fully covered) * Must be happy to work fully onsite in Parkwest Business Park, Dublin 12 * Willingness to travel regularly for site visits and field\-based environmental work **Salary \& Benefits:** * €35,000 starting salary for candidates with approximately 1 year of experience * Up to €45,000 for candidates with 3 years’ relevant experience * Benefits package included * Strong training and development support * Opportunity to grow within an experienced EHS team",https://www.linkedin.com/jobs/view/4413424011
Environmental Worker Milltownpass Tidy Towns CE Scheme,,"Milltownpass, WH, IE",indeed,"Application Details Eligibility to participate on CE is generally linked to those who are 21 years or over and in receipt of a qualifying social welfare payment for 1 year or more or 18 years and over for certain disadvantaged groups. Your eligibility will have to be verified by the Department. To register your interest you can contact an Employment Personal Advisor (EPA) in your local Intreo Centre. Job Description **Duties** This is a developmental opportunity, no experience necessary. Accredited training will be provided to support your career. Duties will include Litter Picking, Grass cutting, hedge cutting, weeding, strimming, planting and other duties that may be required from time to time. Pay: €14\.69 per hour Benefits: * Employee assistance program * On\-site parking Work Location: In person",https://ie.indeed.com/viewjob?jk=90221100a94dadfc
Executive Assistant- Global Tech,RECRUITERS,,linkedin,"Executive Assistant \& Operations Coordinator A globally recognised technology organisation is seeking an organised and proactive Executive Assistant \& Operations Coordinator to join their Dublin\-based team on an 8\-month maternity cover contract.This is a varied position supporting senior leadership within a fast\-paced international environment. The role will suit someone who enjoys working across executive support, team coordination, operations, and day\-to\-day business support while managing multiple priorities in a dynamic setting. **Key Responsibilities:** * Provide executive support including calendar management, meeting coordination, travel arrangements, and expense management * Coordinate team meetings, offsites, events, and internal logistics * Support operational reporting, documentation, and administrative processes * Assist with budget tracking and team coordination activities * Manage internal communications, permissions, and distribution lists * Support cross\-functional collaboration across international teams * Act as a key point of contact for internal stakeholders and team coordination * Maintain accurate records and ensure smooth day\-to\-day operations **Requirements:** * 3\+ years’ experience in an Executive Assistant, Team Coordinator, Operations Coordinator, or Senior Administration role * Experience supporting managers or leadership teams * Strong organisational and multitasking skills * Excellent communication and stakeholder management abilities * Experience working in fast\-paced corporate or multinational environments * Strong attention to detail and ability to prioritise effectively * Proficient across Microsoft Office applications * Ability to work proactively and independently **Package:** * €40,000 salary * 8\-month fixed\-term contract * Fully onsite role based in Dublin 2 * Opportunity to join a globally recognised technology organisation Interested in hearing more? For a confidential discussion, contact Emma O’Connell on \+353 1 632 5032 or email your CV to emma.oconnell@recruiters.ie",https://www.linkedin.com/jobs/view/4410142940
Experienced Power System Engineer,Premium Power Ltd.,"Dublin, D, IE",indeed,"At Premium Power we challenge and develop our engineers to meet their true capability. We are currently looking for Experienced Power Systems Engineers who wish to expand their engineering knowledge and are keen to undertake new challenges. **About us** Premium Power is on a mission to provide best in class electrical engineering consulting on a global scale. We specialize in power systems, electrical safety and arc flash and we collaborate with an outstanding list of household names including Dell, Pfizer, GE and many more. Our ambition is to be the leader in the provision of technology services for electrical energy systems and the optimization of power systems. We’ve made some great strides already and we’ve a lot more to do. Growing our team, we’re looking for a Power Systems Engineer to join us. **Premium Power is now an ABB company**, forming part of **ABB’s Electrification Service division**. This marks an exciting new chapter for our team and significantly expands the opportunities available to our engineers. ABB is a global technology leader in electrification and automation, helping industries run high\-performance operations while improving energy efficiency and sustainability. As part of ABB Electrification Service, Premium Power combines our deep expertise in power systems engineering with ABB’s global reach, advanced technologies, and innovation ecosystem. For our team and future graduates, this means access to world\-class projects, cutting\-edge tools, and the chance to contribute to the transformation of power systems at a global scale. **Purpose of the Role:** * To work as a power engineer on a range of exciting projects for global clients in a rewarding team environment. * To develop technical and solution development skills to develop into an industry recognised consulting engineer. * The position would suit a practical and adaptable individual who wishes to work in a progressive innovative electrical consultancy. **Key Duties and Responsibilities:** * Provide technical input and leadership on a variety of complex projects. * Work closely with and interpret client requirements and translate into deliverables. * Ensure project outputs meet client satisfaction, time and budgetary requirements. * Conduct in\-depth power systems analysis. * Prepare detailed technical and non\-technical reports. * Attend client meetings remotely, manage expectations through effective communications and timely responsiveness. * Track and report on project performance and client satisfaction. * Mentor, coach and develop more junior engineers. On\-line training to be delivered where applicable. * Become familiar with the company’s quality system and try to enhance where possible. * Have an active role in internal workshops and groups that benefit the company’s growth. * Be actively involved in the company’s sales strategies, with previous experience and ideas welcome for enhancing the companies international portfolio. **Typical projects include:** * Strategic power system analysis: redundancy, short circuit, power flow, protection coordination * Electrical safety analysis: arc flash and electrical risk assessments. * Grid connection and embedded generation connections analysis: static \& dynamic transient stability, harmonics, flicker, transformer inrush. * Power quality evaluation: earthing, harmonics, sag ride\-through. * Electrical systems reliability assessments. * Software based analysis solutions. * Supporting wind project and installation teams. * Emerging technology reviews. * Failure investigations and advice. **Experience and Qualifications:** * Qualified Electrical Engineer with 3\+ years of previous power systems study experience including short circuit, protection coordination and arc flash. * Demonstrated experience with Power System Study software (SKM, EasyPower, ETAP, or similar). * Experience in designing unit protection settings e.g. Bus and transformer differential 87B \& 87T, Restricted Earth Fault, and Directional Protection 67\. * Ability to carry out cable sizing calculations according to the relevant standards such as IEC 60502\-2 and IEC60364\-5\-52\. * Experience with Power quality and harmonic analysis would be favourable. * Expert on design, calculations, and specifications associated with power system protection. * Proven application of protection coordination studies. * Superior relationship building and stakeholder management. * High performance with a love of learning. * Fluent in English with excellent communication, written and verbal. **What we can offer** * Excellent career development, award winning projects and an excellent remuneration package. * High commitment by management to training and career development * Premium Power employees work on interesting projects in a supportive and friendly environment, whilst earning market leading salaries. * Premium Power offers the opportunity to work within an exciting and growing sector on a diverse range of technical, strategic and regulatory consultancy projects for various industries: Data Centres, Pharma, Medical, Semi Conductor, Food \& Beverage, Heavy Industry, etc. * Discretionary annual performance\-based bonus * Flexible working hours * Generous Annual leave entitlements * Company contributory pension scheme * Generous expenses and laptop * Paid membership fees for one professional institute * Excellent CPD programme * Health Insurance **Work Locations** You’ll have the flexibility to work from either of our offices: * **Balbriggan, North County Dublin** * **Dublin City Centre** Job Types: Full\-time, Permanent Benefits: * Bike to work scheme * Company events * Company pension * Flexitime * On\-site parking * Private medical insurance * Sick pay * Work from home Work Location: Hybrid remote in Dublin, County Dublin",https://ie.indeed.com/viewjob?jk=9276ea3ad40cf0e1
