title,company,location,site,description,job_url
Commissioning Engineer,Thermo Systems LLC,"Dublin, D, IE",indeed,"**Location:** Field\-Based \- Remote with Travel **Employment Status:** Full\-Time \| Direct Hire **Compensation:** Competitive \+ Bonus **Travel:** Up to 75% \- Ireland, UK, Netherlands, Denmark and Finland **Who We Are** Thermo Systems is a global, full\-service control systems integration partner delivering premier class automation solutions across the **Energy, Life Sciences, and Mission Critical** markets. Guided by ***The Thermo Way***, we are unified, dynamic, and committed to delivering excellence. Our culture is grounded in three core principles: * **Employee Success** – investing in our people and their growth * **Customer Success** – delivering reliable, high\-quality solutions * **Financial Strength** – operating with discipline and long\-term focus We believe strong teams, trusted partnerships, and technical excellence drive sustainable success. **The Opportunity** The Commissioning Engineer will lead and execute advanced commissioning activities across mission\-critical projects, with a focus on BMS, EPMS, PLC, and SCADA systems. This role goes beyond field validation, requiring the ability to diagnose system issues, modify and develop control logic, and support system integration during commissioning and delivery phases. Working closely with Engineering, Integration, and Operations teams, you will play a key role in ensuring systems are not only installed correctly, but functionally robust, fully integrated, and aligned with design intent and operational requirements. This position is ideal for an experienced commissioning professional with strong controls expertise, capable of bridging the gap between design, software, and field execution in high\-availability environments. This position is ideal for professionals who value accountability, technical rigor, and hands\-on execution in environments where safety, performance, and reliability matter every day. **What You’ll Do** **Core Responsibilities:** * Lead commissioning activities for BMS, EPMS, PLC, and SCADA systems across mission\-critical/data centre projects * Perform advanced system validation including point\-to\-point checks, functional testing, and integrated systems testing (IST) * Diagnose, troubleshoot, and resolve complex system issues across controls, networking, and field devices * Modify, develop, and optimise PLC logic and SCADA/BMS software during commissioning phases * Support system integration between mechanical, electrical, and control systems to ensure cohesive operation * Validate control sequences under normal, failure, and redundancy scenarios (including failover testing) * Support and lead Level 3–5 commissioning activities, including client witnessing and sign\-off * Review design documentation, control narratives, and software to ensure alignment with field implementation * Produce and maintain detailed commissioning reports, test scripts, and issue logs **Collaboration \& Communication:** * Coordinate with cross\-functional teams to align scope, schedule, and deliverables. * Communicate clearly and proactively with internal teams, customers, and partners. * Identify and escalate risks, constraints, or scope changes early. **Quality, Safety \& Process** * Adhere to company policies, QMS requirements, and established safety standards. * Deliver accurate, high\-quality results with strong attention to detail. * Identify opportunities for process improvement and contribute to stronger execution and efficiency. **What We’re Looking For** **Education \& Experience:** * Degree or equivalent experience in Electrical Engineering, Controls, Automation, or related discipline * 5\+ years’ experience in commissioning, controls engineering, or system integration * Strong experience in mission\-critical/data centre environments **Skills \& Qualifications:** * Strong knowledge of BMS, EPMS, PLC, and SCADA systems (e.g., Rockwell, Siemens, Ignition, Schneider) * Experience developing or modifying PLC code and SCADA/BMS graphics during live project environments * Understanding of electrical systems, control architectures, and networked systems * Ability to interpret and validate control sequences, schematics, and design documentation * Proven troubleshooting capability across software, hardware, and integration layers * Experience with commissioning processes including FAT, SAT, and IST (Level 1–5\) * Effective communication and teamwork skills * Ability to manage priorities in fast\-paced, high\-pressure environments * Strong problem\-solving and decision\-making capability * Commitment to quality, safety, and accountability * Willingness to travel and work on\-site as required **What You’ll Get** * Competitive compensation with annual bonus opportunity * In\-house and external technical training opportunities * Exposure to complex, high\-impact automation projects * A collaborative culture built on integrity, accountability, and teamwork * Learn more at www.thermosystems.com ***Work Environment \& Physical Requirements*** *The physical and environmental demands described here are representative of those required to perform the essential functions of this role. Reasonable accommodations may be made to enable individuals with disabilities to perform essential functions.* ***Equal Employment Opportunity*** *Thermo Systems provides equal employment opportunities (EEO) to all employees and applicants without regard to race, color, religion, sex, national origin, age, disability, genetics, or any other protected status.* ***Disclaimer*** *This job description outlines the general nature and level of work expected. Responsibilities may evolve based on business needs.*",https://ie.indeed.com/viewjob?jk=9f36efb602425e86
Concrete hole coring dry,AMDG construction services limited,"Dublin, D, IE",indeed,"* Dry concrete hole coring for ventilation, plumbing, electrical, and construction projects * Working on residential and commercial sites * Safe use of coring equipment and tools * Maintaining clean and professional work standards Requirements: Experience in dry concrete hole coring preferred * Safe Pass and Manual Handling certification an advantage * Full driving licence a must * Strong work ethic and reliability Job Type: Permanent Pay: €20\.00\-€25\.00 per hour Work Location: In person",https://ie.indeed.com/viewjob?jk=2a0a4a5afc6a74c8
Corporate Associate,Le Meas Executive Search,"Dublin, County Dublin, Ireland",linkedin,"**Corporate Associate (1\+ PQE) \| Dublin** A leading international law firm is hiring a Corporate Associate to join its Dublin team — one of the market's most active practices in private company M\&A and corporate finance. This is a genuine top\-of\-market opportunity. The team acts predominantly as lead counsel on Irish M\&A, PE/VC investments and growth capital transactions, and is known for advising Ireland's most dynamic innovation\-driven companies as they scale, raise and exit. The group is small and deal\-active, which means real early responsibility, market visibility and a clear path to progression. **The Role** You'll work across M\&A, private equity and venture capital transactions, taking on meaningful involvement from day one. The team supports international acquirors, institutional investors and founder\-led businesses — backed by a full\-service Irish practice. **What We're Looking For** * 1\+ years' PQE with strong M\&A and/or PE/VC experience * Trained and qualified at a leading Dublin or major onshore firm * Commercially minded with a genuine interest in business development * Strong academics and exceptional attention to detail **Why This Role** * Top\-tier deal flow with lead counsel positioning * Early market profile in a high\-performing, collegiate team * Real progression opportunities in a growing practice * Hybrid working, comprehensive benefits and global firm backing Interested or want to find out more? Reach out for a confidential conversation.",https://www.linkedin.com/jobs/view/4419892790
Corporate Finance Analyst – Newly Qualified Accountant,Darwin Hawkins,"Dublin, County Dublin, Ireland",linkedin,"**Job Title:** Corporate Finance Analyst – Newly Qualified Accountant **Sector:** Industry **Location:** Dublin (Hybrid) **Salary:** c. €65,000 plus bonus \& benefits **Our Client** Our client is a large and well\-regarded Irish company currently experiencing significant growth and expansion. With a high\-performing finance function and an ambitious leadership team, they are now looking to hire a top\-tier Newly Qualified Accountant to join their Corporate Finance team. **Why should you apply?** This is an excellent opportunity for a high\-calibre Newly Qualified Accountant to make a move into industry within a commercially focused Corporate Finance role. The position offers broad exposure across strategic projects, M\&A activity, financial analysis, business partnering and senior stakeholder interaction. You will join a high\-performing and collaborative team where strong performers are recognised and progression opportunities are clear. The role will suit someone ambitious who wants to accelerate their career within a dynamic and fast\-paced environment while gaining exposure to key commercial decisions across the business. **Who should apply?** This role will suit ambitious and commercially minded accountants currently working in Top 10 or Big 4 firms who are seeking their first move into industry. The ideal candidate will have the following experience: * Newly Qualified ACA / ACCA accountant * Strong academic background and training * Exposure to Corporate Finance, Transaction Services, Audit or Deals experience beneficial * Strong analytical and financial modelling skills * Excellent communication and stakeholder management abilities * Ambitious mindset with a genuine interest in commercial finance and strategy **Role and Reporting Lines** Reporting directly to the Head of Corporate Finance, this role will involve the following: * Strategic Analysis – Supporting commercial decision\-making through detailed financial analysis and business insights * M\&A Activity – Assisting with acquisitions, due diligence processes and investment appraisals * Financial Modelling – Building and maintaining financial models to support business planning and strategic initiatives * Business Partnering – Working closely with senior stakeholders across finance and operational teams * Budgeting \& Forecasting – Supporting budgeting, forecasting and long\-term planning activities * Performance Analysis – Monitoring business performance and identifying opportunities for growth and efficiencies * Project Work – Involvement in strategic finance projects across multiple business units * Executive Exposure – Preparing presentations and reports for senior leadership and key decision makers **Interested in this position?** To apply please submit your CV to Lisa Tully who is managing this assignment via the link below or to inquire further please contact us directly on 01 913 1135\.",https://www.linkedin.com/jobs/view/4419905101
Corporate Finance Associate,Barden,"Dublin, County Dublin, Ireland",linkedin,"Barden have been exclusively engaged by a well known Irish company that is significantly growing and set to double in size within the next year. They are now building out their finance team in line with this growth and are creating a transactions sub\-team. The transactions team will focus on creating value and growth within the company. They are now inviting three corporate finance professional to join their team as **Corporate Finance Associate** . This is a unique opportunity at this level sitting on a close knit team, gaining direct exposure to a broad range of activities working closely with the senior leadership team. **ABOUT THE ROLE:** This role provides an excellent opportunity to utilise one’s corporate finance experience within an industry setting and add real value to a leading Irish business. Main duties and responsibilities will include: * Support the execution of acquisitions, disposals, and financing activities. * Assist with the development of financial models, investment analysis, and performance forecasting. * Contribute to due diligence efforts and manage data flow and documentation for live transactions. * Help create high\-impact presentations, internal papers, and investor materials. * Collaborate with internal stakeholders across multiple departments to gather insights and input for transaction work. * Liaise with external partners, including advisors, lenders, and investors, throughout deal lifecycles. * Monitor financial obligations and covenant compliance tied to active financing structures. * Identify areas for process improvement across processes. * Ad hoc projects as required. **ABOUT THE PERSON:** * ACA or CFA Qualified with 0\-3 years PQE; * Previous corporate finance, transactions services, tax, transfer pricing or investment experience a strong advantage; * Strong financial modelling skills is an advantage; * Advanced Excel skills; * Ability to deliver both qualitative and quantitative analysis for decision making at senior management level; * Good commercial acumen and ability to analyse qualitative information; * Good problem solving and analytical skills; * Excellent working knowledge of Excel. ***This is an ideal role for someone looking for the opportunity to advance their career in Corporate Finance and progress within a progressive and significantly growing company.*** *Barden’s Accounting and Tax recruitment practice is where finance professionals go before they start looking for a job. Make sure you get expert advice about your Accounting / Tax career from Barden first – your future is just too important to leave to chance.*",https://www.linkedin.com/jobs/view/4419953446
Cost Analyst,WGNSTAR,"Leixlip, County Kildare, Ireland",linkedin,"**WG** NSTAR is a dynamic and growing company with a global footprint. Primarily focused on the semiconductor industry, we provide a platform for you to expand your career with knowledge gained on the job training, and tailored development. We know we need talented people like you that hold similar values, which is why we do not put limits on learning, development, industry, and personal growth. Start your path to a **WG** NSTAR career today! **The Purpose of the Role** The Cost Analyst will be responsible for analysing, forecasting, and managing the cost structures of key commodities to support the organization's operational and financial objectives. This role involves working closely with factory management, factory functional areas, finance and supply chain, to provide insights on cost trends versus budget allocations. **Person Specification** * Strong analytical and problem\-solving abilities * A strong team player * Have excellent organisational and time keeping skills * Ability to adapt to different tasks * You are looking for a new challenge and to develop your career **Work Schedule** 39\-hour regular working week (Monday to Friday) **Principal Duties And Responsibilities** This role provides a wide range of critical Administrative and Analytical Support to the team Including but not limited to: Commodity Cost Data Integrity: Commodity Cost systems management including weekly cost adjustments and mapping to correct technologies budgets (including but not limited to weekly leader, technologies adjustments). Commodity Cost Data Analysis: Factory commodity cost scorecards analysis and Functional areas cost management support to hit quarterly budgets/goals. This includes meeting with Areas Cost POCs to support AdHoc queries. PO Management: Issue site shopping carts for purchase order creation, track and reconcile purchase orders to ensure they are being invoiced correctly and on time (PAT accruals ownership). Commodity Cost Forecasting: support team on quarterly budget forecast analysis and submission to Finance (POR process). Commodity Cost Goaling: Closely work with Factory functional areas to align on quarterly budgets for all technologies, including quarterly upload to Commodity Cost Systems. Cross\-Functional Collaboration: partner with Finance and supply chain departments to reconcile monthly and quarterly spends versus allocated budget. Projects management: support team on tracking of Commodity Cost Factory projects and present out PAS and help needed. Commodity Cost Reporting and Presentations: support team on preparation of regular cost analysis report (OSC decks, Functional Area review) and presentations for senior management (Ad\-Hoc queries and Task Forces meetings). **Role Requirements** Bachelor's degree in finance, Economics, Supply Chain Management, Business, or a related field. 3\+ years of work experience in a Supply Chain, Engineering or Business Administration support role Strong analytical skills with high proficiency in Microsoft applications in particular PowerBI and Advanced Excel. Ability to gather data, effectively compile, analyze \& report out through pivot\-tables, graphs, v\-look up, etc. System and project management skills: Comfortable with navigating variety of internal and external systems and applications. Effectively manage project deliverables to timelines. Additional technical data analytics skills such as creating Power BI reports and/or other similar types of data analytics tools. Ability to crunch data and use other data analytical skills to create automated reports and system solutions to drive efficiencies. Ability to communicate and collaborate effectively with multiple factory customers, and stakeholders with high level of professionalism. **Benefits Of Working With WGNSTAR** Discounted rates of on\-site facilities Free on\-site car parking Reward \& Recognition Programme Employee Assistance Programme Learning and development Opportunities for career progression This job description is intended to convey information essential to understanding the scope of the job and the general nature and level of work performed by job holders within this job. This job description is not intended to be an exhaustive list of qualifications, skills, efforts, duties, responsibilities or working conditions associated with the position. WGNSTAR does not require assistance from Recruitment Agencies. Thank you. Equal Opportunities Employer **WG** NSTAR is an Equal Opportunity Employer in accordance with The Employment Equality Acts. **WG** NSTAR places strong emphasis on equal employment, encourage diversity in the workplace, and apply an open\-door policy for inclusion of all employees. Our diversity program encourages people from any gender, background, ethnicity, culture, education, and experience to join the company and more importantly build a career through employee development.",https://www.linkedin.com/jobs/view/4418801170
Customer Care Specialist I,GoFundMe,"Dublin, D, IE",indeed,"**Want to help us help others? We’re hiring!** GoFundMe is the world’s most powerful community for good, dedicated to helping people help each other. By uniting individuals and nonprofits in one place, GoFundMe makes it easy and safe for people to ask for help and support causes—for themselves and each other. Together, our community has raised more than $40 billion since 2010\. Join us! The GoFundMe team is searching for our next Customer Care Specialist based in Dublin, Ireland, to effectively resolve customer support requests \& drive continuous improvement for the GoFundMe experience. **The Job** * Making a difference by helping customers from all around the world, who are raising or giving money for various causes important to them, all through some of the most exciting \& tough moments of their lives. * Providing exceptional \& human customer support via live messaging \& email, with the potential to support phone calls, for a wide variety of complex support needs \& escalations, including helping customers troubleshoot bank transfer verification, navigate sensitive social dynamics related to fundraising, \& optimise their success through effective use of the GoFundMe product. * Passionately championing customer feedback to improve the GoFundMe experience. * Occasionally support the team with ad\-hoc projects or tasks directly tied to the team’s vision \& annual objectives. * Working in a dynamic environment, hybrid based, with a willingness to work from the office a few times a month. **You** * **Metric \& goal driven** \- You enjoy challenging yourself \& holding yourself accountable to reaching targets! We set high standards so we can provide a human \& effortless experience to our customers. * **Customer centric** \- You care about the experience our customers have \& understand the impact you have on their GoFundMe experience. * **Compassionate** \- You truly care about people \& want to help them, using strong emotional intelligence to adjust your approach based on each customer’s situation. * **Adaptable** \- You enjoy being part of a growing organization. You thrive under new challenges \& in an ever\-evolving environment! * **Effective in communication** \- You are a strong communicator who is able to confidently use communication (written \& verbal) as a tool to address our customers’ needs \& work with teammates internally. * **Tech\-savvy** \- You are comfortable working in an online space, learning new tools quickly, \& troubleshooting tech\-issues in real time. * **Critical thinker \& solution minded** \- You seek out potential challenges \& trends, \& productively propose solutions. Everyone owns the success of our team! * **Attentive to detial** \- Did you notice ""detail"" is misspelled? * **Resourceful** \- You take initiative to research independently, organise your resources effectively, \& discover creative solutions to challenges you may encounter. * **Invested in personal growth** \- You have a growth mindset, stay hungry for feedback, \& have a strong desire to learn. * **Team centered** \- You enjoy empowering others, celebrating their wins, \& supporting others’ growth. * **Leadership prone \- You proactively take initiative with the big picture in mind, \& seek opportunities to drive your team forward in the everyday** **Preferred** * Fluency in German or French preferred but not required **Why you’ll love it here** * **Make an Impact**: Be part of a mission\-driven organization making a positive difference in millions of lives every year. * **Innovative Environment**: Work with a diverse, passionate, and talented team in a fast\-paced, forward\-thinking atmosphere. * **Collaborative Team**: Join a fun and collaborative team that works hard and celebrates success together. * **Competitive Benefits**: Enjoy competitive pay and comprehensive healthcare benefits. * **Holistic Support**: Enjoy financial assistance for things like hybrid work, family planning, along with generous parental leave, flexible time\-off policies, and mental health and wellness resources to support your overall well\-being. * **Growth Opportunities**: Participate in learning, development, and recognition programs to help you thrive and grow. * **Commitment to DEI**: Contribute to diversity, equity, and inclusion through ongoing initiatives and employee resource groups. * **Community Engagement**: Make a difference through our volunteering program. **We live by our core values:** *impatient to be great*, *find a way*, *earn trust every day*, *fueled by purpose*. Be a part of something bigger with us! GoFundMe is proud to be an equal opportunity employer that actively pursues candidates of diverse backgrounds and experiences. We do not discriminate on the basis of race, color, religion, ethnicity, nationality or national origin, sex, sexual orientation, gender, gender identity or expression, pregnancy status, marital status, age, medical condition, mental or physical disability, or military or veteran status. If you require a reasonable accommodation to complete a job application or a job interview or to otherwise participate in the hiring process, please contact us at accommodationrequests@gofundme.com. **Global Data Privacy Notice for Job Candidates and Applicants:** Depending on your location, the General Data Protection Regulation (GDPR) or certain US privacy laws may regulate the way we manage the data of job applicants. By submitting your application, you are agreeing to our use and processing of your data as required. **Learn more about GoFundMe:** We’re proud to partner with GoFundMe.org, an independent public charity, to extend the reach and impact of our generous community, while helping drive critical social change. You can learn more about GoFundMe.org’s activities and impact in their FY ‘25 annual report. Our annual “Year in Help” report reflects our community’s impact in advancing our mission of helping people help each other. \#LI\-RC1",https://ie.indeed.com/viewjob?jk=40ee5db0eafc07dd
