title,company,location,site,description,job_url
"Incident Management Engineer (Spanish/English bilingual), Incident Detection and Response",Amazon Web Services,"Dublin, D, IE",indeed,"**DESCRIPTION** --------------- Amazon has built a reputation for excellence with a mission to be the earth’s most customer\-centric company, a company that customers from all over the globe will recognize, value, and trust for both our products and our service. Amazon Web Services (AWS) is carrying on that tradition while leading the world in cloud technologies. The AWS Incident Detection and Response team is part of the ASPIRE organisation within AWS Support, and is dedicated to offering eligible AWS Enterprise Support customers proactive engagement and incident management to reduce the potential for failure and to accelerate recovery of critical workloads from disruption. We achieve these objectives by working closely with customers to develop runbooks and response plans customized to the context of each workload onboarded to the service. Onboarded workloads are monitored 24x7 by a team of Incident Management Engineers (IMEs) to detect and engage customers on a call bridge within 5 minutes of a critical alarm. ABOUT YOU Incident Management Engineers have a broad skill set with demonstrated career progression and a proven track record of delivering results. The successful candidate will possess strong analytical acumen, solid technology experience, superb business judgment, strategic account ownership and a propensity to dive deep to solve complex problems. You will also have a passion for creating/providing a world class experience for our customers. The candidate must understand the competitive and industry landscape and must have the leadership presence and communication skills to effectively work with customers at all levels of their organization. You must be a self\-starter and able to execute at both a tactical and strategic level – with a strong attention to detail. This is a global role that requires excellent written and verbal communication skills and a passion and desire for leading the resolution of critical incidents. Your decisions are not only fundamental to helping protect our most critical customers but will help maintain the health of AWS customers worldwide. Finally, you are passionate about technology with a desire to learn more and do more with AWS. ABOUT THE ROLE AWS Support is looking for a leader with a strong background in Incident Management and customer ownership to be there during the moments that matter for our most critical customers. We are looking for an Incident Management Engineer to join our team to provide incident response and account ownership. In this position, you will play a pivotal role in providing communication, emergency response, technical resolver engagement and incident management for our customers. Please note as a follow\-the\-sun organisation, IMEs work the core hours of 7am\-3pm UTC. Successful applicants will be required to work some weekends (Sunday to Thursday, or Tuesday to Saturday), and public holidays. Key job responsibilities * Every day will bring new and exciting challenges that include elements of: * Drive the resolution of large scale customer impacting incidents as part of a team rotation * Drive critical, complex customer escalations in situations that are sometimes technically challenging in collaboration with Engineering Teams. * Provide critical incident response/management (including leading calls with internal/external participants) for customer’s critical workloads * Contribute to Problem Records for customers * Conduct continuous real\-time proactive monitoring of customer metrics * Prioritize, manage, and own emerging and developing customer issues from start to finish * Monitor and manage communications during high impact events via relevant channels * Collaborate with key stakeholders across AWS to improve the customer experience and develop mechanisms that support operational excellence * Lead projects and teams to drive operational improvements * Create and review documentation; design/influence new standard operating procedures * Identify and troubleshoot recurring platform issues and own projects to drive improvements * Mentor peers in your areas of technical and operational strength * Perform other duties as required by the organization About the team Diverse Experiences AWS values diverse experiences. Even if you do not meet all of the preferred qualifications and skills listed in the job description, we encourage candidates to apply. If your career is just starting, hasn’t followed a traditional path, or includes alternative experiences, don’t let it stop you from applying. Why AWS? Amazon Web Services (AWS) is the world’s most comprehensive and broadly adopted cloud platform. We pioneered cloud computing and never stopped innovating — that’s why customers from the most successful startups to Global 500 companies trust our robust suite of products and services to power their businesses. Inclusive Team Culture Here at AWS, it’s in our nature to learn and be curious. Our employee\-led affinity groups foster a culture of inclusion that empower us to be proud of our differences. Ongoing events and learning experiences, including our Conversations on Race and Ethnicity (CORE) and AmazeCon (diversity) conferences, inspire us to never stop embracing our uniqueness. Mentorship \& Career Growth We’re continuously raising our performance bar as we strive to become Earth’s Best Employer. That’s why you’ll find endless knowledge\-sharing, mentorship and other career\-advancing resources here to help you develop into a better\-rounded professional. Work/Life Balance We value work\-life harmony. Achieving success at work should never come at the expense of sacrifices at home, which is why we strive for flexibility as part of our working culture. When we feel supported in the workplace and at home, there’s nothing we can’t achieve in the cloud. **BASIC QUALIFICATIONS** ------------------------ * Speak, write, and read fluently in Spanish * Bachelor's degree in computer science or equivalent, or experience in technical support * 4\+ years of technical support experience * 3\+ years demonstrable Major Incident / Problem Manager Experience for organizations that run mission critical applications * 4\+ years of experience in Support Engineering, Network Engineering, Solutions Architecture, or similar IT role **PREFERRED QUALIFICATIONS** ---------------------------- * Industry specific accredited certification(s) such as the AWS Associate level certifications * Knowledge of ITIL/Lean Processes * Ability to work in ambiguous environments * Demonstrated critical thinking and logical problem solving skills * Experience driving collaborative projects from conception to delivery * Familiarity operating or designing distributed architectures with the ability to correlate system behaviors based on known inter\-dependencies * Ability to review complex technical details regarding ongoing issues/events and convey the key details to senior stakeholders to facilitate real\-time decision making Amazon is an equal opportunities employer. We believe passionately that employing a diverse workforce is central to our success. We make recruiting decisions based on your experience and skills. We value your passion to discover, invent, simplify and build. Protecting your privacy and the security of your data is a longstanding top priority for Amazon. Please consult our Privacy Notice (https://www.amazon.jobs/en/privacy\_page) to know more about how we collect, use and transfer the personal data of our candidates. Amazon is an equal opportunity employer and does not discriminate on the basis of protected veteran status, disability, or other legally protected status. Our inclusive culture empowers Amazonians to deliver the best results for our customers. If you have a disability and need a workplace accommodation or adjustment during the application and hiring process, including support for the interview or onboarding process, please visit https://amazon.jobs/content/en/how\-we\-hire/accommodations for more information. If the country/region you’re applying in isn’t listed, please contact your Recruiting Partner.",https://ie.indeed.com/viewjob?jk=8418e2dd27599ceb
Incident Response Analyst II,Astreya,"Dublin, County Dublin, Ireland",linkedin,"**Job Overview** The Incident Response Analyst is a key member of the Incident Response Center (IRC), responsible for 24/7 monitoring, first\-level analysis, triage, and escalation of alerts related to data center infrastructure and services. This role ensures continuous health, availability, and security of data center operations by monitoring critical systems, detecting events, assessing impact, and coordinating with cross\-functional teams for timely resolution. The Analyst provides real\-time situational awareness across data center facilities, network and server systems, environmental controls, cloud infrastructure, and external risk factors. **Key Responsibilities** * Monitor alarms and alerts across data center infrastructure, including network and server devices, hardware health indicators (disk usage, temperature, etc.), WAN circuits, local connectivity, and facility environmental systems such as temperature, humidity, power, racks, and PDUs. * Monitor Oracle Cloud Infrastructure (OCI), cloud dashboards, and relevant monitoring tools for system health and service availability. * Assess external risks such as natural events (floods, earthquakes, fires, severe weather) that may impact data center operations. * Monitor and review CCTV activity for security events within data center facilities. * Validate, investigate, and analyze alerts to determine impact and urgency. * Create, update, and manage incident tickets using Jira or similar ITSM platforms. * Escalate incidents promptly to cross\-functional teams including Network, Compute, Storage, Facilities, Security, and Cloud teams. * Communicate incident updates and notifications using tools such as Everbridge and email. * Prepare Post\-Incident Reviews (PIRs), document timelines, and maintain accurate incident records and handover notes. * Review and track vendor emails regarding planned maintenance, emergency changes, and service advisories. * Maintain documentation including SOPs, process updates, and knowledge base articles. **Basic Qualifications** * Bachelor’s degree in Computer Science, Information Technology, Engineering, or related field, or equivalent practical experience. * 2–5 years of experience in a data center operations center, NOC/SOC, monitoring environment, or incident management role. * Basic understanding of network fundamentals (TCP/IP, routing, WAN/LAN concepts) and server or hardware components (CPU, memory, storage). * Ability to interpret system alerts, analyze issues, and perform initial triage. * Excellent verbal and written communication skills, with the ability to work independently, meet goals, and maintain attention to detail. * Demonstrated ability to interact effectively at all levels within the organization, including with clients, while being a collaborative team player. * Ability to work in 24/7 rotating shifts as required. **Preferred Qualifications** * Experience in a Data Center, NOC, SOC, or similar operations command center environment. * Familiarity with tools such as Jira, Everbridge, DCIM systems, monitoring platforms (SolarWinds, Nagios, Grafana, etc.), and CCTV monitoring tools. * Experience writing incident reports or post\-incident reviews. * Exposure to cloud platforms such as Oracle Cloud Infrastructure, AWS, Azure, or GCP. * Knowledge of ITIL processes, especially Incident, Problem, and Change Management. * Strong situational awareness and ability to manage multiple priorities during critical events. * Effective collaboration skills when working with cross\-functional support teams.",https://www.linkedin.com/jobs/view/4433228100
Industry Technical Consultant - Micro-Electronics (Global High Tech industry),"Nalco Water, An Ecolab Company","Dublin, County Dublin, Ireland",linkedin,"Nalco Water, an Ecolab Company, is seeking an **Industry Technical Consultant** for our **Micro Electronics Division supporting Water Treatment applications** , including cooling, pre\-treatment, wastewater, reclaim/recycle and closed loop applications. Our team of Industry Technical Consultants plays a crucial role in supporting business growth, driving innovation, and transferring knowledge to ensure the success of our programs and clients’ operation. If you are passionate about implementing new technology, helping to troubleshoot and solve complex clients’ problems, supporting our technical field teams, and more, we invite you to apply! This is your opportunity to join a large growing company offering a competitive base salary, bonus structure and benefits. As an Industry Technical Consultant, you will be primarily responsible for troubleshooting and solving complex clients’ problems, training technical audiences, recommending operational efficiency improvements for our clients’ utility systems and validating new innovative technologies. You will also assist Corporate Account Managers and Sales Reps in making technical related sales calls and presentations at a corporate level. You will research, identify and define market and product application opportunities and assist in developing and implementing marketing plans to capture identified sales opportunities. **What’s In It For You** * The opportunity to take on some of the world’s most meaningful challenges, helping customers achieve their sustainability goals * The ability to make an impact with a company that is passionate about your career development * Enjoy a flexible, independent work environment **What You Will Do** * Collaborate with field sales and corporate account teams to support industry\-specific or strategic technical sales opportunities. * Work closely with clients to understand their technology requirements, recommend suitable solutions, and provide training and support to ensure proper use of implemented systems. * Deliver best\-in\-class expertise, system optimization and problem solving in the most dynamic and challenging customer environments * Play a critical role in demonstrating total value delivered and selling value of our solutions combining chemistry, automation, digital, equipment and engineered solutions * Lead problem solving efforts by utilizing various root cause analysis methodologies to resolve application or best practice concerns at customer sites * Assess water treatment programs, recommend and quantify operational efficiency improvement projects in a documented report. * Collaborate with R\&D and Marketing on Innovation projects, from ideation to launch, by completing Phase Gate milestones such as refining value propositions, defining operational savings, creating technical documentation, and educating internal and external stakeholders. * Lead innovation pilot applications, technical trials and market trials * Delivers value to our customers utilizing a problem\-solving mindset to deliver innovative results * Facilitate training for associates and customers, sharing your specialized knowledge to foster skill development and proficiency. * Coach individuals in the organization on processes, applications, technologies, and value documentation **Position Details** * This position is remote and will support customers across Europe * 50% or more overnight travel required * Includes benefits package and company car **Your Profile** * Demonstrable technical expertise and experience in optimizing water/wastewater and cooling operations in the Semi\-Conductor Industry * Proven experience in complex chemistry, automation, digital, equipment and engineered solutions both from Ecolab and the wider industry * Inquisitive mind, challenging the status quo and embracing disruptive technologies * Excellent communicator, able to consult, coach and mentor both internal stakeholders and customers alike * Value mindset with a focus on delivering measurable savings and impact to our customers * Solution oriented, problem solving mindset to complex challenges * Willing and able to travel throughout Europe to customer sites **Minimum Qualifications** * Bachelor’s Degree * Strong technical knowledge of water treatment, cooling applications and solutions * 5\+ years of successful technical implementation, production management, process engineering, technical sales, or field sales support experience * Must have a valid Driver's License and acceptable Motor Vehicle Record **Preferred Qualifications** * Bachelor’s degree in Engineering (Chemical, Mechanical, Process) * Recognized as an expert in industry or technology focus * Strong problem solving mindset and approach * Strong communication and presentation skills * Self\-motivated, pro\-active, result\-oriented professional with an ability to work with minimum direction. * Excellent team orientation, proactivity and sense of urgency in supporting business growth and market leadership through differentiated technology and expertise ***Ecolab’s commitment to diversity, equity and inclusion (DE\&I) reflects our longstanding value of working together to integrate diverse perspectives to challenge ourselves, reach our goals and do what’s right.*** Apply today and join one of the most ethical companies with over a hundred years of history. **Compensation Range** **Join Ecolab and help us protect what’s vital.** The annual pay range for this position is 63,200 \- 79,000 \- 94,800 EUR (Italy). This position is eligible for annual bonus. **Benefits** Ecolab strives to provide comprehensive and market\-competitive benefits to meet the needs of our associates and their families. Click here to see our benefits. **Collective Agreement Information (Italy)** In Italy, Ecolab applies the National Collective Labour Agreement for the Chemical Industry (CCNL Industria Chimica). **Unser Bekenntnis zu einer Kultur der Inklusion und Zugehörigkeit** Ecolab verpflichtet sich zur fairen und gleichen Behandlung von Mitarbeitern und Bewerbern und fördert die Grundsätze der Chancengleichheit in der Beschäftigung. Wir rekrutieren, stellen ein, befördern, versetzen und bieten Aufstiegsmöglichkeiten auf der Grundlage individueller Qualifikationen und Arbeitsleistungen in allen Belangen, die Beschäftigung, Vergütung, Sozialleistungen, Arbeitsbedingungen und Karrierechancen betreffen. Ecolab diskriminiert keine Mitarbeiter oder Bewerber aufgrund von Rasse, Religion, Hautfarbe, Glaubensbekenntnis, nationaler Herkunft, Staatsbürgerschaft, Geschlecht, sexueller Orientierung, Geschlechtsidentität und \-ausdruck, genetischen Informationen, Familienstand, Alter oder Behinderung.",https://www.linkedin.com/jobs/view/4424740381
Information Communication Technology Support Engineer,PFH Technology Group,"Dublin, County Dublin, Ireland",linkedin,"**ICT Support Engineer** PFH Technology are currently looking for an ICT Support Engineer to join our growing team. **Role Overview:** We are seeking an experienced ICT Support Engineer to support the implementation and operation of a major national Laboratory Information Management System (LIMS) programme across healthcare sites in Ireland. This is a field\-based role requiring travel to healthcare facilities within an assigned geographical region. The successful candidate will provide onsite technical support, device configuration, troubleshooting, and stakeholder engagement to ensure successful deployment and ongoing operation of a critical healthcare technology platform. **Key Responsibilities:** * Provide onsite technical support across one or multiple healthcare locations within an assigned region. * Work closely with programme teams and local implementation leads to deliver deployment activities in line with implementation schedules. * Configure and support desktop, laptop, mobile, and peripheral devices for use with the laboratory information system. * Troubleshoot hardware, software, and basic network issues, managing incidents through to resolution. * Escalate complex technical or application issues to appropriate technical teams and managers. * Perform system administration tasks within the laboratory information system environment. * Liaise with third\-party vendors for hardware and software installations and support. * Assess site readiness and conduct hardware assessments for system deployment. * Ensure compatibility between hardware, operating systems, applications, and laboratory system requirements. * Support mobile device configuration and management. * Contribute to technical documentation and knowledge base resources. * Build strong working relationships with healthcare staff, ICT teams, and programme stakeholders. * Coordinate with service providers and local ICT departments to ensure successful implementations. * Deliver excellent customer service and user support throughout deployment and operational phases. **Skills \& Experience:** * Experience providing onsite ICT support in a healthcare or enterprise environment. * Strong troubleshooting skills across hardware, software, and operating systems. * Knowledge of desktop, laptop, peripheral, and mobile device configuration. * Experience supporting Windows environments and common business applications. * Basic understanding of networking concepts and troubleshooting. * Ability to manage multiple priorities and work independently. * Excellent communication and stakeholder engagement skills. * **Full driving licence** and willingness to travel regularly between sites. PFH Technology, owned by Ricoh – a Japanese based global ICT company, is a premier provider of end\-to\-end ICT solutions and a managed services portfolio scaling from SMEs to large Enterprise organisations. We have unrivalled vendor relationships. We can procure, design, deploy and support all your ICT needs. Our ISO certified Custodian™ Cloud Services and Custodian™ Managed Services provide the technology and expertise to mitigate risk and reduce your costs immediately. We have a nationwide network of over 750 dedicated professionals, ready to meet your ICT needs, with offices in Dublin, Cork and Galway. We are an equal opportunity employer and value diversity at PFH. We do not discriminate on the basis of age, disability, civil or family status, gender, gender identity or expression, sexual orientation, race, religion, or any other legally protected status. We are committed to ensuring that individuals with disabilities or access needs are provided with reasonable accommodation during the recruitment process, to perform essential job functions, and to access the full benefits of employment. Please contact us if you require accommodation at any stage.",https://www.linkedin.com/jobs/view/4433836455
Information Technology Support Analyst,Fruition Group Ireland,"Dublin, County Dublin, Ireland",linkedin,"Our Dublin based client are looking for an **Information Technology Support Analyst** to join their team on a permanent basis You will have the opportunity to become part of an established and strong team and work for a company that is a market leader in their field There is an on site presence required for this role and the office is Dublin city centre based **Responsibilities:** * Provide technical support to end\-users and assist in resolving various IT issues in an effective and timely manner. * Learn to identify and resolve IT problems and issues as they arise * Troubleshoot hardware and software issues on site and via cloud services * Assist in the setup, configuration, and maintenance of end\-user devices, laptops and phones * Maintain a highly organised inventory of IT assets and resources (ITAM). * Assist in monitoring and tracking issues to prevent problems occurring a second or third time. * Collaborate with cross\-functional teams to ensure escalations and tickets are registered and dealt with effectively. * Contribute to IT projects, including software deployments and hardware upgrades. * Escalation of technical issues to other team members when necessary and required **Skills and Requirements:** * Minimum of 2\-3 years of experience in a technical support role. * Experience with Active Directory, Azure AD, and managing security groups. * Ability to handle access requests and managing permissions. * Proven capabilities in troubleshooting Office 365 issues and software installations. * Proactive problem\-solving skills. * Have strong verbal and written communication skills. * Demonstrated teamwork skills, attention to detail, and a strong work ethic. * Enthusiasm for technology and a desire to learn and grow in the field. **HOW TO APPLY:** To apply for this role, please submit your updated CV. If your skills and experience match job requirements, you will be contacted to discuss your application in detail. **SIMILAR ROLES OPEN:** As a specialized recruitment agency, we also have several other permanent and contract IT roles available. Visit our website for more information or explore additional opportunities",https://www.linkedin.com/jobs/view/4432966613
