title,company,location,site,description,job_url
AI Engineer,Version 1,"Dublin, County Dublin, Ireland",linkedin,"**Company Description** Version 1 has celebrated 30 years in business and continues to be trusted by global brands to deliver technology and transformation solutions that drive customer success. Our deep expertise enables our customers to navigate the rapidly evolving technology landscape. We foster strong partnerships with global technology leaders including Microsoft, AWS, Oracle, Red Hat, OutSystems, Snowflake, ensuring that our customers are provided with the highest quality solutions and services. We’re an award\-winning employer reflecting how our employees are at the very heart of what we do: * UK \& Ireland's premier AWS, Microsoft \& Oracle partner * 3300\+ strong, €350/£300m revenue business * 10\+ years as a Great Place to Work in Ireland \& UK * Best Workplace for Women in the UK \& Ireland by GPTW * Best Workplace for Wellbeing in the UK by GPTW We’re a core values driven company, we hire people who share our values, and we reward those who display and foster them, it’s deeply embedded within our DNA. Invest in us and we’ll invest in you!. **Job Description** * Develop and maintain back\-end AI\-powered applications and services. * Build and integrate LLMs and multi\-agent systems using frameworks like Semantic Kernel, LangChain, or similar. * Design and implement front\-end interfaces for AI applications using modern frameworks (React, Vue.js, Angular). * Integrate front\-end components with AI APIs and backend services using REST and GraphQL. * Collaborate with data engineers, UX designers, product managers, and QA teams to deliver end\-to\-end AI solutions. * Apply MLOps practices for model deployment, monitoring, and lifecycle management. * Build intuitive, accessible, and standards\-compliant UIs for GenAI applications. * Support junior team members through knowledge sharing and mentoring. * Maintain comprehensive documentation on AI models, including strengths, limitations, and data\-driven justifications. * Ensure secure and compliant development of AI systems in line with GDPR, EU AI Act, and Responsible AI guidelines. **Qualifications** * 4\-6 years experience in Applications Development Lifecycle. * Proven experience in backend development for AI applications and orchestration of LLMs/multi\-agent systems. * Proficiency in Python and ML frameworks such as TensorFlow and PyTorch. * Experience with cloud ML services like Azure ML and AWS SageMaker. * Strong front\-end development skills in HTML, CSS, JavaScript, TypeScript, and frameworks like React, Vue.js, or Angular. * Experience with design tools and systems like Figma and Storybook. * Knowledge of API integration, REST, GraphQL, and backend service orchestration. * Demonstrated experience in prompt engineering and experimentation with multiple AI models. * Familiarity with Agile methodologies, Scrum practices, and Application Lifecycle Management in a .NET environment. * Experience in automated testing, including unit, integration, and end\-to\-end testing using modern frameworks. * Understanding of AI security best practices and regulatory compliance (GDPR, EU AI Act). * Strong communication skills in English, both written and verbal (IET or equivalent). **Additional Information** **Why Version 1?** At Version 1, we believe in providing our employees with a comprehensive benefits package that prioritises their wellbeing, professional growth, and financial stability. * Share in our success with our Quarterly Performance\-Related Profit Share Scheme, where employees collectively benefit from a share of our company's profits * Strong Career Progression \& mentorship coaching through our Strength in Balance \& Leadership schemes with a dedicated quarterly Pathways Career Development programme * Flexible/remote working, Version 1 is tremendously understanding of life events and people’s individual circumstances and offer flexibility to help achieve a healthy work life balance * Financial Wellbeing initiatives including; Pension, Private Healthcare Cover, Life Assurance, Financial advice and an Employee Discount scheme * Employee Wellbeing schemes including Gym Discounts, Bike to Work, Fitness classes, Mindfulness Workshops, Employee Assistance Programme and much more. Generous holiday allowance, enhanced maternity/paternity leave, marriage/civil partnership leave and special leave policies * Educational assistance, incentivised certifications, and accreditations, including AWS, Microsoft, Oracle, and Red Hat * Reward schemes including Version 1’s Annual Excellence Awards \& ‘Call\-Out’ platform. * Environment, Social and Community First initiatives allow you to get involved in local fundraising and development opportunities as part of fostering our diversity, inclusion and belonging schemes. And many more exciting benefits… drop us a note to find out more. Version 1 is an equal opportunities employer. We are committed to building a diverse, inclusive and respectful workplace where everyone feels valued and able to thrive. We welcome applications from people of all backgrounds, identities and lived experiences, and we value the different perspectives people bring. We want every candidate to have a positive and accessible recruitment experience. If you need reasonable adjustments at any stage of the process, please contact ekta.bahl@version1\.com at Version 1\. We will consider all requests carefully, respectfully and confidentially. **Video Links** https://www.youtube.com/watch?v\=F\_d3ELTH5zo",https://www.linkedin.com/jobs/view/4400844077
AWS Sales Development Public Sector internship,Amazon Web Services (AWS),"Dublin, County Dublin, Ireland",linkedin,"**Description** Join us for a transformative 24\-week internship starting June/July 2026, where you'll help drive digital transformation and shape the future of cloud and AI technologies across EMEA. You'll work on meaningful business projects, develop hands\-on experience in cloud sales, and grow alongside a community of interns in a structured program designed to launch your career in technology. This is your opportunity to make a tangible impact while learning from industry leaders in an innovative, AI\-first environment. Your internship will immerse you in the world of cloud computing and emerging technologies. You'll begin by learning the AWS solution portfolio—including earning certifications like the AWS Certified Cloud Practitioner, and AWS Certified AI Practitioner—while gaining insight into Amazon's culture and values. Throughout your internship, you will understand customer challenges and discover how AWS solutions deliver real value. You'll work within agile methodologies on impactful business projects, applying innovative approaches to solve complex problems. Beyond your core responsibilities, you'll participate in speaker series, intern panels, Leadership Principles sessions, and AI technology workshops. You'll also have access to mentorship, networking opportunities with fellow interns across EMEA locations, and career development support to help you grow both professionally and personally. Key job responsibilities * Learn the AWS solution portfolio and Amazon culture, with a focus on AI services and innovative cloud solutions * Build a comprehensive understanding of customer challenges, requirements, and the potential value that AWS solutions can deliver * Differentiate and understand various IT roles and responsibilities in modern, technology\-driven organizations * Guide and accelerate our customers’ cloud integration * Support customers as they extend their cloud capabilities * Collaborate with our business and technical teams to build solutions **About The Team** The internship starts in June/July 2026 and has a duration of 24 weeks. **Basic Qualifications** * Graduating from a Bachelor's or Master's degree in end of 2025/the first half of 2026 * Knowledge of advanced English at native level * Strong interest in demand generation, sales or customer service * Demonstrated interest in digital transformation and strong technical acumen * Demonstrated ability to effectively work cross\-functionally across internal and external organizations * Available to work full\-time for a minimum of 6 months **Preferred Qualifications** * Demonstrated passion for technology sales and AI\-first solutions * A passion for driving innovation in the Public Sector * Strong interest in pursuing a technology sales career focused on innovative cloud and AI technologies * Experience collaborating with cross\-functional teams in agile or fast\-paced environments * Self\-motivation and organizational skills with a focus on achieving results in innovative settings * Critical thinking and problem\-solving abilities with a data\-driven approach * Genuine curiosity about emerging cloud technologies and artificial intelligence * Experience working with or understanding customer needs and business requirements * Demonstrated ability to adapt to new technologies and learn quickly Amazon is an equal opportunities employer. We believe passionately that employing a diverse workforce is central to our success. We make recruiting decisions based on your experience and skills. We value your passion to discover, invent, simplify and build. Protecting your privacy and the security of your data is a longstanding top priority for Amazon. Please consult our Privacy Notice (https://www.amazon.jobs/en/privacy\_page) to know more about how we collect, use and transfer the personal data of our candidates. Amazon is an equal opportunity employer and does not discriminate on the basis of protected veteran status, disability, or other legally protected status. Our inclusive culture empowers Amazonians to deliver the best results for our customers. If you have a disability and need a workplace accommodation or adjustment during the application and hiring process, including support for the interview or onboarding process, please visit https://amazon.jobs/content/en/how\-we\-hire/accommodations for more information. If the country/region you’re applying in isn’t listed, please contact your Recruiting Partner. **Company** \- Amazon Web Services EMEA SARL (Irish Branch) \- G50 Job ID: A10394732",https://www.linkedin.com/jobs/view/4403547634
"Analyst, Internal Controls",PayPal,"Dublin, County Dublin, Ireland",linkedin,"**The Company** PayPal has been revolutionizing commerce globally for more than 25 years. Creating innovative experiences that make moving money, selling, and shopping simple, personalized, and secure, PayPal empowers consumers and businesses in approximately 200 markets to join and thrive in the global economy. We operate a global, two\-sided network at scale that connects hundreds of millions of merchants and consumers. We help merchants and consumers connect, transact, and complete payments, whether they are online or in person. PayPal is more than a connection to third\-party payment networks. We provide proprietary payment solutions accepted by merchants that enable the completion of payments on our platform on behalf of our customers. We offer our customers the flexibility to use their accounts to purchase and receive payments for goods and services, as well as the ability to transfer and withdraw funds. We enable consumers to exchange funds more safely with merchants using a variety of funding sources, which may include a bank account, a PayPal or Venmo account balance, PayPal and Venmo branded credit products, a credit card, a debit card, certain cryptocurrencies, or other stored value products such as gift cards, and eligible credit card rewards. Our PayPal, Venmo, and Xoom products also make it safer and simpler for friends and family to transfer funds to each other. We offer merchants an end\-to\-end payments solution that provides authorization and settlement capabilities, as well as instant access to funds and payouts. We also help merchants connect with their customers, process exchanges and returns, and manage risk. We enable consumers to engage in cross\-border shopping and merchants to extend their global reach while reducing the complexity and friction involved in enabling cross\-border trade. Our beliefs are the foundation for how we conduct business every day. We live each day guided by our core values of Inclusion, Innovation, Collaboration, and Wellness. Together, our values ensure that we work together as one global team with our customers at the center of everything we do – and they push us to ensure we take care of ourselves, each other, and our communities. **Job Summary:** This job contributes to the development and implementation of internal control processes. It involves collaborating with team members, identifying efficiencies and improvements, exercising judgment within defined processes, assisting in monitoring compliance, and participating in team discussions. **Job Description:** **Essential Responsibilities:** * Contribute to the development and implementation of internal control processes. * Collaborate with team members to identify efficiencies and improvements in internal controls. * Exercise judgment within defined processes to support internal control objectives. * Assist in monitoring compliance with internal control policies and procedures. * Participate in team discussions to provide insights and suggestions for process enhancements. **Minimum Qualifications:** * 1\+ years relevant experience and a Bachelor’s degree OR Any equivalent combination of education and experience. **Additional Responsibilities \& Preferred Qualifications:** * Documenting and maintaining business processes, process maps, and controls for key processes and activities within the organization to ensure consistency, efficiency, and compliance with regulations. * Collaborating with key stakeholders, such as department heads, process owners, and risk managers, to identify and address potential risks within existing process documentation. * Conducting regular reviews and updates of process and control documentation to reflect changes in regulations, industry standards, or internal procedures that may impact risk exposure. * Identifying gaps or inefficiencies in current process and control documentation that could pose risks to the organization's operations or objectives. * Participating in risk assessments and audits to evaluate the effectiveness of process and control documentation in mitigating risks and identifying areas for improvement. * Monitoring and evaluating the performance of SOPs in managing risks and achieving desired outcomes, and making recommendations for revisions or enhancements as needed. * Maintaining strong understanding of key risk management principles and PayPal products and customer services within area of responsibility. * Supporting other risk management activities as needed **Subsidiary:** PayPal **Travel Percent:** 0 PayPal does not charge candidates any fees for courses, applications, resume reviews, interviews, background checks, or onboarding. When making an application directly, we will never ask you to share passwords, one\-time passcodes (OTP), or verification codes. Any such request is a red flag and likely part of a scam. All communication regarding your application will come from official PayPal email domains. If you suspect fraudulent activity, please report it immediately. To learn more about how to identify and avoid recruitment fraud please visit https://careers.pypl.com/contact\-us. For the majority of employees, PayPal's balanced hybrid work model offers 3 days in the office for effective in\-person collaboration and 2 days at your choice of either the PayPal office or your home workspace, ensuring that you equally have the benefits and conveniences of both locations. **Our Benefits:** At PayPal, we’re committed to building an equitable and inclusive global economy. And we can’t do this without our most important asset\-you. That’s why we offer comprehensive, choice\-based programs, to support all aspects of personal wellbeing—physical, emotional, and financial—delivering meaningful value where it matters most. We strive to create a flexible, balanced work culture with a holistic approach to benefits, including generous paid time off, healthcare coverage for you and your family, and resources to create financial security and support your mental health. **Who We Are:** Click Here to learn more about our culture and community. **Commitment to Diversity and Inclusion** PayPal provides equal employment opportunity (EEO) to all persons regardless of age, color, national origin, citizenship status, physical or mental disability, race, religion, creed, gender, sex, pregnancy, sexual orientation, gender identity and/or expression, genetic information, marital status, status with regard to public assistance, veteran status, or any other characteristic protected by federal, state, or local law. In addition, PayPal will provide reasonable accommodations for qualified individuals with disabilities. If you are unable to submit an application because of incompatible assistive technology or a disability, please contact us at paypalglobaltalentacquisition@paypal.com. **Belonging at PayPal:** Our employees are central to advancing our mission, and we strive to create an environment where everyone can do their best work with a sense of purpose and belonging. Belonging at PayPal means creating a workplace with a sense of acceptance and security where all employees feel included and valued. We are proud to have a diverse workforce reflective of the merchants, consumers, and communities that we serve, and we continue to take tangible actions to cultivate inclusivity and belonging at PayPal. Any general requests for consideration of your skills, please Join our Talent Community. We know the confidence gap and imposter syndrome can get in the way of meeting spectacular candidates. Please don’t hesitate to apply.",https://www.linkedin.com/jobs/view/4411758906
Apprentice Carpenter,,"South Dublin, D, IE",indeed,"Apprentice Carpenter – KJ Construction \& Renovation LTD KJ Construction \& Renovation LTD are looking for a motivated Apprentice Carpenter to join our growing team working across South Dublin, Wicklow \& Kildare. This is a great opportunity for someone looking to start a long\-term career in carpentry and construction while learning on a wide variety of residential renovation and construction projects. What You’ll Learn * 1st Fix Carpentry * 2nd Fix Carpentry * Roofing \& Timber Frame Work * Windows \& Doors Installation * Flooring \& Skirting * General Construction Skills * Safe use of tools and equipment * Working alongside experienced tradesmen Requirements * Hard working with a good attitude * Reliable and punctual * Willing to learn * Safe Pass preferred * Manual Handling preferred * Own transport is an advantage * Some experience using tools is beneficial but not essential What We Offer * Full apprenticeship support * Opportunity to progress within the company * Variety of work across renovations and new projects * Friendly working environment * Weekly pay * Long\-term career opportunity Working Hours Monday – Friday 7:00am – 4:00pm Break: 11:00am – 11:45am Location Projects based mainly in: * South Dublin * Wicklow * Kildare Apply Send your CV or a short description about yourself to: kj\-construction@outlook.com Pay: €316\.00\-€854\.80 per week Benefits: * On\-site parking Work Location: In person",https://ie.indeed.com/viewjob?jk=d0b51627ebda9200
Associate Client Service Specialist,Jobs via eFinancialCareers,"Dublin, County Dublin, Ireland",linkedin,"**The Opportunity:** As an Irish Client Service Associate, you will be a part of an energetic environment managing daily tasks at one of the world's preeminent private money managers. You are encouraged to ask questions, improve processes, and propose fresh solutions. We base your evaluation performance on meritocracy and invest in employee development to help progression and growth within the firm. The more value you can add, the quicker you will be on your way to earning more advanced opportunities. That is how our top executives got there, and we think you can do it too. In fact, we hope you will promote to your next role within 2 or more years (a typical outcome for successful employees). **The Day\-to\-Day:** Every day in this role is different! Expect a dynamic day where you will liaise Sale Representatives, Investment Counsellors, and many other parties. You will: * Partner directly with top banks (who are our custodians) to assist with administrative and operational tasks * Gain exposure to other European countries' businesses * Help Investment Counsellors with relationship management by working with existing clients on operational inquiries * Help produce reports based on the current situation of prospective clients * Be a direct contact or expert in multiple subjects to develop your skills once you assume more responsibility * Report to your client Service Team Leader who will aid in your on\-the\-job training and professional development **Your Qualifications:** * A university degree or equivalent combination of education and experience (Finance/Economics/Business is a plus) * You can connect with a wide array of audiences by phone and email with a focus on client service * Work well in a collaborative, team\-oriented setting * Commitment to maintain quality of work while sticking to a timeline **Why Fisher Investments Ireland:** The global Fisher organisation distinguishes itself by putting clients first, providing unmatched service, and taking a personalised approach to investing. You can feel confident knowing that Fisher Investments and Fisher Investments Ireland align with our clients' priorities by using a simple and transparent fee structure and recognised European custodians. It's the people that make the Fisher purpose possible, and to help our employees meet their long\-term goals, we offer an array of benefits, including: * 100% paid premiums for our top\-tier supplemental healthcare and dental plans for employees and their qualified dependents * 28 days annual leave, with the ability to purchase up to 3 additional days per year, plus up to 11 paid holidays * Enhanced maternity pay package with 26 weeks' top up to full base pay for eligible employees * $10,000\* fertility, hormonal health and family\-forming benefit * A retirement pension plan, featuring a 9% company pension contribution of your base pay and an additional company match of up to 5% of base pay * Monthly gym subsidy of up to ₠50 per month * Employee Assistance Program and other emotional wellbeing services * A collaborative working environment that practices ongoing training, educational support and employee appreciation events * This is an in\-office role. Based on your role, tenure, and performance eligibility you may have the opportunity to participate in our hybrid work from home program. This program is subject to change. \*Employees residing outside of the US will be eligible for the $10,000 equivalent in their local currency. FISHER INVESTMENTS IRELAND IS AN EQUAL OPPORTUNITY EMPLOYER",https://www.linkedin.com/jobs/view/4412411074
