title,company,location,site,description,job_url
"Regional Environmental Engineer, AWS Environmental",Amazon Web Services (AWS),"Dublin, County Dublin, Ireland",linkedin,"**Description** For over 15 years, Amazon Web Services (AWS) has been the world’s most comprehensive and broadly adopted cloud computing platform. What is cloud computing? Cloud computing is the on\-demand delivery of IT resources over the Internet. In 2019, Amazon announced The Climate Pledge, which includes our commitment to power our operations with 100% renewable energy by 2025, on the path to achieving net zero carbon across our businesses by 2040\. To learn more about AWS, visit https://aws.amazon.com and https://sustainability.aboutamazon.com/environment/the\-cloud. The AWS Environmental team is an expanding and dynamic team that is critical to enabling AWS’s growth around the world, as well as ensuring compliance of AWS’s global operations, including physical data centers, as well as other AWS facilities, customer\-facing enterprises and products. The Environmental team has responsibility for developing and implementing AWS’s global environmental programs. We are seeking a Regional Environmental Engineer to be responsible for AWS environmental compliance in Dublin. The Regional Environmental Engineer will ensure standards and policies support regulatory compliance, and they will provide appropriate environmental guidance to regional operations, design and construction teams. The individual will complete contractual and environmental performance analysis, establish and monitor metrics and guide partner teams in the implementation of Amazon environmental procedures. The Regional Environmental Engineer will work with internal and external partners that include government entities, contractors, consultants, design, construction, operations and other key stakeholders. The Regional Environmental Engineer must have excellent communication skills, strong environmental regulatory knowledge, demonstrated success in program development and project management of complex and technical projects. AWS Infrastructure Services owns the design, planning, delivery, and operation of all AWS global infrastructure. In other words, we’re the people who keep the cloud running. We support all AWS data centers and all of the servers, storage, networking, power, and cooling equipment that ensure our customers have continual access to the innovation they rely on. We work on the most challenging problems, with thousands of variables impacting the supply chain — and we’re looking for talented people who want to help. You’ll join a diverse team of network engineers, supply chain specialists, safety experts, operations managers, and other vital team members in design and construction. You’ll collaborate with people across AWS to help us deliver the highest standards in environmental compliance while providing seemingly infinite capacity at the lowest possible cost for our customers. And you’ll experience an inclusive culture that welcomes bold ideas and empowers you to own them to completion. Key job responsibilities * Develop and implement comprehensive environmental strategic programs across multiple sites, integrating insights from operations, engineering, and construction teams * Manage environmental compliance by navigating local and national regulations, ensuring adherence to Amazon's rigorous standards * Conduct thorough environmental audits and investigations, creating actionable insights and corrective measures * Build collaborative relationships with governmental agencies, internal stakeholders, and external consultants * Create and track environmental performance metrics to measure, monitor, and forecast organizational impact **About The Team** Diverse Experiences Amazon values diverse experiences. Even if you do not meet all of the preferred qualifications and skills listed in the job description, we encourage candidates to apply. If your career is just starting, hasn’t followed a traditional path, or includes alternative experiences, don’t let it stop you from applying. Why AWS Amazon Web Services (AWS) is the world’s most comprehensive and broadly adopted cloud platform. We pioneered cloud computing and never stopped innovating — that’s why customers from the most successful startups to Global 500 companies trust our robust suite of products and services to power their businesses. Work/Life Balance We value work\-life harmony. Achieving success at work should never come at the expense of sacrifices at home, which is why we strive for flexibility as part of our working culture. When we feel supported in the workplace and at home, there’s nothing we can’t achieve in the cloud. Inclusive Team Culture Here at AWS, it’s in our nature to learn and be curious. Our employee\-led affinity groups foster a culture of inclusion that empower us to be proud of our differences. Ongoing events and learning experiences, including our Conversations on Race and Ethnicity (CORE) and AmazeCon (gender diversity) conferences, inspire us to never stop embracing our uniqueness. Mentorship and Career Growth We’re continuously raising our performance bar as we strive to become Earth’s Best Employer. That’s why you’ll find endless knowledge\-sharing, mentorship and other career\-advancing resources here to help you develop into a better\-rounded professional. **Basic Qualifications** * Bachelor's Degree in environmental engineering, environmental science, geology, geography, biology, chemistry or related field with 5\+ years of experience in environmental management or technical advisory roles * Demonstrated knowledge of Irish and EU environmental regulations, with experience in environmental compliance, permitting, waste management, and water discharge requirements * Experience implementing environmental management systems (such as ISO14001\) and conducting environmental impact assessments * Project management experience with proficiency in MS Office applications **Preferred Qualifications** * Knowledge of critical data center equipment * Knowledge of engineering documentation, electrical diagrams and standard operating procedures * Experience in project management in data centers or comparable critical infrastructure * Experience in Data Center Engineering Operations, with a deep understanding of electrical and mechanical data center infrastructure * Experience reading and interpreting construction specifications and drawings for all domains Amazon is an equal opportunities employer. We believe passionately that employing a diverse workforce is central to our success. We make recruiting decisions based on your experience and skills. We value your passion to discover, invent, simplify and build. Protecting your privacy and the security of your data is a longstanding top priority for Amazon. Please consult our Privacy Notice (https://www.amazon.jobs/en/privacy\_page) to know more about how we collect, use and transfer the personal data of our candidates. Amazon is an equal opportunity employer and does not discriminate on the basis of protected veteran status, disability, or other legally protected status. Our inclusive culture empowers Amazonians to deliver the best results for our customers. If you have a disability and need a workplace accommodation or adjustment during the application and hiring process, including support for the interview or onboarding process, please visit https://amazon.jobs/content/en/how\-we\-hire/accommodations for more information. If the country/region you’re applying in isn’t listed, please contact your Recruiting Partner. **Company** \- Amazon Data Services Ireland Limited Job ID: A3180683",https://www.linkedin.com/jobs/view/4372725316
Retail Finance Systems SME,Primark,"Dublin, County Dublin, Ireland",linkedin,"Because we strive to put people first. Culture, our way **Technology at Primark** What’s a career at Primark all about? The positive impact you’re making, the experiences you’re having and the people you’re with. You’re our inspiration. Embrace what sets you apart, own your career and develop in ways you never expected. Leave your mark. And do it your way. Our technology team is actively shaping the next wave of advancements. Engaged with innovative initiatives, your expertise will propel our business into the future. Collaborating with a creative team of tech enthusiasts, you’ll contribute your unique skills to fuel our technological advancements. **What You’ll Get** People are at the heart of what we do here, so it’s essential we provide you with the right environment to perform at your very best. Let’s talk lifestyle: 27 days of leave, plus bank holidays and if you want, you can buy 5 more. Because Primark is all about tailoring to you, we offer Tax Saver Tickets, fitness centre, and a subsidised cafeteria. **What You’ll Do As a Retail Finance SME** We want you to feel challenged and inspired. Here, you’ll develop your skills across a range of responsibilities: * Lead the finance systems workstream for POS and Cash Back Office (CBO) implementation, ensuring accurate configuration of financial settings, tax rules, tender types, and store hierarchies. * Define and maintain end‑to‑end cash control processes, overseeing reconciliations between POS, CBO, banks, and payment providers while managing discrepancies and escalation protocols. * Ensure timely and accurate posting of sales, cash movements, and variances into the ERP/GL, supporting daily, weekly, and period‑end close activities. * Develop, validate, and maintain key POS/CBO finance reports—including cash, variance, banking, and settlement reporting—to support internal controls and audit readiness. * Partner closely with Store Operations, Loss Prevention, Finance, and IT, serving as the primary finance contact for POS/CBO vendors, integrators, and store support. * Support store rollout, training, and post‑go‑live stabilisation by providing guidance on cash handling, reconciliation processes, and financial compliance requirements. **What You’ll Bring** Here at Primark, we want everyone to feel valued – so please bring your authentic self to work, of course with some other key experience and abilities for this role in particular: * Strong background in retail finance systems, including POS and Cash Back Office, with hands‑on experience in cash management, reconciliation, and loss‑prevention controls. * Proficient in ERP/finance platforms (SAP, Oracle, NetSuite, Dynamics) with the ability to analyse high‑volume transactional data and perform complex reconciliations using advanced Excel. * Experience with leading POS and CBO solutions (e.g., Aptos, Oracle Retail, NCR, Lightspeed, Diebold Nixdorf, Shopify POS) and exposure to multi‑country or multi‑currency retail operations. * Qualified or part‑qualified accountant (ACA, ACCA, CIMA) or equivalent, with experience in retail systems, finance transformation, or broader change/project management. * Strong control mindset with high attention to detail; pragmatic, solutions‑focused, and comfortable working closely with store teams and loss prevention. * Proven ability to operate effectively in fast‑paced, high‑volume retail environments, balancing technical expertise with hands\-on problem solving. Does this sound like you? Great, because we can’t wait to see what you’ll bring. You’ll be supported within a team of equally capable people, celebrating who you are and aiding you reach your potential. At Primark, we’re excited about our future \- and we’re excited to develop yours. **About Primark** At Primark, people matter. They’re the beating heart of our business and the reason we’ve grown from our first store in Dublin in 1969 to a £9bn\+ turnover business and over 80,000 colleagues and over 440 stores in 17 countries today. Our values run through everything we do. In essence, we're Caring and always strive to put people first. We're also Dynamic, bravely pushing the boundaries to stay ahead. And finally, we succeed Together. If you need any reasonable adjustments or have an accessibility request, during your recruitment journey, such as extended time or breaks between online assessments, a sign language interpreter, mobility access, or assistive technology please contact your talent acquisition specialist. All offers of employment are subject to background checks, including right to work, reference education and for some roles criminal, and financial checks. If you have any concerns, please reach out to our talent acquisition team to discuss. **REQ ID:** JR\-6908",https://www.linkedin.com/jobs/view/4391751888
SailPoint Engineer,AIG,"Dublin, County Dublin, Ireland",linkedin,"At AIG, we are reimagining the way we help customers to manage risk. Join us as a SailPoint Engineer to play your part in that transformation. It’s an opportunity to grow your skills and experience as a valued member of the team. **Make your mark in Information Technology** At AIG, technology is at the heart of everything we do, from underwriting risks to processing claims. The Information Technology team equips our colleagues with the latest tools to complete their work efficiently and with the highest standards of excellence. The team is responsible for shielding the company’s systems from security risks, while designing technology strategies that enable AIG’s businesses to achieve their goals. AIG’s Information Technology functions include enterprise architecture, software and systems engineering, cybersecurity, and technology risk and compliance. **How You Will Create An Impact** The Identity and Access Management (IAM) team at AIG is seeking a highly skilled IAM Engineer with expertise in SailPoint IdentityIQ and strong Java programming skills. As a SailPoint Engineer, you will play a critical role in designing, implementing, and maintaining our enterprise IAM infrastructure. Your primary responsibilities will be to secure and efficiently manage user identities and access privileges throughout the identity lifecycle. * Help design, configure, and deploy SailPoint IdentityIQ solutions to meet the organization's IAM requirements. * Collaborate with cross\-functional teams to gather IAM requirements and translate them into technical solutions. * Responsible for the development and customization of SailPoint IdentityIQ workflows, rules, connectors, and other components to support identity lifecycle management, access provisioning, and compliance. * Integrate SailPoint IdentityIQ with various systems and applications, including but not limited to Active Directory, LDAP, HR systems, and business applications. * Implement and maintain access control policies and entitlement management within SailPoint IdentityIQ. * Collaborate with development teams to ensure smooth integration of IAM solutions with Java\-based applications. * Conduct integration testing to verify the functionality, performance, and security of IAM solutions. * Stay current with industry best practices and emerging trends in IAM and contribute to the continuous improvement of IAM processes and technologies. **What You'll Need To Succeed** * Bachelor's degree in a Cybersecurity, Information Technology, or related field, such as Computer Science or Information Technology. * 7\+ years of IT experience with designing, developing, and supporting IGA solutions with 5\+ years focused on IAM solutions (specifically SailPoint IdentitiyIQ). * Experience developing and configuring most common SailPoint connectors including Active Directory (AD), Azure AD, JDBC, exchange, mainframe, web services, and authoritative source integrations (Workday, Fieldglass) * Familiar with role\-based access controls and configuring automated provisioning and deprovisioning. * Familiar with software development lifecycles (SDLC) and Agile development methodologies. * Candidates must possess excellent verbal communication, decision making and customer service skills. * Ability to work in a team environment, adapt quickly to change and learn new applications or environments is required. * Must be highly organized and maintain quality work while meeting deadlines. * Extreme attention to detail is necessary due to audit and regulatory requirements. * Expertise in Java programming language and experience with developing and integrating Java\-based applications. * Proven experience in integration testing, ensuring the seamless integration of IAM solutions with various systems and applications. * Valid certification in SailPoint IdentityIQ (e.g., SailPoint Certified IdentityIQ Engineer) is required. * Proficient in IAM concepts, including identity lifecycle management, access provisioning, RBAC, and entitlement management. * Experience with identity protocols and standards such as SAML, OAuth, LDAP, and SCIM. * Strong analytical and problem\-solving skills with the ability to troubleshoot complex technical issues. * Excellent communication skills and the ability to collaborate effectively with cross\-functional teams. * Proactive and self\-motivated with the ability to work independently and manage multiple tasks simultaneously. Ready to prove your potential? We would love to hear from you. At AIG, we value in\-person collaboration as a vital part of our culture, which is why we ask our team members to be primarily in the office. This approach helps us work together effectively and create a supportive, connected environment for our team and clients alike. **Enjoy Benefits That Take Care Of What Matters** At AIG, our people are our greatest asset. We know how important it is to protect and invest in what’s most important to you. That is why we created our Total Rewards Program, a comprehensive benefits package that extends beyond time spent at work to offer benefits focused on your health, wellbeing and financial security—as well as your professional development—to bring peace of mind to you and your family. **Reimagining insurance to make a bigger difference to the world** American International Group, Inc. (AIG) is a global leader in commercial and personal insurance solutions; we are one of the world’s most far\-reaching property casualty networks. It is an exciting time to join us — across our operations, we are thinking in new and innovative ways to deliver ever\-better solutions to our customers. At AIG, you can go further to support individuals, businesses, and communities, helping them to manage risk, respond to times of uncertainty and discover new potential. We invest in our largest asset, our people, through continuous learning and development, in a culture that celebrates everyone for who they are and what they want to become. **Welcome to a culture of inclusion** We’re committed to creating a culture that truly respects and celebrates each other’s talents, backgrounds, cultures, opinions and goals. We foster a culture of inclusion and belonging through learning, cultural awareness activities and Employee Resource Groups (ERGs). With global chapters, ERGs are a cornerstone for our culture of inclusion. The talent of our people is one of AIG’s greatest assets, and we are honored that our drive for positive change has been recognized by numerous recent awards and accreditations. *AIG provides equal opportunity to all qualified individuals regardless of race, color, religion, age, gender, gender expression, national origin, veteran status, disability or any other legally protected categories.* AIG is committed to working with and providing reasonable accommodations to job applicants and employees with disabilities. If you believe you need a reasonable accommodation, please send an email to candidatecare@aig.com. **Functional Area** IT \- Information Technology AIG Employee Services, Inc.",https://www.linkedin.com/jobs/view/4321628399
Sales Advisor,The Perfume Shop,"Dublin, County Dublin, Ireland",linkedin,"Here at The Perfume Shop, people are at the heart of everything we do. We are always on the lookout for individuals with Talent, a Passion for what we do and a Spark to help achieve our vision. **The Role** Are you passionate about perfume, and love people? Do you want to be part of a supportive team, and thrive in a fast\-paced environment? Everyday, our expert Sales Advisors work hard to make sure our customers feel valued, confident and special. As a Sales Advisor, it is your role to create an outstanding customer experience and grow sales. Assisting with the daily operational running of the store, you are customer focused, working as part of an amazing and supportive team to deliver against key targets that drive the success of your store. Contracted Hours: 10 Contract Type: Permanent Contract Pay Rate: €10\.02 \- €15\.77 **What You Will Do** You will greet customers and give great service by listening to their needs We’re proud to be the perfume experts, so you’ll be providing advice to customers on their perfume choices. Don’t worry, we’ll make sure you get all the training you need You will help the team to achieve and exceed store and team targets – and there are fantastic incentives and prizes on offer to recognise success Every customer is a VIP at The Perfume Shop, so you’ll offer every customer a free reward card to maximise their future offers and potential savings **What You Will Bring** We believe that you bring Talent, Passion and Spark and in return we will give you the skills and training in perfume to succeed! **It really helps if you;** Have a talent for getting along with people Have a passion for teamwork, and being successful together Have the spark to love learning about perfume Can be flexible with your work patterns **What You Will Get** * We pay commission at Christmas based on store sales and the number of hours worked * We’ll ensure you work regular hours and get your rota at least 4 weeks in advance so you can plan your life outside work * 32 days holiday (pro rata depending on contract hours) * You’re also a VIP to us, so you’ll get 20% off perfume and be able to take part in any customer offers on top * Additional discounts with our AS Watson partners including Superdrug and 3 Mobile * The opportunity to win some great prizes and incentives based on personal, team and store performance * Continuous learning and training to ensure you are always developing * Access to Wagestream, to support your financial wellbeing needs, giving you more control and flexibility with your pay. * Pension, health and wellbeing benefits, \+ more! **We are passionate about ‘Growing Our Own’, so we always encourage our employees to progress internally.** *We thank you for your interest, however due to the high volumes of applications, only those successful will be contacted. We do still encourage you to continue applying to any roles of interest you see advertised.* The Perfume Shop is an equal opportunity employer that is committed to supporting diversity and inclusion within our work environment. All qualified applicants will receive consideration for employment without regard to race, colour, religion, gender, gender identity or expression, sexual orientation, national origin, genetics, disability, age, or veteran status. We will ensure that individuals with disabilities are provided reasonable accommodation to participate in the job application or interview process, to perform essential job functions, and to receive other benefits and privileges of employment. The Perfume Shop is part of AS Watson Group, the world’s largest international health and beauty retailer operating over 16,500 stores under 12 retail brands in 28 markets, with over 130,000 employees worldwide. For the fiscal year 2023, AS Watson Group recorded revenue of US$23 billion. Every year, it is serving over 5\.5 billion shoppers via its O\+O (Offline plus Online) platforms, providing tech\-enabled retail experience to customers offline and online.",https://www.linkedin.com/jobs/view/4389269256
