title,company,location,site,description,job_url
Junior Brand Accountant,Richmond Marketing,"DUBLIN 24, D, IE",indeed,"**Junior Brand Accountant** **REPORTS TO:** Senior Commercial Accountant **DIRECT REPORTS:** None **ABOUT RICHMOND** At Richmond, we don’t just build brands—we ignite them. As Ireland’s leading trend\-spotting premium brand builder, we’ve been shaping the future since 1992\. Our mantra is simple: *Where Great People Meet Great Brands*. We don’t just hire employees; we bring on bold, agile, and energetic innovators who thrive on shaking up the status quo. We're not just about distributing products—we’re about disrupting the market, challenging the norms, and launching game\-changing ideas and products that leave a lasting impact. **JOB DESCRIPTION** The Junior Accountant role will support the finance function across a number of brands within our portfolio. Reporting directly to the Senior Commercial accountant, this position will assist with financial reporting, commercial pricing analysis, and investment management activities, while ensuring accurate financial records and timely reporting. The role offers an excellent opportunity to develop accounting and commercial finance experience within a dynamic multi\-brand environment. **KEY RESPONSIBILITIES** * Sales Reporting, Analytics \& IT Maintenance * Preparation of information for monthly/quarterly review meetings * Recharging Of Brand Marketing and Promotional Expenses * Assisting with Month End accounts \& Management Accounting Tasks * Assisting Commercial Accounting Team * Budgeting Preparation * Ad hoc project work **KNOWLEDGE SKILLS \& EXPERIENCE** * Part Qualified or must have a relevant College Degree * The Candidate Must Have the Intention of Completing Professional Accounting Exams * Must Have Excellent Verbal and Interpersonal Skills * Self\-Motivated, Team Player and Ambitious * Good Analytical Skills \& Attention to detail * Ability to prioritise responsibilities and manage deadlines * Strong IT Skills (Especially Excel)",https://ie.indeed.com/viewjob?jk=fccee48890c7d556
Junior Project Coordinator to Recruitment,Archer Recruitment,"Dublin, County Dublin, Ireland",linkedin,"**Junior Project Coordinator – Changing Careers?** **Seeking a new direction this summer?** Join the Archer team as a Recruitment Consultant and build lasting relationships with key clients and top IT talent across Ireland and Europe. **Why Choose Archer?** * **Limitless Earnings:** Enjoy a performance\-based environment with massive earning potential. * **Career Elevation:** Determine your own progression in a clear, meritocratic environment. * **Top\-Tier Training:** Receive full mentorship, tailored 1\-to\-1 training, and access to our Leadership Academy. As an Associate Recruitment Executive, you will take full ownership of a specific technology market. You will manage the end\-to\-end recruitment process, consult with clients, and deliver high\-calibre talent. **What We Are Looking For:** * **2\+ years** in professional services, ideally in a Project Coordinator/Management role. * Experience in a client\- or customer\-facing environment is a major plus. * Strong communication and relationship\-building skills. **Compensation \& Benefits:** * **Base Salary:** DOE (Depending on Experience) * **Year 1 Total Comp:** €47,000 (Base \+ Bonus \& Commission) * **Year 2:** €70,000\+, **Year 3:** €100k\+ * **Location:** Ideal Dublin City Centre location **Ready to launch your new career?** For more information and insights, contact **Saoirse Lawton** at **\+353 (0\)1 6498517** .",https://www.linkedin.com/jobs/view/4420990269
Kitchen Porter,Boparan Restaurant Group,"Dublin, County Dublin, Ireland",linkedin,"**Join the Heart of the Kitchen as a Kitchen Porter at Carluccio’s!** **About Us:** At Carluccio’s, we believe that every great dish begins with a clean and organised kitchen. Our passion for authentic Italian cuisine is matched by our commitment to maintaining the highest standards of cleanliness and efficiency. We’re looking for a dedicated Kitchen Porter to join our team and keep our kitchen running smoothly. **The Role:** As a Kitchen Porter at Carluccio’s, you’ll play a crucial role in supporting our chefs and ensuring that the kitchen is always clean, safe, and well\-organised. Here’s what you’ll be doing: * Keep the Kitchen Spotless: Maintain cleanliness in the kitchen by washing dishes, utensils, and equipment, and ensuring work surfaces are clean and sanitary. * Support the Team: Assist chefs and kitchen staff with basic food preparation tasks, and help with organising and storing deliveries. * Manage Waste: Properly dispose of waste and recycling, keeping the kitchen area tidy and free of hazards. * Stock and Organize: Help with the organisation and restocking of ingredients and supplies, making sure the kitchen is always ready for service. * Ensure Safety: Follow all health and safety guidelines to ensure a safe working environment for everyone in the kitchen. What’s In It For You? We’re Not Just Offering a Job; We’re Offering a Career Full Of Excitement And Growth * Feast on 50% Off your total bill for you and 5 friends across all our brands—because great food should be shared! * Unlock Exclusive Discounts on thousands of online and high\-street retailers, plus restaurants, through our BRG Spark App. * Stock Up on Favourites: Enjoy 20% off at Carluccio’s retail gift shop \& deli. * Get Paid When You Need It with Wage Stream, offering access to advanced pay. * Refer Friends and Earn with our bonus scheme. * Skyrocket Your Career: Excellent opportunities for career development across our diverse brand portfolio. * Work Your Way: Enjoy flexible working opportunities that suit your lifestyle. This is your chance to be an essential part of our kitchen team, where every contribution is valued. If you’re ready to start your career in hospitality or take the next step, join us at Carluccio’s as a Kitchen Porter and become part of our family! **Boparan Restaurant Group (BRG)** is a growing hospitality group committed to our goal of striving to become the Best Restaurant Group in everything we do. We’re obsessed with building credibility, going above and beyond, and delivering a memorable guest experience and an amazing working environment. **At BRG, We Live By Our Core Values** ✅ **Honest** – Acting with integrity in everything we do. ✅ **Hardworking** – Giving our best, every day. ✅ **Hungry** – Always striving for growth and excellence. ✅ **Heart** – Caring deeply about our people, our guests, and our communities. Carluccio's on Dawson Street offers a relaxed, authentic Italian dining experience with a menu featuring classic dishes made from fresh, quality ingredients. **Skills** Fast\-Paced Experience",https://www.linkedin.com/jobs/view/4421208755
Kitchen Porter,Carluccio's,"Dublin, County Dublin, Ireland",linkedin,"**Join the Heart of the Kitchen as a Kitchen Porter at Carluccio’s!** **About Us:** At Carluccio’s, we believe that every great dish begins with a clean and organised kitchen. Our passion for authentic Italian cuisine is matched by our commitment to maintaining the highest standards of cleanliness and efficiency. We’re looking for a dedicated Kitchen Porter to join our team and keep our kitchen running smoothly. **The Role:** As a Kitchen Porter at Carluccio’s, you’ll play a crucial role in supporting our chefs and ensuring that the kitchen is always clean, safe, and well\-organised. Here’s what you’ll be doing: * Keep the Kitchen Spotless: Maintain cleanliness in the kitchen by washing dishes, utensils, and equipment, and ensuring work surfaces are clean and sanitary. * Support the Team: Assist chefs and kitchen staff with basic food preparation tasks, and help with organising and storing deliveries. * Manage Waste: Properly dispose of waste and recycling, keeping the kitchen area tidy and free of hazards. * Stock and Organize: Help with the organisation and restocking of ingredients and supplies, making sure the kitchen is always ready for service. * Ensure Safety: Follow all health and safety guidelines to ensure a safe working environment for everyone in the kitchen. What’s In It For You? We’re Not Just Offering a Job; We’re Offering a Career Full Of Excitement And Growth * Feast on 50% Off your total bill for you and 5 friends across all our brands—because great food should be shared! * Unlock Exclusive Discounts on thousands of online and high\-street retailers, plus restaurants, through our BRG Spark App. * Stock Up on Favourites: Enjoy 20% off at Carluccio’s retail gift shop \& deli. * Get Paid When You Need It with Wage Stream, offering access to advanced pay. * Refer Friends and Earn with our bonus scheme. * Skyrocket Your Career: Excellent opportunities for career development across our diverse brand portfolio. * Work Your Way: Enjoy flexible working opportunities that suit your lifestyle. This is your chance to be an essential part of our kitchen team, where every contribution is valued. If you’re ready to start your career in hospitality or take the next step, join us at Carluccio’s as a Kitchen Porter and become part of our family! **Boparan Restaurant Group (BRG)** is a growing hospitality group committed to our goal of striving to become the Best Restaurant Group in everything we do. We’re obsessed with building credibility, going above and beyond, and delivering a memorable guest experience and an amazing working environment. **At BRG, We Live By Our Core Values** ✅ **Honest** – Acting with integrity in everything we do. ✅ **Hardworking** – Giving our best, every day. ✅ **Hungry** – Always striving for growth and excellence. ✅ **Heart** – Caring deeply about our people, our guests, and our communities. Carluccio's on Dawson Street offers a relaxed, authentic Italian dining experience with a menu featuring classic dishes made from fresh, quality ingredients. **Skills** Fast\-Paced Experience",https://www.linkedin.com/jobs/view/4421215872
Laundrette Assistant,,"Dún Laoghaire, D, IE",indeed,Seeking for a laundrette assistant Must be able to be flexible for hours No experience needed training on site. Contact: tonifox1821@gmail.com Pay: From €14\.00 per hour Work Location: In person,https://ie.indeed.com/viewjob?jk=20838c7a576af300
Lawyer - Licensing,WILLIAM FRY LLP,"Dublin, County Dublin, Ireland",linkedin,"**Job Title: Lawyer \- Licensing** **Department: Litigation and Investigations** **Reporting to: Head of Litigation and Investigations** **Duration: Permanent** The Licensing lawyer will support the firm’s licensing and regulatory practice across the retail and hospitality sectors, by advising clients on licensing requirements, preparing and presenting Court applications and liaising with relevant regulatory authorities. This role involves working closely with partners and solicitors to deliver technical, commercial, and client\-focused licensing support across a broad client base. **The Role** In this role you will be responsible for * Advising clients on licensing requirements, processes, and compliance obligations across relevant sectors. * Preparing and presenting Court applications, reviewing, and managing licence applications, renewals, variations, and transfers on behalf of clients. * Drafting correspondences, submissions, and supporting documentation to regulatory authorities. * Liaising with regulators, advisers, and third parties to progress applications and resolve issues. * Tracking licence conditions, renewal dates, and compliance obligations for clients. * Conducting legal and regulatory research to support advisory work across various sectors. * Maintaining accurate client files in line with confidentiality and risk\-management procedures. * Supporting client relationship management and, where appropriate, business development initiatives. **The Person** * You have experience working in licensing, regulatory, or legal support within a law firm or professional services environment. * You are comfortable with preparing and presenting licensing applications and dealing with regulatory authorities. * You are familiarity with Irish and/or EU regulatory frameworks relevant to the firm’s clients. * You have a strong academic or professional background in law, compliance, or a related discipline. * You have prior experience in a top\-tier or mid\-tier law firm. * You have experience in transactional or advisory work involving retail and hospitality. **About us** William Fry LLP is one of Ireland’s leading corporate law firms with offices in Dublin, Cork, London, Silicon Valley and New York. We have over 310 legal and tax professionals and over 500 staff. Our client\-focused service combines technical excellence with commercial awareness and a practical, constructive approach to business issues. We advise leading domestic and international corporations, financial institutions and government organizations. William Fry is an equal opportunity Employer committed to recruiting people from diverse backgrounds and building an inclusive culture which harnesses the unique perspectives and skills of our people to deliver award winning innovative solutions to our clients. We are proud to be accredited as Investors in Diversity by the Irish Centre for Diversity. Please let us know if you require specific arrangements during the recruitment process. We'll do everything we can to support you. All information disclosed will be kept confidential.",https://www.linkedin.com/jobs/view/4420984155
Lawyer - Property,WILLIAM FRY LLP,"Dublin, County Dublin, Ireland",linkedin,"Role: Lawyer – Property Reporting to: Property Partner The successful candidate will be joining an innovative and market leading firm with a growing practice who will be involved in all aspects of Commercial Real Estate matters. Our Property Department is recognised as outstanding in Ireland and is consistently rated as a tier 1 practice by leading legal directories. This innovative and hugely experienced team has been heavily involved in the majority of landmark real estate transactions in Ireland in the past 12 months both direct property investment and real estate loan portfolio sales. Our clients include large institutional investors, international private equity funds, receivers, public authorities and major Irish, UK and US retailers. **The Role:** * Manage end\-to\-end commercial real estate transactions including high value acquisitions, disposals and financings. * Draft, review, and negotiate complex contracts, leases, and ancillary legal documentation to safeguard client interests. * Advise clients on strategic property matters, including regulatory compliance, and risk mitigation. * Lead due diligence processes, ensuring accuracy and efficiency. * Develop and nurture client relationships, acting as a trusted advisor. * Stay abreast of market trends and legislative changes to provide proactive, commercially focused advice. * Contribute to business development initiatives, including thought leadership, client pitches, and networking events. * Mentor and support junior team members, fostering a culture of excellence and continuous learning. **The Person** * You will have between 3 and 7 years’ post qualification experience. * You have strong academic background. * You have strong technical and drafting skills and a good eye for detail. * You are commercially focused. * You have excellent organisational skills and a proven ability to manage multiple priorities and ensure that deadlines are consistently met. * You have the ability to show a high level of initiative but can effectively work as part of a team. **About us** William Fry LLP is one of Ireland’s leading corporate law firms with offices in Dublin, Cork, London, San Francisco, Silicon Valley and New York. We have over 310 legal and tax professionals and over 460 staff. Our client\-focused service combines technical excellence with commercial awareness and a practical, constructive approach to business issues. We advise leading domestic and international corporations, financial institutions and government organizations. William Fry is an equal opportunity Employer committed to recruiting people from diverse backgrounds and building an inclusive culture which harnesses the unique perspectives and skills of our people to deliver award winning innovative solutions to our clients. We are proud to be accredited as Investors in Diversity by the Irish Centre for Diversity. Please let us know if you require specific arrangements during the recruitment process. We'll do everything we can to support you. All information disclosed will be kept confidential.",https://www.linkedin.com/jobs/view/4420965515
Loss Prevention Officer,"The TJX Companies, Inc.","Kildare, KE, IE",indeed,"TJX Europe At TJX Europe, every day brings new opportunities for growth, exploration, and achievement. You’ll be part of our vibrant team that embraces diversity, fosters collaboration, and prioritises your development. Whether you’re working in our Distribution Centers, Corporate Offices, or Retail Stores—TK Maxx \& Homesense, you’ll find abundant opportunities to learn, thrive, and make an impact. Come join our TJX team—a Fortune 100 company and the world’s leading off\-price retailer. **Job Description:** **Could you be one of our Loss Prevention Officers?** As the world's leading off\-price retailer of clothing and homeware, we're all about putting our customers first. With thousands of shops worldwide, we aim to provide a positive and memorable experience for all. Working as a **Loss Prevention Officer**, you'll help to deliver our goal of keeping our customers, associates and assets safe. Experience of being in a customer facing role, within a fast\-paced retail environment or security guard role is ideal but not essential. **In this role:** You will be supporting a positive customer experience within our stores by being a visible, friendly, approachable presence at our entrance doors. You will be focused on deterring loss on the salesfloor whilst acting as an ambassador for the loss prevention function. You will work closely with the store team to maintain security of our product and together you will aim to deliver effective conflict resolution when required. You will need to demonstrate your ability to remain calm and professional under pressure. You will also be self\-motivated, resilient and driven to make a difference with a natural ability to communicate. **In return, you'll get an in\-depth programme of training when you start.** **Are we right for you?** We're all about helping you develop yourself. The skills you'll learn working within Loss Prevention will help you be at your best. Plus, you'll be surrounded by the support of our fun and caring team. Also as a TJX Europe associate, you'll enjoy such things as: Competitive Salary Uniform Provided Comprehensive package of benefits to support your mental, physical and financial wellbeing such as access to an employee assistance program, associate discount and service awards Join us, and you’ll be a part of our thriving, growing European business filled with opportunities for growth and recognition. We’re proud of our culture, we work hard, have lots of fun, and give back to many causes we care about. It will be a role you won't just like but love. As proud as we are of our past success, it’s our future that excites us most. We strive to provide opportunities for growth, recognition and a competitive salary and benefits package. Share our determination to think bolder and bigger, and be part of our future. We consider all applicants for employment without regard to age, disability, gender, gender reassignment, marriage and civil partnerships, pregnancy and maternity, race, religion or belief and/or sexual orientation.**Address:** Unit 1 Main Street The Courtyard Shopping Centre**Location:** EUR TK Maxx IE Store 371 \- Newbridge",https://ie.indeed.com/viewjob?jk=b4567467e9809992
Loss Prevention Officer,TJX Europe,"Kildare, County Kildare, Ireland",linkedin,"TJX Europe At TJX Europe, every day brings new opportunities for growth, exploration, and achievement. You’ll be part of our vibrant team that embraces diversity, fosters collaboration, and prioritises your development. Whether you’re working in our Distribution Centers, Corporate Offices, or Retail Stores—TK Maxx \& Homesense, you’ll find abundant opportunities to learn, thrive, and make an impact. Come join our TJX team—a Fortune 100 company and the world’s leading off\-price retailer. **Job Description** **Could you be one of our Loss Prevention Officers?** As the world's leading off\-price retailer of clothing and homeware, we're all about putting our customers first. With thousands of shops worldwide, we aim to provide a positive and memorable experience for all. Working as a **Loss Prevention Officer** , you'll help to deliver our goal of keeping our customers, associates and assets safe. Experience of being in a customer facing role, within a fast\-paced retail environment or security guard role is ideal but not essential. **In This Role** You will be supporting a positive customer experience within our stores by being a visible, friendly, approachable presence at our entrance doors. You will be focused on deterring loss on the salesfloor whilst acting as an ambassador for the loss prevention function. You will work closely with the store team to maintain security of our product and together you will aim to deliver effective conflict resolution when required. You will need to demonstrate your ability to remain calm and professional under pressure. You will also be self\-motivated, resilient and driven to make a difference with a natural ability to communicate. **In return, you'll get an in\-depth programme of training when you start.** **Are we right for you?** We're all about helping you develop yourself. The skills you'll learn working within Loss Prevention will help you be at your best. Plus, you'll be surrounded by the support of our fun and caring team. Also as a TJX Europe associate, you'll enjoy such things as: Competitive Salary Uniform Provided Comprehensive package of benefits to support your mental, physical and financial wellbeing such as access to an employee assistance program, associate discount and service awards Join us, and you’ll be a part of our thriving, growing European business filled with opportunities for growth and recognition. We’re proud of our culture, we work hard, have lots of fun, and give back to many causes we care about. It will be a role you won't just like but love. As proud as we are of our past success, it’s our future that excites us most. We strive to provide opportunities for growth, recognition and a competitive salary and benefits package. Share our determination to think bolder and bigger, and be part of our future. We consider all applicants for employment without regard to age, disability, gender, gender reassignment, marriage and civil partnerships, pregnancy and maternity, race, religion or belief and/or sexual orientation. **Address** Unit 1 Main Street The Courtyard Shopping Centre **Location:** EUR TK Maxx IE Store 371 \- Newbridge",https://www.linkedin.com/jobs/view/4422040617
