title,company,location,site,description,job_url
Product Designer,CarTrawler,"Dublin, D, IE",indeed,"**Tech that takes you places**We’re CarTrawler, the global travel tech company behind seamless connections between people, places and possibilities. From powering car rental to creating smarter ways to move, we make travel smoother for millions worldwide. Our culture is built on curiosity, collaboration and craic where every idea counts and every journey matters. Ready to make an impact? Let’s go places together. The Product Designer will own the experience and performance of a defined channel, working across both existing and new partners to improve product quality and commercial outcomes. This role sits in our Perform space, where the focus is on optimising live product experiences to drive measurable impact across metrics like conversion, engagement, and revenue. Operating within a cross\-functional squad, the role is responsible for identifying opportunities, testing solutions, and iterating rapidly based on data and insights. The Product Designer collaborates closely with Product and Engineering, with regular presentation of work to internal stakeholders and external partners. Feedback and data are actively incorporated to refine solutions and ensure alignment between user needs and business objectives. The role remains closely involved through delivery, partnering with Engineering to ensure that shipped solutions meet a high standard for quality, usability, and performance. As a strong individual contributor, this position owns design within the squad and is accountable for delivering experiences that are both high\-quality and effective in achieving measurable outcomes. **Your Journey starts here!** ### **What you'll do as a Product Designer:** * Own design within a cross\-functional squad, accountable for the experience and performance of a defined channel * Identify and prioritise opportunities to improve user journeys, reduce friction, and increase conversion * Drive continuous optimisation through experimentation—defining hypotheses, designing solutions, and iterating based on results * Balance short\-term optimisation with longer\-term, hypothesis\-driven discovery—ensuring a continuous pipeline of high\-impact opportunities * Collaborate closely with Product Managers, Engineers, and Product Insights to translate data and user needs into effective solutions * Design high\-quality interaction and visual experiences, with strong attention to detail, edge cases, and real\-world use * Use data, analytics, and user research to inform decisions and measure impact * Present work to internal stakeholders and external partners, using feedback to refine and improve outcomes * Ensure consistency and scalability through effective use of the design system * Stay closely involved through delivery, partnering with engineering to ensure a high standard of quality in what ships * Build strong relationships with internal stakeholders and external partners, using collaboration and feedback to drive better outcomes * Facilitate and participate in critiques and design reviews, helping to raise the quality bar across the team * Share learnings, experiment results, and best practices with the wider design and product teams ### **What you'll bring to the team:** * 3\-5 years experience in product design, with a strong portfolio of shipped work * Relevant third\-level qualification in Product Design, UX/UI, Interaction Design, or a related field, or equivalent industry experience * Additional certifications in UX, accessibility, service design, experimentation, or product management would be advantageous * Proven track record of delivering measurable impact through design, improving metrics such as conversion, engagement, retention, or revenue * Experience owning the end\-to\-end design process, from discovery and problem framing through to delivery and iteration * Strong discovery capability, using research, data, and insights to identify and prioritise high\-impact opportunities * Experience leveraging data and experimentation (e.g. A/B testing, analytics tools) to inform decisions and evaluate outcomes * Ability to balance user needs, business goals, and technical constraints to drive effective product decisions * High level of design craft across UX, interaction, and visual design, with strong attention to usability and accessibility * Experience designing for web and/or mobile products * Experience working with, or contributing to, design systems to ensure consistency and scalability **Go on, give it a go!** We know that looking for a new job can feel a bit daunting but don’t let a touch of imposter syndrome hold you back. Even if you don’t tick every box, we’d still love to hear from you! Apply today to stay connected. At CarTrawler, we’re proud to be an equal opportunities employer. We celebrate diversity and are committed to creating an inclusive environment for everyone. No matter your background, identity, or life experience, if you’re passionate about what you do, you’ll be welcomed here. **Perks for the journey** * Competitive pay and benefits, including a performance\-based annual bonus, fully subsidised VHI health insurance and pension matching up to 4%. * Generous time off and flexible working, including 25 days’ annual leave, extra company days, monthly Friday Unplugged afternoons and the option to work abroad for up to 20 days a year. * Comprehensive wellbeing support, including access to health and mental health programmes (HeadsUp and EAP) and paid leave for marriage, volunteering and personal wellbeing including menstrual, menopause, and fertility leave. * Growth and recognition culture with development opportunities through training, coaching and study support plus programmes that celebrate individual and team achievements. * Everyday perks that make a difference \- subsidised canteen (KC Peaches), on\-site car parking, Bike to Work and TaxSaver schemes plus an active Sports \& Social Club. We may use artificial intelligence (AI) tools to support parts of the hiring process, such as reviewing applications, analyzing resumes, or assessing responses. These tools assist our recruitment team but do not replace human judgment. Final hiring decisions are ultimately made by humans. If you would like more information about how your data is processed, please contact us.",https://ie.indeed.com/viewjob?jk=5769f3df8764b180
Product Designer,Ceartas,"Dublin, County Dublin, Ireland",linkedin,"At **Ceartas** , we stand at the forefront of AI\-powered brand protection, copyright law, and digital security, dedicated to safeguarding the integrity of content creators, brands, and enterprises worldwide. As we accelerate our growth and expand our global footprint, we're seeking a **Mid\-Level UX/UI Designer** who is passionate about crafting intuitive and engaging user experiences and contributing to our design system and product innovation. This role is a unique opportunity to make a significant impact on the future of digital content protection. You will work closely with our Senior Product Designer, engineers, and business stakeholders as part of the Product Team to develop cutting\-edge solutions that address the challenges of brand protection. 🚀 **Your Role: Beyond the High\-Level** You'll be a key contributor to our product team, ensuring our user experience meets industry standards and aligns with our business goals. In this role, you will: **Enhance User Experience \& Engagement:** You will play a critical role in designing intuitive and engaging user journeys. From conducting user research and developing personas to creating wireframes, prototypes, and high\-fidelity UI, your work will help define our product's overall experience. **Contribute to Our Design System:** You will help maintain and enhance our design system, ensuring consistency across our digital platforms. Your contributions will help shape a scalable and structured approach to design at Ceartas. **Take Ownership of Features:** You will be responsible for taking features from concept to completion, considering all user touchpoints and edge cases. You will work collaboratively with engineers and stakeholders to ensure smooth implementation. **Support Research\-Driven Design:** You will participate in user research efforts, gathering qualitative and quantitative insights to inform design decisions. Your ability to analyze and interpret research findings will contribute to a more user\-centric product. **Work Cross\-Functionally:** You will collaborate with engineers, business stakeholders, and other designers to ensure a seamless handoff between design and development. Understanding basic coding principles and technical feasibility will be a plus in this role. 🗒️ **Responsibilities:** * Contribute to and maintain the design system to ensure consistency and scalability across products. * Design user flows, wireframes, prototypes, and high\-fidelity UI for web and mobile applications. * Conduct user research and testing to validate design decisions and improve usability. * Collaborate closely with engineers and stakeholders to translate requirements into functional designs. * Take ownership of features from discovery to delivery, ensuring a holistic user experience. * Assist in refining the UX architecture of our product, including mind mapping and journey mapping. 🌟 **Must\-Haves:** * 2\-3 years of experience in UX/UI design for web and mobile applications. * Strong knowledge of UX design principles, user flows, and information architecture. * Experience with Figma and other industry\-standard design tools. * Experience as a UX designer, showcasing your previous work and skillset in a portfolio of projects that demonstrate your contribution to designing engaging user experiences. * Good understanding of the UX design process from research, concept, design, prototyping and user validation to implementation. * Familiarity with user research methodologies and the ability to conduct usability testing. * Thorough knowledge in the field of interaction design, visual design and (low \& high fid) prototyping. * Strong UI design skills with a keen eye for detail and consistency. * Experience working closely with development teams and other stakeholders to implement designs. * Knowledge of design systems and experience in building or maintaining one. 👀 Nice To Haves: * Ability to create custom illustrations to enhance UI. * Familiarity with HTML, CSS, and JavaScript to bridge the gap between design and development. * Understanding of AI and machine learning concepts as they relate to UX. * Prior experience in the brand protection * Strong problem\-solving skills and ability to take ownership of projects. * Experience with motion design and creating engaging UI animations. 🔥 What we offer: * Supportive leadership committed to your personal and professional development. * Remote Role with flexibility. * 25 paid days off per year, plus public holidays, and your birthday! * A culture of innovation and continuous learning. * A vibrant startup environment with a collaborative team. * Home Office Allowance and all the tech you need, including a brand new MacBook Air. * Employee recognition and reward program. * An inclusive workplace that celebrates diversity and equal opportunity. If you’re a passionate UX/UI Designer looking for an opportunity to grow, contribute, and make an impact in a fast\-growing company, we’d love to hear from you!",https://www.linkedin.com/jobs/view/4419960119
Product Owner - Hiring Sprint,Revolut,,linkedin,"**About Revolut** People deserve more from their money. More visibility, more control, and more freedom. Since 2015, Revolut has been on a mission to deliver just that. Our powerhouse of products — including spending, saving, investing, exchanging, travelling, and more — help our 75\+ million customers get more from their money every day. As we continue our lightning\-fast growth,‌ 2 things are essential to our success: our people and our culture. In recognition of our outstanding employee experience, we've been certified as a Great Place to Work™. So far, we have 13,000\+ people working around the world, from our offices and remotely, to help us achieve our mission. And we're looking for more brilliant people. People who love building great products, redefining success, and turning the complexity of a chaotic world into the simplicity of a beautiful solution. **About The Role** The Product team shapes the experiences that power Revolut. They turn complex problems into simple, scalable solutions \- collaborating across Design, Engineering, and Data to build features our customers love. We’re looking for a Product Owner who knows how to take responsibility over a product roadmap, including day\-to\-day operations, project execution, and addressing risks. From conception to launch and beyond, you’ll collaborate cross\-functionally and communicate with senior management to be the go\-to person for your feature. Up to shape what's next in finance? Let's get in touch. **About Our Hiring Sprint** We've compressed our usual hiring process into a single fast\-track. After you apply, a recruiter will walk you through how it works. You'll start with our Problem Solving interview, and if successful, you'll be invited to the Hiring Sprint on 26 June: Skills, Bar Raiser, and Team Fit interviews in one day. Successful candidates will receive an offer within 24 hours. Steps: * Application screening * Introductory call with a recruiter * Problem Solving interview * Hiring Sprint: Skills, Bar Raiser, and Team Fit interviews, all in one day (26 June) * Offer within 24 hours of the Hiring Sprint *Exact sequence may vary by location and scheduling.* We're hiring across two tracks: * Product Owner (Technical) — for those who go deep into platforms, distributed systems, data, or ML, and partner closely with Engineering on architecture and delivery * Product Owner (UX) — for people who own end\-to\-end consumer\-facing mobile experiences and obsess over UX and design craft **What You’ll Be Doing** * Setting your team's goals, success metrics, and roadmap to align with company strategy * Driving impact based on data, market research, and customer insight * Owning your team's products from end to end, from ideation through development, launch, growth, and maintenance * Partnering with Engineering on technical approach, requirements, and delivery * Working with Design and UX to define the customer journey and ship experiences customers love * Liaising with stakeholders across Marketing, Legal, Financial Crime, and Strategy **What You'll Need** * 2\+ years of experience at a high\-growth tech company or in banking/finance areas (acquiring, payments, investments, cryptocurrency, insurance, etc.) * 1\+ years of people management experience * Solid analytical acumen and business sense that guides ROI\-based prioritisation * A track record of formulating product vision and owning the narrative with leadership, customers, and partners * Outstanding written and verbal communication skills * Experience launching products from scratch * A bias for action, comfort with ambiguity, and an entrepreneurial drive to never settle Technical track (additionally): * 2\+ years working on technical products (platforms, distributed systems, data science, etc.) * High technical acumen and the ability to hold your own in deep technical discussions with engineers UX track (additionally): * 2\+ years leading consumer\-facing mobile products * A strong eye for UX/UI and solid understanding of design best practices **Nice to have** * A bachelor’s degree from a top university Building a global financial super app isn’t enough. Our Revoluters are a priority, and that’s why in 2021 we launched our inaugural D\&I Framework, designed to help us thrive and grow everyday. We're not just doing this because it's the right thing to do. We’re doing it because we know that seeking out diverse talent and creating an inclusive workplace is the way to create exceptional, innovative products and services for our customers. That’s why we encourage applications from people with diverse backgrounds and experiences to join this multicultural, hard\-working team. **Important notice for candidates:** Job scams are on the rise. Please keep these guidelines in mind when applying for any open roles. * Only apply through official Revolut channels. We don’t use any third\-party services or platforms for our recruitment. * Always double\-check the emails you receive. Make sure all communications are being done through official Revolut emails, with an @revolut.com domain. **We won't ask for payment or personal financial information during the hiring process.** If anyone does ask you for this, it’s a scam. Report it immediately. By submitting this application, I confirm that all the information given by me in this application for employment and any additional documents attached hereto are true to the best of my knowledge and that I have not wilfully suppressed any material fact. I confirm I have disclosed if applicable any previous employment with Revolut. I accept that if any of the information given by me in this application is in any way false or incorrect, my application may be rejected, any offer of employment may be withdrawn or my employment with Revolut may be terminated summarily or I may be dismissed. By submitting this application, I agree that my personal data will be processed in accordance with Revolut's Candidate Privacy Notice",https://www.linkedin.com/jobs/view/4418594556
Product Solutions Architect 3,Datadog,"Dublin, County Dublin, Ireland",linkedin,"We are Datadog's in\-house product experts. The technical solutions team enables Datadog's worldwide growth by educating potential clients and ensuring that existing customers are happy and successful. We share our technical and product expertise with customers through demos, presentations, technical evaluations, and ongoing support. Technical solutions is a growing global team that collaborates constantly to share knowledge and continuously advance our technical skillset. The Logs family of products represents a strategic evolution in how organizations manage and analyze logs at scale while meeting stringent data residency, compliance, and cost requirements. The Product Solutions Architect (PSA) will work closely with Datadog customers, Logs Product team, and the CloudPrem product team to architect, implement best practices, and drive adoption of the log management suite. *At Datadog, we place value in our office culture \- the relationships and collaboration it builds and the creativity it brings to the table. We operate as a hybrid workplace to ensure our Datadogs can create a work\-life harmony that best fits them.* **What You’ll Do:** * Serve as the Product Expert on Logs, CloudPrem, and Observability Pipelines * Offer guidance on architecture choices, data collection, and best practices to large Enterprise customers as they adopt these Datadog services across the organization at scale * Design and validate hands\-on, production\-ready architectures spanning cloud infrastructure, Kubernetes platforms, and customer\-managed environments * Actively identify opportunities to simplify, optimize, and standardize deployment patterns, reducing operational complexity for customers through architectural guidance and best practices. * Be a Trusted Advisor to Product Management by providing high quality feedback based on your field experience working closely with our Support, Partners, and Customers * Capture repeat customer use cases and solutions and in turn publish Reference Architectures, automation patterns, and Implementation Guides for Datadog prospect and customer consumption * Build world class training material, solutions briefs, blogs, and documentation to the wider Datadog field technical teams over the latest product features and capabilities * Collaborate with other teams at Datadog including Marketing, Sales, Community, Documentation, and Evangelism to ensure the success of the Log Management product family * Exercise the products you represent by building hands\-on proof of concepts, small scale deployments to validate solutions and reproduce customer environments * Engage deeply with customers, feeling their operational pain points and driving solutions that measurably improve reliability, scalability, and day\-to\-day operations **Who You Are:** * Someone with strong hands\-on experience with tools such as Kubernetes, including cluster architecture, networking, storage, and operational best practices. * Someone with strong knowledge of cloud infrastructure fundamentals, including networking, compute, storage, and distributed system design. * Someone familiar with Security, Governance, and Compliance requirements for industry verticals * Someone who can dive deep into our Codebase, SDKs, and GitHub workflows to understand, debug, and influence product behavior * Experience with languages like Python and/or Rust, and file formats such as JSON and YAML * A self\-starter, tech\-savvy professional, who is comfortable working with bleeding edge technology and processes, even if it hasn’t been well defined * A deep learner and a Subject Matter Expert today that has built advocacy and knowledge across multiple teams with the knowledge you possess * Fluent in understanding the observability market domain, competition, technological shifts, and customer needs * Someone who values getting things done, taking ownership from problem definition through implementation and outcome * Highly detail\-oriented, especially when working on architectures, documentation, and customer\-facing solutions * A person who possesses exceptional listening and consultative skills, for both internal and external audiences * Experienced working with customers in high pressure situations where the solution is sometimes not obvious \- caring about customer pain and motivated to solve hard problems on their behalf * Able to sit up to 4 hours, traveling to and from client sites * Able to travel via auto, train, or air up to 40% of the time **Bonus Points:** * Successful track record with 5\+ years experience working as an Architect or Consultant * Experience using Datadog and/or other observability tools in an SRE or DevOps capacity * Have recent experience deploying solutions in production environments at scale * Strong knowledge or experience with Splunk, Elastic, Opensearch, SumoLogic, Vector, Cribl, Quickwit *Datadog values people from all walks of life. We understand not everyone will meet all the above qualifications on day one. That's okay. If you’re passionate about technology and want to grow your skills, we encourage you to apply.* Benefits and Growth: * Best\-in\-breed onboarding * Generous global benefits * Intra\-departmental mentor and buddy program for in\-house networking * New hire stock equity (RSUs) and employee stock purchase plan (ESPP) * Continuous professional development, product training, and career pathing * An inclusive company culture, able to join our Community Guilds and Inclusion Talks *Benefits and Growth listed above may vary based on the country of your employment and the nature of your employment with Datadog.* **About Datadog:** Datadog is the leading observability and security platform for the AI era, providing businesses with unified visibility across the technology stack to manage complexity at scale. It brings applications, infrastructure, data, models, and security into one place, using AI to detect and resolve issues before they impact customers. Trusted globally by Fortune 500 companies and high\-growth AI leaders, Datadog enables businesses to move faster with clarity and confidence. Learn more about \#DatadogLife on Instagram, LinkedIn, and Datadog Learning Center. **Equal Opportunity at Datadog:** Datadog is proud to offer equal employment opportunity to everyone regardless of race, color, ancestry, religion, sex, national origin, sexual orientation, age, citizenship, marital status, disability, gender identity, veteran status, and other characteristics protected by law. We also consider qualified applicants regardless of criminal histories, consistent with legal requirements. Here are our Candidate Legal Notices for your reference. Datadog endeavors to make our Careers Page accessible to all users. If you would like to contact us regarding the accessibility of our website or need assistance completing the application process, please complete this form. This form is for accommodation requests only and cannot be used to inquire about the status of applications. **Privacy and AI Guidelines:** Any information you submit to Datadog as part of your application will be processed in accordance with Datadog’s Applicant and Candidate Privacy Notice. For information on our AI policy, please visit Interviewing at Datadog AI Guidelines.",https://www.linkedin.com/jobs/view/4389295243
