title,company,location,site,description,job_url
"ASIC Digital Design, Architect",Synopsys Inc,"Dublin, County Dublin, Ireland",linkedin,"We Are: At Synopsys, we drive the innovations that shape the way we live and connect. Our technology is central to the Era of Pervasive Intelligence, from self\-driving cars to learning machines. We lead in chip design, verification, and IP integration, empowering the creation of high\-performance silicon chips and software content. Join us to transform the future through continuous technological innovation. You Are: An experienced and visionary ASIC Digital Architect, who is passionate about driving the future of semiconductor technology. You possess deep functional knowledge and expertise in design methodologies, and you thrive in an environment where you can influence and implement strategic goals. Your background includes a comprehensive understanding of protocols such as DDR, PCIe/CXL, UCIe, AMBA and its applications. You can define and executing a new architecture for protocols such as UAL (Universal Accelerator Link). You are a proactive problem solver, capable of working with minimal oversight, and you excel in communicating complex technical concepts to a diverse audience. Your leadership skills enable you to guide and mentor teams, fostering innovation and excellence in all your projects. What You’ll Be Doing: * Defining and developing ASIC RTL design and verification at both chip and block levels. * Creating and executing design plans for complex digital designs, particularly focusing on DDR, PCIe,CXL,UAL, UCIe IO protocols. * Collaborating with cross\-functional teams to ensure seamless integration and functionality of designs. * Utilizing advanced design and verification methodologies and tools to achieve high\-quality results. * Mentoring and guiding junior engineers, promoting best practices, and fostering a culture of continuous improvement. * Communicating with internal and external stakeholders to align on project goals and deliverables. The Impact You Will Have: * Enhancing the reliability and performance of Synopsys’ digital design processes. * Driving innovations in DDR, PCIe, UAL, UCIe technology, contributing to the development of cutting\-edge semiconductor solutions. * Improving time\-to\-market for high\-performance silicon chips through efficient methodologies. * Building and nurturing a highly skilled development team, elevating overall project quality. * Influencing strategic decisions that shape the future of Synopsys’ capabilities. * Ensuring that Synopsys remains a leader in the semiconductor industry through continuous technological advancements. What You’ll Need: * Extensive experience in ASIC RTL design. * In\-depth knowledge of DDR, PCIe, UAL, UCIe and similar IO protocols and their applications. * Proficiency in advanced digital design tools and methodologies. * Strong problem\-solving skills and the ability to work independently. * Excellent communication skills for effective collaboration with diverse teams. Who You Are: * A visionary leader with a strategic mindset. * A mentor who fosters talent and encourages innovation. * A proactive problem solver who thrives in complex environments. * An effective communicator with the ability to convey technical concepts to a broad audience. * A team player who values collaboration and diversity. The Team You’ll Be A Part Of: You will join a dynamic and innovative team focused on advancing Synopsys' design technologies. Our team is dedicated to excellence, collaboration, and continuous improvement. We work closely with various departments to ensure the successful integration and performance of our solutions. Together, we drive the future of semiconductor technology and make a significant impact on the industry. Specifically, according to a match profile, you will be a key technical contributor to the architecture and execution of one of DDR/PCIe/UAL/UCIe digital core protocols. Rewards and Benefits: We offer a comprehensive range of health, wellness, and financial benefits to cater to your needs. Our total rewards include both monetary and non\-monetary offerings. Your recruiter will provide more details about the salary range and benefits during the hiring process.",https://www.linkedin.com/jobs/view/4385882407
Administrator,Mercury,"Kildare, County Kildare, Ireland",linkedin,"Administrator, Kildare, Ireland Apply Now **Mercury is the European leader in construction solutions.** We build and manage complex engineering \& construction projects for the world’s leading corporations. Our solutions help deliver technologies and life changing advancements that connect people, communities and businesses, giving them the power to achieve incredible things. Our people have the courage to be innovative. Their determination and sharp focus enable us to deliver with certainty, time and time again. We deliver our clients’ visions through leading edge construction solutions across multiple sectors, including: Enterprise Data Centres, Advanced Technology \& Life Sciences, Hyperscale Data Centres, Fire Protection. At Mercury, it is our duty to encourage and back our people to realise their vision of themselves. We place them at the heart of what we do, providing challenging opportunities to develop within a great team in a supportive environment that allows them to reach their full potential. **Key Responsibilities Of The Role** * Working on Digital platforms such BIM 360, ACC, Eida, etc * Ensuring the timely distribution of documents \& drawings to project personnel * Working in accordance with company procedures \& guidelines * Distribution of drawing transmittals and submittals to client * Maintenance of controlled document registers and associated documentation * Developing and maintaining filing systems \& workflows * General Administration including typing, printing * Data entry on SAP, Running SAP reports and queries * Liaising with Site Management, Design Team and Client * Maintain up to date Org Charts * Cover for the Time Administration of the Project when required * All other duties associated with this role. **Essential Criteria For The Role** * Must have experience with online digital platforms such as ACC \& BIM360 * Min 2 years relevant experience * Strong Administration experience * Fluent in English language * PC literate with competency in Microsoft Word, Excel, Outlook * Ability to liaise and manage all site paperwork * Attention to detail * Ability to multitask and work under pressure * Strong interpersonal and Organisational skills * Pride in the quality and presentation of work * Excellent communication skills ***Mercury is an equal opportunities employer*** . Apply Now",https://www.linkedin.com/jobs/view/4405931186
Application Security Architect,Paysafe,"Dublin 1, County Dublin, Ireland",linkedin,"Paysafe is a global payments platform powering the experience economy, with a strong focus on the iGaming, video gaming, e\-commerce, retail, travel and hospitality sectors. With 30 years of expertise in payment technology, Paysafe helps businesses and consumers lift every experience through seamless, secure payment solutions, including card payments, digital wallets such as Skrill, eCash solutions like PaysafeCard, and a suite of local payment methods. With approximately 2,900 employees across 12 countries and annualized transactional volume of $167 billion in 2025, Paysafe connects people and businesses worldwide through innovative digital payment experiences. **What you will do:** * Aligns Information Security Architecture with Paysafe’ s overall business and product strategy, ensuring that security controls are embedded in Paysafe products. Designs secure architectures for IT systems, networks, and applications to protect against cyber threats in the context of various regulatory environments. * Responsible for architecting and designing the security infrastructure of Paysafe. Works on transition strategies, bundled solutions, and roadmap planning while contributing to secure software, network, and process development. * Conducts risk assessments to identify control deficiencies and potential risks for the organization and develop strategies to mitigate them. * Partners with cross\-functional teams including Information Security Enterprise Architecture, Information Security Risk \& Compliance, Engineering and the Global InfoSec Organization to embed security requirements and risk mitigation strategies into architectural design. * Stays current with emerging security threats, trends, and technology advancements, adjusting security architectures as needed in collaboration with Enterprise Security Architecture. **To be successful you need to have/be:** * Solid background in security architecture, with strong technical knowledge of infrastructure, application security and automation. * Experienced in applying cyber and information security principles throughout software and system design, with working knowledge of current standards and frameworks like PCI, DORA and ISO27001\. * Strong organizational skills and a natural ability to prioritize, multitask, and keep things moving smoothly. Known for writing clear, thoughtful reports and turning complex data into meaningful insights. * Comfortable communicating at all levels, with a confident and empathetic approach to negotiation, influence, and relationship\-building. * Understands the online payments space and brings a good business sense to security matters. Holds or is working toward recognized InfoSec certifications like SABSA, TOGAF, CSSLP, CISSP, etc.. **We offer in return:** * The opportunity to write the history of a leading and growing multinational company * Tailor\-made training and ongoing development to help you enhance your skills in the field of online payments * Multiple career progression opportunities in a dynamic in\-house business * Environment where product expertise, professional and personal commitment are rewarded * Competitive remuneration and social benefits package * Fun and collaborative working atmosphere * Flexible working model \- we encourage our employees to embrace our flexible working approach. You will be expected to work from home and spend an average of three days a week at our office as part of our hybrid work model Are you ready to take your career to the next level? Join our team that is inspired by a unified vision and propelled by passion. Send your CV in English. Only shortlisted candidates will be contacted for an interview. Wondering how our interview process looks like now? Learn more here: https://bit.ly/paysafeinterviews Equal Employment Opportunity Paysafe provides equal employment opportunities to all employees, and applicants for employment, and prohibits discrimination of any type with regard to ethnicity, religion, age, sex, national origin, disability status, sexual orientation, gender identity or expression, or any other protected characteristics. This policy applies to all terms and conditions of recruitment and employment. If you need any reasonable adjustments please let us know. We will be happy to help and look forward to hearing from you.",https://www.linkedin.com/jobs/view/4373330492
Apprentice Electrician,Rooney Electrical,"Dublin, D, IE",indeed,We are a well established company operating in Dublin and the surrounding areas (Please see rooneyelectrical.ie). As we continue to expand we are looking for 1st year apprentices for a long term role. On site experience would give an advantage as would own transport. Job Type: Apprenticeship Pay: From €9\.47 per hour Licence/Certification: * Safepass Card (preferred) * Manual Handling Certificate (preferred) Work Location: In person,https://ie.indeed.com/viewjob?jk=a755af039121dac1
Azure DevOps Engineer,Analog Devices,"Dublin, County Dublin, Ireland",linkedin,"**About Analog Devices** Analog Devices, Inc. (NASDAQ: ADI ) is a global semiconductor leader that bridges the physical and digital worlds to enable breakthroughs at the Intelligent Edge. ADI combines analog, digital, and software technologies into solutions that help drive advancements in digitized factories, mobility, and digital healthcare, combat climate change, and reliably connect humans and the world. With revenue of more than $9 billion in FY24 and approximately 24,000 people globally, ADI ensures today's innovators stay Ahead of What's Possible™. Learn more at www.analog.com and on LinkedIn and Twitter (X). **Azure DevOps Engineer With Javascript Experience** We are looking for a DevOps Engineer who has a good mix of Database experience as well as good experience with Cloud Architecture and deployment, ideally on the Azure platform. Experience with Kubernetes and container\-based management in general would be helpful also. The ideal candidate will be passionate and opinionated about ensuring the reliability and security of our Cloud platform and be keen to use their experience and ideas to help streamline the dev, test and deployment of functioning code to the production platform. Core responsibilities will include planning and deployment of new versions of platform code, managing Dev, Test and Production environments, dealing with production issues, managing the design and deployment of production databases. On the Dev side, the ability to write backend API code with Node.js to support the frontend would be an important requirement. **What you will do:** * Manage the testing, deployment and maintenance of our Cloud Databases and Azure Cloud Platform * Be directly responsible for the reliability and security of these APIs and Web Applications on our cloud infrastructure * Working directly with management and the frontend developers to build a new set of APIs for our new platform * Development and maintenance of the backend Node.js APIs * Implementation and maintenance of Azure Cloud Infrastructure (VPN, Azure VPN Gateway, Azure Firewall, IPSEC Tunnels, Azure PrivateLink, etc) **What you need:** * A degree in Computer Science or related IT degree * Minimum 5 years of experience with Dev and DevOps roles * Solid Experience with DevOps on Azure cloud specifically * Experience with server\-side Javascript (node, express, etc) * Strong knowledge and experience with relational databases (mssql, mysql, etc) and ideally also NoSQL databases (Mongo, etc) * Experience integrating web apps with RESTful APIs. * Comfortable with version control system, e.g. GIT * Strong knowledge of CI/CD and good deployment practices * Reasonable knowledge of HTML, CSS and modern Javascript a bonus. *For positions requiring access to technical data, Analog Devices, Inc. may have to obtain export licensing approval from the U.S. Department of Commerce \- Bureau of Industry and Security and/or the U.S. Department of State \- Directorate of Defense Trade Controls. As such, applicants for this position – except US Citizens, US Permanent Residents, and protected individuals as defined by 8 U.S.C. 1324b(a)(3\) – may have to go through an export licensing review process.* *Analog Devices is an equal opportunity employer. We foster a culture where everyone has an opportunity to succeed regardless of their race, color, religion, age, ancestry, national origin, social or ethnic origin, sex, sexual orientation, gender, gender identity, gender expression, marital status, pregnancy, parental status, disability, medical condition, genetic information, military or veteran status, union membership, and political affiliation, or any other legally protected group.* Job Req Type: Experienced Required Travel: Yes, 10% of the time Shift Type: 1st Shift/Days",https://www.linkedin.com/jobs/view/4383092784
"Backend Software Engineer III (Hybrid, IRE)",CrowdStrike,"Dublin, County Dublin, Ireland",linkedin,"As a global leader in cybersecurity, CrowdStrike protects the people, processes and technologies that drive modern organizations. Since 2011, our mission hasn’t changed — we’re here to stop breaches, and we’ve redefined modern security with the world’s most advanced AI\-native platform. We work on large scale distributed systems, processing almost 3 trillion events per day and this traffic is growing daily. Our customers span all industries, and they count on CrowdStrike to keep their businesses running, their communities safe and their lives moving forward. We’re also a mission\-driven company. We cultivate a culture that gives every CrowdStriker both the flexibility and autonomy to own their careers. We’re always looking to add talented CrowdStrikers to the team who have limitless passion, a relentless focus on innovation and a fanatical commitment to our customers, our community and each other. Ready to join a mission that matters? The future of cybersecurity starts with you. ****About The Role:**** Our Workflow Automation Team (Falcon Fusion SOAR) provides core orchestration and workflow capabilities to all users of Crowdstrike’s Flagship Product, the Falcon Platform, to expedite application development. This role is for an experienced backend microservices developer adept with cloud engineering principles. Your passion and meticulous attention to performance, reliability and scalability will be key ingredients to your success here at CrowdStrike. ****What You'll Do:**** * Help design, build, and maintain key backend services / orchestration layer of platform that will be used by both other product groups and our customers. * Design and build highly scalable and resilient distributed systems * Work with industry\-leading technologies like Apache Kafka, Cassandra, Elasticsearch, Redis and more * Work on cross\-team platform\-level initiatives and projects * Troubleshoot critical production issues and implement solutions ****What You'll Need:**** * Experienced building streaming platforms at scale (Note: We process over a trillion events per day) * 4\+ years of relevant work experience building backend software with a SaaS delivery model * 2\+ years of recent experience building a microservices\-oriented architecture * Expert knowledge of any of the following backend languages: Go, Scala, Java, or Node.js * Proven expertise in building distributed systems, micro services, REST APIs * Production experience with commercial clouds (AWS, Azure, GCP) * BS/MS degree in Computer Science or related field or equivalent work experience * Developing applications using SQL and No\-SQL databases ****Bonus Points:**** * Contributed to the open source community (GitHub, Stack Overflow, blogging) * Master’s degree in computer science or related field * Golang experience * Prior experience with cybersecurity ****Benefits Of Working At CrowdStrike:**** * Market leader in compensation and equity awards * Comprehensive physical and mental wellness programs * Competitive vacation and holidays for recharge * Paid parental and adoption leaves * Professional development opportunities for all employees regardless of level or role * Employee Networks, geographic neighborhood groups, and volunteer opportunities to build connections * Vibrant office culture with world class amenities * Great Place to Work Certified™ across the globe CrowdStrike is proud to be an equal opportunity employer. We are committed to fostering a culture of belonging where everyone is valued for who they are and empowered to succeed. We support veterans and individuals with disabilities through our affirmative action program. CrowdStrike is committed to providing equal employment opportunity for all employees and applicants for employment. The Company does not discriminate in employment opportunities or practices on the basis of race, color, creed, ethnicity, religion, sex (including pregnancy or pregnancy\-related medical conditions), sexual orientation, gender identity, marital or family status, veteran status, age, national origin, ancestry, physical disability (including HIV and AIDS), mental disability, medical condition, genetic information, membership or activity in a local human rights commission, status with regard to public assistance, or any other characteristic protected by law. We base all employment decisions\-\-including recruitment, selection, training, compensation, benefits, discipline, promotions, transfers, lay\-offs, return from lay\-off, terminations and social/recreational programs\-\-on valid job requirements. If you need assistance accessing or reviewing the information on this website or need help submitting an application for employment or requesting an accommodation, please contact us at recruiting@crowdstrike.com for further assistance. , ****Bonus Points:**** * Contributed to the open source community (GitHub, Stack Overflow, blogging) * Master’s degree in computer science or related field * Golang experience * Prior experience with cybersecurity",https://www.linkedin.com/jobs/view/4373702434
