title,company,location,site,description,job_url
Electronic Engineering Product Engineer,Siemens Healthineers,"Dublin, County Dublin, Ireland",linkedin,"Now’s our time to inspire the future of healthcare together. Siemens Healthineers is a leading global medical technology company with over 170 years of experience and 18,000 patents. More than 70,000 dedicated colleagues in over 70 countries are driven to shape the future of healthcare. We stand with our customers around the world to support them in delivering high quality care to their patients. An estimated 5 million patients across the globe benefit every day from our innovative technologies and services in the areas of diagnostic and therapeutic imaging, laboratory diagnostics and molecular medicine, as well as digital health and enterprise services. This is what truly matters to us. This is a role well suited to an ambitious professional, looking for the next step in their career as a Electrical/Electronic Engineer. Are you a passionate Electrical/Electronic Engineer who can support the manufacturing and design of complex, electromechanical medical devices? The successful applicant will be a key member of the Engineering Team with responsibility for providing technical support to the Commercial Product Engineering (CPE) function and Manufacturing Operations for electrical/electronic assemblies, PCBAs and associated subsystems. This includes leading root cause analysis to implement corrective and preventive actions for production or design issues. This role also involves driving changes to enhance our products, improve reliability and monitor component obsolescence management and implementation. As a key member of the team, you will be part of a highly innovative, multidisciplinary Engineering group working on complex problems to serve the needs of laboratories of any size – today and tomorrow. * Drive engineering changes within a regulated framework including the associated V\&V, process and implementation activities required. * Own part and component obsolescence changes. * Drive cross\-functional root cause analysis (RCA) and implement corrective and preventive actions (CAPA), coordinating with quality, suppliers, and manufacturing teams. * Own delivery of technical solutions that enhance product reliability. * Provide technical support to manufacturing operations for electrical/electronic assemblies, PCBs, and embedded systems. * Perform component\-level failure analysis of PCBAs to support production and field returns to determine root cause. * Support of design changes related to electronic manufacturing test systems, including ICT, flying probe, test equipment and automated test systems. It would be advantageous to have the following experience: * Experience working effectively with manufacturing, quality, supply chain and external partners. * Experience with design for manufacturability (DFM) * PCB design experience with a good understanding of design concepts and component selection * Knowledge of power electronics, sensing and control circuitry, cabling routing, computing hardware and integration into a complex instrument. * Good understanding of EMC, and methods to eliminate electronic interference * Hands\-on experience with component\-level diagnostics tools (electrical test bench equipment). * Knowledge of electronic and mechanical CAD design tools. Requirements to succeed in this role: * Bachelor’s or Master’s degree in Electrical/Electronic Engineering or related field with a minimum of 2 years relevant experience. Consideration will also be given to individuals with alternative degrees if balanced by relevant technical experience. * Experience in electrical/electronic engineering, preferably in a regulated environment * Proven track record in problem\-solving and root cause analysis in production settings * Track record in supplier collaboration and component lifecycle management * Excellent communication, documentation, and cross\-functional collaboration skills. * An excellent team player who knows how to work in a team environment. At Siemens Healthineers, we value those who dedicate their energy and passion to a greater cause. Our people make us unique as an employer in the med\-tech industry. What unites and motivates our global team is the inspiration of our common purpose: To innovate for healthcare, building on our remarkable legacy of pioneering ideas that translate into even better healthcare products and services. We recognize that taking ownership of our work allows both us and the company to grow. We offer you a flexible and dynamic environment and the space to move beyond your comfort zone to grow both personally and professionally. We have an excellent benefits package for the right candidate. \#siemens",https://www.linkedin.com/jobs/view/4379871319
Enterprise Account Executive,Dolby Laboratories,"Dublin, County Dublin, Ireland",linkedin,"Join the leader in entertainment innovation and help us design the future. At Dolby, science meets art, and high tech means more than computer code. As a member of the Dolby team, you’ll see and hear the results of your work everywhere, from movie theaters to smartphones. We continue to revolutionize how people create, deliver, and enjoy entertainment worldwide. To do that, we need the absolute best talent. We’re big enough to give you all the resources you need, and small enough so you can make a real difference and earn recognition for your work. We offer a collegial culture, challenging projects, and excellent compensation and benefits, not to mention a **Flex Work** approach that is truly flexible to support where, when, and how you do your best work. **Dolby OptiView** Dolby OptiView helps sports, media, and entertainment companies to maximise viewer engagement and monetisation. Use cases primarily focus on Live Sports, Sports Betting, eSports, and Live Auctions that demand high quality real\-time Streaming solutions. Whether it is high\-quality playback across platforms, a live streaming solution designed to meet every latency requirement, or seamless ad experiences, Dolby OptiView powers unforgettable viewer experiences while unlocking new revenue opportunities. Engage more and earn more effortlessly. **What you will do:** Help organisations take full advantage of Dolby Cloud Solutions across complex, mission\-critical requirements, with a particular focus on Gaming, Sports, Events and Entertainment verticals. Develop and maintain strategic relationships with key decision\-makers, understand their unique business needs, and position our solutions as the ideal fit. Success in this role will require a combination of consultative selling skills, industry expertise, and a passion for delivering exceptional customer experiences. If you’re looking for an exciting sales position within a highly visible part of Dolby’s business, this is for you. **This job might be for you if:** You are a highly motivated, outcome driven, solutions oriented, charismatic, and passionate individual looking for a great opportunity to progress your career. We need team members who are comfortable bringing their previous selling motions to pitch our amazing platform to Fortune 1000 companies and C\-level executives. Sales experience with complex solutions in events, sports, or broadcasting verticals preferred. **Responsibilities:** * Prospect and identify new enterprise\-level business opportunities, targeting key accounts and industries aligned with our product offerings. * Develop and execute strategic account plans to build relationships with C\-level executives, decision\-makers, and stakeholders, nurturing long\-term partnerships. * Collaborate closely with cross\-functional teams, including pre\-sales, product management, and customer success, to ensure seamless onboarding, deployment, and support for enterprise clients. * Deliver compelling sales presentations, demonstrations, and proposals tailored to the unique requirements and objectives of enterprise prospects. * Negotiate contract terms and conditions, leveraging a consultative approach to drive mutually beneficial agreements while maximising revenue potential. * Achieve or exceed assigned sales targets and quotas, consistently driving revenue growth within the enterprise market segment. * Maintain accurate and up\-to\-date records of sales activities, customer interactions, and opportunities in the CRM system. * Conduct thorough research to understand the specific needs and challenges of prospective enterprise clients and articulate how our solutions can address their requirements effectively. * Keep abreast of market trends, competitors, and industry developments to identify emerging opportunities and refine sales strategies accordingly. * Collaborate with marketing teams to provide valuable market feedback, insights, and suggestions for refining go\-to\-market strategies and product positioning. **Requirements:** * Proven success selling six figure deals to executives in large organisations with complex sales cycles. * Demonstrated experience in consultative selling, building and nurturing relationships with C\-level executives and key decision\-makers. * Strong understanding of the digital media landscape, including hardware, software, and services to support production \& distribution workflows. * Exceptional communication and presentation skills, with the ability to articulate complex concepts in a clear and compelling manner. * Strong business acumen, with the ability to understand the unique needs and challenges of enterprise clients across diverse industries. * Ability to work independently and as part of a team, collaborating effectively with internal stakeholders to drive customer success. * Proactive and self\-motivated, with a strong sense of ownership and a results\-oriented mindset. * Bachelor's degree in business, computer science, or a related field (or equivalent work experience). * 10\+ years of sales experience. **Equal Employment Opportunity:** Dolby is proud to be an equal opportunity employer. Our success depends on the combined skills and talents of all our employees. We are committed to making employment decisions without regard to race, religious creed, color, age, sex, sexual orientation, gender identity, national origin, religion, marital status, family status, medical condition, disability, military service, pregnancy, childbirth and related medical conditions or any other classification protected by federal, state, and local laws and ordinances.",https://www.linkedin.com/jobs/view/4391706811
Expression of interest for clinical examiners in General Medicine examinations in Ireland,Royal College of Physicians of Ireland,"Dublin, County Dublin, Ireland",linkedin,"**Company Description** The Institute of Medicine, RCPI is responsible for the strategic development of the General Medicine Membership exam and oversight of the delivery of all aspects (part I, part II written, part II clinical) of the exam. The Royal College of Physicians of Ireland delivers General Medicine examinations to over 4000 candidates annually. The Part and Part II written examinations are conducted globally via remote invigilation. The clinical examinations take place nationally in Ireland and in various centres overseas such as the UAE, Oman, Saudi Arabia, Bahrain and Malaysia. **Job Description** Expressions of interest are open to **General Medicine Consultants in Ireland** to join our team of expert MRCPI Clinical examiners for the Ireland based clinical examinations. General Medicine Part II Clinical examination is the final examination which must be completed to be eligible for conferral as a member of the Royal College of Physicians of Ireland (MRCPI) in General Medicine. The MRCPI General Medicine Part II Clinical exam assesses a candidate’ clinical skills, their ability to take a history, perform clinical examinations and formulate investigation and management plans. **Closing date:** 5 June at 16:00 **About The Role** Becoming an RCPI examiner will help you to improve your own teaching practise and better prepare Trainees who are eligible for the GM clinical exam. You will also gain a deeper understanding of the clinical skills and acumen you should expect from a Trainee completing BST and entering HST. **Time Commitment** MRCPI in General Medicine Clinical in Ireland is held 3 diets per year (Jan/Feb, May/June, Sept/Oct) across multiple hospital exam centres nationwide. Those who meet the criteria to become an examiner will be required to successfully complete examiner training which is held in\-person or online and takes approximately 2 hrs to complete. You must also commit to examine at least 1 examining day per year. **Examiner Criteria** To become an RCPI examiner for General Medicine clinical examinations in Ireland we will require some information. Please fill out a short form and register your interest via the application form. If you have any questions regarding examiner criteria, please contact the RCPI Exams Department at exams@rcpi.ie. **About Us** The Royal College of Physicians of Ireland is a postgraduate medical training college dedicated to ensuring that doctors have the skills to provide patients with the best possible care. Founded in 1654, the college supports doctors to enhance their skills, competencies, and professionalism throughout their working lives. Through its Faculties and Institutes, The Royal College of Physicians of Ireland, offers medical training programmes, examinations, diplomas, and educational courses to equip doctors with the skills and knowledge they need to care for patients and run safe and efficient healthcare systems. It also offers a range of educational diplomas and courses for learners in the wider healthcare sector.",https://www.linkedin.com/jobs/view/4412658175
Fixed Income Sales Trader - Vice President,BNY,"Dublin, County Dublin, Ireland",linkedin,"**Job Description** At BNY, our culture allows us to run our company better and enables employees’ growth and success. As a leading global financial services company at the heart of the global financial system, we influence nearly 20% of the world’s investible assets. Every day, our teams harness cutting\-edge AI and breakthrough technologies to collaborate with clients, driving transformative solutions that redefine industries and uplift communities worldwide. Recognized as a top destination for innovators, BNY is where bold ideas meet advanced technology and exceptional talent. Together, we power the future of finance – and this is what is all about. Join us and be part of something extraordinary. The BNY Markets business helps our clients formulate, implement and operationalise their investment strategies. It provides clients with financing, execution, liquidity and collateral solutions that are integrated with BNY’s asset servicing ecosystem. Within the Markets division we have Global Markets Trading unit, which is comprised of the Foreign Exchange, Fixed Income, and Equities businesses. We are seeking a future team member for the role of VP, Fixed Income Sales Trading, to join our Global Markets Trading Fixed Income \& Equities Team. This role is located in Dublin, Ireland. In this role, you’ll make an impact and support the team in the following ways: * Fixed Income trade execution and client coverage * Support Equities execution and client coverage * Create, gather and distribute market commentary and strategic content * Internal brand development and proactive stakeholder relationship building * Monitor client requests and liaise with appropriate teams for resolution/responses * Work with Tech and Product teams globally to enhance FIEQ product offering * Support Best Execution/TCA development * Support strategic initiatives * Enhance market structure awareness To be successful in this role, we’re seeking the following: * Execution experience across Riskless Principal \& Agency FI products and markets * Bachelor’s degree or the equivalent combination of education and experience is required. * Advanced/graduate degree preferred. * Some cross asset exposure to FI, Equities \& FX. * Ability to multi\-task under pressure while maintaining a heavy focus on accuracy. * Highly numerate both in a theoretical and practical basis At BNY, our culture speaks for itself, check out the latest BNY news at: BNY Newsroom BNY LinkedIn **Here’s a Few Of Our Recent Awards** * America’s Most Innovative Companies, Fortune, 2025 * World’s Most Admired Companies, Fortune 2025 * “Most Just Companies”, Just Capital and CNBC, 2025 **Our Benefits And Rewards** BNY offers highly competitive compensation, benefits, and wellbeing programs rooted in a strong culture of excellence and our pay\-for\-performance philosophy. We provide access to flexible global resources and tools for your life’s journey. Focus on your health, foster your personal resilience, and reach your financial goals as a valued member of our team, along with generous paid leaves, including paid volunteer time, that can support you and your family through moments that matter. BNY is an Equal Employment Opportunity/Affirmative Action Employer \- Underrepresented racial and ethnic groups/Females/Individuals with Disabilities/Protected Veterans",https://www.linkedin.com/jobs/view/4391300185
Forward Deployed Software Engineer - Dublin,OpenAI,"Dublin, County Dublin, Ireland",linkedin,"**About The Team** OpenAI’s Forward Deployed Engineering team partners with customers to turn research breakthroughs into production systems. We operate at the intersection of customer delivery and core platform development. **About The Role** We are looking for customer\-focused software engineers to build effective custom software that leverages OpenAI’s APIs to solve real customer problems. As an FDSWE, you will work with our customers and OpenAI Forward Deployed Engineers to design and implement scalable solutions that solve their most difficult problems. You will design abstractions to solve customer problems, and then use them to scale our speed and quality of delivery across all Forward Deployed engagements. You will collaborate closely with Sales, Solutions Engineering, Solutions Architects, and Customer Success Managers who work on the same account. You will also work with our Research and Applied Product and Engineering teams to provide insightful customer feedback. This role is based in Dublin. We use a hybrid work model of 3 days in the office per week. We offer relocation assistance. Travel up to 50% is required. **In This Role, You Will** * Embed deeply with strategic customers to understand their business challenges and technical requirements in detail. * Design, architect, and develop full\-stack solutions using an experiment\-driven, iterative approach. * Prepare detailed scopes of work and project plans for both proof\-of\-concept prototypes and full production deployments. * Work hands\-on with customers' technical teams as a technical expert and trusted advisor, coding side\-by\-side to drive projects to completion on their infrastructure. * Collaborate with Product, Research and Applied teams to ensure seamless customer experiences, project success and actionable product feedback * Contribute to internal knowledge bases, codifying best practices and sharing insights gained from customer engagements to scale the Forward Deployed Engineering function. **You’ll Thrive In This Role If You** * 7\+ years of professional full stack engineering experience (excluding internships) in relevant roles at tech and product\-driven companies \- customer\-facing experience is highly desirable * Former founder, or early engineer at a startup who has built a product from scratch is a plus * Experience with relational databases like Postgres/MySQL * Have a bias for action and willingness to work iteratively with your customers to deliver the right solution that solves their problem. **About OpenAI** OpenAI is an AI research and deployment company dedicated to ensuring that general\-purpose artificial intelligence benefits all of humanity. We push the boundaries of the capabilities of AI systems and seek to safely deploy them to the world through our products. AI is an extremely powerful tool that must be created with safety and human needs at its core, and to achieve our mission, we must encompass and value the many different perspectives, voices, and experiences that form the full spectrum of humanity. We are an equal opportunity employer, and we do not discriminate on the basis of race, religion, color, national origin, sex, sexual orientation, age, veteran status, disability, genetic information, or other applicable legally protected characteristic. For additional information, please see OpenAI’s Affirmative Action and Equal Employment Opportunity Policy Statement. Background checks for applicants will be administered in accordance with applicable law, and qualified applicants with arrest or conviction records will be considered for employment consistent with those laws, including the San Francisco Fair Chance Ordinance, the Los Angeles County Fair Chance Ordinance for Employers, and the California Fair Chance Act, for US\-based candidates. For unincorporated Los Angeles County workers: we reasonably believe that criminal history may have a direct, adverse and negative relationship with the following job duties, potentially resulting in the withdrawal of a conditional offer of employment: protect computer hardware entrusted to you from theft, loss or damage; return all computer hardware in your possession (including the data contained therein) upon termination of employment or end of assignment; and maintain the confidentiality of proprietary, confidential, and non\-public information. In addition, job duties require access to secure and protected information technology systems and related data security obligations. To notify OpenAI that you believe this job posting is non\-compliant, please submit a report through this form. No response will be provided to inquiries unrelated to job posting compliance. We are committed to providing reasonable accommodations to applicants with disabilities, and requests can be made via this link. OpenAI Global Applicant Privacy Policy At OpenAI, we believe artificial intelligence has the potential to help people solve immense global challenges, and we want the upside of AI to be widely shared. Join us in shaping the future of technology.",https://www.linkedin.com/jobs/view/4347004926
"Full Stack Engineer, Services Technology",Apple,"Dublin, D, IE",indeed,"Join IS\&T's Services Technology team and build cutting\-edge IT systems for Apple TV Studio \& Production and Music operations. As a Full Stack Engineer, you'll architect and develop large\-scale web applications, collaborating with cross\-functional teams to deliver high\-quality solutions in a fast\-paced environment. You'll own applications end\-to\-end, working full stack and contributing to a robust technology ecosystem. **Description** We are seeking a highly skilled and motivated Full Stack Engineer to join our dynamic and expanding team. In this role, you will be part of a larger engineering team working on highly integrated applications in a fast\-paced environment. This role requires close collaboration with cross\-functional teams, including Quality Engineering, DevOps, Design, and Product, to design and develop complex, distributed, high\-quality solutions with tight deadlines. **Preferred Qualifications** Knowledge of containerization concepts like Kubernetes, Docker and others Experience with DevOps process automation using Terraform, Pulumi, or alternatives Experience with continuous integration (e.g. Jenkins) and testing frameworks(e.g.JUnit) Experience working with distributed, global teams Experience working with observability and monitoring systems such as Dynatrace orDataDog Experience working in highly integrated systems Strong communication, collaboration, interpersonal skills, and the ability to work and solveproblems independently. **Minimum Qualifications** Hands\-on experience in Java, or Node.js including Javascript \& Vue.js Solid proficiency experience using SQL or NoSQL Databases Experience in designing and developing microservices and APIs (RESTful and/or GraphQL) Experience with Cloud Platforms (AWS or Azure or GCP), and Cloud Services (e.g, functions/Lamdas)"",""internalDetails"":null",https://ie.indeed.com/viewjob?jk=f8506c0fbf10ee5a
