title,company,location,site,description,job_url
"Safety Product Operation Analyst, Search & Interaction Safety - Trust & Safety",TikTok,"Dublin, County Dublin, Ireland",linkedin,"**Responsibilities** About the Team The Search \& Interaction Safety Team is a lean and agile group focused on safeguarding user interactions across Search, Comment, and Messaging. Our mission is to respond quickly to evolving safety challenges by streamlining workflows, implementing efficient operational processes, and fostering cross team collaboration to proactively address risks. The planning team ensures that safety operations are adequately resourced, optimized, and future\-ready. By aligning workforce supply with business needs, managing vendors and internal capacity, and responding to real\-time changes, the team plays a central role in maintaining service levels, productivity, and long term scalability of safety operations. Responsibilities \- Translate product strategies into quantifiable resource requirements and corresponding operational plans. \- Establish an efficiency metrics system and an end\-to\-end attribution analysis framework to identify operational risks and guide efficiency optimization. \- Define and break down multi\-dimensional operational efficiency targets; continuously track execution progress, analyze deviations, and drive cross\-functional collaboration to achieve goals. \- Conduct in\-depth analysis of metric discrepancies and data fluctuations, and collaborate with Product and Engineering teams to develop and implement mitigation solutions. \- Partner with stakeholders to streamline platform functionalities, enhance foundational data maintenance mechanisms, identify risks in manual operations, diagnose feature usage issues and optimization opportunities, and drive resolution with platform product teams. **Qualifications** Minimum Qualifications: \- Bachelor's degree or above in Mathematics, Statistics, Computer Science, Engineering, or a related field. \- At least 2 years of experience in data analysis, business analysis, or product operations. \- Familiarity with metrics system design, attribution analysis, and goal\-setting methodologies. \- Proficient in data visualization tools (e.g., Tableau, Power BI), SQL, Excel, and statistical analysis tools. \- Strong communication skills, with the ability to collaborate effectively across teams and stakeholders. Preferred Qualifications: \- Experience with Python is a plus. \- Platform experience **Trust \& Safety** Content that this role interacts with includes images, video, and text related to every\-day life, but it can also include (but is not limited to) bullying; hate speech; child safety; depictions of harm to self and others, and harm to animals. Hence, it is possible that this role will be exposed to harmful content on a daily basis. ​ ​ TikTok recognises that keeping our platform safe for the TikTok communities is no ordinary job which can be both rewarding and psychologically demanding and emotionally taxing for some. This is why we are sharing the potential hazards, risks and implications in this unique line of work from the start, so our candidates are well informed before joining. ​ ​ We are committed to the wellbeing of all our employees and promise to provide comprehensive and evidence\-based programs, to promote and support physical and mental wellbeing throughout each employee's journey with us. We believe that wellbeing is a relationship and that everyone has a part to play, so we work in collaboration and consultation with our employees and across our functions in order to ensure a truly person\-centred, innovative and integrated approach.​ **About TikTok** TikTok is the leading destination for short\-form mobile video. At TikTok, our mission is to inspire creativity and bring joy. TikTok's global headquarters are in Los Angeles and Singapore, and we also have offices in New York City, London, Dublin, Paris, Berlin, Dubai, Jakarta, Seoul, and Tokyo.​ **Why Join Us** Inspiring creativity is at the core of TikTok's mission. Our innovative product is built to help people authentically express themselves, discover and connect – and our global, diverse teams make that possible. Together, we create value for our communities, inspire creativity and bring joy \- a mission we work towards every day.​ We strive to do great things with great people. We lead with curiosity, humility, and a desire to make impact in a rapidly growing tech company. Every challenge is an opportunity to learn and innovate as one team. We're resilient and embrace challenges as they come. By constantly iterating and fostering an ""Always Day 1"" mindset, we achieve meaningful breakthroughs for ourselves, our company, and our users. When we create and grow together, the possibilities are limitless. Join us.​ ​ Diversity \& Inclusion​ TikTok is committed to creating an inclusive space where employees are valued for their skills, experiences, and unique perspectives. Our platform connects people from across the globe and so does our workplace. At TikTok, our mission is to inspire creativity and bring joy. To achieve that goal, we are committed to celebrating our diverse voices and to creating an environment that reflects the many communities we reach. We are passionate about this and hope you are too.​",https://www.linkedin.com/jobs/view/4422011288
Sales Advisor,The Perfume Shop,"Dublin, County Dublin, Ireland",linkedin,"Here at The Perfume Shop, people are at the heart of everything we do. We are always on the lookout for individuals with Talent, a Passion for what we do and a Spark to help achieve our vision. **The Role** Are you passionate about perfume, and love people? Do you want to be part of a supportive team, and thrive in a fast\-paced environment? Everyday, our expert Sales Advisors work hard to make sure our customers feel valued, confident and special. As a Sales Advisor, it is your role to create an outstanding customer experience and grow sales. Assisting with the daily operational running of the store, you are customer focused, working as part of an amazing and supportive team to deliver against key targets that drive the success of your store. Contracted Hours: 4 Contract Type: Permanent Contract Pay Rate: €10\.02 \- €15\.77 **What You Will Do** You will greet customers and give great service by listening to their needs We’re proud to be the perfume experts, so you’ll be providing advice to customers on their perfume choices. Don’t worry, we’ll make sure you get all the training you need You will help the team to achieve and exceed store and team targets – and there are fantastic incentives and prizes on offer to recognise success Every customer is a VIP at The Perfume Shop, so you’ll offer every customer a free reward card to maximise their future offers and potential savings **What You Will Bring** We believe that you bring Talent, Passion and Spark and in return we will give you the skills and training in perfume to succeed! **It really helps if you;** Have a talent for getting along with people Have a passion for teamwork, and being successful together Have the spark to love learning about perfume Can be flexible with your work patterns **What You Will Get** * We pay commission at Christmas based on store sales and the number of hours worked * We’ll ensure you work regular hours and get your rota at least 4 weeks in advance so you can plan your life outside work * 32 days holiday (pro rata depending on contract hours) * You’re also a VIP to us, so you’ll get 20% off perfume and be able to take part in any customer offers on top * Additional discounts with our AS Watson partners including Superdrug and 3 Mobile * The opportunity to win some great prizes and incentives based on personal, team and store performance * Continuous learning and training to ensure you are always developing * Access to Wagestream, to support your financial wellbeing needs, giving you more control and flexibility with your pay. * Pension, health and wellbeing benefits, \+ more! **We are passionate about ‘Growing Our Own’, so we always encourage our employees to progress internally.** *We thank you for your interest, however due to the high volumes of applications, only those successful will be contacted. We do still encourage you to continue applying to any roles of interest you see advertised.* The Perfume Shop is an equal opportunity employer that is committed to supporting diversity and inclusion within our work environment. All qualified applicants will receive consideration for employment without regard to race, colour, religion, gender, gender identity or expression, sexual orientation, national origin, genetics, disability, age, or veteran status. We will ensure that individuals with disabilities are provided reasonable accommodation to participate in the job application or interview process, to perform essential job functions, and to receive other benefits and privileges of employment. The Perfume Shop is part of AS Watson Group, the world’s largest international health and beauty retailer operating over 16,500 stores under 12 retail brands in 28 markets, with over 130,000 employees worldwide. For the fiscal year 2023, AS Watson Group recorded revenue of US$23 billion. Every year, it is serving over 5\.5 billion shoppers via its O\+O (Offline plus Online) platforms, providing tech\-enabled retail experience to customers offline and online.",https://www.linkedin.com/jobs/view/4420966791
Sales Advisor,The Perfume Shop,"Blanchardstown, D, IE",indeed,"* Up to €15\.77 * Blanchardstown, Ireland * Part Time * Retail Stores Here at The Perfume Shop, people are at the heart of everything we do. We are always on the lookout for individuals with Talent, a Passion for what we do and a Spark to help achieve our vision. **The Role** Are you passionate about perfume, and love people? Do you want to be part of a supportive team, and thrive in a fast\-paced environment? Everyday, our expert Sales Advisors work hard to make sure our customers feel valued, confident and special. As a Sales Advisor, it is your role to create an outstanding customer experience and grow sales. Assisting with the daily operational running of the store, you are customer focused, working as part of an amazing and supportive team to deliver against key targets that drive the success of your store. Contracted Hours: 4 Contract Type: Permanent Contract Pay Rate: €10\.02 \- €15\.77 **What You Will Do:** You will greet customers and give great service by listening to their needs We’re proud to be the perfume experts, so you’ll be providing advice to customers on their perfume choices. Don’t worry, we’ll make sure you get all the training you need You will help the team to achieve and exceed store and team targets – and there are fantastic incentives and prizes on offer to recognise success Every customer is a VIP at The Perfume Shop, so you’ll offer every customer a free reward card to maximise their future offers and potential savings **What You Will Bring:** We believe that you bring Talent, Passion and Spark and in return we will give you the skills and training in perfume to succeed! **It really helps if you;** Have a talent for getting along with people Have a passion for teamwork, and being successful together Have the spark to love learning about perfume Can be flexible with your work patterns **What You Will Get:** * We pay commission at Christmas based on store sales and the number of hours worked * We’ll ensure you work regular hours and get your rota at least 4 weeks in advance so you can plan your life outside work * 32 days holiday (pro rata depending on contract hours) * You’re also a VIP to us, so you’ll get 20% off perfume and be able to take part in any customer offers on top * Additional discounts with our AS Watson partners including Superdrug and 3 Mobile * The opportunity to win some great prizes and incentives based on personal, team and store performance * Continuous learning and training to ensure you are always developing * Access to Wagestream, to support your financial wellbeing needs, giving you more control and flexibility with your pay. * Pension, health and wellbeing benefits, \+ more! **We are passionate about ‘Growing Our Own’, so we always encourage our employees to progress internally.** *We thank you for your interest, however due to the high volumes of applications, only those successful will be contacted. We do still encourage you to continue applying to any roles of interest you see advertised.* The Perfume Shop is an equal opportunity employer that is committed to supporting diversity and inclusion within our work environment. All qualified applicants will receive consideration for employment without regard to race, colour, religion, gender, gender identity or expression, sexual orientation, national origin, genetics, disability, age, or veteran status. We will ensure that individuals with disabilities are provided reasonable accommodation to participate in the job application or interview process, to perform essential job functions, and to receive other benefits and privileges of employment. The Perfume Shop is part of AS Watson Group, the world’s largest international health and beauty retailer operating over 16,500 stores under 12 retail brands in 28 markets, with over 130,000 employees worldwide. For the fiscal year 2023, AS Watson Group recorded revenue of US$23 billion. Every year, it is serving over 5\.5 billion shoppers via its O\+O (Offline plus Online) platforms, providing tech\-enabled retail experience to customers offline and online.",https://ie.indeed.com/viewjob?jk=2995379f31ac11bc
Sales Associate,Ralph Lauren,"Kildare, KE, IE",indeed,"**Ref\#:** W177585 **Department:** Retail **City:** Kildare **State/Province:** Kildare **Location:** Ireland **Company Description**Ralph Lauren Corporation (NYSE:RL) is a global leader in the design, marketing and distribution of premium lifestyle products in five categories: apparel, accessories, home, fragrances, and hospitality. For more than 50 years, Ralph Lauren's reputation and distinctive image have been consistently developed across an expanding number of products, brands and international markets. The Company's brand names, which include Ralph Lauren, Ralph Lauren Collection, Ralph Lauren Purple Label, Polo Ralph Lauren, Double RL, Lauren Ralph Lauren, Polo Ralph Lauren Children, Chaps, among others, constitute one of the world's most widely recognized families of consumer brands. At Ralph Lauren, we unite and inspire the communities within our company as well as those in which we serve by amplifying voices and perspectives to create a culture of belonging, ensuring inclusion, and fairness for all. We foster a culture of inclusion through: Talent, Education \& Communication, Employee Groups and Celebration. **Position Overview** **WHAT WE OFFER** * The opportunity to work for an iconic and unique lifestyle brand * Exciting career opportunities * Competitive benefits package and discounts * An environment where you can bring your whole self to work **Essential Duties \& Responsibilities** **WHAT YOU'LL DO** **One team focused on the consumer** * Deliver an extraordinary customer experience to drive sales * Communicate consistently with the team to ensure an excellent customer service * Provide product and customer feedback to managers **Ralph Lauren Brand Ambassador** * Provide a welcoming and elevated experience * Embody the Ralph Lauren values and spirit * Demonstrate a customer\-first culture **Operations** * Use the Ralph Lauren store systems and procedures to enhance selling efficiencies and to build the customer data\-base * Maintain established operational and merchandising store standards * Store maintenance **Experience, Skills, and Knowledge** **WHAT YOU ARE** * Energetic, passionate, and results\-driven team player * Experience in a fast\-paced environment * Excellent communication skills",https://ie.indeed.com/viewjob?jk=989a14210925af64
Sanctions Operations Associate,Rippling,"Dublin, County Dublin, Ireland",linkedin,"**About Rippling** Rippling gives businesses one place to run HR, IT, and Finance. It brings together all of the workforce systems that are normally scattered across a company, like payroll, expenses, benefits, and computers. For the first time ever, you can manage and automate every part of the employee lifecycle in a single system. Take onboarding, for example. With Rippling, you can hire a new employee anywhere in the world and set up their payroll, corporate card, computer, benefits, and even third\-party apps like Slack and Microsoft 365—all within 90 seconds. Based in San Francisco, CA, Rippling has raised $1\.4B\+ from the world’s top investors—including Kleiner Perkins, Founders Fund, Sequoia, Greenoaks, and Bedrock—and was named one of America's best startup employers by Forbes. We prioritize candidate safety. Please be aware that all official communication will only be sent from @Rippling.com addresses. **About The Role** Rippling is seeking a Sanctions Operations Associate to join our growing Financial Crime Compliance Team. A core part of this role is the review and disposition of sanctions screening alerts. You will evaluate matches generated by Rippling’s automated screening program, applying sound analytical judgment to distinguish true matches from false positives, escalate confirmed hits, and maintain clear documentation throughout the alert lifecycle. This includes assessing name, geography, and ownership\-based hits across OFAC and international sanctions lists, and ensuring disposition rationales meet audit and regulatory standards. You will also support sanctions due diligence reviews of existing customers, prospects, and third\-party partners, helping ensure alignment with Rippling’s risk appetite and applicable sanctions regulations. Due diligence reviews involve research using open\-source, proprietary, and third\-party tools, reviewing sanctions\-related adverse media, and drafting targeted outreach and escalation questions. You will contribute to risk analyses across a broad spectrum of sanctions exposure and work closely with teams across the organisation, including the Compliance FCC Team, KYC, Sales, Implementation, Legal, and Product. You will help maintain policies, procedures, and operational frameworks that support how the team identifies, assesses, and escalates sanctions risk, and will contribute to sanctions risk analyses and governance documentation. You will stay current on US and international sanctions programs and support the delivery of internal training on new or emerging risks. Strong cross\-functional partnership is important. This role works closely with Go\-to\-Market teams and requires the ability to communicate sanctions risk clearly to non\-specialist audiences. **What You Will Do** * Review and disposition sanctions screening alerts generated through Rippling’s screening program; evaluating potential matches against OFAC and international sanctions lists, assessing name, geography, and ownership\-based hits, applying risk\-based judgment to distinguish true positives from false positives, and escalating confirmed or high\-risk matches with clear, well\-documented rationales * Support end\-to\-end sanctions due diligence reviews of customers, prospects, and third\-party partners, from initial screening through risk determination and resolution * Conduct research across open\-source, proprietary, and third\-party tools, including adverse media analysis and sanctions nexus assessments for complex entities and ownership structures * Participate in customer\-facing due diligence calls and help develop targeted outreach and escalation questions that surface meaningful risk * Contribute to the policies, procedures, and operational frameworks that support Rippling’s sanctions due diligence program * Produce clear, well\-reasoned sanctions risk analyses and governance documentation * Work cross\-functionally with the EDD Team, Sales, Implementation, Legal, and Product to keep sanctions risk visible and actionable across the business * Stay current on OFAC and international sanctions developments and support translation of regulatory change into practical guidance for the team * Support internal sanctions training and help answer sanctions questions from business units **What You Will Need** * 1\-2 years of sanctions or financial crime compliance experience, including exposure to OFAC/sanctions due diligence or high\-risk customer reviews * Some experience conducting sanctions investigations and risk analyses, in a first\-line or second\-line role * Familiarity with multi\-jurisdictional sanctions regimes, particularly US (OFAC), EU, and UK programs * Working knowledge of sanctions typologies, regulatory obligations, and risk assessments for entities and ownership structures * Strong research, analytical, and communication skills, with the ability to manage multiple reviews in a fast\-paced environment * BA/BS degree required; professional certifications such as CGSS, CFCS, or CAMS are a plus **About The Team** Rippling's Financial Crime Team is a core function within the Compliance department, responsible for managing financial crime risk across Rippling's global operations. The team brings together deep expertise across sanctions, AML, KYC, and EDD to build and maintain scalable compliance frameworks that protect the company and support sustainable growth. Sanctions compliance is a critical pillar of that mission. As Rippling expands into new markets and onboards an increasingly complex customer base, the ability to identify and manage OFAC and international sanctions exposure is more important than ever. The Sanctions Due Diligence function sits at the centre of that effort, owning the reviews, frameworks, and cross\-functional partnerships that keep Rippling's sanctions program effective. At Rippling, we view compliance as a strategic enabler rather than a constraint. We build efficient, technology\-driven processes that safeguard the business without slowing it down. Join us to help shape a modern sanctions compliance function at a rapidly growing, global company.",https://www.linkedin.com/jobs/view/4411826675
