title,company,location,site,description,job_url
Edge Systems & Security Engineer,Protex AI,"Dublin, County Dublin, Ireland",linkedin,"**Protex AI is the AI Safety and Operations Intelligence Company.** At Protex AI, we are at the forefront of AI\-driven computer vision, building a safer, smarter industrial workplace with an intelligent operating system that redefines how facilities operate. Backed by top\-tier global investors, we recently secured a $36 million Series B to accelerate our mission. Industry leaders like DHL, Amazon, and Tesla trust Protex AI to drive measurable safety improvements, achieving an average 64% risk reduction within just three months of deployment. Operating in 20\+ countries, Protex is the go\-to safety partner for Fortune 500 manufacturing and logistics enterprises, transforming workplace safety with real\-time, AI\-powered insights. **About The Team** The Infrastructure Team builds and maintains the core foundation that powers all Protex systems, ensuring scalable data infrastructure, robust edge\-to\-cloud connectivity, and high\-performance backend services. We support edge deployments for real\-time computer vision applications and deliver resilient systems to enable proactive workplace safety at global scale. Within Infrastructure, this role sits at the intersection of systems administration, edge device operations, networking, and security, owning the layer between our cloud platform and the thousands of cameras and edge compute units running on customer sites across the world. **About The Role** We're looking for an Edge Systems \& Security Engineer to own how Protex devices are provisioned, accessed, secured, and kept healthy in the field. You'll be the technical lead for our remote access stack, OS lifecycle on the edge, fleet\-wide patching and upgrades, endpoint security tooling, and the networking posture we present to some of the most security\-conscious enterprises in the world. You'll work directly with Infrastructure, Edge Engineering, IT, and customer security teams at Fortune 500 logistics and manufacturing companies. The decisions you make show up in customer security reviews, in the way our devices land on a new site, and in how quickly we can respond when something goes wrong at 3am in a warehouse on the other side of the world. This is a hands\-on role with a lot of surface area. You'll be expected to build, document, and operate, and to raise our security bar without slowing the field team down. What you'll own * Remote access \- Run and evolve our remote access fabric for edge devices. Evaluate and roll out alternative access architectures (outbound\-only relays, on\-demand session models, hardware\-based options) to meet the security requirements of customers who can't accept the default approach. * Edge security \& endpoint protection \- Deploy and operate security monitoring tools across remote devices via our existing device management platform. Define sensor policy, vulnerability scanning cadence, the firewall and endpoint documentation we share with customers, and the edge\-compute performance budget we're willing to spend on security tooling. * OS lifecycle \- Own OS updates, upgrades, and kernel/driver compatibility across the fleet. Lead evaluation and migration work when we need to move to a more enterprise\-grade base OS, including compatibility testing across our video analytics stack, GPU drivers, and device management agents. * Provisioning from get\-go \- Design how a brand\-new Protex device goes from box to production: zero\-touch or low\-touch imaging, identity, secrets, certificates, remote access enrolment, device management registration, and first\-boot validation. The bar is ""an installer on a customer site can do it in minutes, every time."" * Networking \& customer security posture \- Maintain the firewall, port, and endpoint documentation we hand to customer IT and security teams. Be the technical voice in customer security reviews. Help close audits and procurement security questionnaires. * Systems administration \- Internal Linux infrastructure, identity, SSO, MDM where relevant, and the day\-to\-day systems work that keeps the engineering org and the fleet running. What You’ll Need * 5\+ years of professional experience in systems administration, infrastructure, security engineering, or a similar hands\-on operations role * Strong Linux fundamentals \- including package management, init systems, networking, kernel/driver troubleshooting, and OS upgrade paths * Experience operating a fleet of Linux devices in the field (not just servers in a data centre) \- remote management, patching, observability, recovery * Bachelor's degree in Computer Science, Engineering, or a related field * Hands\-on experience with a mesh/VPN or zero\-trust remote access solution * Solid networking knowledge: TCP/IP, DNS, NAT/firewalls, outbound\-only architectures, certificate handling, and how to explain all of the above to a customer's security team * Experience deploying and operating endpoint security and vulnerability scanning tools at scale * Experience with a major public cloud provider, particularly the compute, identity, monitoring, and edge/IoT services * Proficiency coding in Python \- comfortable writing automation, tooling, and small services rather than only shell one\-liners * Additional scripting and automation skills (Bash or similar) to make manual fleet operations go away * A security mindset \- secrets management, least privilege, threat modelling, and an instinct for what a customer security reviewer is going to ask * Mindset: + Owns their work end\-to\-end: planning, delivery, documentation, and cooperation across teams + Helpful and responsive \- willing to jump on a field issue with urgency when an edge device or a customer is impacted + Bias to write things down so the next person doesn't have to ask Nice To Have * Experience with managed edge / IoT deployment platforms and remote component delivery * Experience working with edge GPU hardware and GPU\-accelerated inference pipelines * Experience supporting SOC 2, ISO 27001, or similar compliance programs from the infrastructure side * Experience responding to enterprise customer security reviews at Fortune 500 scale * Experience with MDM or device fleet management tooling Why Join Us At Protex AI, you'll work on cutting\-edge problems with a mission\-driven team. You'll have ownership, autonomy, and the opportunity to make a tangible impact on workplace safety around the world. This role in particular gives you a clean slate over the edge security and remote access story for a fleet that's already deployed across 20\+ countries \- the work you do will show up in every customer security review we run. Protex AI is an inclusive and equal opportunities employer. We are committed to creating an equitable workplace for everyone regardless of gender, civil status, family status, sexual orientation, religion, age, disability, education level, or race. Protex AI is an inclusive and equal opportunities employer. We are committed to creating an equitable workplace for everyone regardless of gender, civil status, family status, sexual orientation, religion, age, disability, education level, or race.",https://www.linkedin.com/jobs/view/4421225335
Electronic Health Record EHR Application Support Analyst Grade IV 98764,HSE Workplace Health & Wellbeing,"Dublin, County Dublin, Ireland",linkedin,"Before you apply This job opportunity is open to both HSE and non\-HSE applicants. Reference 98764 Category Management/Admin/ICT Grade Grade IV 0558 Advertisement source Section 38 Advertisement Type Open to all Important Information The HSE is advertising this job on behalf of a publicly funded organisation. This job is not with the HSE. The terms and conditions of this job may be different from the HSE’s terms and conditions. County * Dublin Location Herberton, St James’s Walk, Rialto D08 HP97 Recruiter Children's Health Ireland Contract type * Specified Purpose Wholetime Closing date 19/06/2026 12:00:00 Application details CHI.EHR@cpl.ie Informal enquiries CHI.EHR@cpl.ie External link https://www.rezoomo.com/job/98764/",https://www.linkedin.com/jobs/view/4422021456
Enterprise Architect,FBD Insurance,"Bluebell, County Dublin, Ireland",linkedin,"****Job Overview**** The Enterprise Architect, reporting to the Head of IT Architecture, is responsible for defining, owning, and evolving FBD’s enterprise\-wide architecture vision, principles, and target states across business, application, data, integration, security, and infrastructure domains. The Enterprise Architect acts as a critical bridge between business strategy and IT execution, working with business leaders to understand strategic objectives, regulatory drivers, and capability needs, and translating these into clear architectural principles, target states, and roadmaps. The Enterprise Architect collaborates closely with IT leadership, Solution Architects, and delivery teams to ensure technology solutions are aligned to those business goals, fit within enterprise standards, and can be delivered sustainably. By balancing business priorities, risk, cost, and technical constraints, the Enterprise Architect ensures that individual initiatives collectively move the organisation toward its desired future state while maintaining architectural coherence, resilience, and regulatory compliance. ****Job Responsibilities**** **Enterprise Architecture Strategy \& Governance** * Support definition, maintenance and communication of FBD’s enterprise architecture, including principles, standards, reference architectures, and target states across all architecture domains. * Participate in FBD’s Design Authority, presenting strategic blueprints and solution designs and ensuring solution and programme architectures align to the agreed enterprise direction. * Provide architectural assurance and direction across major programmes and change initiatives. * Actively support the development and evolution of the FBD IT Strategy, translating business strategy into clear, achievable technology roadmaps. **Architecture Design \& Enablement** * Define and evolve enterprise level application, integration, data, infrastructure, and security architectures, ensuring consistency, reuse, scalability, and maintainability. * Establish and maintain architecture patterns and integration standards, including API based and event driven integration. * Ensure enterprise architectures meet security, resilience, regulatory, and operational requirements, including alignment with DORA and established IT controls. * Guide the assessment and rationalisation of current‑state architectures, identifying technical debt, risks, and opportunities for simplification and modernisation. ****Job Responsibilities**** **Stakeholder Collaboration \& Leadership** * Work collaboratively with senior business and technology stakeholders to ensure shared understanding of architectural direction and constraints. * Provide leadership, mentoring, and oversight to Solution Architects, encouraging consistency and high architectural quality across delivery teams. * Facilitate architectural discussions with both technical and non‑technical audiences, translating complexity into clear, actionable guidance. * Promote collaboration, knowledge sharing, and continuous improvement within the wider IT Architecture function. **Continuous Improvement \& Standards** * Lead the evaluation and selection of technology platforms, standards, and services, balancing innovation with operational stability. * Identify opportunities to improve architectural processes, governance, and artefacts, driving improvements through to adoption. * Ensure architectural documentation remains current, accessible, and aligned with enterprise objectives. **Education** * Bachelor’s Degree in Computer Science, Information Systems, or equivalent professional experience. * Relevant architecture certification such as TOGAF, IASA Core Certification, or equivalent. * Relevant technical certifications (e.g. Microsoft Azure, Microsoft 365\) desirable. ****Experiences**** * 10\+ years’ experience working in IT, with 5\+ years in architecture roles, including enterprise or domain level architecture. * Demonstrated experience defining and delivering enterprise architecture in complex, regulated environments. * Strong experience with on‑premise enterprise environments, with integration to SaaS platforms such as Microsoft Dynamics 365 and Microsoft 365\. * Strong background in architecture governance, architectural standards, IT controls, and risk management. * Experience with Microsoft Azure and Microsoft 365 desirable * Experience using architecture modelling frameworks and tools, particularly ArchiMate. * Experience working in the insurance industry or another regulated industry would be a strong advantage. * Comfortable engaging with senior stakeholders, vendors, and delivery teams across multiple disciplines. **Competencies** * Strategic thinker with a strong ability to connect business objectives to technology outcomes. * Highly organised, structured, and detail oriented approach to architectural work. * Strong leadership and influencing skills, with the ability to guide without direct authority. * Excellent written and verbal communication skills. * Ability to engage effectively with both technical and business stakeholders at all levels. * Proactive, accountable, and comfortable taking ownership for architectural outcomes. **MCC** * Excellent communication, negotiation, and stakeholder management skills * Strong analytical and problem\-solving abilities * Ability to work effectively in a fast\-paced, dynamic environment * Team player * Strong interest in continuously improving **Footer** This role sits within the Manager/Specialist pay grade in the IT department. FBD is proud to be an Equal Opportunity Employer. We welcome applicants of all ages, genders, ethnicities, cultures, religions, languages, sexual orientations, abilities, disabilities, and social backgrounds. We are dedicated to fostering a diverse, equitable, and inclusive workplace where everyone is encouraged to bring their whole, authentic self to work. Our approach to inclusion is embedded in our hiring practices, pay structures, leadership development, and workplace policies. At FBD, we believe that when our people feel valued and supported, they thrive, and so does our business. We are proud to foster a culture of collaboration, respect, and shared success at every stage of your career.",https://www.linkedin.com/jobs/view/4422042896
Facilities Administrator,Hays,"Dublin, County Dublin, Ireland",linkedin,"**Your new role** You will join a busy maintenance and facilities team as a Facilities Administrator, supporting the delivery of contract administration services across a diverse client portfolio. This position plays a key role in ensuring maintenance agreements are managed efficiently, kept up to date, and aligned with client requirements. **Your responsibilities** * Prepare and issue planned maintenance contract renewals ahead of expiry dates * Review and update contract scope in collaboration with internal stakeholders * Coordinate with clients to issue contracts and follow up to secure signed agreements * Set up and maintain contract records within internal systems to support scheduling and delivery * Track contracts throughout the renewal life cycle, ensuring all data is accurate and up to date * Maintain contract trackers, service details, and associated documentation * Work closely with operational teams to ensure asset and service information remains current. * Update and manage process documentation to ensure compliance and audit readiness * Produce regular reports on maintenance activities and contract performance **What you'll need to succeed** * Minimum of 2 years' experience in a similar administrative or coordination role * Experience within a construction, engineering, or facilities maintenance environment is advantageous. * Strong organisational and time management skills with the ability to manage multiple tasks * Ability to work effectively in a fast\-paced environment * Proficiency in Microsoft Office and experience with maintenance management systems is desirable. * Strong communication and interpersonal skills * Flexible approach with the ability to adapt to changing priorities and client needs **What you'll get in return** * Opportunity to work within a well\-established and growing organisation * Exposure to a wide variety of projects and sectors * Supportive team environment with opportunities for development * Competitive salary and benefits package (dependent on experience) **What you need to do now** If you're interested in this role, click 'apply now' to forward an up\-to\-date copy of your CV. Hays Ireland is a trading division of Hays Specialist Recruitment (Ireland) Limited and acts as an employment agency for permanent recruitment and employment business for the supply of temporary workers. By applying for this job you accept the T\&C's, Privacy Policy and Disclaimers which can be found at hays.co.uk",https://www.linkedin.com/jobs/view/4422011061
Field Service Engineer,Manning Global AG,"Dublin, County Dublin, Ireland",linkedin,"Our client, a leading global ICT service provider,is recruiting for a Field Service Engineer to join their business in Ireland. Position Title: Field Service Engineer Position Type: One\-year rolling contract Start Date: ASAP Location: Dublin office and Client site Contact: Zuni Vallejo / t \+49 (0\) 89 23 88 98 456 Responsibilities: * Lead field technical operations to ensure compliance with Service Level Agreements (SLAs) for PV, Battery Energy Storage Systems (BESS), Data Center (DC), and EV Charging products, while fostering the development of a localized service ecosystem. * Client Satisfaction: Take responsibility for resolving live network issues within SLA parameters for PV, BESS, DC, and Charging products. This includes managing spare parts effectively to ensure quick problem resolution and implementing preventive measures to avoid future occurrences. * Delivery Quality: Conduct field audits for installation partners to ensure adherence to Clients's technical standards. Carry out random site checks and issue quality deficiency reports as needed. * Proactive Maintenance: Implement contractual preventive maintenance to ensure the seamless operation of products on the live network. * Installer Enablement: Provide quarterly technical training to installers and oversee the resolution of local hotline Key Performance Indicators (KPIs). Requirements: * Candidates should have at least 1 year of experience in PV, BESS, DC, or EV Charge. A strong understanding of high\-voltage fields is preferred. Alternatively, entry\-level candidates with a strong willingness to learn and grow in the role will also be considered. * Bachelor degree or above * Fluency in English is required, with the ability to explain technical protocols to installers. Strong verbal and written communication skills are essential. * Communication Skills: Excellent verbal and written communication skills are essential for effectively engaging with local installers, partners, and team members. * Time Management and Adaptability: The ability to work under pressure, meet deadlines, and manage targets while adapting to continuously changing situations is crucial. On\-call readiness for emergency dispatch is also required. * Planning and Organizational Skills: Candidates should be able to work according to outlined processes, manage multiple tasks, prioritize effectively, and maintain organized work processes to meet deadlines. * Proactive and Detail\-Oriented: A self\-motivated individual with a strong initiative, accurate execution, and the ability to collaborate effectively within a team is preferred. For more details contact: sales(at)manningglobal.com Quoting reference: IR\_MGAL\_FSE\_12858 Or call Zuni on: \+49 (0\) 89 23 88 98 456 View our latest jobs: www.manningglobal.com Follow us on twitter: @ManningGlobal If you know of anyone within your network who may also be interested in this position,would you please forward this ‘Email \& Role’ to them. Please note: - That we do all we can to respond to all applications but if we have not contacted you within 2 days following your application \- its likely we have not shortlisted your CV for the position. - Manning Global cannot consider your application for this role if you are working for the customer we are recruiting for - If you are working for the client we are representing, but have confirmation you are leaving a permanent or contract position, please discuss this with us, so we can discuss representation with you. - This email and any files transmitted with it are confidential and intended solely for the use of the individual or entity to whom they are addressed. If you have received this email in error please notify the originator of the message. Any views expressed in this message are those of the individual sender. Group Head Office Manning Global AG Hohenzollernstraße 60, 80801 Munich, Germany Sitz der Manning Global AG: München, HRB 170058 Amtsgericht München, Vorstandsvorsitz: Rachael Manning Munich (DE) – Dublin (IRE) – Liverpool (UK) – Zurich (CH) \- Maastricht (NL) Lille (FR) – Changzhou (CN) – New York/Houston (USA) – Zagreb (HR) Timișoara (RO) – Madrid (ES) – Istanbul (TR) – Mexico (DF) – New Delhi (India)",https://www.linkedin.com/jobs/view/4417963207
