title,company,location,site,description,job_url
AI Engineer,EBM Software,"Dublin, County Dublin, Ireland",linkedin,"AI ENGINEER \- Role Overview We are looking for a hands\-on AI/ML Engineer to implement production\-grade, multi\-agent systems. You will translate high\-level architectural designs into robust Python code, focusing on reliability, latency, and the deterministic execution of agentic workflows. This role can be remote in Greece or Poland, or hybrid in our Dublin office. Key Responsibilities * Develop Multi\-Agent Workflows: Create agentic systems using frameworks like LangGraph and LangChain, implementing tool\-calling, planning, and self\-correction capabilities * Build Production RAG Systems: Design and implement sophisticated retrieval\-augmented generation pipelines with multi\-modal capabilities, handling text, tables, and complex document structures. Integration of Graph Databases with LLM systems for entity extraction, relationship mapping, and structured retrieval. * Production Deployment: Deploy and monitor AI systems using Docker, Kubernetes, and CI/CD pipelines, ensuring reliability, scalability, and cost\-effectiveness **Technical Qualifications** Core Tech Stack * Languages: Strong Python proficiency (asyncio, type hinting, Pydantic). * AI Frameworks: Deep practical experience with LangChain, LangGraph, or LlamaIndex. * Data Engineering: Experience with SQL and Vector Databases (Cosmos DB, Milvus, Chroma, or Pinecone, etc). * API Development: Experience building FastAPI or Flask endpoints to expose agent workflows to the frontend. Engineering Practices * Containerization: Package AI applications and models in Docker containers with proper dependency management and optimization for production workloads * CI/CD Pipeline Management: Build and maintain automated pipelines for testing, building, and deploying GenAI applications using Azure DevOps, GitHub Actions, or similar * Kubernetes Orchestration: Deploy and manage containerized AI services on Kubernetes, handling autoscaling, resource allocation, and service mesh configuration * Infrastructure as Code: Define and version control infrastructure configurations, deployment manifests, and cloud resources * Version Control: Maintain clean Git workflows with proper branching strategies, meaningful commits, and thorough code reviews * Monitoring \& Observability: Implement logging, tracing, and metrics collection for production AI systems; set up alerts and dashboards",https://www.linkedin.com/jobs/view/4340156155
Ailm Graduate Quantitative Trader,Ailm Quantitative Trading,"Dublin, County Dublin, Ireland",linkedin,"**Who are AILM Quantitative Trading Ltd?** Newly founded Irish Proprietary Quantitative Trading company, located in Dublin. **Why work for AILM Quantitative Trading Ltd?** * Receive one\-on\-one mentorship from experienced traders. * Base salary plus discretionary performance bonus tied to desk P\&L. * Exposure to every part of the trading lifecycle: quantitative research, execution, risk \- rather than being slotted into a narrow function as you would at a larger firm. * You'll join as one of our early hires, with meaningful influence on how the firm is built. **Who we're looking for at AILM Quantitative Trading Ltd:** * First\-class honours / GPA 3\.7\+ / equivalent in Mathematics, Physics, Computer Science, Statistics, Operational Research, Electrical Engineering, Actuarial Science, Economics (with strong quantitative content), or a closely related quantitative discipline. * Strongly preferred: demonstrated competitive achievement requiring decision\-making under pressure \- for example, academic competitions (IMO, ICPC, Kaggle) or games of skill (tournament\-level poker, competitive bridge, high\-rated chess), or comparable. * Ability to think systematically and reason rigorously under uncertainty. * We're looking for candidates who think for themselves rather than following templates, people who given a hard problem, instinctively start by reasoning from first principles rather than searching for the standard answer. * Sharp competitive instinct, attention to detail, ability to focus and think clearly in a fast\-paced environment. * Comfortable writing production\-quality Python with NumPy and pandas. Familiarity with C\+\+ or other programming languages a plus. * Track record of self\-initiated building \-personal projects, AI tooling, automation, side projects, GitHub activity, or similar evidence that you build things on your own initiative rather than only when assigned. * Genuine interest in financial markets and intellectually relentless , driven to compound your skills rapidly. **Eligibility:** Candidates must be eligible to work in Ireland; we are not sponsoring visas at this stage. Candidates must have completed all studies (including thesis/dissertation) before the September 2026 start date. We are hiring for permanent graduate roles; candidates returning to full\-time education after the programme will not be considered. **Online Assessment:** Successful applicants will be invited to complete a short online assessment before progressing to interviews. **Apply:** **Apply:** Via LinkedIn with your CV plus the following two short notes pasted into the application: 1. Why are you interested in trading? (\~200 words) 2. Describe the most ambitious thing you've personally built using AI tools \-what you built, what you learned, and what you'd do differently. (\~150 words)",https://www.linkedin.com/jobs/view/4412567476
"Asset & Wealth Management, Social Media, Analyst, Dublin",Goldman Sachs,"Dublin, County Dublin, Ireland",linkedin,"**Job Description** **OUR IMPACT** Across Asset Wealth Management, Goldman Sachs helps empower clients and customers around the world to reach their financial goals. Our advisor\-led wealth management businesses provide financial planning, investment management, banking, and comprehensive advice to a wide range of clients, including ultra\-high net worth and high net worth individuals, as well as family offices, foundations and endowments, and corporations and their employees. Our direct\-to\-consumer business provides digital solutions that help customers save and invest. Across Wealth Management, our growth is driven by a relentless focus on our people, our clients and customers, and leading\-edge technology, data, and design. **The Role** We are seeking an organised, analytical and highly motivated Social Media Executive (Analyst) to join our Marketing team in Dublin. The successful candidate will be responsible for developing and executing social media strategies that increase brand awareness and customer sentiment. You will create and curate engaging content for different platforms, manage the company’s social media accounts to maintain an online presence, and monitor analytics to measure campaign impact and refine approaches. This role also requires close collaboration with other teams to align social media activities with wider campaigns, as well as staying up to date with industry trends and regulatory changes to ensure compliance. **Responsibilities** * Develop and implement social media strategies to enhance brand awareness and customer engagement * Create and curate compelling content for various social media platforms, aligning with the company's brand identity and financial services offerings * Manage and maintain the company’s social media accounts, ensuring a consistent and professional online presence * Monitor and analyse social media metrics to evaluate the effectiveness of campaigns and adjust strategies accordingly * Collaborate with the marketing team to integrate social media campaigns with other marketing initiatives and promotions * Stay informed about industry trends, competitor activities, and regulatory changes to ensure compliance and relevance in social media communications * Identify and engage with key influencers and partners to expand the reach and impact of social media efforts * Produce regular reports on social media performance and insights, presenting findings to senior management and stakeholders **Requirements** * 2\+ years of relevant experience in organic social media growth and engagement * Experience in developing and executing strategies to broaden social media presence * Strong analytical skills to measure and optimise social media performance * Excellent copywriting, attention to detail, and the ability to balance multiple campaigns. * Background in marketing with a focus on social media platforms * Enthusiasm for experimenting with new social media tools and techniques * Ability to analyse data and derive actionable insights for social media campaigns * Experience in managing and scaling multiple social media channels * Passionate about staying current with social media trends and best practices * Proactive approach to testing and learning from social media initiatives * Excellent communication skills to collaborate with cross\-functional team **About Goldman Sachs** At Goldman Sachs, we commit our people, capital and ideas to help our clients, shareholders and the communities we serve to grow. Founded in 1869, we are a leading global investment banking, securities and investment management firm. Headquartered in New York, we maintain offices around the world. We believe who you are makes you better at what you do. We're committed to fostering and advancing diversity and inclusion in our own workplace and beyond by ensuring every individual within our firm has a number of opportunities to grow professionally and personally, from our training and development opportunities and firmwide networks to benefits, wellness and personal finance offerings and mindfulness programs. Learn more about our culture, benefits, and people at GS.com/careers. We’re committed to finding reasonable accommodations for candidates with special needs or disabilities during our recruiting process. Learn more: https://www.goldmansachs.com/careers/footer/disability\-statement.html © The Goldman Sachs Group, Inc., 2026\. All rights reserved. Goldman Sachs is an equal opportunity employer and does not discriminate on the basis of race, colour, religion, sex, national origin, age, veterans status, disability, or any other characteristic protected by applicable law.",https://www.linkedin.com/jobs/view/4370745338
Back-End Software Engineer,Consumer Edge,"Dublin, County Dublin, Ireland",linkedin,"**CONSUMER EDGE** Consumer Edge is a data and AI\-driven company that equips global organizations with real\-time, transaction\-based insights. Our engineers work across domains—Data, AI, and application development—to build a platform that translates complex data into clear business intelligence. **SOFTWARE ENGINEER BACKEND, CLIENT PLATFORM TEAM** You'll be joining Consumer Edge's Client Platform Team — a distributed cross\-disciplinary team located across Europe and the US. Our mission is to build web\-based products that empower our clients and transform how they make decisions. You'll be joining a group of Software Engineers, Product Managers and UX Designers, working closely with stakeholders to use data to answer real\-world business questions. We believe in building a culture of autonomy, where enabling team members to make decisions independently leads to greater motivation, innovation and productivity. **TECHNOLOGIES** We work in a microservices, DevOps environment where teams own their code and infrastructure in production. We favour type\-safe and functional programming styles — clean, composable code is something we care deeply about. Some of the technologies we use across Consumer Edge include Google Cloud Platform and BigQuery. **RESPONSIBILITIES** * Working on a distributed multi\-discipline team in an Agile environment to build a best\-in\-class customer\-facing platform that provides better insights into our data * Participate in architecture and design discussions. * Building maintainable and scalable services, performant APIs and infrastructure to serve data to our client\-facing web platform * Optimising system design for maximum performance and scalability * Building cross\-functional relationships within the team to enable meaningful impact **WHAT YOU'LL BRING TO THE TEAM** * 4\+ years of experience working as a Backend Engineer in a similar environment * Strong proficiency in Node.js and TypeScript, with an appreciation for type safety and functional programming principles * Excellent interpersonal skills for cross\-team collaboration, with great communication ability to share knowledge and get your message across * Experience building REST services * Good understanding of SQL * Experience working with a cloud service such as AWS or GCP **NICE TO HAVE** * Experience or interest in functional programming languages such as Scala. * Experience building GraphQL services * Familiarity with functional libraries and patterns in TypeScript (e.g. fp\-ts, Effect) * Experience of building/maintaining CI/CD pipelines * Experience building Data pipelines * Some exposure to infrastructure as code practices * Some frontend experience using Vue or React **WHAT TO EXPECT** * A strong tech community with training and support to develop your skills * Ability to make an immediate impact on our products **BENEFITS \& PERKS** * Distributed environment and flexible working arrangements * Generous leave options * In\-country benefits related to health insurance and pension / 401K *Consumer Edge is an equal opportunity employer, and we encourage people with a diverse range of backgrounds to apply.*",https://www.linkedin.com/jobs/view/4403871153
Business Support Specialist 12 month Fixed Term Contract,Uniphar Group,"Dublin, County Dublin, Ireland",linkedin,"**The Role** We are looking for a dynamic, highly motivated individual to join our Business Support team. Excellent technical and communication skills are essential to generate accurate data and access information from various data sources, both structured and unstructured. The candidate should have exceptionally strong healthcare, reporting, operational, and IT knowledge, with the capability of managing multiple complex projects and clients at one time. **Key Outcomes** * Strong analytical and validation skills, manipulating data to present actionable insights to the team. * Cleansing and analyzing multiple sources of data and finding ways to calibrate this data (combining internal and external data, financial and non\-financial data). * Collaborate with other functions to gather relevant data on time and check the accuracy of all sources. * Generate all reporting, pricing, and operational metrics, which ensures that the group is meeting its business reporting goals across over 100 blue\-chip multinational clients. * Deliver a clear set of principal KPIs to ensure market\-leading reporting, pricing, and stock capabilities are met. * Work with the Business Support Manager to deliver high\-level administrative duties by assisting with key reporting duties. * Provide all data input for the Master Data team from a pricing and billing perspective. * Co\-ordinate all ‘New Account’ and ‘New Product’ set up through the Key Account Management team to ensure accuracy and consistency for all clients. * Recommend and implement, where feasible, alternate solutions and be a catalyst for change to improve the customer experience. * Analyze and understand the client and their business, including future business direction. * IT interface management. * Follow internal system processes but be flexible to adapt to different responsibilities in a fast\-paced, dynamic environment. **Key Skills \& Experiences** * Exceptional written and verbal communication skills, and computer skills. * Excellent attention to detail and ability to think outside the box. * Communication skills provide the ability to create strong relationships internally and externally within the business. * Ability to multitask and problem\-solve effectively. * Highly driven and motivated. * At least 3 years’ experience working in a business role. * Ability to analyze a high volume of financial and nonfinancial data and clearly communicate the results to the commercial team. * Well\-developed PC skills and proficiency in MS Excel \& PowerPoint – Required. * Dynamic and proactive person, 'can\-do' attitude. * Demonstrated negotiation and conflict resolution skills. * Strong knowledge of SAP Business Warehouse/Business Intelligence (tools \& process) is essential. **Uniphar – Who We Are** With a workforce of more than 3000 employees spread across Ireland, the United Kingdom, Mainland Europe, MENA, and the USA, Uniphar is a trusted global partner to pharma and MedTech manufacturers, working to improve patient access to medicines around the world. Uniphar provides outsourced and specialised services to its clients, leveraging the strong relationships with 200\+ of the world’s best\-known pharmaco\-medical manufacturers across multiple geographies, enabled by our cutting\-edge digital technology and our highly expert teams. Uniphar is organized into three key divisions: Supply Chain, Retail \& On Demand, Uniphar Med Tech and Uniphar Pharma. **Supply Chain \& Retail** Supply Chain Services provides both pre\-wholesale and wholesale distribution of pharmaceutical, healthcare, and animal health products to pharmacies and hospitals nationwide. The business supports a diverse customer base through the provision of strong service levels coupled with innovative commercial initiatives. In addition, the business provides services and supports that help independent community pharmacies to compete more effectively in an increasingly difficult environment and runs a network of Uniphar\-owned pharmacies under the Life, Allcare, McCauleys and Hickeys symbol brands. **Pharma – On Demand** The On\-Demand business is a specialist medical supply business that sources and distributes pharmaceuticals, medical equipment, and consumable supplies to healthcare professionals in over 160 countries worldwide. We have offices in Ireland, UK, Europe, USA and New Zealand. The company’s main divisions encompass everything from International Sales through Sales to NGO’s and Charities, Clinical Trials Supply, Imported (Unlicensed Medicines), Sexual Health Supplies, and the storage and distribution of medical products and devices for third parties. **Click here to find out more: About Us \- Who we are \| Uniphar** **Culture at Uniphar** Uniphar is a combination of many businesses, each with its own identity, culture, values, and ways of working. Our overarching culture narrative is inclusive of each of these stores. Uniphar lives and breathes four key pillars that unpin and support our culture. We have a people\-first approach \- we do the right thing. We support entrepreneurial spirit where adaptability, commitment \& resilience is embodied in our way of working. We have a Common Purpose that connects our diversified businesses and people. Finally, Trust is at the heart of how we operate. Everything Uniphar does is enabled by our people, and as we continue to grow domestically and internationally, we become more diverse. This diversity fuels our business and culture. **Sustainability** Sustainability is at the core of what we do and is deeply embedded in our business strategy. We want to contribute positively to the people and the world around us. Sustainably running our business ensures that Uniphar will continue to prosper in the long term. We are focused on ensuring that each of the five pillars of our sustainability strategy is a fundamental part of our decision\-making process.",https://www.linkedin.com/jobs/view/4389715666
CSA Engineer,Mercury,"Dublin, County Dublin, Ireland",linkedin,"CSA Engineer, Ballycoolin Business Park, Dublin Apply Now **Mercury is the European leader in construction solutions.** We build and manage complex engineering \& construction projects for the world’s leading corporations. Our solutions help deliver technologies and life changing advancements that connect people, communities, and businesses, giving them the power to achieve incredible things. Our people have the courage to be innovative. Their determination and sharp focus enable us to deliver with certainty, time and time again. We deliver our clients’ visions through leading edge construction solutions across multiple sectors, including Enterprise Data Centres, Advanced Technology \& Life Sciences, Hyperscale Data Centres, Fire Protection. At Mercury, it is our duty to encourage and back our people to realise their vision of themselves. We place them at the heart of what we do, providing challenging opportunities to develop within a great team in a supportive environment that allows them to reach their full potential. **Key Role Responsibilities** **Team Management:** * Collaborate with engineers, and construction managers to develop comprehensive project plans and ensure delivery on schedule. * Collaborate with any other consultants, subcontractors, supervisors, planners, estimators, quantity surveyors and the general workforce involved in the project. * Liaise with clients and other 3rd parties as required, such as insurance companies, vendors, etc. * Develop comprehensive scope\-of\-works (SoW), task information deliverables lists (TIDP), and responsibility matrices (R\&R/ RACI) for CSA disciplines. * Raise any design\-related risks to planning, commercial and management, and establish a course to minimise their impact. * Maintain accurate records of key design activities (e.g. changes, issues) as they arise and escalate to management as appropriate. * Assist the Central Engineering and site teams with proactive contributions to construction and team matters. * Attend design related meetings and provide continual input for optimisation. * Collaborate on new design issues/ changes/ research within the team. * Assist with new tenders and PCSA (pre\-construction services agreements) deliverables within the Business Unit. **Project Management \& Planning** * Oversee the construction process to ensure adherence to design specifications and schedules. * Assist in developing design delivery schedules along with the client, project manager, design team and consultants. * Assist with managing the deliverables and approvals processes of design packages to ensure full approval for procurement. * Check design programmes on projects are aligned to consultant resource and construction/ procurement requirements. * Conduct site visits and report progress and quality of work. * Correctly follow information control and flow standards e.g. for RFIs, use of ACC, etc. **Technical Engineering** * Ensure CSA technical compliance on all projects. * Ensure knowledge of client and country\-specific design standards. * Assess and mitigate potential risks and issues as they’re identified in design, or that could have potential impact on construction activities. * Review design proposals by others for suitability and constructability. * Offer proposals for added value (VE) and off\-site manufacturing (OSM). * Ensure material choices are aligned to project requirements, budget, and QEHS standards. * Prepare comprehensive handover packs to the site team for any packages under your responsibility. * Coordinate and assist with coordination of CSA disciplines and interfaces with Electrical and Mechanical. * Check plans, drawings, and quantities for accuracy of calculations. * Review, monitor, and interpret the contract design documents supplied by the client or architect. **Sustainability** * Integrate sustainable practices into design and construction processes. * Evaluate the environmental impact of projects and propose options for improvements. **Documentation** * Prepare detailed reports, and documentation for project approval and permits. * Maintain accurate records of project progress and changes. * Manage key registers throughout the project design period: + Procurement schedule. + TIDP/ MIDP. + RFI log. + Deviation tracker. + Lessons Learnt log. + Issues, interface \& scope gap trackers. + Design change tracker. + Value Engineering Register + OSM Register **Other** * Provide technical guidance and support to construction teams. * Review and submit technical submittals. * Assist with recruitment activities for the Central Engineering team as deemed suitable. * Undertake other engineering tasks or duties as required by the Engineering Manager and/ or Company. * The Company reserves the right to vary the scope and nature of the Employee’s normal duties to consider changes in the Company’s work patterns and practices and the requirements of its business. **Essential Criteria For The Role** * Minimum 5 years post graduate experience in the Industrial, Pharmaceutical, Life Sciences or Data Centre sectors. * Demonstration of design, technical and construction knowledge is essential for this role. * Experience in leading meetings and coordinating the other team members. * Strong working knowledge of design and analysis software such as BIM, Revit. * Clean driving licence essential **Mercury is an equal opportunities employer.** Apply Now",https://www.linkedin.com/jobs/view/4403050246
