title,company,location,site,description,job_url
Quantity Surveyor - Transport,Mott MacDonald,"Dublin, County Dublin, Ireland",linkedin,"**Location/s:** Dublin, IE **Recruiter contact:** William Bates Mott MacDonald is a global engineering, management, and development consultancy with over 20,000 employees across more than 50 countries and 140\+ offices. We work across incredible global industries, delivering exciting work that is defining our future and making an important societal impact in the communities we serve. Our people power our performance – we succeed when they do. With countless opportunities to collaborate, learn, and grow, the possibilities for excellence are as varied as every individual. Whether you want to grow as a subject matter expert or broaden your experience with roles across our international community, you’re surrounded by global specialists who want to combine their expertise and champion you to be your best. As a proudly employee\-owned business, we benefit our clients, our communities, and each other, investing in creating the right space for everyone to feel empowered, included, and valued. Whatever your ambition, Mott MacDonald is where people come to be **brilliant.** **About The Division** The Advisory and Programme Delivery (APD) unit delivers management services in all the sectors that Mott MacDonald operate in the Built Environment, Defence, Energy, Water, Transportation and, Education, Health and Care. We deliver tailored solutions that directly address our clients’ key challenges, combining our world\-leading project expertise with unrivalled programme delivery capabilities and advisory services. Our APD team in Ireland is expanding, and we have multiple exciting opportunities for project and commercial managers. We are a vibrant team based across Belfast, Dublin, Cork and Galway with an ambitious goal of growing to match our expanding portfolio. Our core team consists of professionally qualified and experienced Project/Programme Managers, Planners, Commercial Managers, and Quantity Surveyors. What is our vision? Our vision, with your help, is to deliver major transportation projects as part of a global business and to establish our wide\-ranging consultancy as credible and preferred for our existing and new clients. **About The Team** Our transportation team is expanding, and we have multiple exciting opportunities for project and commercial managers. Our core team consists of professionally qualified and experienced Project/Programme Managers, Planners, Commercial Managers, and Quantity Surveyors. We lead and deliver a broad range of exciting transportation projects and programmes through our integrated, full service, Project, Programme, and Commercial Management (PPCM). We deliver a one Mott MacDonald solution by collaborating closely with our clients in the transportation sector and leveraging Mott MacDonald’s technical excellence in engineering, development, and management services. We are seeking driven professionals with the right attitude to integrate both internally and externally, grow our team, represent Mott MacDonald, and to deliver excellent service to our clients. We operate in Aviation, Highways, Rail and Maritime. Our vision is to deliver major transportation projects as part of a global business and to establish our wide\-ranging consultancy as ‘credible’ and ‘preferred’ for our existing and new clients. **Overview Of The Role** As Quantity Surveyor you will report to the Senior Quantity Surveyor and will assist on the commercial management of multiple projects and workstreams on major transportation projects. Key responsibilities and duties include: * Commercial management of a project or multiple projects, including: * Budget management including month end reporting (actuals, monthly variances, accruals and annual variances) * Risk management and reporting * Dispute resolution / avoidance * Offering commercial strategy advice * Review and recommendation of subcontractor acceptance * Assessment of compensation events * Assessment of monthly payment applications * Commercial audits * Mentoring of junior members of team **Candidate specification** Desirable: * Full Membership of the Royal Institution of Chartered Surveyors (MRICS) or working towards same * Cost planning skills and experience of delivering ideally within a cost consultancy / multi\-disciplinary environment * Previous experience of contract administration, cost estimates and NEC contracts * Relevant experience working on transportation/highways projects is preferred Essential: * Ideally degree qualified * Ability to operate both autonomously and as a part of a larger team * Excellent IT Skills – Word/Excel/PowerPoint * Strong communication skills including writing reports and presenting * Ability to establish and maintain good working relationships with clients, stakeholders, colleagues and the supply chain * Ability to demonstrate a flexible approach to work * Flexibility to travel to client sites and other MM offices Please be advised that offers for this role are conditional upon obtaining the appropriate level of Security Clearance. **We offer some fantastic benefits including:** * Flexible working * Pension matched up to 7% of base salary * Competitive annual leave * An annual professional institution subscription * Life insurance * Income continuance * Enhanced Paternity leave * Annual company performance bonus scheme – Subject to company performance * Cycle to work scheme * Travel TaxSaver tickets * Commitment to Continuing Professional Development – we are accredited by Engineers Ireland * Mentoring and support for career development and progression **Employee Ownership** * Our employee ownership model means no external investors, just us, creating a culture of shared success. * Our employees have a stake and a voice in our business, giving them a direct connection to our success through our personal and group performance bonuses. * As your career grows, so does your stake, recognising your long\-term impact and contribution. * Your voice matters, with the opportunity to connect directly with senior leadership through formal channels to help shape our future. * For our senior roles you will have a direct pathway towards ownership from day one. **Equality, diversity, and inclusion** We put equality, diversity, and inclusion at the heart of our business, seeking to promote fair employment procedures and practices to ensure equal opportunities for all. We encourage individual expression in our workplace and are committed to creating an inclusive environment where **everyone** feels they can contribute. **Accessibility** We want you to perform your best at every stage in the recruitment process. If you are disabled or need any support to enable you to apply or attend an interview, please contact us at reasonable.adjustments@mottmac.com and we will talk to you about how we can support you. **Agile working** At Mott MacDonald, we believe it makes business sense for you and your manager to choose how you can work most effectively to meet your client, team, and personal commitments. We offer a hybrid working policy that embraces your well\-being, flexibility, and trust. Apply now, or for more information about our application process, click here. Location(s): Dublin, IE Contract Type: Permanent Work Pattern: Full Time Market: Transport Discipline: Project programme and commercial management Job Ref: 13048 Recruiter Contact: William Bates",https://www.linkedin.com/jobs/view/4371490316
Real Estate Analyst,Mercor,"Dublin, County Dublin, Ireland",linkedin,"**About The Job** **Mercor** connects elite creative and technical talent with leading AI research labs. Headquartered in San Francisco, our investors include **Benchmark** , **General Catalyst** , **Peter Thiel** , **Adam D'Angelo** , **Larry Summers** , and **Jack Dorsey** . **Position:** Real Estate / Property Professionals **Type:** **Contract** **Compensation:** **$80–$160/hour** **Location:** **Remote** **Role Responsibilities** * Review and assess domain\-specific documents to ensure quality, accuracy, and relevance. * Provide structured feedback to improve document standards and evaluation processes. * Utilize strong analytical skills to contribute to high\-impact evaluation projects. * Collaborate with teams to enhance document assessment methodologies. * Work independently and asynchronously to meet project deadlines. **Qualifications** **Must\-Have** * Bachelor's degree (minimum) * 2\+ years of professional experience in a relevant domain * Strong proficiency in Excel, PowerPoint, and Word * Strong document analysis and review skills * Attention to detail and ability to follow structured guidelines **Preferred** * Based in the United States, Europe, UK, or Canada **Application Process (Takes 20–30 mins to complete)** * Upload resume * AI interview based on your resume * Submit form **Resources \& Support** * For details about the interview process and platform information, please check: https://talent.docs.mercor.com/welcome * For any help or support, reach out to: support@mercor.com *PS: Our team reviews applications daily. Please complete your AI interview and application steps to be considered for this opportunity.*",https://www.linkedin.com/jobs/view/4412707068
Recruitment Consultant,GPC Finance,"Sandyford, Dún Laoghaire-Rathdown, Ireland",linkedin,"**Recruitment Consultant– Uncapped Commission!** **Location:** South County Dublin (Sandyford) **Earnings:** €40k\-€60k\+ (Salary \+ Uncapped Commission) GPC Finance is a specialist recruitment consultancy in Dublin with 25\+ years’ experience in Ireland, the UK and internationally. We’re hiring a Recruitment Consultant to join our dynamic team in Sandyford. This role suits an ambitious, confident person who thrives in a fast\-paced, target\-driven environment. Ideal for someone from a people\-facing background ( **Hospitality, Education, Personal Training, Sales, Recruitment Coordination** ) looking for a career move. **Role:** * The successful **Recruitment Consultant** will manage the full 360 recruitment process. * Business development with new and existing clients * Manage your own client database * Source and interview candidates * Creating job specifications for client’s roles. * Receive full training and mentoring from senior consultants \& the MD **Requirements:** * Degree preferred (or equivalent experience) * 1\+ year in an office or recruitment environment * **A background in a people facing role such as Sales, Recruitment Coordination, Hospitality, Education or Personal Training highly considered.** * Strong people skills and communication (written \& verbal) * Confident on the phone and with cold calling * Organised, motivated, results\-driven, with strong attention to detail * Have a strong sense of urgency **Salary \& Benefits:** * **Basic \+ uncapped commission (OTE €40k–€60k\+)** * Fast\-track career opportunities and hands on mentorship * 23 days leave (25 after 2 years) * Pension, mobile phone * Annual performance bonus * Collaborative, supportive team with regular social events * Monthly, Quarterly \& Annual targets with rewards If you are looking for a challenging and rewarding career as Recruitment Consultant, please send your CV to Katie Garvey.",https://www.linkedin.com/jobs/view/4412662158
Recruitment Consultant,Global Professional Consultants,"Sandyford, Dún Laoghaire-Rathdown, Ireland",linkedin,"**Recruitment Consultant– Uncapped Commission!** **Location:** South County Dublin (Sandyford) **Earnings:** €40k\-€60k\+ (Salary \+ Uncapped Commission) GPC is a specialist recruitment consultancy in Dublin with 25\+ years’ experience in Ireland, the UK and internationally. We’re hiring a Recruitment Consultant to join our dynamic team in Sandyford. This role suits an ambitious, confident person who thrives in a fast\-paced, target\-driven environment. Ideal for someone from a people\-facing background ( **Hospitality, Education, Personal Training, Sales, Recruitment Coordination** ) looking for a career move. **Role:** * The successful **Recruitment Consultant** will manage the full 360 recruitment process. * Business development with new and existing clients * Manage your own client database * Source and interview candidates * Creating job specifications for client’s roles. * Receive full training and mentoring from senior consultants \& the MD **Requirements:** * Degree preferred (or equivalent experience) * 1\+ year in an office or recruitment environment * **A background in a people facing role such as Sales, Recruitment Coordination, Hospitality, Education or Personal Training highly considered.** * Strong people skills and communication (written \& verbal) * Confident on the phone and with cold calling * Organised, motivated, results\-driven, with strong attention to detail * Have a strong sense of urgency **Salary \& Benefits:** * **Basic \+ uncapped commission (OTE €40k–€60k\+)** * Fast\-track career opportunities and hands on mentorship * 23 days leave (25 after 2 years) * Pension, mobile phone * Annual performance bonus * Collaborative, supportive team with regular social events * Monthly, Quarterly \& Annual targets with rewards If you are looking for a challenging and rewarding career as Recruitment Consultant, please send your CV to Deborah Byrne.",https://www.linkedin.com/jobs/view/4412643963
Remote Marketer – Personal Growth Coach,Perfect Life Group Limited,"Dublin, County Dublin, Ireland",linkedin,"We're looking for an experienced marketer to promote established mindset and business coaching programs to a global audience. This is a fully remote, performance\-based contractor role — your earnings reflect your results, with no ceiling on what you can make. **About The Role** You'll work independently to run and optimise digital marketing campaigns, generate leads, and drive conversions for proven coaching programs that are already delivering results. Full training and systems are provided from day one. **Responsibilities** * Develop and run campaigns across email, social media, and paid ads * Create content that drives awareness, engagement, and conversions * Nurture leads through targeted follow\-ups and funnels * Analyse performance metrics and optimise for ROI * Collaborate with the team to scale what's working **What You'll Need** * 2\+ years of results\-driven marketing experience * Excellent written and spoken English * Strong communication and self\-management skills * Comfortable with WhatsApp or phone for initial screening **What's On Offer** * Fully remote with a flexible schedule * Performance\-based earnings — uncapped * Comprehensive training and proven systems * Ongoing support and team collaboration * A growing market with real momentum **To apply** This role involves a direct WhatsApp or phone screening call. Prompt, reliable communication is essential. Not suitable for students or entry\-level candidates. *Keywords: remote marketing contractor, digital marketing, performance marketing, lead generation, content marketing, mindset coaching, business coaching, personal development, work from home, coaching industry jobs*",https://www.linkedin.com/jobs/view/4412718762
Resident Engineer Civil - Water,RPS,"Dublin, County Dublin, Ireland",linkedin,"RPS has great opportunities for **Resident Engineers Civils** to join our site based teams for roles in the **South East, South West, and Dublin Region of Republic of Ireland.** **About The Role** We are seeking a number of **Resident Engineers Civils** to work on major above and below ground water utility projects helping to deliver important infrastructure for their customers and to ensure that the works are carried out in accordance with the contract documents (works requirements). The duties of the roles shall include, but not be limited to: * Monitor and report on works being carried out onsite * Monitor the Contractor for compliance with the Safety Health \& Welfare at Work (Construction) Regulations * Prepare excellent technical reports and presentations for internal and external use. **Qualifications And Experience** The desired qualifications and experience for the Resident Engineers Civils are: * Level 8 degree in Engineering * 7\+ years of relevant post graduate experience in engineering including site works supervision and monitoring of safe working practices. Ideally this will include water sector projects. Experience of pipeline treatment plant work will be an advantage. * Hold a clean driving licence * Hold current Safepass, Managing safely in construction and manual handling. **About You \- Core Competencies** * Safety and Delivery focussed * Accountable * Problem solver * Self\-motivated/Initiative * Works well as part of a team. **Position Specific Competencies** * Attention to detail. * Computer skills \- MS Office Suite (advanced user of MS Excel preferred). * Excellent communication skills and ability to work within a diverse multi\-disciplinary team with excellent people management skills. * Written – excellent report writing. * Verbal – excellent communications skills. * Have a good knowledge \& experience of Health \& Safety legislation and regulations. * Good record keeping. * Working knowledge of Public Works and FIDIC form of contract * Detailed understanding of Health \& Safety legislation and regulations * Track record of leading or working in site supervision teams * Contractor design review experience beneficial * Team Player with excellent communication skills (both written and verbal), team working skills and analytical skills * Ability to lead and motivate themselves and others; willingly takes ownership of issues and seeks team participation to achieve best solution * Ability to define problems, collect data, establish facts, draw valid conclusions, and make recommendations * Ability to devise new approaches to problems encountered **What We Offer You** Our employees are rewarded with competitive salaries, opportunities to invest and many other benefits including: 23 days holiday increasing with service \+ bank holidays, Company pension scheme, Disability Scheme, Cycle to Work Scheme, Health Screening, Employee Assistance Programme, Professional Memberships and Sponsored Education. We understand the need to work flexibly, with agile offices and hybrid working offered as standard, we’re happy to talk about flexible working. This is a workplace that works for you. A career here is far from ordinary. Here you’re not a number, your part of the solution. **About RPS** RPS a TetraTech company, is a leading international professional services company providing management, engineering, planning, environmental, sustainability and communications consultancy, employing over 600 staff in Ireland with a global staff of over 28,000 plus employees across UK, Europe, US and Australia We benefit from the scale of business that allows us to work on large and/or exciting projects and, at the same time, we retain the local presence in our markets which fosters positive engagement with our clients. We define, design and manage projects that create shared value in a complex, urbanising and resource\-scarce world. Connecting with our global expertise we make it easy for our clients to create winning solutions for their communities and their clients. By being confidently pragmatic we solve problems that matter. We make complex easy. **What Happens Next** The Talent Acquisition Team will be in touch to let you know the outcome of your application. If your application is progressed, you’ll have a conversation with one of our recruiters and then there’ll be a two\-stage interview process with the Team. All applications will be considered, and we will try our best to respond to you within seven working days. **Recruitment Agencies** We have a Preferred Supplier List of trusted partners to assist us when required and do not acknowledge any speculative CVs or unsolicited candidate introductions from agencies not on this list. Please refer to the careers page on our website if you require any further information.",https://www.linkedin.com/jobs/view/4150431128
SMB Strategic New Business Executive - UKI,TikTok,"Dublin, County Dublin, Ireland",linkedin,"**Responsibilities** TikTok's SMB team aims to help businesses, agencies and brands of all sizes unleash their creative side, connect with our audience, and drive revenue and growth. To help businesses achieve their marketing goals on TikTok, no matter how big or small, our SMB team combines operational expertise with a customer\-centric strategic mindstep. You will be doing so by designing and executing scaled sales \& service delivery strategies, as well as ensuring that our customers have the right tools and product at their fingertips. We're looking for a passionate Strategic New Business Executive with a digital advertising background to join our growing Sales team in Dublin, looking after Small \& Medium size businesses (SMB). You will be a crucial member of a growing team that will partner with SMB advertisers in a one to many structure with the goal of activating accounts in the UKI market. Responsibilities: \- Build, manage and convert a high\-volume pipeline of new advertisers across the UKI market through proactive outreach (calls, email, LinkedIn, video, events). \- Identify, qualify, and convert new business opportunities for the TikTok Ads platform, focusing on speed to engagement and pipeline velocity. \- Execute structured multi\-channel outreach campaigns to generate qualified opportunities in priority verticals. \- Develop a strong understanding of TikTok Ads solutions and demonstrate early client success through pilot campaigns. \- Collaborate closely with marketing and sales teams to optimise lead generation and conversion strategies. \- Partner with Account Managers to ensure seamless handover and onboarding of new clients for long\-term success. \- Consistently exceed activity, conversion, and revenue targets while delivering a best\-in\-class advertiser experience. \- Serve as an ambassador for TikTok \- representing our products, brand, and values in every client interaction. **Qualifications** Minimum Qualifications \- Extensive experience in sales, business development, or lead generation, ideally in a digital media or SaaS environment. \- High oral and written fluency in English, is required, as the role involves direct client communication across the English\-speaking markets served by the business. \- Proven experience building pipeline through outbound prospecting and multi\-channel outreach. \- Highly metrics\-driven and comfortable working in a fast\-paced, target\-oriented environment. \- Demonstrated integrity, professionalism, and attention to detail when handling client data and information. \- A genuine passion for digital marketing, creativity, and helping businesses grow through TikTok. Preferred Qualifications \- Prior experience in a BDR/SDR or early\-stage sales role within SaaS, ad tech, or digital marketing. \- Understanding of online advertising fundamentals (campaign setup, optimisation, KPIs). \- Proven ability to manage high outreach volume while maintaining quality conversations and follow\-ups. \- Entrepreneurial mindset \- able to think strategically, adapt quickly, and deliver results in a scaling organisation. **About TikTok** TikTok is the leading destination for short\-form mobile video. At TikTok, our mission is to inspire creativity and bring joy. TikTok's global headquarters are in Los Angeles and Singapore, and we also have offices in New York City, London, Dublin, Paris, Berlin, Dubai, Jakarta, Seoul, and Tokyo.​ **Why Join Us** Inspiring creativity is at the core of TikTok's mission. Our innovative product is built to help people authentically express themselves, discover and connect – and our global, diverse teams make that possible. Together, we create value for our communities, inspire creativity and bring joy \- a mission we work towards every day.​ We strive to do great things with great people. We lead with curiosity, humility, and a desire to make impact in a rapidly growing tech company. Every challenge is an opportunity to learn and innovate as one team. We're resilient and embrace challenges as they come. By constantly iterating and fostering an ""Always Day 1"" mindset, we achieve meaningful breakthroughs for ourselves, our company, and our users. When we create and grow together, the possibilities are limitless. Join us.​ ​ Diversity \& Inclusion​ TikTok is committed to creating an inclusive space where employees are valued for their skills, experiences, and unique perspectives. Our platform connects people from across the globe and so does our workplace. At TikTok, our mission is to inspire creativity and bring joy. To achieve that goal, we are committed to celebrating our diverse voices and to creating an environment that reflects the many communities we reach. We are passionate about this and hope you are too.​",https://www.linkedin.com/jobs/view/4412563837
