title,company,location,site,description,job_url
Lean & Sustainability Graduate,Dawn Farms,"Naas, KE, IE",indeed,"***Your recipe for a rewarding career starts here!*** **About Us** Established in 1985, Dawn Farms is a **family\-owned company** and the largest dedicated supplier of **cooked meat and plant\-based ingredients and fermented and dried sausage products** outside of the US. The company currently supplies world\-leading food brands across more than 44 markets, including the UK, Europe, Asia and Africa. With over 1,000 employees we are committed to meeting the needs of our customers in a safe, innovative and sustainable way, all while strengthening the communities where they live and work. **Job Purpose** Dawn Farms is currently seeking an **Lean \& Sustainability Graduate** to join our **Sustainability Department** to be based in our state of the art production facilities in **Naas, Co. Kildare**. The Lean \& Sustainability Graduate will support the delivery of continuous improvement and sustainability initiatives across the business, using lean business tools and theories. The role will focus on eliminating waste, improving flow and efficiency, strengthening standard work, and supporting environmental performance within a regulated food manufacturing environment. Working closely with crossfunctional teams, the graduate will contribute to building a strong culture of continuous improvement while ensuring that food safety, quality, and health \& safety requirements are consistently upheld. **Positions:** Full\-Time, Fixed Term 2 years. **Location:** Naas, Co. Kildare, Ireland. **Salary:** DOE **Working Hours:** 39 hours per week, Mon. \- Fri. (some flexibility required) **Role Responsibilities \& Duties:** * Support and participate in Lean improvement activities across operations, focusing on waste reduction, environmental improvements, process stability and efficiency. * Apply Lean tools and techniques such as process mapping, root cause analysis, standard work, visual management, and continuous improvement workshops. * Assist in identifying improvement opportunities that enhance sustainability, efficiency, quality and safety. * Support delivery of sustainability objectives, including energy efficiency, waste reduction, and responsible resource use. * Collect and analyse operational data to track performance and support evidencebased decision making. * Collaborate with crossfunctional teams to embed Lean ways of working into daily operations. * Actively promote a culture of continuous improvement, accountability, and problem ownership at all levels of the organisation. * Carry out all activities in line with food safety, quality, and health \& safety standards, ensuring compliance with company policies, procedures, and good manufacturing practices. **Knowledge and Experience to Be Demonstrated:** * Understanding of Lean principles and continuous improvement approaches. * Strong analytical and problemsolving capability. * Awareness of sustainability principles and their application in a manufacturing environment. * Ability to work with data to support improvement initiatives. **Key Skills \& Competencies:** * Bachelors degree (minimum) in Environmental \& Sustainability Studies or another relevant discipline. * Exposure to Lean or continuous improvement methodologies (certification desirable but not essential). * Strong IT skills, particularly in data analysis and process improvement tools. * **Proactive:** Seeks out improvement opportunities and takes ownership of actions. * **Curious:** Questions existing ways of working and looks for better, simpler solutions. * **Continuous Learner:** Open to feedback and committed to developing Lean capability. * **Communicative:** Communicates clearly and works effectively with teams at all levels. * **TeamOriented:** Collaborates openly and supports shared improvement goals. * **Resilient:** Maintains focus and momentum in a fastpaced manufacturing environment. * **Adaptable:** Responds positively to change and supports continuous improvement culture. **Why Dawn Farms?** We can offer an excellent opportunity to be part of a world\-class team, equipping our teams with the knowledge and the necessary skills to achieve their full potential. Innovation is a key ingredient of our success in protecting our market position and keeping our competitive edge. To be truly innovative, we invest in recruiting and developing a highly skilled, ambitious and talented team. **What we can offer you?** * 22 Days Annual Leave. * Health Insurance Contribution. * Pension Plan. * Subsided Canteen. * Training and Development Opportunities for further career progression. * Employee Assistance Programme (Free access/support to Life Coachs, Dietitians, Work Relocation advice etc.) * Bike to Work Scheme. * Christmas savings scheme. *'Dawn Farm Foods Ltd. is an equal opprtunities employer'*",https://ie.indeed.com/viewjob?jk=a8c06bbe0f54fe6e
Lean & Sustainability Graduate,Dawn Farms,"Naas, County Kildare, Ireland",linkedin,"***Your recipe for a rewarding career starts here!*** **About Us** Established in 1985, Dawn Farms is a **family\-owned company** and the largest dedicated supplier of **cooked meat and plant\-based ingredients and fermented and dried sausage products** outside of the US. The company currently supplies world\-leading food brands across more than 44 markets, including the UK, Europe, Asia and Africa. With over 1,000 employees we are committed to meeting the needs of our customers in a safe, innovative and sustainable way, all while strengthening the communities where they live and work. **Job Purpose** Dawn Farms is currently seeking an **Lean \& Sustainability Graduate** to join our **Sustainability Department** to be based in our state of the art production facilities in **Naas, Co. Kildare** . The Lean \& Sustainability Graduate will support the delivery of continuous improvement and sustainability initiatives across the business, using lean business tools and theories. The role will focus on eliminating waste, improving flow and efficiency, strengthening standard work, and supporting environmental performance within a regulated food manufacturing environment. Working closely with cross‑functional teams, the graduate will contribute to building a strong culture of continuous improvement while ensuring that food safety, quality, and health \& safety requirements are consistently upheld. **Positions:** Full\-Time, Fixed Term 2 years. **Location:** Naas, Co. Kildare, Ireland. **Salary:** DOE **Working Hours:** 39 hours per week, Mon. \- Fri. (some flexibility required) **Role Responsibilities \& Duties:** * Support and participate in Lean improvement activities across operations, focusing on waste reduction, environmental improvements, process stability and efficiency. * Apply Lean tools and techniques such as process mapping, root cause analysis, standard work, visual management, and continuous improvement workshops. * Assist in identifying improvement opportunities that enhance sustainability, efficiency, quality and safety. * Support delivery of sustainability objectives, including energy efficiency, waste reduction, and responsible resource use. * Collect and analyse operational data to track performance and support evidence‑based decision making. * Collaborate with cross‑functional teams to embed Lean ways of working into daily operations. * Actively promote a culture of continuous improvement, accountability, and problem ownership at all levels of the organisation. * Carry out all activities in line with food safety, quality, and health \& safety standards, ensuring compliance with company policies, procedures, and good manufacturing practices. **Knowledge and Experience to Be Demonstrated:** * Understanding of Lean principles and continuous improvement approaches. * Strong analytical and problem‑solving capability. * Awareness of sustainability principles and their application in a manufacturing environment. * Ability to work with data to support improvement initiatives. **Key Skills \& Competencies:** * Bachelor’s degree (minimum) in Environmental \& Sustainability Studies or another relevant discipline. * Exposure to Lean or continuous improvement methodologies (certification desirable but not essential). * Strong IT skills, particularly in data analysis and process improvement tools. * Proactive: Seeks out improvement opportunities and takes ownership of actions. * Curious: Questions existing ways of working and looks for better, simpler solutions. * Continuous Learner: Open to feedback and committed to developing Lean capability. * Communicative: Communicates clearly and works effectively with teams at all levels. * Team‑Oriented: Collaborates openly and supports shared improvement goals. * Resilient: Maintains focus and momentum in a fast‑paced manufacturing environment. * Adaptable: Responds positively to change and supports continuous improvement culture. **Why Dawn Farms?** We can offer an excellent opportunity to be part of a world\-class team, equipping our teams with the knowledge and the necessary skills to achieve their full potential. Innovation is a key ingredient of our success in protecting our market position and keeping our competitive edge. To be truly innovative, we invest in recruiting and developing a highly skilled, ambitious and talented team. **What we can offer you?** * 22 Days Annual Leave. * Health Insurance Contribution. * Pension Plan. * Subsided Canteen. * Training and Development Opportunities for further career progression. * Employee Assistance Programme (Free access/support to Life Coach’s, Dietitians, Work Relocation advice etc.) * Bike to Work Scheme. * Christmas savings scheme. *'Dawn Farm Foods Ltd. is an equal opprtunities employer'*",https://www.linkedin.com/jobs/view/4412326541
Mechanical Engineer,Mercury,"Dublin, County Dublin, Ireland",linkedin,"Mechanical Engineer, Ballycoolin Business Park, Dublin Apply Now **Mercury is the European leader in construction solutions.** We build and manage complex engineering \& construction projects for the world’s leading corporations. Our solutions help deliver technologies and life changing advancements that connect people, communities, and businesses, giving them the power to achieve incredible things. Our people have the courage to be innovative. Their determination and sharp focus enable us to deliver with certainty, time and time again. We deliver our clients’ visions through leading edge construction solutions across multiple sectors, including Enterprise Data Centres, Advanced Technology \& Life Sciences, Hyperscale Data Centres, Fire Protection. At Mercury, it is our duty to encourage and back our people to realise their vision of themselves. We place them at the heart of what we do, providing challenging opportunities to develop within a great team in a supportive environment that allows them to reach their full potential. **Key Role Responsibilities** **Team Management:** * Collaborate with engineers, and construction managers to develop comprehensive project plans and ensure delivery on schedule. * Collaborate with any other consultants, subcontractors, supervisors, planners, estimators, quantity surveyors and the general workforce involved in the project. * Liaise with clients and other 3rd parties as required, such as insurance companies, vendors, etc. * Develop comprehensive scope\-of\-works (SoW), task information deliverables lists (TIDP), and responsibility matrices (R\&R/ RACI) for Mechanical disciplines. * Raise any design\-related risks to planning, commercial and management, and establish a course to minimise their impact. * Maintain accurate records of key design activities (e.g. changes, issues) as they arise and escalate to management as appropriate. * Assist the Central Engineering and site teams with proactive contributions to construction and team matters. * Attend design related meetings and provide continual input for optimisation. * Collaborate on new design issues/ changes/ research within the team. * Assist with new tenders and PCSA (pre\-construction services agreements) deliverables within the Business Unit. **Project Management \& Planning** * Oversee the construction process to ensure adherence to design specifications and schedules. * Assist in developing design delivery schedules along with the client, project manager, design team and consultants. * Assist with managing the deliverables and approvals processes of design packages to ensure full approval for procurement. * Check design programmes on projects are aligned to consultant resource and construction/ procurement requirements. * Conduct site visits and report progress and quality of work. * Correctly follow information control and flow standards e.g. for RFIs, use of ACC, etc. **Technical Engineering** * Ensure Mechanical technical compliance on all projects. * Ensure knowledge of client and country\-specific design standards. * Assess and mitigate potential risks and issues as they’re identified in design, or that could have potential impact on construction activities. * Review design proposals by others for suitability and constructability. * Offer proposals for added value (VE) and off\-site manufacturing (OSM). * Ensure material choices are aligned to project requirements, budget, and QEHS standards. * Prepare comprehensive handover packs to the site team for any packages under your responsibility. * Coordinate and assist with coordination of Mechanical disciplines and interfaces with CSA and Electrical. * Check plans, drawings, and quantities for accuracy of calculations. * Review, monitor, and interpret the contract design documents supplied by the client or architect. **Sustainability** * Integrate sustainable practices into design and construction processes. * Evaluate the environmental impact of projects and propose options for improvements. **Documentation** * Prepare detailed reports, and documentation for project approval and permits. * Maintain accurate records of project progress and changes. * Manage key registers throughout the project design period: + Procurement schedule. + TIDP/ MIDP. + RFI log. + Deviation tracker. + Lessons Learnt log. + Issues, interface \& scope gap trackers. + Design change tracker. + Value Engineering Register + OSM Register **Other** * Provide technical guidance and support to construction teams. * Review and submit technical submittals. * Assist with recruitment activities for the Central Engineering team as deemed suitable. * Undertake other engineering tasks or duties as required by the Engineering Manager and/ or Company. * The Company reserves the right to vary the scope and nature of the Employee’s normal duties to consider changes in the Company’s work patterns and practices and the requirements of its business. **Essential Criteria For The Role** * Minimum 5 years post graduate experience in the Industrial, Pharmaceutical, Life Sciences or Data Centre sectors. * Demonstration of design, technical and construction knowledge is essential for this role. * Experience in leading meetings and coordinating the other team members. * Strong working knowledge of design and analysis software such as BIM, Revit. * Clean driving licence essential **Mercury is an equal opportunities employer.** Apply Now",https://www.linkedin.com/jobs/view/4403047244
NeoDyne Engineering Graduate Programme Dublin 2026,NeoDyne,"Dublin, County Dublin, Ireland",linkedin,"*Want to influence the power grid of the future? Tackle climate change? Play your part in the greening of the gas network?* *Launch your career with NeoDyne and open a world of opportunities!* **Overview** NeoDyne is a leading engineering company specialising in industrial automation, digital manufacturing, and electrical engineering solutions. With a strong presence across multiple sectors, including Life Sciences, Food \& Beverage, and Energy, NeoDyne delivers leading\-edge solutions that drive efficiency, safety, and performance for its customers worldwide. We develop high\-availability automation and electrical systems for mission\-critical industries, including pharmaceutical manufacturing, data centres, and energy infrastructure, ensuring continuous operation and compliance. We additionally integrate emerging technologies to enhance control, scalability, and operational insight. Our expertise also extends to power generation, natural gas transmission, and high\-voltage system design, delivering robust solutions that strengthen critical infrastructure. With a team of 200\+ skilled engineers, our expertise spans the entire project lifecycle, from design and implementation to commissioning and operations. From our offices in Ireland, the UK, Romania, and the US, we operate on a global scale, combining technical expertise with local delivery. We support customers across Europe, North America, and Asia, delivering tailored engineering services that drive long\-term success. **Position Summary** NeoDyne are recruiting a **Graduate Electrical Engineer** to join our expanding engineering teams. Our graduate programme is all about learning new and developing your existing skills. Over a two\-year period, you will be placed in projects where you get to do meaningful work and contribute to the business. This Graduate opportunity is offered as a full\-time permanent contract, based at our **Dublin** **Office** , with an excellent salary and benefits package. If successful, you will enjoy NeoDyne's ""People First"" company culture, built on mutual respect, trust, and honesty, where each individual actively contributes as a valued team member. **What will I be doing?** * Data Centre and Substation Electrical Design: Projects could include preparation of coordinated drawings covering all aspects of installations, including mechanical, electrical, instrumentation and structural elements. More specifically, you will be producing Electrical Design including, Electrical Layouts, LV \& MV Distribution Design, Control \& Instrumentation Design and General Services Design. You will have the opportunity to use state\-of\-the\-art engineering software for control and protection design and substation layouts. * Carrying out Power Systems Electrical Studies: Load Estimates, Protection Coordination, Cable Sizing Calcs. You will have the opportunity to use state\-of\-the\-art engineering software along side leading\-edge power system modelling software to run steady state and transient electrical studies, including short circuit studies, and protection studies for proposed renewable generation * Generating technical documentation: You will be producing specifications for various electrical equipment and assemblies: transformers, RTUs, instrumentation etc. Dealing with customers will also be key parts of our graduate programme to help develop your soft skills. * You will also have the opportunity to travel to customer sites to get involved in installation, testing, and commissioning, by participating in design \& commissioning of SCADA and control systems in the field: I/O and instrumentation testing, full testing and commissioning. **What about training?** *Our induction programme revolves around a 70\-20\-10 model for learning and development.* * 70% On\-the\-job Learning: You'll get stuck in from Day 1, working on real projects, delivering real business value to our customers both on\- and off\-site. * 20% Learning from others: You'll be part of a team, working with subject matter experts and interacting with our customers daily. You'll receive support and guidance, and an invaluable opportunity to learn from former graduates who've seen it and done it. * 10% Formal Education: We'll help you become an expert in your chosen field, backed up by formal e\-learning and classroom training. This extends to attaining professional certifications where relevant to our business specialisations. **Required** **Experience \& skills** * Level 8 Degree in Electrical/ Power Systems/ Energy Engineering, or equivalent. * 0\-2 years' experience in a similar electrical design role or Work Placement. * Full Irish driving license or to be achieved within 12 months of starting the role. Desired * Experience in developing Electrical Schematics using AutoCAD, EPLAN or similar. * Experience in developing equipment layouts using AutoCAD, or similar. **Characteristics** *We look for candidates who* * Work well as part of a team. * Have excellent problem solving and diagnostic skills. * Can complete tasks independently, capable of self\-learning. * Can prioritise and coordinate work. * Have excellent customer service, interpersonal, communication and organisational skills. * Can multitask and work well under pressure. * Are a strategic business thinker. **What's on offer?** * Competitive starting salary with year\-on\-year bonuses and salary increases * Paid Overtime * Paid Graduation Day * Health Insurance * Income Protection * Life Assurance * PRSA pension with employer contribution * Flexible Working * Personalised Career Development Plan * Professional Certifications, pathways to become a Chartered Engineer * Cycle to work scheme **Apply today!** With our diverse range of business specialisations, customers, and industries that we serve, we offer an unrivalled programme designed to accelerate your personal and professional development. Don't miss this opportunity to join a company at the forefront of industrial automation projects in Ireland, the UK, mainland Europe and the US. So why wait? Apply Today! NeoDyne Ltd. is an equal opportunity employer, and all applications will be treated in strictest confidence.",https://www.linkedin.com/jobs/view/4335476424
"Operator & License Owner, Dublin",Stranger Soccer,"Dublin, County Dublin, Ireland",linkedin,"**Love Football (Soccer)? Love Business? Stranger Soccer is rolling out to key cities globally, and we're seeking a License Owner / Operator to launch and operate the Stranger Soccer brand in Dublin.** **This isn't your regular management role — it's truly built for someone who wants to run, grow, and own their own venture,** while helping make football more accessible in their city. Best suited for entrepreneurial individuals who love football and enjoy seeing tangible results from their work. ⚽ **About the Role** As License Owner/Operator, you will be responsible for establishing and growing Stranger Soccer in Dublin. You will oversee daily operations while building a strong, engaged football community. This opportunity goes beyond typical employment — it is ideal for someone who enjoys hands\-on ownership, is driven by performance, and wants to make a real impact in their city. 💼 **What You'll Do** * Launch and grow Stranger Soccer operations in Dublin * Secure and manage partnerships with football venues * Recruit, train, and manage game hosts and part\-time staff * Drive player acquisition through creative marketing and community engagement * Ensure a high\-quality, consistent game experience that keeps players coming back * Continuously improve and scale operations You'll be supported by our headquarters team in Singapore, including: * Technology platform (app, payments, automation) * Proven operating model * Ongoing operational and marketing guidance 🎯 **Who We're Looking For** * Passionate about football with strong local insight * Entrepreneurial mindset with a bias for action * Comfortable taking ownership and driving measurable results * Experience in operations, events, community building, or similar areas * Strong communication and people leadership skills 💡 **What Makes This Opportunity Unique** * Full ownership and autonomy over local operations * Direct impact on growth and success in your city * Performance\-driven structure with strong upside potential * Opportunity to build and lead a local team 🌍 **About Stranger Soccer** Stranger Soccer makes playing football as easy as going for a jog. Through our mobile app, players can browse games, book slots, and play anytime. Born in Singapore, Stranger Soccer is now open in 10\+ cities around the world, with over 100,000 games run. We continue to grow and are accepting applications from license partners who want to bring Stranger Soccer to their city. 🚀 **How to Apply** To learn more about this opportunity, please visit: www.strangersoccer.com (see *""Bring Stranger Soccer to your City""* ) If this aligns with your ambitions, we'd love to hear from you.",https://www.linkedin.com/jobs/view/4412525990
