title,company,location,site,description,job_url
Presales Architect,Hewlett Packard Enterprise,"Naas, County Kildare, Ireland",linkedin,"This role has been designed as ‘Hybrid’ with an expectation that you will work on average 2 days per week from an HPE office. **Who We Are** Hewlett Packard Enterprise is the global edge\-to\-cloud company advancing the way people live and work. We help companies connect, protect, analyze, and act on their data and applications wherever they live, from edge to cloud, so they can turn insights into outcomes at the speed required to thrive in today’s complex world. Our culture thrives on finding new and better ways to accelerate what’s next. We know varied backgrounds are valued and succeed here. We have the flexibility to manage our work and personal needs. We make bold moves, together, and are a force for good. If you are looking to stretch and grow your career our culture will embrace you. Open up opportunities with HPE. **Job Description** **Start your career in tech by helping customers solve real\-world problems.** **The Opportunity** Are you passionate about technology and curious about how it helps businesses thrive? Join our Ireland sales team and turn your curiosity into impact. In this early\-career role, you’ll learn how to design smart, scalable solutions that help customers achieve their goals — from cloud to edge and everything in between. You’ll work alongside experienced architects and sales professionals, gaining hands\-on experience with cutting\-edge technologies, and learning how to turn business challenges into technical solutions that deliver real value. **Please note: This is a hybrid position and requires a minimum of 3 days per week in our Leixlip office.** **What You’ll Do** * Partner with our customer and partner sales teams to understand customer challenges and help design solutions that make a difference. * Learn how to translate business needs into technical architectures using our full portfolio — from hardware and software to cloud and services. * Contribute to solution proposals, presentations, and demos that inspire confidence and excitement. * Stay curious about new technologies and trends, and bring fresh ideas to the team. * Support customer engagements by helping to tell the story of how technology can drive transformation. * Work with mentors who’ll guide you as you build your expertise and confidence in pre\-sales. * Collaborate with internal and partner teams to deliver seamless solutions. * Document your work, share ideas, and help us continuously improve. **About You** You don’t need to be an expert yet — just motivated, curious, and ready to learn. You’ll succeed if you’re: * Passionate about technology and eager to understand how it solves business problems. * A natural communicator — someone who enjoys connecting ideas and people. * Analytical and creative — you like solving puzzles and explaining the “why” behind your thinking. * Collaborative — you thrive in team settings and enjoy learning from others. * Comfortable presenting your ideas, both in person and virtually. **What You’ll Bring** * A degree (or equivalent experience) in a technical, business, or related field. * Some exposure to IT, technology, or sales through study, internships, or work experience. * A growth mindset and willingness to learn quickly in a fast\-paced environment. * Strong written and verbal communication skills. * Curiosity about cloud computing, infrastructure, and emerging technologies. **Why Join Us** * Learn from the best: You’ll be mentored by experienced solution architects and sales professionals. * Grow your career: We’ll invest in your technical training and professional certifications. * Make an impact: You’ll be helping customers innovate, transform, and achieve their goals. * Be part of something bigger: Join a culture that celebrates curiosity, collaboration, and courage. * Hybrid Working: the flexibility to work from home and our Leixlip office. Our expectation is that you would be in the office 3 days a week. You’ll also have the opportunity to meet with customers and partners face to face. **Your Future Starts Here** This isn’t just a job — it’s a launchpad for your career in tech. If you’re ready to learn, grow, and help shape the future of how technology empowers businesses, we’d love to meet you. **Additional Skills** Accountability, Accountability, Active Learning, Active Listening, Assertiveness, Bias, Building Rapport, Buyer Personas, Coaching, Complex Sales, Creativity, Critical Thinking, Cross\-Functional Teamwork, Customer Experience Strategy, Customer Interactions, Design Thinking, Empathy, Financial Acumen, Follow\-Through, Growth Mindset, Identifying Sales Opportunities, Industry Knowledge, Intellectual Curiosity (Inactive), Long Term Planning, Managing Ambiguity {\+ 6 more} **What We Can Offer You** **Health \& Wellbeing** We strive to provide our team members and their loved ones with a comprehensive suite of benefits that supports their physical, financial and emotional wellbeing. **Personal \& Professional Development** We also invest in your career because the better you are, the better we all are. We have specific programs catered to helping you reach any career goals you have — whether you want to become a knowledge expert in your field or apply your skills to another division. **Unconditional Inclusion** We are unconditionally inclusive in the way we work and celebrate individual uniqueness. We know varied backgrounds are valued and succeed here. We have the flexibility to manage our work and personal needs. We make bold moves, together, and are a force for good. **Let's Stay Connected** Follow @HPECareers on Instagram to see the latest on people, culture and tech at HPE. **Job** Sales **Job Level** TCP\_01 HPE is an Equal Employment Opportunity/ Veterans/Disabled/LGBT employer. We do not discriminate on the basis of race, gender, or any other protected category, and all decisions we make are made on the basis of qualifications, merit, and business need. Our goal is to be one global team that is representative of our customers, in an inclusive environment where we can continue to innovate and grow together. Please click here: Equal Employment Opportunity. **Hewlett Packard Enterprise is EEO Protected Veteran/ Individual with Disabilities.** HPE will comply with all applicable laws related to employer use of arrest and conviction records, including laws requiring employers to consider for employment qualified applicants with criminal histories. **No Fees Notice \& Recruitment Fraud Disclaimer** *It has come to HPE’s attention that there has been an increase in recruitment fraud whereby scammer impersonate HPE or HPE\-authorized recruiting agencies and offer fake employment opportunities to candidates. These scammers often seek to obtain personal information or money from candidates.* *Please note that Hewlett Packard Enterprise (HPE), its direct and indirect subsidiaries and affiliated companies, and its authorized recruitment agencies/vendors **will never charge any candidate a registration fee, hiring fee, or any other fee in connection with its recruitment and hiring process.** The credentials of any hiring agency that claims to be working with HPE for recruitment of talent should be verified by candidates and candidates shall be solely responsible to conduct such verification. Any candidate/individual who relies on the erroneous representations made by fraudulent employment agencies does so at their own risk, and HPE disclaims liability for any damages or claims that may result from any such communication.*",https://www.linkedin.com/jobs/view/4412313236
Privileged Access Management Engineer,AIG,"Dublin, County Dublin, Ireland",linkedin,"**Who We Are** American International Group, Inc. (AIG) is a leading global insurance organization. AIG member companies provide a wide range of property casualty insurance in approximately 70 countries and jurisdictions. These diverse offerings include products and services that help businesses and individuals protect their assets and manage risks. We’re also committed to making a positive difference for our colleagues and in the communities where we work and live. We encourage colleagues to give back to the causes they care most about, supporting these efforts through our Volunteer Time Off and Matching Grants Programs. **Get to know the business** At AIG, technology is at the heart of everything we do, from underwriting risks to processing claims. The Information Technology team equips our colleagues with the latest tools to complete their work efficiently and with the highest standards of excellence. The team is responsible for shielding the company’s systems from security risks, while designing technology strategies that enable AIG’s businesses to achieve their goals. AIG’s Information Technology functions include enterprise architecture, software and systems engineering, cybersecurity, and technology risk and compliance. **About The Role** The Privileged Access Management team is situated within the AIG Global Identity and Access Management team. The team is currently focused on increasing the adoption of the selected Enterprise Privileged Access management tool, CyberArk, to reduce the overall risk landscape at AIG. You will partner closely with the PAM Principal Engineers and the development teams to implement strong PAM controls, protect credentials and secrets and mature AIG’s posture using the zero\-trust framework. **What You Will Do** * The PAM (Privileged Access Management) Engineer role is essential to supporting business requests for securing and managing privileged accounts. * Plays a pivotal role in supporting the principal engineers by integrating applications with the PAM tool and extending capabilities of the PAM service, ensuring the management of Privileged Accounts and Secrets. * Work directly with our users, being the front line of Privileged Access. * Partner with engineering and architecture teams to scope requirements and capabilities for PAM that are out of the box. Installing and implementing marketplace plug\-ins as needed to support adoption. * Support the Principal Engineers to identify opportunities to enhance the PAM capabilities and contribute to process improvements. * Provide training to end\-users, Admins and DevOps, on CyberArk functionality and capabilities. * Leverage knowledge of Privileged Access to maintain a clean and compliant environment. * Implement robust monitoring and alerting for the PAM tool and privileged access. * Help to define, identify, and inventory privileged access within our environment and detect exceptions to our standards through automated reporting solutions. * Make risk\-based and data\-driven decisions to achieve prioritized outcomes in alignment with PAM standard. **Qualifications** **What You Will Need:** * Detail\-oriented and self\-motivated. * Customer\-focused with strong communication skills, having the ability to communicate technical concepts to a non\-technical audience. * Bachelor's degree in a Cybersecurity, Information Technology, or related field, such as Computer Science or Information Technology. * In depth experience as a Privileged Access Management (PAM) hands\-on practitioner, ideally with experience running an enterprise vault, such as CyberArk, with a strong track record of configuring and maintaining the solution. * CyberArk Defender Certification * Extremely proficient using CyberArk AAM * Profound understanding of privileged access management concepts, identity and access management, and security best practices * Hands on experience using ServiceNow and Active Directory * Conjur Fundamentals certifications * Experience administering Secrets and Key management solutions such as Hashicorp Vault, AWS Secrets Manager, Keyfactor, and Conjur * Knowledge of common IT infrastructure technologies and concepts: + Directories: LDAP, Windows Active Directory, Azure AD, Okta, etc. + Operating Systems: Windows, Linux, Unix (including AIX and Solaris), etc. + Databases: Oracle, SQL, Postgres + Mainframes: RACF, z/OS + Network Protocols * Familiarity with authentication security, such as MFA and certificates, a plus At AIG, we value in\-person collaboration as a vital part of our culture, which is why we ask our team members to be primarily in the office. This approach helps us work together effectively and create a supportive, connected environment for our team and clients alike. **Enjoy Benefits That Take Care Of What Matters** At AIG, our people are our greatest asset. We know how important it is to protect and invest in what’s most important to you. That is why we created our Total Rewards Program, a comprehensive benefits package that extends beyond time spent at work to offer benefits focused on your health, wellbeing and financial security—as well as your professional development—to bring peace of mind to you and your family. **Reimagining insurance to make a bigger difference to the world** American International Group, Inc. (AIG) is a global leader in commercial and personal insurance solutions; we are one of the world’s most far\-reaching property casualty networks. It is an exciting time to join us — across our operations, we are thinking in new and innovative ways to deliver ever\-better solutions to our customers. At AIG, you can go further to support individuals, businesses, and communities, helping them to manage risk, respond to times of uncertainty and discover new potential. We invest in our largest asset, our people, through continuous learning and development, in a culture that celebrates everyone for who they are and what they want to become. **Welcome to a culture of inclusion** We’re committed to creating a culture that truly respects and celebrates each other’s talents, backgrounds, cultures, opinions and goals. We foster a culture of inclusion and belonging through learning, cultural awareness activities and Employee Resource Groups (ERGs). With global chapters, ERGs are a cornerstone for our culture of inclusion. The talent of our people is one of AIG’s greatest assets, and we are honored that our drive for positive change has been recognized by numerous recent awards and accreditations. *AIG provides equal opportunity to all qualified individuals regardless of race, color, religion, age, gender, gender expression, national origin, veteran status, disability or any other legally protected categories.* AIG is committed to working with and providing reasonable accommodations to job applicants and employees with disabilities. If you believe you need a reasonable accommodation, please send an email to candidatecare@aig.com. **Functional Area** IT \- Information Technology American International Group UK Limited, Ireland Branch \& AIG Europe S.A. (Ireland Branch)",https://www.linkedin.com/jobs/view/4326672964
QC Analyst,SGS,"Wicklow, County Wicklow, Ireland",linkedin,"**Company Description** SGS are the world’s leading testing, inspection and certification company SGS Group. We deliver solutions to a wide range of industry sectors in Ireland. Enjoy a truly rewarding career in a global, multicultural organisation with a proud heritage that has been making the world a better, safer place for over 140 years. Our client services include providing SGS QC analysts and technical support staff on\-site to fulfill staffing requirements (Scientific In\-sourcing), all under the supervision and guidance of ISL technical and operational teams. Like all SGS personnel, they are committed to upholding stringent technical and GMP standards, ensuring the safety of medications for the multitude of patients relying on the products we test. Due to growth, we have an exciting opportunity for an experienced QC Analyst to join our growing Scientific In\-sourcing team. **Job Description** Testing of pharmaceutical substances e.g. raw materials and drug substances in a GMP environment in accordance with clients' procedures and quality systems. Main focus will be **GC and HPLC analysis** , along with a range of other analytical techniques as required. **Key Accountabilities** * Receive training from SGS and client and get qualified in relevant analytical techniques. Maintain own training 100% current. Train other analysts where appropriately qualified * Carry out testing in accordance to the valid testing procedures and regulatory requirements * Ensure that laboratory equipment is well maintained, and calibrations are carried out at the designated frequencies * Manage inventory and status of materials required for analysis * When qualified to do so, verify and review results generated by other analysts for compliance with requirements * Ensure correct data entry to LIMS * Assessment of testing results generated in the laboratory and close out of batch analysis * Ensure that all target dates are met. Update visibility tools and communicate status of testing at meetings * Maintain laboratories to a high housekeeping standard * Ensure high standard of lab records, with work completed Right First Time and on time * Write and maintain necessary documentation (SOPs, methods, reports etc) * Work as part of the team ensuring customer expectations are met and exceeded. Support achievement of client and SGS Key Performance Indicators, such as around investigations, training, productivity and on\-time testing * Notify appropriate contact and document results and investigations for any atypical or aberrant results * Lead Laboratory investigations and deviations if required * Maintenance of a safe working environment, in a state of audit readiness * Identification and implementation of safety, environmental, quality and service improvements * Work with their leader to ensure self\-development and progression **Qualifications** * Education and training: Science Graduate in Chemistry or equivalent science education (Level 7\) * Necessary job experience: At least 2 years' experience in a GMP laboratory. GMP experience is a minimum requirement for this position. * Professional requirements: Demonstrated Experience with current Good Manufacturing Practices, Data Integrity and sound knowledge of analytical technologies (HPLC, GC, KF, IR, PSD, Xray, Wet chemistry) * Good organizational skills and strong communication – written and verbal * Team player, flexible to evolving needs with a strong customer service mentality * Excellent quality and safety standards * Aptitude in lab computer systems, including LIMS and Trackwise **Additional Information** **Expected Behaviors:** * Integrity, flexibility, working under own initiative * Strong analytical ability and associated problem solving * Results and performance driven * Good time management \& attention to detail * Professionalism; with the client, contractors and colleagues at all times * Compliance with SGS and client policies and procedures To apply please submit your CV. **Candidates must be immediately eligible to work in Ireland, this is a site based role.** *We are an equal opportunity employer and value diversity at our company.*",https://www.linkedin.com/jobs/view/4411988628
Quality Analyst Operation-CapCut,ByteDance,"Dublin, County Dublin, Ireland",linkedin,"**Responsibilities** About the team The CapCut and Jianying\-Security and Compliance department is responsible for the safety and privacy of all global products, including but not limited to privacy security, youth safety, end\-to\-end security and ecology of AIGC, content safety, risk control security, departmental compliance processes, crisis response, regional legal compliance, information security, social responsibility, and more. The team closely collaborates with various central departments of the company to ensure the smooth development of products. The team primarily consists of Product and Operations who are based across Beijing, Shenzhen, and San Jose. The work environment offers high flexibility and abundant opportunities for growth. Whether in Product or Operations, we hope you possess proficient working skills internationally, strong self\-motivation, learning ability, and long\-term optimism and resilience. \- Perform analysis of errors in platform/moderation quality and feedback to the respective team \- Participate in the development of quality inspection standards and continuously optimize the process and system platform \- Responsible for policy cascading, clarification, and calibration sessions to ensure an accurate understanding of the policy and operations readiness in accordance with responsible product quality delivery \- Provide high\-level and detailed reports/RCA on the Market/Site Quality Level report \- Coordinate and work closely with Process Delivery, Policy Enforcement, Content Ops to ensure safety of product (if applicable), and other relevant stakeholders to support quality operations\-related tasks **Qualifications** Minimum Qualification(s) \- Bachelor's degree or above. \- Excellent Portuguese language proficiency and comprehension skills are required, as all product stakeholders and demand partners communicate in Portuguese. \- Strong data analysis capabilities and at least 2 years of QA experiences. \- Good understanding of Generative AI, online safety, privacy, content and market trends, this includes in\-depth understanding of general market lifestyle contents, culture and familiarity with the internet usage habits of their users. **About CapCut** CapCut is an all\-in\-one video editing app that empowers creators to express themselves and transform videos into creative masterpieces. In addition to its basic features, such as video editing, text, stickers, filters, colors and music, CapCut offers free advanced features, including keyframe animation, smooth slow\-motion effects, chroma key, Picture\-in\-Picture (PIP), and stabilization to help you capture and snip moments.​ **Why Join ByteDance** Inspiring creativity is at the core of ByteDance's mission. Our innovative products are built to help people authentically express themselves, discover and connect – and our global, diverse teams make that possible. Together, we create value for our communities, inspire creativity and enrich life \- a mission we work towards every day.​ As ByteDancers, we strive to do great things with great people. We lead with curiosity, humility, and a desire to make impact in a rapidly growing tech company. By constantly iterating and fostering an ""Always Day 1"" mindset, we achieve meaningful breakthroughs for ourselves, our Company, and our users. When we create and grow together, the possibilities are limitless. Join us.​ Diversity \& Inclusion​ ByteDance is committed to creating an inclusive space where employees are valued for their skills, experiences, and unique perspectives. Our platform connects people from across the globe and so does our workplace. At ByteDance, our mission is to inspire creativity and enrich life. To achieve that goal, we are committed to celebrating our diverse voices and to creating an environment that reflects the many communities we reach. We are passionate about this and hope you are too.​",https://www.linkedin.com/jobs/view/4412483862
Real Estate Analyst,Mercor,"Dublin, County Dublin, Ireland",linkedin,"**About The Job** **Mercor** connects elite creative and technical talent with leading AI research labs. Headquartered in San Francisco, our investors include **Benchmark** , **General Catalyst** , **Peter Thiel** , **Adam D'Angelo** , **Larry Summers** , and **Jack Dorsey** . **Position:** Real Estate / Property Professionals **Type:** **Contract** **Compensation:** **$80–$160/hour** **Location:** **Remote** **Role Responsibilities** * Review and assess domain\-specific documents to ensure quality, accuracy, and relevance. * Provide structured feedback to improve document standards and evaluation processes. * Utilize strong analytical skills to contribute to high\-impact evaluation projects. * Collaborate with teams to enhance document assessment methodologies. * Work independently and asynchronously to meet project deadlines. **Qualifications** **Must\-Have** * Bachelor's degree (minimum) * 2\+ years of professional experience in a relevant domain * Strong proficiency in Excel, PowerPoint, and Word * Strong document analysis and review skills * Attention to detail and ability to follow structured guidelines **Preferred** * Based in the United States, Europe, UK, or Canada **Application Process (Takes 20–30 mins to complete)** * Upload resume * AI interview based on your resume * Submit form **Resources \& Support** * For details about the interview process and platform information, please check: https://talent.docs.mercor.com/welcome * For any help or support, reach out to: support@mercor.com *PS: Our team reviews applications daily. Please complete your AI interview and application steps to be considered for this opportunity.*",https://www.linkedin.com/jobs/view/4412417856
