title,company,location,site,description,job_url
Graduate software engineer,Bending Spoons,"Dublin, County Dublin, Ireland",linkedin,"At Bending Spoons, we’re striving to build one of the all\-time great companies. A company that serves a huge number of customers. A company where team members grow to their full potential. A company that functions at unparalleled levels of effectiveness and efficiency. A company that creates value for shareowners at an extraordinary rate. And a company that does so while adhering to high ethical standards. In pursuit of this objective, we acquire and improve digital businesses, not to sell on, but to own and operate for the long term. The transformations we make are often deep—designed to speed up innovation, benefit customers, and strengthen business performance. Here, hierarchy is minimal and teams are small and talent\-dense. We operate established products with the ambition, agility, and urgency of a startup. Across the company, we integrate AI deeply into how we work so that human judgment and machine intelligence reinforce each other. For a talented, driven, and collaborative individual, working at Bending Spoons is an opportunity to learn, make an impact, and progress their career at an exceptionally high rate. That’s our promise to such a candidate. **A few examples of your responsibilities** * **Build software that matters.** Take real ownership from idea to production, creating systems used by millions and evolving them into products at scale. * **Amplify your impact with AI.** Integrate the most powerful AI tools directly into your development workflow—design, implementation, testing, and documentation—to move faster while maintaining high standards for correctness, reliability, and maintainability. * **Master your toolkit.** Work across diverse stacks with end\-to\-end ownership, choosing the right technologies for each challenge. From monoliths to microservices, gRPC to REST, Kubernetes to Docker, Python to Rust—you’ll apply technologies thoughtfully, focusing on depth and purpose rather than trends. * **Simplify relentlessly.** Question every layer of complexity. Improve architectures, pipelines, and codebases to build systems that are simpler, more scalable, and easier to maintain. **What we look for** * **Reasoning ability.** Given the necessary knowledge, you can solve complex problems. You think from first principles, and structure your ideas sharply. You resist the influence of biases. You identify and take care of the details that matter. * **Drive.** You’re extremely ambitious in everything you do—and your initiative, effort, and tenacity match the intensity of your ambition. You feel deeply responsible for your work. You hold yourself to a high—and rising—bar. * **Team spirit.** You give generously and without the expectation of receiving in return. You support the best idea, not your idea. You're always happy to get your hands dirty to help your team. You’re reliable, honest, and transparent. * **Proficiency in English.** You read, write, and speak proficiently in English. **What we offer** * **Incredibly talented, entrepreneurial teams.** You’ll work in small, result\-oriented, autonomous teams alongside some of the brightest people in your field. * **An exceptional opportunity for growth.** We go to great lengths to hire individuals of outstanding potential—then, our priority is to put them in the ideal position to thrive. Spooners in their 20s lead products worth hundreds of millions of dollars. And if you’ve got what it takes, you’ll soon be playing an essential role in major projects, too. * **Competitive pay and access to equity in the company.** Typically, we offer individuals at the start of their career an annual salary of £85,797 in London and €66,065 elsewhere in Europe. For a candidate that we assess as possessing considerable relevant experience, the salary on offer tends to be between £112,189 and £250,512 in London, and €107,837 and €188,848 elsewhere in Europe. Compensation varies by location and expected impact, and grows rapidly as you gain experience and translate it into greater contributions. For individuals who demonstrate exceptional capability, we may offer compensation that extends beyond the usual ranges to reflect their higher expected impact. If you're offered a permanent contract, you'll also be able receive some of your pay in company equity at a discounted price, thus participating in the value creation we achieve together. If relocating to Italy, you may enjoy a 50% tax cut. * **All. These. Benefits.** Flexible hours, remote working, unlimited backing for learning and training, top\-of\-the\-market health insurance, a rich relocation package, generous parental support, and a yearly retreat to a stunning location. We help each Spooner set up the conditions to do their best work. * **A flexible start date and part\-time options.** You don't need to wait until graduation to apply. We offer flexible start dates and the possibility to begin part\-time, transitioning to full\-time as you complete your degree. Many Spooners joined before graduating and progressively took on greater responsibility, with arrangements that allowed them to do so without compromising their education. **Commitment \& contract** Permanent or fixed\-term. Full\-time. **Location** Milan (Italy), London (UK), Madrid (Spain), Warsaw (Poland) or remote in selected countries. **The selection process** In our screening process, we prioritize verifiable signals of excellence, regardless of seniority. Some people hold back because they feel they lack experience or have an “imperfect” CV. If you like the role and believe you could excel over time, don’t self\-reject. If you pass our screening, you’ll be asked to complete one or more tests. They are challenging, may involve unfamiliar problems, and can take several hours. We set the bar high and won’t extend an offer until we’re confident we’ve found the right candidate. This is why a job may remain open for months or be reposted several times. We consider all applicants for employment and provide reasonable accommodations for individuals with disabilities—please let us know through this form. **Before you apply** If you’ve applied before but didn't receive an offer, we recommend waiting at least one year before applying again. Bending Spoons is a demanding environment. We’re extremely ambitious and we hold ourselves—and one another—to a high standard. While this tends to lead to extraordinary learning, achievement, and career growth, it also requires significant commitment. To help you ramp up quickly and set yourself up for success, we recommend spending your first few months working from our Milan office, regardless of your long\-term work location. It’s the best way to rapidly absorb our company culture and build trust with your new teammates. We’ll support you with generous travel and accommodation assistance. After that, you’re welcome to work from our offices in Milan or London, or remotely from approved countries—depending on what we agree at the offer stage. If the role speaks to you and you’re excited to give your best, we’d love to hear from you. Apply now—we can’t wait to meet you.",https://www.linkedin.com/jobs/view/4412367948
IT Systems Support Analyst - Full time,Roadstone Ltd.,"Dublin, County Dublin, Ireland",linkedin,"**Job Description** **Location:** Roadstone, Cookstown Road, Fortunestown ISAC Ltd is currently seeking an experienced and technically capable IT Systems Support Analyst. This is a permanent position which will report to the Business Systems Manager where you will play a key role in the day\-to\-day support of business applications, incident management and hardware services across the organisation. This role will be based at Fortunestown, Tallaght, Dublin 24\. ISAC Ltd is a Shared Services Company within the CRH Group which provides a centralised Finance and Administration Function for fellow CRH Group companies (Roadstone, Northstone etc.) **Benefits** * Competitive Salary * Pension Scheme with up to 10% employer contribution * Share Participation Scheme (Revenue Approved) * Paid Holidays (22 days) * Training \& Development Opportunities. * Employee Assistance Programme * Free parking * Product discount * Bike\-to\-Work Scheme * Paid Maternity/Paternity Leave and other Family Leave available. **About The Role** **Key Areas of Responsibility:** **Application Support** * Provide day\-to\-day support for key business applications used across the organisation * Execute and monitor critical system processes and scheduled activities * Assist with system upgrades, patching lifecycles, and testing including user acceptance testing * Act as a primary liaison between third\-party vendors and business users, translating technical issues into clear, non\-technical language * Develop, maintain, and continuously improve system documentation, procedures, and support materials **Incident Management** * Monitor and manage incident and service request queues in collaboration with IT support teams * Track and manage SLAs using incident management tools, ensuring timely resolution of issues * Build and maintain KPI reports and dashboards to measure performance and identify trends * Support root cause analysis and contribute to continuous service improvement initiatives **Hardware Management** * Provide hands\-on hardware support across all business units * Build, image, configure, and deploy laptops, desktops, and peripheral equipment * Support hardware lifecycle activities including new starter onboarding and hardware refreshes * Assist with asset tracking and hardware documentation **The following knowledge, skills and competencies are required for this role:** **Essential** * Minimum of 3 years’ experience in an IT Analyst, IT Support, or similar role * Experience providing application and end\-user support in a corporate environment * Working knowledge of SQL Developer or similar database tools * Understanding of networking fundamentals, including connectivity troubleshooting * Experience supporting Azure\-based environments including Azure Virtual Desktop and/or Citrix * Strong troubleshooting skills across applications, desktops, printers, and user access * Excellent analytical, organisational, and planning skills * Ability to build strong working relationships with business users, management, vendors, and consultants **Desirable** * Experience supporting ERP / Dispatch systems * Exposure to IT compliance and control frameworks such as SOX * Project delivery experience or project management certification * Experience with Power Automate or workflow automation tools **Personal Attributes** * Analytical and detail\-oriented with a strong sense of ownership * Proactive problem solver with strong follow\-through * Confident communicator with technical and non\-technical stakeholders * Able to manage multiple priorities and work independently * Curious, collaborative, and comfortable learning new systems **Why Join Us?** * Opportunity to work across a broad range of applications, systems, and technologies * Hands\-on role with real ownership and visibility across the business * Collaborative IT environment with structured processes * Scope to develop your technical expertise and progress your IT career in a multinational environment * Hybrid role The successful candidate must be a highly motivated, self\-directed individual with a desire for personal, Company and Group achievement. **Closing date: close of business 20th of May 2026** **Skills Needed** **About The Company** Roadstone’s nationwide business includes the manufacture and distribution of a wide range of construction products including ready\-mix concrete, aggregates, asphalt and macadam, mortar and plaster, concrete blocks and masonry, paving products, roof tiles and agricultural lime. We also provide an asphalt contracting service for commercial, domestic and local authority road projects. Our business leaders include internally developed operational managers, highly qualified professionals and owner\-entrepreneurs who join the organisation as a result of acquisitions. The sustained expansion of CRH as a group, since its foundation in 1970, has created a wide range of career opportunities for ambitious and talented people throughout the world. Our decentralised structure and entrepreneurial environment is particularly suited to attracting, motivating and retaining talented, committed, enthusiastic and well\-qualified people. **Company Culture** Our company is committed to leadership and skills development at all levels of the organisation, encouraging and supporting the continuous professional development of its employees to achieve their potential. Our development philosophy involves leveraging challenging work assignments with targeted coaching and mentoring, augmented by formal training and education. Our Success is built on your Success Roadstone offers exciting and rewarding opportunities for talented, dedicated people. There’s no single type of person who succeeds in Roadstone. We are looking for people who have a passion for excellence and achieving results. You’ll need the ability to challenge and influence others, along with the capacity to adapt to new and different situations. The ability to build strong and effective relationships and to inspire and motivate others. **Required Criteria** **Desired Criteria** **Closing Date** Wednesday 20th May, 2026 **Contract Type** fulltime **Salary** Based on Experience",https://www.linkedin.com/jobs/view/4412630234
Information Technology Support Analyst,Fruition Group Ireland,"Dublin, County Dublin, Ireland",linkedin,"Our Dublin based client are looking for an **Information Technology Support Analyst** to join their team on a permanent basis You will have the opportunity to become part of an established and strong team and work for a company that is a market leader in their field There is an on site presence required for this role and the office is Dublin city centre based **Responsibilities:** * Provide technical support to end\-users and assist in resolving various IT issues in an effective and timely manner. * Learn to identify and resolve IT problems and issues as they arise * Troubleshoot hardware and software issues on site and via cloud services * Assist in the setup, configuration, and maintenance of end\-user devices, laptops and phones * Maintain a highly organised inventory of IT assets and resources (ITAM). * Assist in monitoring and tracking issues to prevent problems occurring a second or third time. * Collaborate with cross\-functional teams to ensure escalations and tickets are registered and dealt with effectively. * Contribute to IT projects, including software deployments and hardware upgrades. * Escalation of technical issues to other team members when necessary and required **Skills and Requirements:** * Minimum of 2\-3 years of experience in a technical support role. * Experience with Active Directory, Azure AD, and managing security groups. * Ability to handle access requests and managing permissions. * Proven capabilities in troubleshooting Office 365 issues and software installations. * Proactive problem\-solving skills. * Have strong verbal and written communication skills. * Demonstrated teamwork skills, attention to detail, and a strong work ethic. * Enthusiasm for technology and a desire to learn and grow in the field. **HOW TO APPLY:** To apply for this role, please submit your updated CV. If your skills and experience match job requirements, you will be contacted to discuss your application in detail. **SIMILAR ROLES OPEN:** As a specialized recruitment agency, we also have several other permanent and contract IT roles available. Visit our website for more information or explore additional opportunities",https://www.linkedin.com/jobs/view/4412660518
"Intern, Software Engineer",Autodesk,"Dublin, County Dublin, Ireland",linkedin,"**Job Requisition ID \#** 25WD92001 **Position Overview** At Autodesk, we’re reimagining what’s possible. As a global leader in 3D design, engineering, and entertainment software, we help people everywhere imagine, design, and create a better world. Right now, we’re transforming how our products work by moving to the cloud—opening up exciting opportunities for collaboration, innovation, and impact. What sets us apart isn’t just our technology, but our culture. At Autodesk, you’ll find an inclusive, supportive environment where early\-career talent can grow, be creative, and make real impact. It’s one of the reasons we’ve been consistently recognized by **Fortune, Forbes, and Glassdoor as a top place to work** . Over three months in our Summer 2026 Internship Programme, you’ll gain hands\-on experience, mentorship, and opportunities to grow your engineering and domain expertise, while making real contributions to Autodesk’s manufacturing and construction technologies. Alongside technical growth, you’ll develop soft skills and build connections with other interns, locally in your office, regionally across EMEA, and globally, through programs designed just for interns. As a Software Engineer Intern on the Developer Enablement team, you’ll contribute directly to building and scaling applications that utilize environmental data, delivered through a unified standardized interface. You’ll receive mentorship, guidance, and support, while also having the autonomy and responsibility to make a real impact. **Responsibilities** * Collaborate with cross\-functional teams to understand the full software development lifecycle * Contribute to real commercial development projects, guided by experienced Autodesk developers * Gain hands\-on experience with TypeScript, AWS, automated testing frameworks, DevOps, and more * Apply Agile and Scrum practices, building your project management skills * Use source control and Continuous Integration platforms such as GitHub and Jenkins * Develop robust APIs to enable sustainability analysis for Autodesk customers * Share your progress and achievements in team meetings, gaining feedback and recognition **Minimum Qualifications** * Currently pursuing a degree in a STEM field (e.g., Computer Science, Engineering) * Expected graduation date: please include your month and year of graduation in your application * Experience with API development (REST and GraphQL), through coursework, personal projects, or previous internships * Programming experience (TypeScript preferred) * Enthusiasm for learning new technologies and a proactive approach to problem\-solving **The Ideal Candidate** * Familiarity with automated testing principles to help write reliable, maintainable code * Familiarity with AWS or other cloud platforms, giving you a head start in cloud\-based development * Additional experience with other programming languages or frameworks is a plus * Strong communication skills and ability to work in a team environment * Previous internship experience in a related field is advantageous Learn More **About Autodesk** Welcome to Autodesk! Amazing things are created every day with our software – from the greenest buildings and cleanest cars to the smartest factories and biggest hit movies. We help innovators turn their ideas into reality, transforming not only how things are made, but what can be made. We take great pride in our culture here at Autodesk – it’s at the core of everything we do. Our culture guides the way we work and treat each other, informs how we connect with customers and partners, and defines how we show up in the world. When you’re an Autodesker, you can do meaningful work that helps build a better world designed and made for all. Ready to shape the world and your future? Join us! **Salary transparency** Salary is one part of Autodesk’s competitive compensation package. Offers are based on the candidate’s experience, educational level, and geographic location. **Diversity \& Belonging** We take pride in cultivating a culture of belonging where everyone can thrive. Learn more here: https://www.autodesk.com/company/diversity\-and\-belonging",https://www.linkedin.com/jobs/view/4366877163
Junior Accounts Payable Specialist - Dublin - 145169,Jones Engineering,"Dublin, County Dublin, Ireland",linkedin,"**Company Description** **Jones Engineering** are a leading engineering services company with a proven track record of high quality, customer focused project delivery for over 130 years. Our core divisions include Mechanical Engineering, Electrical Engineering, Sprinkler and Fire Protection. Some of the other services we provide include Specialist Lift, Off Site Fabrication, Technical Support Services, Maintenance, Asset Management, BIM (Building Information Modelling) and Geo\-Surveying. We offer competitive salaries, financial support for further training, performance incentives and the ability to progress your career with a world class engineering contractor. **Job Description** **Jones Engineering** are looking to hire an AP Specialist to join our team. This is a full\-time role based onsite at our headquarters in Pembroke Road, Dublin 4\. The ideal candidate will have a good understanding of the Accounts Payable process within a high\-volume, multinational environment. They will join the AP finance team and work within a team and report to the Finance Manager **In this role, You will;** * Process invoices/credit notes and expenses using SAP system * Dealing with vendor queries in a timely manner * Completion of vendor reconciliations * Process monthly employee expenses * Preparation of payment proposals for weekly payment run * Process changes to vendor account set up * Work with purchasing and commercial team to resolve invoice issues * Ensure general ledger postings are coded correctly * Ad\-hoc projects as required **For this role you will need;** * Candidates must have a minimum 2 years’ experience in Accounts Payable * Third level qualification or equivalent * Experience in a multinational environment with high invoice volumes * Excellent communication skills both verbal and written * Good team player with a strong willingness to participate and help others * Strong Excel skills and overall computer skills required **Benefits** We offer a competitive salary package commensurate with experience and qualifications. In addition, you will have the opportunity to work in a dynamic and supportive environment, collaborating with industry leaders and contributing to a sustainable future. Our company values work\-life balance and encourages professional growth through training and development programs. If you are ready to make a difference and be part of a growing industry, please submit your CV, along with a cover letter highlighting your relevant experience and why you are interested in this role. Recognising the contributions and respecting our people is core to our culture and values. We are an equal opportunities employer, and we encourage candidates from all backgrounds to apply for roles.",https://www.linkedin.com/jobs/view/4382199692
