title,company,location,site,description,job_url
"Critical Infrastructure Mechanical Engineer, Field Engineering",Amazon Web Services (AWS),"Dublin, County Dublin, Ireland",linkedin,"**Description** AWS Infrastructure Services owns the design, planning, delivery, and operation of all AWS global infrastructure. In other words, we’re the people who keep the cloud running. We support all AWS data centers and all of the servers, storage, networking, power, and cooling equipment that ensure our customers have continual access to the innovation they rely on. We work on the most challenging problems, with thousands of variables impacting the supply chain — and we’re looking for talented people who want to help. You’ll join a diverse team of software, hardware, and network engineers, supply chain specialists, security experts, operations managers, and other vital roles. You’ll collaborate with people across AWS to help us deliver the highest standards for safety and security while providing seemingly infinite capacity at the lowest possible cost for our customers. And you’ll experience an inclusive culture that welcomes bold ideas and empowers you to own them to completion. As An Amazon Field Engineer, You Will Provide Full Life\-cycle Support To AWS Data Centers From Design Inception Through Site Improvement And Maintenance. You Will Be The ‘go To’ Engineering Resource For Your Region When Technical Advice Is Needed, And Will Use Your Subject Matter Expertise And Engage With Diverse Teams To * Perform design and equipment submittal review for new Data Centers in your region. * Troubleshoot, conduct Root Cause Analysis (RCA) and create Corrective Action (CA) documentation for site/equipment failures. * Directly support operational issues with ad\-hoc training, complex operating procedure reviews, including critical equipment, and event support. * Own the conceptual design for existing data center upgrades and design\-solutions, which add capacity, improve availability, increase efficiency and sustainability. * Interface with internal data center operations team, data center design engineering team, server hardware team, environmental health and safety team to promote standards that maintain consistency and reliability in services delivered. * Develop innovative solutions for AWS’s data centers. * Work on concurrent projects, sometimes in multiple geographical regions. * Initiate and lead engineering audits including on\-site visits within Amazon’s data centers. Produce reports outlining risks with recommended mitigations and remediations. * Act as resident engineer during new construction projects. Support construction, commissioning, and turnover. Key job responsibilities **Role** Amazon's vision is to be the world's most customer\-centric company, and this role is key to that vision. As a Field Engineer, you will be leading projects to fit out our data centers to meet ever\-evolving customer needs as we continue expanding our fleet to hyper\-scale. As an ideal candidate you: * Possess Strong Engineering Judgement and are able to provide recommendations despite uncertainty/ambiguity. * Are detail and data oriented. * Have experience solving problems with engineered solutions. * Have experience managing engineering projects and consultants. * Build trust and relationships with different stakeholders (e.g., Operations, Controls, Construction, Design, Commissioning, Product Managers, Technical Program Managers, ). * Are adaptable and inclined to get into the field to see things up close. * Excited about a mix of office and field work. A day in the life Each day you will interact with different teams responsible for all aspects of the data centers. You will prioritize your activities to support data center capacity availability and safety focusing on the actions that are most impactful. You will have the opportunity to work on projects locally and globally. If you meet these qualifications, exude passion, and enjoy the challenge of innovative projects at hyper\-scale, this job is for you! **About The Team** Why AWS : Amazon Web Services (AWS) is the world’s most comprehensive and broadly adopted cloud platform. We pioneered cloud computing and never stopped innovating — that’s why customers from the most successful startups to Global 500 companies trust our robust suite of products and services to power their businesses. **Diverse Experiences** Amazon values diverse experiences. Even if you do not meet all of the preferred qualifications and skills listed in the job description, we encourage candidates to apply. If your career is just starting, hasn’t followed a traditional path, or includes alternative experiences, don’t let it stop you from applying. **Work/Life Balance** We value work\-life harmony. Achieving success at work should never come at the expense of sacrifices at home, which is why we strive for flexibility as part of our working culture. When we feel supported in the workplace and at home, there’s nothing we can’t achieve in the cloud. **Inclusive Team Culture** Here at AWS, it’s in our nature to learn and be curious. Our employee\-led affinity groups foster a culture of inclusion that empower us to be proud of our differences. Ongoing events and learning experiences, including our Conversations on Race and Ethnicity (CORE) and AmazeCon (gender diversity) conferences, inspire us to never stop embracing our uniqueness. **Mentorship And Career Growth** We’re continuously raising our performance bar as we strive to become Earth’s Best Employer. That’s why you’ll find endless knowledge\-sharing, mentorship and other career\-advancing resources here to help you develop into a better\-rounded professional. **Basic Qualifications** * Knowledge of Microsoft Office including Outlook, Word, and Excel * Experience in industrial or commercial engineering in mission critical facilities including but not limited to: data centers, power generation or oil and gas facilities * Experience researching new designs, technologies, and construction methods of data center equipment and facilities * Bachelor's degree in Mechanical or Electrical Engineering or a related field **Preferred Qualifications** * Professional Engineer License * Experience with building codes and regulations for your region * Experience carrying design concepts through exploration, development, and into deployment or mass production * Experience reading, interpreting, and creating construction drawings, specifications, and submittal documents Amazon is an equal opportunities employer. We believe passionately that employing a diverse workforce is central to our success. We make recruiting decisions based on your experience and skills. We value your passion to discover, invent, simplify and build. Protecting your privacy and the security of your data is a longstanding top priority for Amazon. Please consult our Privacy Notice (https://www.amazon.jobs/en/privacy\_page) to know more about how we collect, use and transfer the personal data of our candidates. Amazon is an equal opportunity employer and does not discriminate on the basis of protected veteran status, disability, or other legally protected status. Our inclusive culture empowers Amazonians to deliver the best results for our customers. If you have a disability and need a workplace accommodation or adjustment during the application and hiring process, including support for the interview or onboarding process, please visit https://amazon.jobs/content/en/how\-we\-hire/accommodations for more information. If the country/region you’re applying in isn’t listed, please contact your Recruiting Partner. **Company** \- Amazon Development Centre Ireland Limited Job ID: A10403007",https://www.linkedin.com/jobs/view/4406803409
Customer Account Specalist,Analog Devices,"Dublin, County Dublin, Ireland",linkedin,"**About Analog Devices** Analog Devices, Inc. (NASDAQ: ADI ) is a global semiconductor leader that bridges the physical and digital worlds to enable breakthroughs at the Intelligent Edge. ADI combines analog, digital, and software technologies into solutions that help drive advancements in digitized factories, mobility, and digital healthcare, combat climate change, and reliably connect humans and the world. With revenue of more than $9 billion in FY24 and approximately 24,000 people globally, ADI ensures today's innovators stay Ahead of What's Possible™. Learn more at www.analog.com and on LinkedIn and Twitter (X). **Job Description Summary** At Analog Devices, Inc. we know it’s our great people who make us a great company, and our Customer Operations team is no exception. We are a group of positive, hard\-working, customer\-centric employees who represent our company in a positive light when working on the front line with our customers. Want to join a fun team with smart people who make a difference every day? If so, you’ve found the right organization! This entry level role (Customer Account Specialist) partners with the Sales Team adding value to the FSE mission and enhancing the customer experience. The CSS will drive ADI’s go\-to\-market strategy focused on enabling customer success on ADI’s most strategic accounts. The CAS will proactively manage all aspects of assigned customer's demand stream with ADI. This includes sales support, customer interface, pricing and contracts, sales forecasting, supply and demand optimization, and project management. The CAS will also work with Planning, Manufacturing, Business Units, and the Global Supply Partners to communicate requirements and expectations for assigned accounts. This role is fast paced, exciting, and challenging. The perfect candidate will be professional, agile, and able to make an impact out of the gate. Additional role specifics: The CAS continually monitors revenue, backlog, forecasts, and performance to plan. This person understands customer programs that drive revenue and ensures all backend systems are aligned to support anticipated demand. The CAS collaborates closely with Global Ops, Planning, and the Sales Team on a day\-to\-day basis and is a point of escalation for both the internal and external customers. The CAS should function as an advisor to the team adding input to help resolve problems and/or achieve goals. The CAS works pro\-actively to be in front of situations and notify appropriate teams ahead of issues as well as providing solutions to problems. The CAS should have excellent presentation skills being able to lead customer meetings via phone, virtually, and in person. The CAS manages all pricing needs of the customers providing quotations, managing pricing contracts, and coordinating worldwide. This includes being a focal point for contract negotiations coordinating with the contract center, providing input, and participating in negotiations. The CAS will also manage Forecasting Revenue, Unit Forecasting (CFIT), Split / DAR Management, MSD/PRT\+, Sampling, Demand Monitoring (QlikView / Drop off reports, etc.) You’ll also have the opportunity to collaborate with internal partners to support ADI’s customer base. Internal partners include: * Sales \- track new design opportunities and project ramps * Business Units \- review end customer product life cycles to understand business environments * Demand Planning – share and consult on customer forecast data * Quality Assurance \- coordinate product changes and applications support * Social \& Environmental Management Teams \- align customer requirements with ADI policies * Supply Chain Management \- analyze and understand supply position at each stage of production * Legal \- review and negotiate customer supply agreements **Minimum Qualifications:** * Service\-oriented individual with a four\-year Bachelor's degree * Highly organized and detail\-oriented with outstanding follow\-through skills * Must have outstanding written and oral communication skills and presentation skills * Ability to work collaboratively as well as independently * Ability to perform with poise under tight deadlines and shifting priorities, as well as ability to understand independently what those priorities should be * Excellent MS Office skills, especially Excel * Self\-motivated and disciplined, with a strong sense of ownership and the ability to execute tasks with minimal supervision * Excellent time management capability * Strong problem\-solving and critical thinking capability * Quick learner and willing to take on challenges * Potential travel (10%) IND1 *For positions requiring access to technical data, Analog Devices, Inc. may have to obtain export licensing approval from the U.S. Department of Commerce \- Bureau of Industry and Security and/or the U.S. Department of State \- Directorate of Defense Trade Controls. As such, applicants for this position – except US Citizens, US Permanent Residents, and protected individuals as defined by 8 U.S.C. 1324b(a)(3\) – may have to go through an export licensing review process.* *Analog Devices is an equal opportunity employer. We foster a culture where everyone has an opportunity to succeed regardless of their race, color, religion, age, ancestry, national origin, social or ethnic origin, sex, sexual orientation, gender, gender identity, gender expression, marital status, pregnancy, parental status, disability, medical condition, genetic information, military or veteran status, union membership, and political affiliation, or any other legally protected group.* Job Req Type: Experienced Required Travel: Yes, 10% of the time Shift Type: 1st Shift/Days",https://www.linkedin.com/jobs/view/4328808387
Customer Learning Consultant,Gong,"Dublin, County Dublin, Ireland",linkedin,"Gong harnesses the power of AI to transform how revenue teams win. The Gong Revenue AI Operating System unifies data, insights, and workflows into a single, trusted system that observes, guides, and acts alongside the world’s most successful revenue teams. Powered by the Gong Revenue Graph, AI\-powered intelligence, specialized agents, and trusted applications, Gong helps more than 5,000 companies around the world deeply understand their teams and customers, automate critical sales workflows, and close more deals with less effort. For more information, visit www.gong.io. At Gong, you will join a company built on innovative products, ambitious goals, and passionate people. We are shaping the future of revenue intelligence and we want people who are excited to build what comes next. You will work with a team that dreams big, moves fast, and cares deeply about the craft and about each other. Here, transparency and trust are core to how we operate, and every person has the opportunity to make a visible impact. If you want to grow, stretch, and do work that truly matters, Gong is the place to do the best work of your career. Based in our Dublin office, this hybrid position requires 3 days per week in office. As a Customer Learning Consultant, you will serve as the primary strategic partner and subject matter expert on learning methodologies for our largest global Enterprise accounts. You will architect and execute comprehensive learning strategies that span the entire customer lifecycle, bridging the gap between high\-stakes initial rollouts and long\-term continuous education for multi\-year partners. Acting as the central pillar of the delivery team, you will translate custom SOWs into robust training plans, navigating complex stakeholder relationships, customizing strategies for diverse cultural needs, and ensuring every engagement drives deep adoption and creates lifelong \#RavingFans of Gong. **Responsibilities** * You will effectively translate Gong’s curriculum into interactive, multi\-tier live training programs tailored to the specific business goals of our Enterprise customers. * You will act as the ""boots on the ground"" for the Instructional Design team, leveraging insights from live sessions to identify gaps in education materials and proactively working to address them. * You must be able to explain the behind the learning strategy to senior stakeholders, positioning yourself as the main point of contact for their learning success. * You will design and lead high\-impact sessions across all formats from virtual to in\-person trainings. * This role supports our global footprint. You must be willing to travel periodically (estimated up to 40%\+) to deliver onsite trainings (including US, EMEA, and APAC regions). * You have the resilience to manage time\-zone complexities and the skill to adapt your teaching style to diverse cultural audiences. * You will serve as the voice of the customer back to the business, collaborating with cross functional teams to ensure our training aligns with the latest features and market needs. * You will work lock\-step with Professional Services, Customer Success, and Support to ensure a seamless customer experience from the SOW signature to post\-training implementation to ongoing training post implementation. * You need to be articulate, dynamic, and capable of commanding a room. You bring the energy required to turn skeptical users into passionate adopters. * Conduct regular, high\-quality communications (verbal and written) with all project stakeholders, from core teams to VP/Director\-level sponsors. **Qualifications** * + 3\+ Years High\-Impact SaaS Experience. You have a track record of delivering consultative training within the SaaS space. Experience is not just about delivery; it’s about driving adoption and strategy for complex organizations. + Proven ability to manage a portfolio of multiple large Enterprise accounts concurrently. You can juggle varying implementation timelines and custom SOWs without compromising the customer experience. + You possess deep domain knowledge (Sales/Revenue Intelligence) and use it to drive customer success, quickly establishing yourself as a trusted advisor to our clients. + You are energetic, compelling, and possess the executive presence required to engage audiences ranging from end\-users to C\-Suite leadership. You aren’t just ""not afraid"" to present; you thrive on the stage. + You are skilled at navigating resistance and influencing senior stakeholders to adopt new behaviors and methodologies. + You have a growth mindset. You crave feedback both internally from your team and in real\-time from your audience and use it to constantly refine your craft. + You understand the reality of global business and can manage your energy across time zones. You are willing and able to travel up to 50% including to NAMER, EMEA, APJ/APAC. + You thrive in a fast\-moving, changing environment where priorities shift. You can pivot quickly while keeping a positive attitude. + Languages: English required. Additional languages are a plus. **Perks \& Benefits** * We offer Gongsters a variety of private health insurance plans, designed to fit you and your family’s needs. * Pension Contribution * Wellbeing Fund \- flexible wellness stipend to support a healthy lifestyle. * Mental Health benefits with covered therapy and coaching. * Education \& learning stipend for personal growth and development. * Flexible vacation time to promote a healthy work\-life blend. * Paid parental leave to support you and your family. * Company\-wide recharge days each quarter. **About Us** Gong empowers everyone in revenue teams to improve productivity, increase predictability, and drive revenue growth by deeply understanding customers and business trends; driving impactful decisions and actions. The Gong Revenue AI Platform captures and contextualizes customer interactions, surfaces insights and predictions, and powers actions and workflows that are essential for business success. More than 4,500 companies around the world rely on Gong to unlock their revenue potential. For more information, visit www.gong.io. **We have noticed a rise in recruiting impersonations across the industry, where scammers attempt to access candidates' personal and financial information through fake interviews and offers. All Gong recruiting email communications will always come from the @gong.io domain. Any outreach claiming to be from Gong via other sources should be ignored.**",https://www.linkedin.com/jobs/view/4395359520
Customer Support Technician,Applied Materials,"Leixlip, County Kildare, Ireland",linkedin,"**Who We Are** Applied Materials is a global leader in materials engineering solutions used to produce virtually every new chip and advanced display in the world. We design, build and service cutting\-edge equipment that helps our customers manufacture display and semiconductor chips – the brains of devices we use every day. As the foundation of the global electronics industry, Applied enables the exciting technologies that literally connect our world – like AI and IoT. If you want to push the boundaries of materials science and engineering to create next generation technology, join us to deliver material innovation that changes the world. **What We Offer** Location: Leixlip,IRL You’ll benefit from a supportive work culture that encourages you to learn, develop, and grow your career as you take on challenges and drive innovative solutions for our customers. We empower our team to push the boundaries of what is possible—while learning every day in a supportive leading global company. Visit our Careers website to learn more. At Applied Materials, we care about the health and wellbeing of our employees. We’re committed to providing programs and support that encourage personal and professional growth and care for you at work, at home, or wherever you may go. Learn more about our benefits. **What You’ll Do** As a Customer Support Technician, you'll work hands\-on in a cleanroom environment to build and test our multimillion\-dollar display and wafer fabrication equipment that’s behind the technology we use every day— like the VR headset you use for gaming, the smart watch that tracks your heart rate, and advancing generations of your smart phone. As key member of a team of highly skilled engineers, technicians, and problem\-solvers, you’ll receive strong collaborative support and contribute your new ideas to help us continuously improve our processes and business. **This role is based at our customer site in Leixlip, Co. Kildare and operates on a rotating day‑and‑night shift pattern. Full training will be provided.** **Role Responsibilities:** * Assist in planning the daily work schedule within assigned territory to ensure completion of Installation, Preventive Maintenance and/or remedial maintenance. * Use escalation policies to keep management informed of down situations. * Verify and approve the operational quality of system equipment. Perform quality checks daily, weekly, monthly, quarterly, biannual, and annual periodic maintenance on systems within established time frames. Also perform wet cleans if/as required. * Instruct customers and trades personnel in the installation, operation and maintenance of systems. Troubleshoot and correct process variations on systems partially with assistance from senior engineers. * Assume responsibility for complete customer satisfaction. Assist in planning, communicating, and co\-ordinating support plans with customer management. * Perform start\-up, warranty, paid service, and service contract activities. Perform TIER 0,I \& II start\-ups within established time frames. * Use training and experience to identify some process related system problems. * Develop and implement plans to increase productivity. Tracks equipment performance, install cycle times and plan uptime improvement * Plan and execute support activities on a wide range of Applied Materials' systems. **Minimum Qualifications:** * An associate degree and field experience or technical certification * 1–2 years of related work experience in customer/field support * A willingness to learn how to read and interpret electrical and mechanical schematics * Clear and effective written/verbal communications skills, with an emphasis on documenting details * Proficiency in the Microsoft Office suite (Excel, Word, and PowerPoint) * Basic mechanical aptitude and knowledge in any of the following: pneumatics, hydraulics, electronics, vacuum, or thermodynamics * Knowledge of hand tools and proper usage, including a digital multimeter **Physical Requirements:** This is a physically demanding position that often requires standing for extended periods of time, walking, working in tight spaces, bending, squatting, twisting, kneeling, reaching, climbing stairs and ladders, lifting, the ability to distinguish between colors, the ability to work in an environment with noise that may be difficult for some individuals with sensitivity to noise, the use of hand and power tools, and driving or operating heavy machinery including forklifts. Additionally, because this position may involve working in a clean room, the use of appropriate Personal Protective Equipment such as coveralls, hoods, booties, safety glasses, gloves, respirators, chemical aprons, and face shields may be required. **Additional Information** **Time Type:** Full time **Employee Type:** Assignee / Regular **Travel:** Yes, 10% of the Time **Relocation Eligible:** No Applied Materials is an Equal Opportunity Employer. Qualified applicants will receive consideration for employment without regard to race, color, national origin, citizenship, ancestry, religion, creed, sex, sexual orientation, gender identity, age, disability, veteran or military status, or any other basis prohibited by law.",https://www.linkedin.com/jobs/view/4405590647
