title,company,location,site,description,job_url
Junior HR Business Partner,Marsh,"Dublin, County Dublin, Ireland",linkedin,"**We are seeking a talented individual to join our Human Resource team at Marsh in Ireland.This is a hybrid role that has a requirement of working at least three days a week in the office.** Reporting to the Lead HR Manager, the successful candidate will be responsible for the provision of comprehensive Human Resource services in a successful and growing organization. As a **Junior HR Business Partner,** you will play an important role within the People Function and will support our businesses across Ireland. In this role, you will coach, support and advise People Managers based in Ireland, aiming to develop and enhance the quality of people management throughout the colleague lifecycle; this role can also include project work. You will have the opportunity to advise and support on people matters in a business where the People function is considered an essential partner. The Junior HR Business Partner will also be key to the supporting the deployment and adoption of new processes or initiatives which are aimed at People Managers. Youwill need to understand and reflect the local market perspective whilst respecting the value of enterprise\-wide alignment where appropriate. **We will count on you to:** * Support the deployment of enterprise\-wide HR programs and initiatives. * Provide guidance and support to Managers across the full range of activities in the HR portfolio, including and not limited to performance management, skills and competence development and learning, succession planning, absent/leave management, change management, organizational effectiveness, colleague engagement, compensation, and total rewards including the year\-end process. * Assist in employee relations matters such as performance improvement processes, disciplinary actions, grievances, and appeals, working closely with more experienced colleagues and the Employee Relations CoE for guidance on complex cases. * Supporting the rollout and delivery of HR programs and contributing to process improvements. * Cultivate strong relationships with functional teams (Finance, Total Rewards, Talent Acquisition and Benefits) and support the alignment between the people and business strategies. * Support People Managers and colleagues during organizational changes by assisting with coordination of activities and consultations, working alongside senior HR colleagues to ensure smooth transitions. * Consult and partner with the wider HR network and CoEs to determine best practices, continuously improve delivery methods, and especially consider country\-specific nuances to guide local implementation. * Work with the HR Team and Centres of Expertise to understand and support compliance with regulatory and statutory requirements, contributing to reporting and related activities as part of your development. **What you will need to have:** * 2\+ years of relevant work experience in HR alongside a requirement for relevant qualifications. * Able to operate without supervision for straightforward matters and able to judge when guidance is required for more complex situations and seek support from appropriate colleagues/experts * Contribute to the successful implementation of HR projects and initiatives by supporting project activities and collaborating with stakeholders, gaining experience in aligning HR efforts with business objectives. * Experience in supporting managers with employee relations cases, with a knowledge of relevant Irish legislation. * Able to support People Managers in specific groups within the country on all aspects of the employee life cycle in all typical situations. * Able to identify opportunities to make improvements to the service provided by People Services, and demonstrates a willingness and aptitude to embrace changes that will deliver a better service to People Managers * Effective communications and change management skills. * Attention to detail with high personal work standards. * Ability to work in a fast\-paced environment, with shifting priorities and a complex matrix organization. **What makes you stand out?** * Bachelors’ degree * CIPD qualified or HR related certifications * Previous experience in the financial services sector, or experience in a regulated company * Familiarity with HR system, like Workday or similar systems, * Demonstrated passion for regular self\-investment to maintain up\-to\-date professional knowledge and competence and enthusiasm for learning new skills like Artificial intelligence **Why join our team:** * We’re looking for someone with a great attitude and a collaborative spirit, eager to join an exciting, dynamic team that thrives on flexibility and adaptability to support a wide range of stakeholders and priorities—an excellent opportunity for someone passionate about learning and growing their HR career. * To be part of a company with a strong brand, committed to making a difference in people's lives. * We help you be your best through professional development opportunities, interesting work and supportive leaders. * We foster a vibrant and inclusive culture where you can work with talented colleagues to create new solutions and have impact for colleagues, clients and communities. * Our scale enables us to provide a range of career opportunities, as well as benefits and rewards to enhance your well\-being. * Marsh is a Certified 'Great Place to Work', June 2025 \- June 2026, Best Workplaces and Best Workplaces for Women. Marsh (NYSE: MRSH) is a global leader in risk, reinsurance and capital, people and investments, and management consulting, advising clients in 130 countries. With annual revenue of over $27 billion and more than 95,000 colleagues, Marsh helps build the confidence to thrive through the power of perspective. For more information, visit corporate.marsh.com, or follow us on LinkedIn and X. Marsh is committed to embracing a diverse, inclusive and flexible work environment. We aim to attract and retain the best people and embrace diversity of age, background, disability, ethnic origin, family duties, gender orientation or expression, marital status, nationality, parental status, personal or social status, political affiliation, race, religion and beliefs, sex/gender, sexual orientation or expression, skin color, Traveller community, or any other characteristic protected by applicable law. We are an equal opportunities employer. We are committed to providing reasonable support to any candidate with a disability/health condition to allow them to fully participate in the recruitment process. We welcome candidates to contact us at reasonableaccommodations@mmc.com to discuss any specific needs. Marsh is committed to hybrid work, which includes the flexibility of working remotely and the collaboration, connections and professional development benefits of working together in the office. All Marsh colleagues are expected to be in their local office or working onsite with clients at least three days per week. Office\-based teams will identify at least one “anchor day” per week on which their full team will be together in person. **R\_350581**",https://www.linkedin.com/jobs/view/4413411456
Junior HR Business Partner,Mercer,"Dublin, D, IE",indeed,"**Company:** ------------ Mercer **Description:** ---------------- **We are seeking a talented individual to join our Human Resource team at Marsh in Ireland.This is a hybrid role that has a requirement of working at least three days a week in the office.** Reporting to the Lead HR Manager, the successful candidate will be responsible for the provision of comprehensive Human Resource services in a successful and growing organization. As a **Junior HR Business Partner,** you will play an important role within the People Function and will support our businesses across Ireland. In this role, you will coach, support and advise People Managers based in Ireland, aiming to develop and enhance the quality of people management throughout the colleague lifecycle; this role can also include project work. You will have the opportunity to advise and support on people matters in a business where the People function is considered an essential partner. The Junior HR Business Partner will also be key to the supporting the deployment and adoption of new processes or initiatives which are aimed at People Managers. Youwill need to understand and reflect the local market perspective whilst respecting the value of enterprise\-wide alignment where appropriate. **We will count on you to:** * Support the deployment of enterprise\-wide HR programs and initiatives. * Provide guidance and support to Managers across the full range of activities in the HR portfolio, including and not limited to performance management, skills and competence development and learning, succession planning, absent/leave management, change management, organizational effectiveness, colleague engagement, compensation, and total rewards including the year\-end process. * Assist in employee relations matters such as performance improvement processes, disciplinary actions, grievances, and appeals, working closely with more experienced colleagues and the Employee Relations CoE for guidance on complex cases. * Supporting the rollout and delivery of HR programs and contributing to process improvements. * Cultivate strong relationships with functional teams (Finance, Total Rewards, Talent Acquisition and Benefits) and support the alignment between the people and business strategies. * Support People Managers and colleagues during organizational changes by assisting with coordination of activities and consultations, working alongside senior HR colleagues to ensure smooth transitions. * Consult and partner with the wider HR network and CoEs to determine best practices, continuously improve delivery methods, and especially consider country\-specific nuances to guide local implementation. * Work with the HR Team and Centres of Expertise to understand and support compliance with regulatory and statutory requirements, contributing to reporting and related activities as part of your development. **What you will need to have:** * 2\+ years of relevant work experience in HR alongside a requirement for relevant qualifications. * Able to operate without supervision for straightforward matters and able to judge when guidance is required for more complex situations and seek support from appropriate colleagues/experts * Contribute to the successful implementation of HR projects and initiatives by supporting project activities and collaborating with stakeholders, gaining experience in aligning HR efforts with business objectives. * Experience in supporting managers with employee relations cases, with a knowledge of relevant Irish legislation. * Able to support People Managers in specific groups within the country on all aspects of the employee life cycle in all typical situations. * Able to identify opportunities to make improvements to the service provided by People Services, and demonstrates a willingness and aptitude to embrace changes that will deliver a better service to People Managers * Effective communications and change management skills. * Attention to detail with high personal work standards. * Ability to work in a fast\-paced environment, with shifting priorities and a complex matrix organization. **What makes you stand out?** * Bachelors’ degree * CIPD qualified or HR related certifications * Previous experience in the financial services sector, or experience in a regulated company * Familiarity with HR system, like Workday or similar systems, * Demonstrated passion for regular self\-investment to maintain up\-to\-date professional knowledge and competence and enthusiasm for learning new skills like Artificial intelligence **Why join our team:** * We’re looking for someone with a great attitude and a collaborative spirit, eager to join an exciting, dynamic team that thrives on flexibility and adaptability to support a wide range of stakeholders and priorities—an excellent opportunity for someone passionate about learning and growing their HR career. * To be part of a company with a strong brand, committed to making a difference in people's lives. * We help you be your best through professional development opportunities, interesting work and supportive leaders. * We foster a vibrant and inclusive culture where you can work with talented colleagues to create new solutions and have impact for colleagues, clients and communities. * Our scale enables us to provide a range of career opportunities, as well as benefits and rewards to enhance your well\-being. * Marsh is a Certified 'Great Place to Work', June 2025 \- June 2026, Best Workplaces and Best Workplaces for Women. Marsh (NYSE: MRSH) is a global leader in risk, reinsurance and capital, people and investments, and management consulting, advising clients in 130 countries. With annual revenue of over $27 billion and more than 95,000 colleagues, Marsh helps build the confidence to thrive through the power of perspective. For more information, visit corporate.marsh.com, or follow us on LinkedIn and X. ### **Marsh is committed to embracing a diverse, inclusive and flexible work environment. We aim to attract and retain the best people and embrace diversity of age, background, disability, ethnic origin, family duties, gender orientation or expression, marital status, nationality, parental status, personal or social status, political affiliation, race, religion and beliefs, sex/gender, sexual orientation or expression, skin color, Traveller community, or any other characteristic protected by applicable law. We are an equal opportunities employer. We are committed to providing reasonable support to any candidate with a disability/health condition to allow them to fully participate in the recruitment process. We welcome candidates to contact us at reasonableaccommodations@mmc.com to discuss any specific needs.** ### **Marsh is committed to hybrid work, which includes the flexibility of working remotely and the collaboration, connections and professional development benefits of working together in the office. All Marsh colleagues are expected to be in their local office or working onsite with clients at least three days per week. Office\-based teams will identify at least one “anchor day” per week on which their full team will be together in person.**",https://ie.indeed.com/viewjob?jk=6f407a25015d497f
Junior Lighting Design,ROBUS Lighting,"Dublin, County Dublin, Ireland",linkedin,"**About the Company** The LED Group, an Irish owned company, has a global presence and a reputation worldwide for first\-class customer service and products. LED Group currently employs over 200 people worldwide. LED Group has ISO9001:2008 Quality Assurance Accreditation and insists upon uncompromising attention to detail and care throughout all processes and practices within the Group. The ROBUS range of products integrates new technologies with an emphasis on high\-performance LEDs, focusing on energy savings and functionality. LED Group’s core values are that of accountability – we always do what we say we will do, ambition, empowerment, customer focus and fast pace. As a result of increased customer demand for lighting designs coupled with strong sales growth, an opportunity has arisen for an in\-house Lighting Designer role within the Lighting Design Department at LED Group in the Dublin office. The right candidate will perform a pivotal role in supporting the Sales Team to win projects by providing top\-class lighting designs and quick turnaround times. This is a junior role, full training and support will be given to the successful applicant. The ideal candidate would be enthusiastic, focused, and energetic with a huge appetite to learn. This role is based in our head office. **Role Overview** Lighting Design Engineer supporting sales and project delivery by creating CAD\-based lighting designs, managing multiple projects, and providing technical and tendering support using tools like Relux or Dialux. **Responsibilities** * Working with the Sales Team primarily, and other key stakeholders in the delivery of lighting design projects. * Review and interpret CAD files to create lighting designs that meet specification requirements. * Deliver lighting designs as requested by the Sales Team within agreed timelines. * Project Management, take ownership of lighting design projects allocated. * Support the Sales team in the tendering process. * Carry out a comparative analysis of ROBUS vs Competitor products through lighting designs and reports. * Assist in technical support functions as business needs demand. **Required Skills** * Basic level of Lighting design experience using Relux or Dialux. * Level 8 Technical Graduate in Engineering or Design. * Experience in working with CAD. * A self\-starter with excellent communication and interpersonal skills. * Ability to work well in a team environment as well as being able to work individually. * Results focused, the ability to handle large volumes of data and to run multiple projects concurrently. * Persistent and diligent with a focus on attention to detail. * Assertive and dynamic with a willingness to learn and take on responsibility. **Preferred Skills** * Relevant experience in the lighting industry. * Completion of College modules linked to Lighting Design. * Understanding of building services. * Knowledge of BIM is preferred. * Proven track record of office and industrial lighting design. * Experience in working with CAD files to create suitable lighting designs. * Good working knowledge of lighting\-related standards, schemes, and calculations. **Benefits** * 22 days holidays * Subsidised canteen on site. * Pension scheme available (after 6 months). * Company laptop. * Bike to Work Scheme. * Social Activities. * Personal ADR training.",https://www.linkedin.com/jobs/view/4413470512
Junior Procurement Engineer,HR Duo,"Leixlip, KE, IE",indeed,"**Company Information and Introduction:** Weltec Engineering is a well\-established provider of Mechanical and Electrical engineering services, delivering complex, high\-quality solutions across Europe. We support major clients in the Semiconductor, Pharma/Biopharma, and Advanced Manufacturing sectors and are committed to the highest standards of safety, quality, and engineering excellence. Due to continued growth, we are seeking an experienced and detail\-driven Junior Procurement Engineer to join our project team in Leixlip. The Junior Procurement Engineer will support the procurement function within an M\&E contracting environment, assisting in sourcing materials, managing supplier relationships, and ensuring timely and cost\-effective delivery of mechanical and electrical components for projects. The role will suit a motivated engineering graduate looking to develop a career in procurement within the construction sector. **Key Responsibilities and Duties:** * Assist in sourcing and procuring mechanical and electrical materials, equipment, and services. * Support preparation of enquiries, requests for quotations (RFQs), and tender documentation. * Evaluate supplier quotations and assist in commercial and technical comparisons. * Liaise with project teams (engineering, design, and site teams) to understand procurement requirements. * Track orders and ensure timely delivery in line with project schedules. * Maintain accurate procurement records and documentation. * Support supplier negotiations under the guidance of senior team members. * Monitor supplier performance and resolve delivery or quality issues. * Assist in identifying cost\-saving opportunities and alternative suppliers. * Ensure compliance with company procurement procedures and health \& safety requirements. **Key Skills and Competencies:*** Relevant Level 7 degree in Engineering (e.g., Mechanical, Electrical, Building Services, or similar) * Strong organisational and time management skills * Good communication and interpersonal skills * Attention to detail and accuracy * Ability to work as part of a team in a fast\-paced environment * Proficiency in Microsoft Office (Excel, Word, Outlook) * Eagerness to learn and develop within procurement and construction At Weltec Engineering, we believe in recognizing and rewarding the contributions of our team members with a competitive salary that reflects industry standards and individual achievements. We are an equal opportunity employer and encourage candidates from diverse backgrounds to apply.",https://ie.indeed.com/viewjob?jk=4a4af405ab67b379
Junior Recruitment Consultant,SSA Recruitment Ireland,"Dublin, County Dublin, Ireland",linkedin,"We at SSA Group are seeking a Junior Recruitment Consultant to become part of an established team within our Dublin Office. **About Us:** SSA Group is an international recruitment business with more than 20 years in operation, partnering with leading construction and engineering companies worldwide. With offices across Ireland, the UK, North America, the Middle East, and Australia, we are a well\-established brand offering genuine opportunities to grow your career in a global environment. **The Opportunity:** We are looking to add a Junior Recruitment Consultant to our Dublin office. This is a chance to join an experienced, supportive team where you will work with an existing client base while also developing new relationships. From day one, you’ll be given a warm desk, exposure to a busy market, and ongoing support from senior management to help you build expertise and achieve success. Key responsibilities include: * Managing the full recruitment cycle, matching skilled professionals with opportunities that suit them. * Maintaining and growing relationships with clients and candidates. * Building knowledge in your market and using it to expand your desk. * Collaborating with colleagues to support the wider business. **What’s in it for you:** We offer a competitive salary, a **market\-leading commission scheme with no thresholds** , and a wide range of benefits including: * 25 days annual leave plus your birthday off * Twice\-yearly performance bonus * Flexible working options and early Friday finishes * Laptop, iPhone, and other perks depending on experience Most importantly, you’ll benefit from a culture that rewards effort, encourages career progression, and provides clear pathways to advance within the business. **What we’re looking for** * A degree in Construction, Business, HR, Marketing, or a related area. * Excellent communication skills and a professional manner. * Drive, organisation, and resilience to handle a busy workload. * A positive attitude and a strong desire to succeed in recruitment. * No prior recruitment experience is necessary – just the ambition to build a career in the sector. **For further information on this role, please contact Sean Duggan at SSA Group, or apply now.**",https://www.linkedin.com/jobs/view/4413737221
