title,company,location,site,description,job_url
Scrum Master,Fruition Group Ireland,"Dublin, County Dublin, Ireland",linkedin,"We are currently seeking an experienced Scrum Master to join our client's team, supporting a large\-scale Microsoft Dynamics 365 implementation. This is an exciting opportunity to contribute to a significant digital transformation programme, enabling Agile delivery and supporting teams to consistently deliver business value. As Scrum Master, you will act as a facilitator, coach, and servant leader, ensuring Scrum principles are effectively embedded across the team while fostering a culture of collaboration, continuous improvement, and delivery excellence. **Key Responsibilities** * Facilitate Scrum ceremonies, including Daily Stand\-ups, Sprint Planning, Sprint Reviews, and Retrospectives. * Coach and mentor team members on Agile principles and Scrum best practices. * Support the development of high\-performing, self\-organising, cross\-functional teams. * Identify and remove impediments to delivery while managing risks and dependencies. * Partner closely with the Product Owner to support backlog refinement, prioritisation, and sprint readiness. * Collaborate with delivery, technical, and business stakeholders to ensure alignment and effective communication. * Promote transparency through Agile metrics, reporting, and continuous improvement initiatives. * Assess and support the ongoing development of Scrum maturity across the team. **About You** The successful candidate will have: * Proven experience working as a Scrum Master within Agile delivery environments. * Strong knowledge of the Scrum framework, Agile principles, and sprint delivery practices. * Excellent facilitation, coaching, and stakeholder management skills. * Experience removing delivery impediments and enabling teams to consistently achieve sprint goals. * Strong communication and relationship\-building skills, with the ability to work effectively across cross\-functional teams. * A collaborative, proactive approach and a commitment to continuous improvement. **Desirable Experience** * Certified Scrum Master (CSM), Professional Scrum Master (PSM), or equivalent certification. * Experience using Azure DevOps and/or Jira. * Experience supporting Microsoft Dynamics 365 implementations. * Experience working across multiple Agile teams or within large\-scale transformation programmes. **How to Apply** If you are an experienced Scrum Master looking for your next opportunity to support a high\-profile digital transformation programme, please apply with your latest CV.",https://www.linkedin.com/jobs/view/4432954468
"Security Engineer, Detection and Response",Notion @ RMIT,"Dublin, County Dublin, Ireland",linkedin,"Who We Are Notion is the collaborative AI workspace where teams and agents think together. We're building one place where your knowledge, projects, meetings, and AI tools live side by side, so work is faster, clearer, and less fragmented. Millions of individuals, small teams, and large companies run their work on Notion. Notinos (our employees) are customer zero in bringing this future of work to life. We care about craft, building things that last, and the belief that great work is still fundamentally human. Our goal isn’t to ship the next feature. Each and every team of Notinos is working to set the standard for how humans work together in the AI era. From building a business’s system of record to making and managing AI agents to automating away the busy work, we care deeply about giving our customers more time for their life’s work. **About The Role** Millions of people rely on Notion to do their most important work, and protecting that trust is foundational to everything we build. We’re looking for a hands\-on Detection Engineer to build and operate the systems and workflows we use to detect and respond to attacks across Notion’s cloud\-native environment. You’ll ship high\-signal detections, improve the platform that powers them, participate in incident response, and help shape how detection and response engineering scales at Notion. You’ll work closely with Engineering, Corporate Security, and Infrastructure, with broad latitude to identify gaps, prioritize investments, and build what’s needed next. We view detection and response as a software engineering discipline: detections are code, platforms are products, and measurement matters What You'll Achieve * Design and maintain high\-signal detections across cloud, identity, endpoints, and SaaS environments. * Build and improve the detection platform, including rule lifecycle management, tuning, measurement, and rollout safety. * Develop tooling and automation that accelerate triage, enrichment, investigation, and detection authoring, including LLM\-based workflows where useful. * Translate threat intelligence and adversary TTPs into durable detections, telemetry requirements, and response improvements. * Participate in investigations, incident response, and postmortems that drive long\-term security improvements. * Define and track key metrics such as coverage, MTTD, and alert quality to guide investment decisions. * Participate in a shared on\-call rotation for incident response. Skills You'll Need to Bring * Have 6\+ years of experience in detection engineering, security operations, incident response, or threat hunting. * Have built and operated production detections with strong signal quality and sustainable tuning processes. * Are fluent in one or more detection languages such as Sigma, KQL, SPL, YARA\-L, EQL, or Panther. * Have an offensive security mindset and have led purple team, blue team, or adversary emulation exercises that improved detections and telemetry. * Have strong cloud security experience in AWS, GCP, or Azure, including identity\-focused attack detection. * Are hands\-on with SIEM, EDR, and SOAR platforms in large\-scale environments. * Communicate clearly through design docs, runbooks, and incident reports, and can drive projects independently. Nice to Have * Experience applying LLMs or agent\-style tooling to security workflows. * Experience securing AI\-enabled systems or endpoint tooling. * Kubernetes or container detection experience. * Background in threat intelligence, malware analysis, or digital forensics. * Contributions to the detection engineering community through research, tooling, or talks. * Experience at a high\-growth startup or AI company. Notion is committed to providing highly competitive cash compensation, equity, and benefits. The compensation offered for this role will be based on multiple factors such as location, the role's scope and complexity, and the candidate's experience and expertise, and may vary from the range provided below. The estimated base salary range for this role is €127,000–€142,000 per year. By clicking “Submit Application”, I understand and agree that Notion and its affiliates and subsidiaries will collect and process my information in accordance with Notion’s Global Recruiting Privacy Policy. A Note on AI You don’t need deep AI expertise for every role, but we do expect every Notino to be intellectually curious, drawn to tinkering and discovery, and excited to use AI as a real collaborator in their work. For some roles, AI fluency is a core requirement — when that’s the case, we'll say so explicitly in the qualifications. People who thrive here don’t treat AI as a novelty. They use it to think better, and make their work easier for others to build on. Equal Opportunity \& Accommodations We hire talented people from a wide range of backgrounds. If you’re excited about this role but don’t meet every bullet, we still encourage you to apply. Notion is an equal opportunity employer and does not discriminate on the basis of any legally protected characteristic. Consistent with applicable law, we will consider for employment qualified applicants with arrest and conviction records. Notion provides reasonable accommodations during the application process; if you need one, please let your recruiter know. Notion is proud to be an equal opportunity employer. We do not discriminate in hiring or any employment decision based on race, color, religion, national origin, age, sex (including pregnancy, childbirth, or related medical conditions), marital status, ancestry, physical or mental disability, genetic information, veteran status, gender identity or expression, sexual orientation, or other applicable legally protected characteristic. Notion considers qualified applicants with criminal histories, consistent with applicable federal, state and local law. Notion is also committed to providing reasonable accommodations for qualified individuals with disabilities and disabled veterans in our job application procedures. If you need assistance or an accommodation due to a disability, please let your recruiter know.",https://www.linkedin.com/jobs/view/4432977450
Site Reliability Engineer (BizOps)– 12-Month Contract,Vantage,"Dublin, County Dublin, Ireland",linkedin,"**Site Reliability Engineer (BizOps)– 12\-Month Contract, South Dublin** Don’t miss out on this great opportunity. Apply today for an immediate start!!! **What’s involved** * :Work on Automation \& Monitorin * gCollaborate with product and development teams to build resilient system * sLead incident response \& root cause analysi * sDrive **DevOps and automation practice** s, including CI/CD pipeline management and tooling improvements * .Shape operational design, capacity planning, monitoring strategies, and mor **e What you nee** * d:5\+ years’ experience as an SRE/ BizOps Engine * erStrong networking backgrou * ndAutomation experience: Ansible, Jenkins XLR et * c.Excellent monitoring skills: Splunk, Dynatra * ceCI/CD pipeline deployme * ntProven work experience in an agile environme **nt What’s on off** * er:€600\-€700 per day depending on experie * nceHybrid\- 3 days per week on s * iteHigh chance of contract extension or going perman **ent Apply** * NowIf you would like to discuss this opportunity in person or with one of our IT Resourcers please forward your CV to Vantage Resources or contact Eric S **e** ery on \+35315255046 or eric.seery@vantage.ie for a confidential discussion. Vantage Resources will not forward your details without prior discussion and appro val. Vantage Resources is an equal opportunity employer. All qualified applicants will receive equal consideration for engagement and/or employment. An inclusive and diverse workforce is an essential part of the development of our organisation’s culture which we believe enhances both our working environment and the service we provide to our custo mers.",https://www.linkedin.com/jobs/view/4433811893
Site Reliability Engineer I,Mastercard,,linkedin,"**Our Purpose** *Mastercard powers economies and empowers people in 200\+ countries and territories worldwide. Together with our customers, we’re helping build a sustainable economy where everyone can prosper. We support a wide range of digital payments choices, making transactions secure, simple, smart and accessible. Our technology and innovation, partnerships and networks combine to deliver a unique set of products and services that help people, businesses and governments realize their greatest potential.* **Title And Summary** Site Reliability Engineer I Who is Mastercard? At Mastercard technology, we work to connect and power an inclusive, digital economy that benefits everyone, everywhere, by making transactions safe, simple, smart, and accessible. Using secure data and networks, partnerships, and passion, our innovations and solutions help individuals, financial institutions, governments, and businesses realize their greatest potential. Our decency quotient, or DQ, drives our culture and everything we do inside and outside of our company. We cultivate a culture of inclusion for all employees that respects their individual strengths, views, and experiences. We believe that our differences enable us to be a better team – one that makes better decisions, drives innovation, and delivers better business results. Technology at Mastercard What we create today will define tomorrow. Revolutionary technologies that reshape the digital economy to be more connected and inclusive than ever before. Safer, faster, more sustainable. And we need the best people to do it. Technologists who are energized by the challenges of a truly global network. With the talent and vision to create the critical systems and products that power global commerce and connect people everywhere to the vital goods and services they need every day. Working at Mastercard means being part of a unique culture. Inclusive and diverse, a rich collaboration of ideas and perspectives. A place that celebrates your strengths, values your experiences, and offers you the flexibility to shape a career across disciplines and continents. And the opportunity to work alongside experts and leaders at every level of the business, improving what exists, and inventing what’s next. **About The Role** The Business Operations team is seeking a highly motivated and experienced Site Reliability Engineer I (SRE) to join our team. You will play a critical role in ensuring the reliability, scalability, and performance of our applications, supporting essential services that power Mastercard's global operations. As a thought leader in your field, you will bring technical expertise, a passion for automation, and the ability to mentor. The role of the Business Operations Site Reliability Engineer is to be the production readiness steward for Mastercard products. As Business Operations SRE, we are responsible for ensuring that our platform is stable and healthy. We break down barriers to running our products by fostering developer run ownership and empowering developers to build resilient products. We support our developers during the application build phase in software run principles that include operational design, automation, capacity planning, and monitoring that leads to fault\-tolerant, scalable products. We see the big picture and help create and enforce operations standards while facilitating an agile and learning culture. We support daily operations with a hyper focus on triage, root cause by understanding the business impact of our products and subsequently performing blameless post\-mortems. The goal of every Business Operations team is to engage early in the development lifecycle to be more proactive and upfront in the development process, and to proactively manage production and change activities to maximize customer experience and increase the overall value of supported applications. Business Operations teams also focus on risk management by tying all our activities together with an overarching responsibility for compliance and risk mitigation across all our environments. Ultimately, the role of Business Operations is to align Product and Customer Focused priorities with Operational needs by providing continuous feedback throughout the lifecycle. **As Part Of The Business Operations Team, You Will** * Follow clearly defined guidelines to complete routine tasks within the Site Reliability Engineering area by applying basic/theoretical knowledge and area best practices. * Support day\-to\-day system maintenance tasks and help gather requirements for technical solutions. * Identify automation that can be used and scripting efforts with guidance from senior engineers. * Learn troubleshooting techniques and assist in resolving basic system issues. * Gain familiarity with system applications and infrastructure, maintenance standards, and best practices used within the organization. * Support deployment and monitoring activities, gaining experience in operational aspects of software delivery. * Seek guidance from senior team members to improve technical skills and understanding of project requirements * Troubleshoot and resolve basic to moderate system issues, escalating more complex problems as needed. * Participate in team meetings and knowledge\-sharing sessions to enhance technical understanding. **Role Qualifications** The ideal candidate will understand core concepts, terminology, and principles of the following skills, apply them in routine situations with support, and build confidence through learning and practice. They may require guidance in moderately complex or unfamiliar scenarios. * Observability \- Ability to use scripting and tooling to implement observability solutions, enabling the collection, analysis, and visualization of metrics, logs, and traces to support incident detection, diagnosis, and continuous service improvement. * Programming and Scripting \- Ability to write and maintain code and scripts to automate tasks, build operational tools, and support monitoring, deployment, and incident response using languages such as Python, Go, Bash, or similar. * Systems and Network Administration \- Ability to configure, operate, and troubleshoot Linux/Unix systems and network components, applying knowledge of networking concepts, protocols, security, and system reliability. * Cloud Computing and Infrastructure \- Ability to design, deploy, and manage applications and infrastructure on cloud platforms (e.g., AWS, Azure, GCP), ensuring scalability, security, availability, and operational efficiency. * Reliability and Scalability \- Ability to design and operate systems for high availability, fault tolerance, and disaster recovery, while ensuring systems can scale to meet current and future demand * DevOps Practices \- Ability to apply DevOps principles and practices, including CI/CD pipelines, containerization, and orchestration, to enable faster, more reliable software delivery and operations. * Troubleshooting \- Capability to systematically identify, diagnose, and resolve technical issues across systems, applications, and networks, using analytical methods and tools to restore functionality, minimize disruption, and ensure stable operations. * Capacity Planning and Performance Optimization \- Ability to monitor resource utilization, forecast future capacity needs, and optimize system performance to support growth, scalability, and efficient infrastructure usage. * IT Service Management \- Ability to apply IT service management principles to incident, problem, and change management, ensuring reliable service delivery, effective incident response, and continuous service improvement aligned to business needs. * Proactive Monitoring and Improvement (SRE Applications) \- The ability to use application reliability signals to anticipate issues, identify risks, and drive preventative improvements that enhance application performance and availability. **Corporate Security Responsibility** All activities involving access to Mastercard assets, information, and networks comes with an inherent risk to the organization and, therefore, it is expected that every person working for, or on behalf of, Mastercard is responsible for information security and must: * Abide by Mastercard’s security policies and practices; * Ensure the confidentiality and integrity of the information being accessed; * Report any suspected information security violation or breach, and * Complete all periodic mandatory security trainings in accordance with Mastercard’s guidelines.",https://www.linkedin.com/jobs/view/4430265628
Skip the CV - Send a Video or Cover Letter to Land This Role,Access Healthcare,"Dublin, County Dublin, Ireland",linkedin,"* **Average performers promoted every 6 months. No politics. No seniority.** * **Year 2 average earnings: €75K\+. And that's just the average.** * **100% of our leaders started exactly where you are \- and got there fast.** You're good at what you do. You can hold a conversation, handle pressure, and push through a bad day without falling apart. The problem isn't your ability, it's where you're using it. At **Access** in **Dublin** , we're looking for professionals to join us as **Recruitment Consultants** who build their own pipeline, own their results, and get rewarded for it directly. Every candidate you place, every shift you book puts money in your pocket: uncapped, no clawbacks, no limits. And w **hen your numbers speak, your title changes. Fast!** **What you're building towards:** * **Average Year 1 total earnings: €45K\+** * **Average Year 2 total earnings: €75K\+** * Top performers naturally earn much more * Promotions every 6 months for average performers * A clear path from Consultant to Team Lead to Manager to Director **What we're looking for:** * 1–5 years in any fast\-moving, people\-facing role * Drive, resilience, and the hunger to own your future * EU citizenship or Stamp 4 visa **Send a short video or cover letter telling us why recruitment, and why now.** **cesar.toscano@accesshealthcare.ie** \| \+353 (1\) 572 1161",https://www.linkedin.com/jobs/view/4433084055
Social Care Worker,St. Catherine's Association,"Newcastle, WW, IE",indeed,"**We have exciting opportunities for** **Social Care Workers** **To join our Residential and Respite Services** **POSITION’S AVAILABLE:** Permanent Full\-time (39 hrs/week Monday to Sunday) Relief (Various hours, flexible shifts available) **You are:** A dynamic and energetic team player with a passion for working with children/young people with intellectual disabilities. You are kind, caring, and compassionate. You have excellent team working skills, and thrive in a collaborative environment. You have the ability to work under pressure and handle changing priorities. You are familiar with best practices in Social Care and apply these consistently in your work. **We are:** St. Catherine’s Association is a non\-profit organisation and registered charity funded by the HSE that provides health related supports to children and young adults with moderate to profound intellectual disabilities and autism in the Wicklow area. These services include Respite and Short Break Support Services, Adult Day Services and Residential Services and access to clinical supports through referral to Children’s Disability Network Team. **Job Role:** · Provide a high quality of life and supportive atmosphere for individuals in our care. · Promote involvement and participation in all activities. · Implement programmes designed to assist in learning new skills. · Assist individuals to carry out tasks \& activities and offer support as necessary. · Develop close contacts locally and encourage community integration. · Administer medication and address basic health care and personal needs. · Ensure written records are completed and up to date. · Reports to: Residential/Respite Services Manager **Essential:** · Graduate or studying towards QQI Level 7 BA in Applied Social Studies, Social Care or equivalent. · Coru Registered or currently in the process of obtaining registration. · An interest in working with individuals that have Intellectual Disabilities and Autism · Person\-centred approach. · Excellent communication skills and the ability to work as part of a team. · Flexibility and reliability for shift work (e.g. sleepovers / night duty, weekends, holidays, etc.) · Knowledge of HIQA regulations for persons with disabilities in residential and respite services. · Full driving license and willing to drive company vehicles. **Benefits:** · HSE Consolidated Pay Scales · National Federation Voluntary Bodies Pension Scheme · Employee Wellbeing Initiatives · Refer a Friend Scheme · Christmas Savings Club · Excellent training opportunities · Staff Education Loans and Paid Study Leave · Bike to Work Scheme · Enhanced Annual Leave · Paid Maternity and Adoptive Leave \* *eligibility criteria* · Sick Pay Scheme \* *eligibility criteria* **Salary:** As per HSE consolidated pay scale **To Apply:** 5pm Friday 31st July 2026 Job Types: Full\-time, Part\-time, Permanent Pay: €39,695\.00\-€55,595\.00 per year Benefits: * Company pension * Employee assistance program Education: * Bachelor's (required) Licence/Certification: * CORU Registration or in the process of obtaining (required) Work authorisation: * Ireland (required) Work Location: In person",https://ie.indeed.com/viewjob?jk=d5cad1e05583c703
