title,company,location,site,description,job_url
Corporate Finance Associate,Barden | B Corp,"Dublin, County Dublin, Ireland",linkedin,"Barden have been exclusively engaged by a well known Irish company that is significantly growing and set to double in size within the next year. They are now building out their finance team in line with this growth and are creating a transactions sub\-team. The transactions team will focus on creating value and growth within the company. They are now inviting three corporate finance professional to join their team as **Corporate Finance Associate** . This is a unique opportunity at this level sitting on a close knit team, gaining direct exposure to a broad range of activities working closely with the senior leadership team. **ABOUT THE ROLE:** This role provides an excellent opportunity to utilise one’s corporate finance experience within an industry setting and add real value to a leading Irish business. Main duties and responsibilities will include: * Support the execution of acquisitions, disposals, and financing activities. * Assist with the development of financial models, investment analysis, and performance forecasting. * Contribute to due diligence efforts and manage data flow and documentation for live transactions. * Help create high\-impact presentations, internal papers, and investor materials. * Collaborate with internal stakeholders across multiple departments to gather insights and input for transaction work. * Liaise with external partners, including advisors, lenders, and investors, throughout deal lifecycles. * Monitor financial obligations and covenant compliance tied to active financing structures. * Identify areas for process improvement across processes. * Ad hoc projects as required. **ABOUT THE PERSON:** * ACA or CFA Qualified with 0\-3 years PQE; * Previous corporate finance, transactions services, tax, transfer pricing or investment experience a strong advantage; * Strong financial modelling skills is an advantage; * Advanced Excel skills; * Ability to deliver both qualitative and quantitative analysis for decision making at senior management level; * Good commercial acumen and ability to analyse qualitative information; * Good problem solving and analytical skills; * Excellent working knowledge of Excel. ***This is an ideal role for someone looking for the opportunity to advance their career in Corporate Finance and progress within a progressive and significantly growing company.*** *Barden’s Accounting and Tax recruitment practice is where finance professionals go before they start looking for a job. Make sure you get expert advice about your Accounting / Tax career from Barden first – your future is just too important to leave to chance.*",https://www.linkedin.com/jobs/view/4433803488
Creator Support Quality Analyst,TikTok,"Dublin, County Dublin, Ireland",linkedin,"**Responsibilities** About the Team As part of our growing Customer Support team, you will be responsible for ensuring our creators receive professional, efficient, and accurate assistance. Our quality team is responsible for setting the standard of excellence across all support channels. As a Quality Analyst, you will act as the primary safeguard for quality across our support operations. You will evaluate complex interactions, identify areas for operational improvement, and serve as the critical link that transforms raw quality data into actionable feedback for our stakeholders, Training, and Operations teams. This is an exciting opportunity to join a global operation and provide a world\-class support service for our users. \- Quality Auditing \& Analysis: Conduct comprehensive quality \& CSAT assessments across the Customer Support team, encompassing complex policies, processes, and regional laws/regulations. \- Trend Spotting \& Reporting: Track, flag, and analyze trends and patterns within assessments; cascade actionable insights back to relevant operational stakeholders. Monitor quality assurance \& CSAT related metrics, data statistics, and analysis dashboards. \- Policy \& Process Expertise: Maintain up\-to\-date knowledge of key operational guidelines, policy updates, and relevant regulations to ensure evaluations reflect the most recent changes. \- Root Cause \& Case Reviews: Use quantitative and qualitative research methods to create and present in\-depth case reviews. Adapt reporting for various audiences and internal stakeholders to establish a unified message and an understanding of events and root causes. \- Continuous Improvement: Identify and recommend strategic improvements to policies, processes, systems, and products that mitigate risk to TikTok and improve the overall user experience. \- Feedback \& Coaching: Provide constructive, evidence\-based feedback to support team members regarding the quality of work, highlighting any identified risks and/or improvement opportunities. \- Training Enablement: Design, prepare, and deliver training and assessments on policies, processes, and operational guidelines based on quality findings. **Qualifications** Minimum Qualification(s) \- Minimum 2\+ years of experience in Quality Assurance, Customer Support, or a related analytical role within a high\-volume contact center or fast\-paced digital environment. \- Proficient in both written and verbal English communication, with the ability to explain complex policy interpretations clearly and concisely. \- Experience facilitating calibration sessions, quality discussions, or delivering training to internal teams or third\-party vendors (BPOs). \- Previous experience in a high\-growth tech environment, Trust \& Safety, or a policy\-heavy industry. \- Strong data interpretation skills with the ability to read dashboards and prioritize which queues, trends, or themes require deeper audit focus. \- Deep understanding of customer service KPIs such as CSAT, AHT, FCR, SLA, and Quality scores. \- Experience using ticketing systems, CRM tools (e.g., Zendesk, Salesforce), or specialized QA auditing platforms. Preferred Qualification(s) \- Demonstrated ability in problem\-solving, root cause analysis, and utilizing research methods to summarize data. \- Track record of resolving complex operational or customer issues with minimal supervision while driving a culture of continuous improvement. \- Ability to work independently, show initiative, and take ownership of tasks and projects from start to finish. \- Proven ability to learn, interpret, and apply complex operational policies and procedures with high accuracy. \- Experience delivering evidence\-based, constructive feedback and conducting thorough quality assessments. \- High attention to detail with the ability to identify subtle nuances in customer interactions that impact policy compliance. **Trust \& Safety** Content that this role interacts with includes images, video, and text related to every\-day life, but it can also include (but is not limited to) bullying; hate speech; child safety; depictions of harm to self and others, and harm to animals. Hence, it is possible that this role will be exposed to harmful content on a daily basis. ​ ​ TikTok recognises that keeping our platform safe for the TikTok communities is no ordinary job which can be both rewarding and psychologically demanding and emotionally taxing for some. This is why we are sharing the potential hazards, risks and implications in this unique line of work from the start, so our candidates are well informed before joining. ​ ​ We are committed to the wellbeing of all our employees and promise to provide comprehensive and evidence\-based programs, to promote and support physical and mental wellbeing throughout each employee's journey with us. We believe that wellbeing is a relationship and that everyone has a part to play, so we work in collaboration and consultation with our employees and across our functions in order to ensure a truly person\-centred, innovative and integrated approach.​ **About TikTok** TikTok is the leading destination for short\-form mobile video. At TikTok, our mission is to inspire creativity and bring joy. TikTok's global headquarters are in Los Angeles and Singapore, and we also have offices in New York City, London, Dublin, Paris, Berlin, Dubai, Jakarta, Seoul, and Tokyo.​ **Why Join Us** Inspiring creativity is at the core of TikTok's mission. Our innovative product is built to help people authentically express themselves, discover and connect – and our global, diverse teams make that possible. Together, we create value for our communities, inspire creativity and bring joy \- a mission we work towards every day.​ We strive to do great things with great people. We lead with curiosity, humility, and a desire to make impact in a rapidly growing tech company. Every challenge is an opportunity to learn and innovate as one team. We're resilient and embrace challenges as they come. By constantly iterating and fostering an ""Always Day 1"" mindset, we achieve meaningful breakthroughs for ourselves, our company, and our users. When we create and grow together, the possibilities are limitless. Join us.​ ​ Diversity \& Inclusion​ TikTok is committed to creating an inclusive space where employees are valued for their skills, experiences, and unique perspectives. Our platform connects people from across the globe and so does our workplace. At TikTok, our mission is to inspire creativity and bring joy. To achieve that goal, we are committed to celebrating our diverse voices and to creating an environment that reflects the many communities we reach. We are passionate about this and hope you are too.​",https://www.linkedin.com/jobs/view/4433252053
Customer Assistant,Carrolls Irish Gifts,"Dublin, D, IE",indeed,"Start your journey with us As a **Customer Assistant** you are the core of our business. The face of the company you will uphold the company values in how you interact with customers. By going the extra mile, you will boost customer satisfaction to drive sales. We believe anybody can give excellent customer service and for this reason no experience is required! This is a **fixed term contract** until September 30th, 2026 What's in it for you? Additional annual leave for length of service Service rewards Annual events Employee discount Commission plan Career \& skill development Health \& Safety training Flexible hours",https://ie.indeed.com/viewjob?jk=6c7b034b3d1b892f
Customer Assistant  (20 - 25 Hours) - Pearse street,Tesco Ireland,"Dublin, County Dublin, Ireland",linkedin,"**About the role** We pride ourselves on offering customers the biggest range of products around. And that's not just food, but everything from clothes and kettles to financial services. But did you know we offer the biggest job opportunities too? With stores across the UK and Ireland, and a variety of roles, we are always looking for people who are as passionate about helping customers as we are. Our Every Little Helps approach doesn't just apply to our customers. It's at the very heart of everything we do at work â€“ and it's what makes us different. We believe in treating each other with respect, and everyone having the opportunity to get on. That's what makes Tesco such a great place to work **Should you be successful in your application, your offer will be subject to and conditional upon you providing your bank account details before your agreed start date.** **You will be responsible for** * Always put the customer first and consider them in everything you do. * Get to know your customers and serve them with pride. * Help to ensure products and services are available for customers at all times. * Handle all products with care to maintain quality and ensure they reach the customer in the best condition. * Keep the shop floor and back areas clean and tidy at all times. * Â Using the training you receive, follow department routines and processes. * Follow all company policies and adhere to Health and Safety routines. * Whilst you will have a core role, you may be asked to support your colleagues by helping in other departments. **You will need** * Able to give great, natural customer service by proactively smiling, greeting, acknowledging and helping customers. * Works hard for customers, your team and your department. * You are able to prioritise to ensure anything you do is right for our customers. * Adaptable and resilient to meet the ever changing demands of our business. * You must be able to follow instructions either verbal or written. * You are reliable and a good timekeeper. * You must be smart and tidy at all times. **Whats in it for you?** We offer excellent benefits that help make Tesco a great place to work.Â These include but arenâ€™t limited to: * Competitive Salary * Bonus Scheme\* * Our Virtual GP service provides free and confidential access to an online GP through video GP consultations, and online prescription service for colleagues. The service is also available to families of colleagues who live at the same address for a reduced cost. * 24/7 access to our Employee Assistance Programme (EAP) for you and family members for in the moment emotional support along with free access to a range of wellbeing services supporting you under our new Wellbeing First approach of Body, Mind and Life. * Colleague Clubcard offering 10% discount across stores and online, with 15% discount weekends once a month (Friday to Sunday), and 20% off twice a year. There is also 20% off F\&F clothing, all year long, these various discounts can be extended to a family member with a 2 nd Clubcard available.\* * Life Assurance * Pension Plan\* * Save As You Earn Scheme\* * Paid Family Leave * Bike to Work * Long Service Awards * Commuter Scheme \*Entry requirements and rules of the scheme apply Â **About Us** Our vision at Tesco is to become every customerâ€™s favourite way to shop, whether they are at home or out on the move. Â Our core purpose is â€œServing our customers, communities and planet a little better every dayâ€. Â Serving means more than a transactional relationship with our customers. Â It means acting as a responsible and sustainable business for all stakeholders, for the communities we are part of, and for the planet. Through initiatives like the Tesco Community Fund, our association with Childrenâ€™s Health Foundation, our partnership with FoodCloud and our Stronger Starts programme, we have supported over 21,000 community groups, raised over â‚¬7\.5 million for medical equipment, and provided almost 15 million meals nationwide, to those living in food insecurity. Tesco has operated in the Irish retail market since 1997, and with 170 stores nationwide, we employ over 13,000 people in cities and towns around Ireland, supporting almost 45,000 jobs directly and indirectly. We partner with over 500 Irish suppliers \- of which almost three\-quarters are small and medium enterprises \- which in turn supports almost 13,000 farming families around Ireland. Tesco is the single largest buyer of Irish food and drink in the world, buying â‚¬1\.6 Billion a year; more than any other single country in the European Union, more than even the USA which you perceive as a massive buyer of Irish food. Â We work closely with suppliers across Ireland who are dedicated to making the best products for our customers and this is reflected in the numerous awards our products have won over the years including BlÃ¡s Na hÃ‰ireann, World Steak Challenge and Great Taste Awards. We are proud to have an inclusive culture at Tesco where everyone truly feels able to be themselves. It is embedded in our values: we treat people how they want to be treated. Â At Tesco, we not only celebrate diversity, but recognise the value and opportunity it brings. Â We always want our colleagues to feel they can be themselves at work and we are committed to helping them be at their best. We know life looks a little different for each of us. Thatâ€™s why at Tesco, we always welcome chats about flexible working. Some people are at the start of their careers, some want the freedom to do the things they love. Others are going through life\-changing moments like becoming a carer, nearing retirement, adapting to parenthood, or something else. So, talk to us throughout your application about how we can support. Tesco is committed to celebrating diversity and everyone is welcome at Tesco. We're committed to providing a fully inclusive recruitment process, allowing candidates the opportunity to thrive and inform us of any reasonable adjustments they may require. For further information on the accessibility support we can offer, please click http://roi.tesco\-careers.com/accessibility/ **How can I let Tesco know I need additional support?** Please let us know you need additional support by emailing **tescoireland.recruitment@tesco.ie** This will allow us to understand more about you and how we can best support you through the recruitment process.",https://www.linkedin.com/jobs/view/4433815806
Customer Experience Champion - Dublin Region,PTSB,"Dublin, County Dublin, Ireland",linkedin,"PTSB is one of Ireland's leading retail and SME banks, with an innovative range of products and services powered through an evolving digital landscape, our focus is centred on ensuring we deliver what our customers, colleagues and communities need to be successful. As a Branch Customer Experience Champion, you will work collaboratively with your team and Branch Lead to support the efficient delivery of business objectives and the day to day branch operations in a compliant manner. You will actively develop your skills through participation in our Collaborative Customer Conversations program whilst ensuring you meet the needs of our customers through promotion of our Omni\-Channel approach. You will become familiar with the Banks Customer Segmentation Strategy and take part in \`in branch and localised promotional activities within the territory to identify new business opportunities to increase new customer acquisition whilst maintaining positive relationships with existing customers. **Responsibilities:** * Support in the day to day operation of customer service within the branch. * Provide an excellent level of customer service and advise our customers throughout their product /financial needs journey, further improving the customer experience with both over the phone and face to face interactions. * Take ownership and deal with customer queries in an effective, professional and compliant manner. * Generate and execute sales from lead (where qualified to do so) to fulfilment in accordance with the Omni\-Channel ethos and activity management system. * Assist with sales campaigns including post sales fulfilment, administration and follow up tasks. * Adopt a prompt and customer centred response to leads passed from Open24 to maximise new business opportunities from customer base. **Requirements:** * QFA or APA in Loans and/or Savings \& Investments, with up\-to\-date CPD hours for the relevant CPD years. If no APA held, or only one APA in Loans or S\&I held, the candidate must commit to qualifying within a 2 year period to achieve APA in both Loans and S\&I. * If no APA held, the candidate must meet the minimum entry requirements of holding an Ordinary Leaving Certificate (or equivalent) with a grade D3/O6/H6 at Ordinary or Higher Level in five Leaving Certificate subjects (including English and Maths), and/or 5\+ years post Leaving Certificate experience. * Strong interpersonal and communication skills with a commitment to providing an outstanding customer experience * Have significant level of proven sales, customer service or clerical experience in a regulatory compliant environment (where MCC) * Committed to and enjoys working in a sales environment **This is a Permanent role, based in Dublin (Onsite).** Is this you? Please apply online on our website or via the apply link of this role. Your application will be sent through to our Talent Acquisition team and they will be in touch regarding your application. We reserve the right to draw up a shortlist for interview. The Bank understands the importance of a consistent and relentless focus on championing diversity and inclusion. We aim to attract, recruit, and retain individuals with diverse backgrounds, skills, competencies and abilities to work collaboratively to enhance the service we provide to all of our customers and the communities we serve.",https://www.linkedin.com/jobs/view/4433869228
"Customer Growth Associate, Engage, Google Customer Solutions (English, Danish)",Google,"Dublin, D, IE",indeed,"### **Minimum qualifications:** * Bachelor's degree or equivalent practical experience. * Experience in digital sales, client management, customer service, business development, customer outreach, marketing, consulting, digital advertising, or a related field. * Ability to communicate in English and Danish fluently to support client relationship management in this region. ### **Preferred qualifications:** * Familiarity with Google Ads and online advertising, with Google Digital Workshop certification or equivalent experience. * Ability to own a portfolio in an advertising or media business context in Denmark, and consistently overachieve quotas to drive growth. * Ability to build compelling narratives and utilize storytelling as a client engagement strategy. * Ability to influence stakeholders internally and externally to deliver impact. * Ability to multi\-task and manage multiple projects at a time while paying attention to detail. **About the job** ----------------- Consulting with a wide variety of existing advertising companies of all sizes, you are committed to finding the optimal advertising solution for each client. Your interest in sales and the digital economy and your entrepreneurial drive enables brands to expand their businesses with Google's latest advertising products and solutions. Your understanding of online media combined with your commercial know\-how shape how new and existing businesses grow. Using your effective communication skills, you are the face of Google to a portfolio of clients whose needs you listen to, and help define the strategy for how their products and services can reach thousands or millions of users.Google Customer Solutions (GCS) sales teams are trusted advisors and competitive sellers who maintain a relentless focus on customer success by bringing the best Google has to offer to small\- and medium\-sized businesses (SMBs), which are the backbone of our communities. As a member of our team, you’ll have the opportunity to work with company owners and make a real difference in their businesses by helping them grow. Together, we help shape the future of innovation for customers, partners, and sellers...and we have fun doing it.Individual pay is determined by factors including job\-related skills, experience, and relevant education or training. Ireland: €60000 \- €61500 (EUR) \+ 30% bonus target \+ equity \+ benefits Learn more about benefits at Google.**Responsibilities** -------------------- * Serve as a trusted advisor to clients by building relationships with key decision\-makers and business owners to understand their goals and digital marketing strategies, empowering their business with Google advertising. * Manage large accounts and identify opportunities where Google Ads can impact growth while tracking account growth and product adoption quarterly goals. * Conduct frequent phone consultations to evaluate campaign performance, make account recommendations, and mentor/influence business owners on digital marketing strategy. * Engage in essential activities to drive customer relationship growth (e.g., proactive engagement, campaign performance review, client meetings, pitches, research, internal strategy building/execution, etc.). * Participate in training throughout the program to develop professional and business skills. Google is proud to be an equal opportunity workplace and is an affirmative action employer. We are committed to equal employment opportunity regardless of race, color, ancestry, religion, sex, national origin, sexual orientation, age, citizenship, marital status, disability, gender identity or Veteran status. We also consider qualified applicants regardless of criminal histories, consistent with legal requirements. See also Google's EEO Policy and EEO is the Law. If you have a disability or special need that requires accommodation, please let us know by completing our Accommodations for Applicants form.",https://ie.indeed.com/viewjob?jk=0fd8a0b515b050ef
