title,company,location,site,description,job_url
70240 - Associate,TK Maxx,"Louth, LH, IE",indeed,"TK Maxx At TJX Europe, every day brings new opportunities for growth, exploration, and achievement. You’ll be part of our vibrant team that embraces diversity, fosters collaboration, and prioritises your development. Whether you’re working in our Distribution Centers, Corporate Offices, or Retail Stores—TK Maxx \& Homesense, you’ll find abundant opportunities to learn, thrive, and make an impact. Come join our TJX team—a Fortune 100 company and the world’s leading off\-price retailer. **Job Description:** We’re looking for Retail Associates to join our team in a welcoming environment. Whether you’re starting your career or already have experience, we’re excited to work with you and help you grow. **Why Work With Us?** * Enjoy exclusive discounts at our stores—just for you and your eligible family members. * We value integrity, respect, and teamwork, encouraging a unique and inclusive culture. * Training and development resources that are designed to help you learn, grow, and succeed. * Support for you and your family through our Associate and Family Assistance programs, offering helpful resources and services to enhance your well\-being. **What You’ll Do:** * Create a welcoming atmosphere by greeting customers with a smile, assisting with their needs, and ensuring they have a positive shopping experience. * Take on a variety of tasks, from cashier duties and fitting room assistance to backroom support and keeping the store clean and inviting. * Embrace opportunities to grow by participating in learning and development programs that build your skills and knowledge. * Be a valued part of a supportive and collaborative team, working together to achieve shared goals. **About You:** * Friendly and approachable – creates a warm and inclusive environment, making everyone feel comfortable and appreciated. * A committed teammate – supports colleagues, communicates openly, and is always ready to lend a hand. * Great communicator – explains things clearly, listens actively, and addresses concerns with care. * Flexible and adaptable – stays organized, manages time well, and thrives in a busy, ever\-changing environment. * No experience? No problem! We’ll provide all the training you need. If you’re ready to bring your energy and passion, we’d love to hear from you! Join us and be part of a place where every day is a chance to make a difference. As proud as we are of our past success, it’s our future that excites us most. We strive to provide opportunities for growth, recognition and a competitive salary and benefits package. Share our determination to think bolder and bigger, and be part of our future. We consider all applicants for employment without regard to age, disability, gender, gender reassignment, marriage and civil partnerships, pregnancy and maternity, race, religion or belief and/or sexual orientation.**Address:** Drogheda Retail Park Donore Road Drogheda**Location:** EUR TK Maxx IE Store 319 \- Drogheda",https://ie.indeed.com/viewjob?jk=41b226a9f4d64685
AI Automation Engineer III,Astreya,"Dublin, County Dublin, Ireland",linkedin,"**Job Responsibilities** * Contribute toward AI roadmap for AI\-driven automation aligning with strategic company and client goals. * Collaborate with engineering and data teams to design and architect scalable, robust, and innovative AI solutions (e.g., automated network diagnostics, bot recommendation systems, AI agents NOC operations). * Act as the Solution Owner in an Agile/Scrum environment, managing the product backlog, writing detailed user stories, defining acceptance criteria, and prioritizing features. * Lead the evaluation, fine\-tuning, and integration of open\-source Large Language Models (LLMs) like Llama series \& other LLMs. * Develop and own key components of the automation framework, including PowerShell and Python runbook executors. * Develop and train machine learning models for tasks such as anomaly detection, predictive maintenance, and capacity planning in IT environments. * Work with large datasets of IT operational data, performing data cleaning, feature engineering, and data analysis to improve model accuracy and performance. * Contribute to the development of internal automation tools and frameworks. * Deliver continuous service improvements by proactively identifying opportunities for process enhancements. * Proficiently develop AI/Gen AI point solutions to meet business needs. * Troubleshoot and resolve issues related to automation systems and AI models. * Engage with customers, IT operators, Network Engineers, and internal stakeholders to gather requirements, validate solutions, and ensure product\-market fit. * Serve as the Subject Matter Expert (SME) on AIOps, IT Process Automation (ITPA), and Runbook Automation (RBA), providing technical guidance and insights. * Document automation processes, code, and models clearly and concisely. * Actively contribute to team results and work towards achieving team goals and objectives. * Undertake designated skill/knowledge development within the organization, including training of next\-level team members. **Required Skills \& Competencies** * 4\+ years of experience in IT services, with at least 3 years in: + IT Service Automation – Orchestration, Scripting, \& Process Assessment. + AI Engineering – Developing and deploying AI Agents and cutting\-edge GenAI \& ML solutions to address complex business challenges. * Expertise in integrating various tools and building analytics/insights. * Proficiency in at least two scripting languages such as PowerShell, Python, or Shell Script. * Strong foundational knowledge across core IT domains, with a specific emphasis on Network \& Network Services, including understanding network topologies, protocols, and common operational issues. * Demonstrable experience implementing solutions using state\-of\-the\-art LLMs, with hands\-on experience with both open\-source models (e.g., Llama series) and proprietary models (e.g., GPT\-4\). * Proficiency with a major deep learning framework, preferably PyTorch, for model experimentation and fine\-tuning. * Proficiency in a high\-level programming language (Java, Python) and experience with containerization technologies (Docker, Kubernetes) for deploying AI models. * Solid understanding and practical experience with cloud platforms such as Azure or GCP, including knowledge of their networking services (e.g., VNets, VPCs). * Experience with AI/ML libraries and frameworks. * A strong understanding of ITIL process on one or more service lifecycle or service capability modules. * Knowledge in one or more System administrative activities like monitoring, service requests, incident management, change management, \& maintenance. * Excellent communication skills with an ability to explain concepts and solutions clearly and concisely. * Excellent analytical and problem\-solving skills.",https://www.linkedin.com/jobs/view/4417976175
AI Engineer,Version 1,"Dublin, County Dublin, Ireland",linkedin,"**Company Description** Version 1 has celebrated 30 years in business and continues to be trusted by global brands to deliver technology and transformation solutions that drive customer success. Our deep expertise enables our customers to navigate the rapidly evolving technology landscape. We foster strong partnerships with global technology leaders including Microsoft, AWS, Oracle, Red Hat, OutSystems, Snowflake, ensuring that our customers are provided with the highest quality solutions and services. We’re an award\-winning employer reflecting how our employees are at the very heart of what we do: * UK \& Ireland's premier AWS, Microsoft \& Oracle partner * 3300\+ strong, €350/£300m revenue business * 10\+ years as a Great Place to Work in Ireland \& UK * Best Workplace for Women in the UK \& Ireland by GPTW * Best Workplace for Wellbeing in the UK by GPTW We’re a core values driven company, we hire people who share our values, and we reward those who display and foster them, it’s deeply embedded within our DNA. Invest in us and we’ll invest in you!. **Job Description** * Develop and maintain back\-end AI\-powered applications and services. * Build and integrate LLMs and multi\-agent systems using frameworks like Semantic Kernel, LangChain, or similar. * Design and implement front\-end interfaces for AI applications using modern frameworks (React, Vue.js, Angular). * Integrate front\-end components with AI APIs and backend services using REST and GraphQL. * Collaborate with data engineers, UX designers, product managers, and QA teams to deliver end\-to\-end AI solutions. * Apply MLOps practices for model deployment, monitoring, and lifecycle management. * Build intuitive, accessible, and standards\-compliant UIs for GenAI applications. * Support junior team members through knowledge sharing and mentoring. * Maintain comprehensive documentation on AI models, including strengths, limitations, and data\-driven justifications. * Ensure secure and compliant development of AI systems in line with GDPR, EU AI Act, and Responsible AI guidelines. **Qualifications** * 4\-6 years experience in Applications Development Lifecycle. * Proven experience in backend development for AI applications and orchestration of LLMs/multi\-agent systems. * Proficiency in Python and ML frameworks such as TensorFlow and PyTorch. * Experience with cloud ML services like Azure ML and AWS SageMaker. * Strong front\-end development skills in HTML, CSS, JavaScript, TypeScript, and frameworks like React, Vue.js, or Angular. * Experience with design tools and systems like Figma and Storybook. * Knowledge of API integration, REST, GraphQL, and backend service orchestration. * Demonstrated experience in prompt engineering and experimentation with multiple AI models. * Familiarity with Agile methodologies, Scrum practices, and Application Lifecycle Management in a .NET environment. * Experience in automated testing, including unit, integration, and end\-to\-end testing using modern frameworks. * Understanding of AI security best practices and regulatory compliance (GDPR, EU AI Act). * Strong communication skills in English, both written and verbal (IET or equivalent). **Additional Information** **Why Version 1?** At Version 1, we believe in providing our employees with a comprehensive benefits package that prioritises their wellbeing, professional growth, and financial stability. * Share in our success with our Quarterly Performance\-Related Profit Share Scheme, where employees collectively benefit from a share of our company's profits * Strong Career Progression \& mentorship coaching through our Strength in Balance \& Leadership schemes with a dedicated quarterly Pathways Career Development programme * Flexible/remote working, Version 1 is tremendously understanding of life events and people’s individual circumstances and offer flexibility to help achieve a healthy work life balance * Financial Wellbeing initiatives including; Pension, Private Healthcare Cover, Life Assurance, Financial advice and an Employee Discount scheme * Employee Wellbeing schemes including Gym Discounts, Bike to Work, Fitness classes, Mindfulness Workshops, Employee Assistance Programme and much more. Generous holiday allowance, enhanced maternity/paternity leave, marriage/civil partnership leave and special leave policies * Educational assistance, incentivised certifications, and accreditations, including AWS, Microsoft, Oracle, and Red Hat * Reward schemes including Version 1’s Annual Excellence Awards \& ‘Call\-Out’ platform. * Environment, Social and Community First initiatives allow you to get involved in local fundraising and development opportunities as part of fostering our diversity, inclusion and belonging schemes. And many more exciting benefits… drop us a note to find out more. Version 1 is an equal opportunities employer. We are committed to building a diverse, inclusive and respectful workplace where everyone feels valued and able to thrive. We welcome applications from people of all backgrounds, identities and lived experiences, and we value the different perspectives people bring. We want every candidate to have a positive and accessible recruitment experience. If you need reasonable adjustments at any stage of the process, please contact \[recruiter email address] at Version 1\. We will consider all requests carefully, respectfully and confidentially. Version 1 is an equal opportunities employer. We are committed to building a diverse, inclusive and respectful workplace where everyone feels valued and able to thrive. We welcome applications from people of all backgrounds, identities and lived experiences, and we value the different perspectives people bring including those shaped by disability and neurodiversity. We want every candidate to have a positive and accessible recruitment experience. If you need reasonable adjustments at any stage of the process, please contact your recruiter at Version 1\. We will consider all requests carefully, respectfully and confidentially. Video links: https://www.youtube.com/watch?v\=F\_d3ELTH5zo",https://www.linkedin.com/jobs/view/4412108741
AML Compliance Analyst - 12 Month FTC,Mediolanum International - Ireland,"Dublin, County Dublin, Ireland",linkedin,"At Mediolanum, we are seeking an AML Compliance Analyst to join our AML Compliance Team at a key stage of its development and transformation. The role will support the continued strengthening, optimisation and future\-proofing of the AML/CTF compliance framework across the Irish Mediolanum entities and their cross\-border operations. The successful candidate will play an active role not only in the day\-to\-day AML/CTF compliance activities, but also in the evolution of the AML Compliance function, with a strong focus on: * streamlining processes, * driving efficiency and leveraging data, * automation and AI\-enabled solutions to enhance risk identification, monitoring and reporting. This role will be responsible for advising on and supporting the implementation of AML/CTF regulatory requirements applicable to Mediolanum International Funds Ltd and Mediolanum International Life dac, ensuring ongoing alignment with Irish and EU regulations, industry best practice and Mediolanum Group policies. The role suits a candidate who is comfortable working in a fast‑paced, evolving regulatory environment, demonstrates strong analytical and problem‑solving skills, and has a genuine interest in process improvement, digitalisation and the responsible use of AI within compliance functions. As part of the wider Risk and Compliance function, you will have the opportunity to interact with business units, outsourced service providers and Group functions, and also act as a key interface with the Mediolanum Group AML Function, representing the Irish operations. **Principal Duties of the position, including but not limited to:** * Support the Head of AML/MLRO in the implementation, maintenance and enhancement of the AML/CTF compliance framework and annual compliance plan. * Manage and support AML/CTF requirements across Ireland, Germany, Spain and Luxembourg. * Perform gap analyses comparing Mediolanum Group AML policies against local applicable AML/CTF legislation and regulatory guidance, identifying gaps, proposing remediation actions and supporting implementation tracking. * Perform preliminary assessments of unusual and suspicious transactions, including PEP\-related activity, escalating matters where appropriate. * Maintain AML/CTF registers and contribute to improvements in data quality, consistency and automation. * Monitor and assess regulatory and legislative developments and evaluate their impact on the Irish entities. * Assist in the development and implementation of AML/CTF policies, procedures and controls. * Perform on\-going monitoring and testing of AML/CTF activities outsourced to third\-party service providers. * Conduct AML/CTF due diligence reviews of outsourced service providers. * Assist the MLRO in the preparation of reporting to senior management, Boards and Mediolanum Group committees. * Support regulatory inspections, audits and internal reviews. * Contribute to business change and transformation initiatives, including AML process redesign and system enhancements. * Promote a strong AML/CTF compliance culture across the organisation. **Skills and Competencies:** * Proactive and critical thinker with a solutions\-focused mindset. * Strong organisational skills with proven ability to manage multiple priorities. * Ability to work independently and collaboratively. * Excellent attention to detail and documentation skills. * Strong stakeholder management and communication skills. * Advanced proficiency in Microsoft Office; particularly Excel and PowerPoint. * Curiosity and willingness to contribute to the design or testing of AI\-enabled solutions or AI agents to support AML activities, under appropriate governance. * Strong interest in streamlining AML/CTF processes through standardisation and automation. * Italian and/or German language skills are an advantage. **Qualifications and Experience:** * Third\-level degree in a related field is required; legal or regulatory content desirable. * At least 2 years experience in the financial services sector with relevant AML/CTF compliance experience (Second Line of Defence). * Solid knowledge of the Irish AML/CTF regulatory framework; cross\-border experience is an advantage. * Understanding of AI governance, explainability and regulatory expectations. * Demonstrated interest in the application of Artificial Intelligence, automation and data\-driven tools within AML/CTF compliance including the use of AI to enhance efficiency, consistency and risk identification. * Formal AML/CTF qualification is desirable.",https://www.linkedin.com/jobs/view/4411626659
"Accelerated Growth Consultant, Google Customer Solutions, UKI",Google,"Dublin, County Dublin, Ireland",linkedin,"**Minimum qualifications:** * Bachelor's degree or equivalent practical experience. * 5 years of industry experience in advertising, consultative sales, business development, or IT, or 3 years of experience with an advanced degree. **Preferred qualifications:** * Experience in hunting and acquisition within a start\-up environment. * Experience in planning, delivering and executing marketing campaigns, measurement and creative strategy. * Ability to own a portfolio in an advertising or media sales context, and consistently overachieve quotas to drive growth. * Ability to move fast, be bold, and grow in a dynamic, fast\-changing environment. * Ability to think strategically about complex issues and develop recommendations and action plans, with excellent problem\-solving skills. **About The Job** Businesses of all shapes and sizes rely on Google’s unparalleled advertising solutions to help them grow in today's dynamic marketing environment. You bring a passion for sales, knowledge of online media, and commitment to maximize customer success. You act like an owner, move with velocity through change, finding innovative and strategic ways to consistently deliver extraordinary and incremental outcomes for both Google and your customers. You build trusted relationships with customers, uncovering their business needs and translating them into powerful solutions to achieve their most ambitious goals. You achieve as a team with sellers, shape the future of advertising in the AI\-era, and make a real impact on the millions of companies and billions of users that trust Google with their most important goals. Google Customer Solutions (GCS) sales teams are trusted advisors and competitive sellers who maintain a relentless focus on customer success by bringing the best Google has to offer to small\- and medium\-sized businesses (SMBs), which are the backbone of our communities. As a member of our team, you’ll have the opportunity to work with company owners and make a real difference in their businesses by helping them grow. Together, we help shape the future of innovation for customers, partners, and sellers...and we have fun doing it. **Responsibilities** * Deliver against ambitious quarterly business and product growth goals, while prioritizing and delivering an outstanding experience to Google's advertisers within EMEA. * Build and manage a pipeline through proactive identification of high\-potential business in addition to close partnership with our marketing teams. * Establish relationships via phone calls, e\-mail marketing and face\-to\-face meetings, design effective marketing strategies using expert product knowledge and deliver outstanding customer sales experience to drive long\-term success for our customers. * Consult with C\-level clients to achieve national and international online marketing and business goals through utilizing the full suite of Google’s marketing solutions (e.g., YouTube, Google Search and Display Network platforms). Google is proud to be an equal opportunity workplace and is an affirmative action employer. We are committed to equal employment opportunity regardless of race, color, ancestry, religion, sex, national origin, sexual orientation, age, citizenship, marital status, disability, gender identity or Veteran status. We also consider qualified applicants regardless of criminal histories, consistent with legal requirements. See also Google's EEO Policy and EEO is the Law. If you have a disability or special need that requires accommodation, please let us know by completing our Accommodations for Applicants form .",https://www.linkedin.com/jobs/view/4421793805
