title,company,location,site,description,job_url
IT Systems Support Analyst - Full time,Roadstone Ltd.,"Dublin, County Dublin, Ireland",linkedin,"**Job Description** **Location:** Roadstone, Cookstown Road, Fortunestown ISAC Ltd is currently seeking an experienced and technically capable IT Systems Support Analyst. This is a permanent position which will report to the Business Systems Manager where you will play a key role in the day\-to\-day support of business applications, incident management and hardware services across the organisation. This role will be based at Fortunestown, Tallaght, Dublin 24\. ISAC Ltd is a Shared Services Company within the CRH Group which provides a centralised Finance and Administration Function for fellow CRH Group companies (Roadstone, Northstone etc.) **Benefits** * Competitive Salary * Pension Scheme with up to 10% employer contribution * Share Participation Scheme (Revenue Approved) * Paid Holidays (22 days) * Training \& Development Opportunities. * Employee Assistance Programme * Free parking * Product discount * Bike\-to\-Work Scheme * Paid Maternity/Paternity Leave and other Family Leave available. **About The Role** **Key Areas of Responsibility:** **Application Support** * Provide day\-to\-day support for key business applications used across the organisation * Execute and monitor critical system processes and scheduled activities * Assist with system upgrades, patching lifecycles, and testing including user acceptance testing * Act as a primary liaison between third\-party vendors and business users, translating technical issues into clear, non\-technical language * Develop, maintain, and continuously improve system documentation, procedures, and support materials **Incident Management** * Monitor and manage incident and service request queues in collaboration with IT support teams * Track and manage SLAs using incident management tools, ensuring timely resolution of issues * Build and maintain KPI reports and dashboards to measure performance and identify trends * Support root cause analysis and contribute to continuous service improvement initiatives **Hardware Management** * Provide hands\-on hardware support across all business units * Build, image, configure, and deploy laptops, desktops, and peripheral equipment * Support hardware lifecycle activities including new starter onboarding and hardware refreshes * Assist with asset tracking and hardware documentation **The following knowledge, skills and competencies are required for this role:** **Essential** * Minimum of 3 years’ experience in an IT Analyst, IT Support, or similar role * Experience providing application and end\-user support in a corporate environment * Working knowledge of SQL Developer or similar database tools * Understanding of networking fundamentals, including connectivity troubleshooting * Experience supporting Azure\-based environments including Azure Virtual Desktop and/or Citrix * Strong troubleshooting skills across applications, desktops, printers, and user access * Excellent analytical, organisational, and planning skills * Ability to build strong working relationships with business users, management, vendors, and consultants **Desirable** * Experience supporting ERP / Dispatch systems * Exposure to IT compliance and control frameworks such as SOX * Project delivery experience or project management certification * Experience with Power Automate or workflow automation tools **Personal Attributes** * Analytical and detail\-oriented with a strong sense of ownership * Proactive problem solver with strong follow\-through * Confident communicator with technical and non\-technical stakeholders * Able to manage multiple priorities and work independently * Curious, collaborative, and comfortable learning new systems **Why Join Us?** * Opportunity to work across a broad range of applications, systems, and technologies * Hands\-on role with real ownership and visibility across the business * Collaborative IT environment with structured processes * Scope to develop your technical expertise and progress your IT career in a multinational environment * Hybrid role The successful candidate must be a highly motivated, self\-directed individual with a desire for personal, Company and Group achievement. **Closing date: close of business 20th of May 2026** **Skills Needed** **About The Company** Roadstone’s nationwide business includes the manufacture and distribution of a wide range of construction products including ready\-mix concrete, aggregates, asphalt and macadam, mortar and plaster, concrete blocks and masonry, paving products, roof tiles and agricultural lime. We also provide an asphalt contracting service for commercial, domestic and local authority road projects. Our business leaders include internally developed operational managers, highly qualified professionals and owner\-entrepreneurs who join the organisation as a result of acquisitions. The sustained expansion of CRH as a group, since its foundation in 1970, has created a wide range of career opportunities for ambitious and talented people throughout the world. Our decentralised structure and entrepreneurial environment is particularly suited to attracting, motivating and retaining talented, committed, enthusiastic and well\-qualified people. **Company Culture** Our company is committed to leadership and skills development at all levels of the organisation, encouraging and supporting the continuous professional development of its employees to achieve their potential. Our development philosophy involves leveraging challenging work assignments with targeted coaching and mentoring, augmented by formal training and education. Our Success is built on your Success Roadstone offers exciting and rewarding opportunities for talented, dedicated people. There’s no single type of person who succeeds in Roadstone. We are looking for people who have a passion for excellence and achieving results. You’ll need the ability to challenge and influence others, along with the capacity to adapt to new and different situations. The ability to build strong and effective relationships and to inspire and motivate others. **Required Criteria** **Desired Criteria** **Closing Date** Wednesday 20th May, 2026 **Contract Type** fulltime **Salary** Based on Experience",https://www.linkedin.com/jobs/view/4412300249
Information Technology Technical Support,MPG Recruitment,,linkedin,"**IT Service \& Support Technician** **Fixed Term Contract** **Dublin** **€40\-50K** Are you a tech\-savvy IT professional who thrives on solving problems and delivering great customer experiences? We have an exciting Fixed Term Contract opportunity for an IT Service \& Support Technician to join a busy, dynamic IT team. **The Role** You'll be the go\-to person for diagnosing, troubleshooting and resolving technical issues across desktop, mobile and network environments. You'll take full ownership of issues from first contact through to resolution , working across phone, email and chat with internal customers. **What You'll Do** You'll provide hands\-on support across Windows, Mac and Linux environments, manage tickets through systems such as ServiceNow or ConnectWise, support Google Workspace and mobile devices (iPhone/iPad), and liaise with wider IT teams to identify root causes for recurring issues. Creating and maintaining clear technical documentation will also be part of your day\-to\-day. **What You'll Need** ✅ Minimum 2 years' experience in a similar IT support role ✅ 3rd level degree in Computer Science, IT, Software Engineering or a related field ✅ Hands\-on experience with Windows, Linux and Mac OS environments ✅ Strong knowledge of computer systems, mobile devices and networking ✅ Experience using a ticketing system (ServiceNow, ConnectWise or similar) ✅ Excellent problem\-solving and communication skills, written and verbal ✅ A full clean driver's licence, **this is essential** ✅ Microsoft, Cisco or Linux certification is a bonus **What's on Offer** This role comes with a strong benefits package including private medical insurance, company pension, flexible start and finish times, up to 2 days remote working per week, on\-site gym and canteen, free parking and excellent career progression opportunities. **Interested?** If this sounds like your next move, I'd love to hear from you. Reach out in confidence to: margaret@mpgrecruitment.ie",https://www.linkedin.com/jobs/view/4412447564
Join AECOM's Quantity Surveyor Talent Network,AECOM,"Dublin, County Dublin, Ireland",linkedin,"**Company Description** **Work with Us. Change the World.** At AECOM, we're delivering a better world. Whether improving your commute, keeping the lights on, providing access to clean water, or transforming skylines, our work helps people and communities thrive. We are the world's trusted infrastructure consulting firm, partnering with clients to solve the world’s most complex challenges and build legacies for future generations. There has never been a better time to be at AECOM. With accelerating infrastructure investment worldwide, our services are in great demand. We invite you to bring your bold ideas and big dreams and become part of a global team of over 50,000 planners, designers, engineers, scientists, digital innovators, program and construction managers and other professionals delivering projects that create a positive and tangible impact around the world. We're one global team driven by our common purpose to deliver a better world. Join us. **Job Description** **Start here. Grow here.** **Join Our Growing Quantity Surveying Team at AECOM Ireland** At AECOM, we take pride in our impressive and expansive Quantity Surveying team, delivering excellence across Ireland. As our operations continue to grow, so too does our need for talented, dedicated, and passionate professionals who are ready to make a difference. Whether you're early in your career or a seasoned Quantity Surveyor, we would be delighted to hear from you. If you're looking for an opportunity to work on impactful projects with a collaborative and supportive team, AECOM could be the perfect fit. **Ready to take the next step in your career?** Get in touch — we’d love to hear from you. **Why Join AECOM?** * **Impactful Projects:** Our construction project management team leads some of the largest commercial,healthcare,education,data center and infrastructure projects across Ireland. By joining us, you'll deliver designs that prioritise innovative and sustainable solutions, working on collaborative platforms and harnessing cutting\-edge technology. * **Professional Growth:** At AECOM, we prioritise the professional growth of our team members from day one. We offer fast\-track opportunities for development, making you a key member of a diverse, dynamic, and ever\-expanding team. * **Flexibility:** Given the varied and dynamic nature of our projects, we regularly require different skill sets and levels of experience. We're flexible and often create roles around specific skill sets to best suit our team and projects. * **Sector experience/workload** \- Commercial,healthcare,education,data center and infrastructure sectors * **Locations:** Dublin,Cork,Galway and Belfast **Apply Now – Quantity Surveyors (All Levels)** **Location: Ireland \| AECOM** If you have a background in Quantity Surveying, we’d love to hear from you. Please submit your CV against this role — your application will be considered for current openings as well as upcoming opportunities across our expanding team. **Who We're Looking For** We’re seeking experienced professionals for roles ranging from **Quantity Surveyor** to **Associate Quantity Surveyor** . You’ll ideally bring experience in one or more of the following sectors: * Healthcare * Commercial * Data Centres * Infrastructure * Rai and Metro * Education At AECOM, you’ll be part of a dynamic, supportive, and forward\-thinking team delivering high\-impact projects across Ireland. If you’re ready to take the next step in your career, apply today. **Come grow with us.** At AECOM, you’ll thrive in an inclusive and forward\-thinking environment where your contributions are valued \- and let's not forget the perks! You'll enjoy a range of core and personalised benefits designed to support your future and well\-being, which you can tailor to fit your lifestyle. Take advantage of career development opportunities, technical practice networks, AECOM University, volunteering days and our flexible hybrid working model to create a healthy work\-life balance. **Qualifications** **Ready to push the limits of what’s possible?** **Here’s What We’re Looking For** As a successful candidate, you will have experience working within cost management in one or more of our key sectors. We're looking for individuals who can bring strong technical knowledge, commercial awareness, and a collaborative mindset. **Qualifications \& Experience:** * A degree in Quantity Surveying or a related discipline (or equivalent) * Chartered status with MRICS (or equivalent), or actively working towards accreditation * Demonstrated experience in cost management within sectors such as healthcare, commercial, data centres, infrastructure, or education * Strong communication and stakeholder management skills * Ability to work both independently and as part of a team on high\-profile projects **Additional Information** Interested in the role or curious about life at AECOM? Follow us on LinkedIn, Facebook, Instagram, and YouTube to explore our AECOM voices, employee stories, latest projects, and much more! For further information about the role, reach out to the recruiter on LinkedIn Colum Calnan **About AECOM** AECOM is the world’s trusted infrastructure consulting firm, delivering professional services throughout the project lifecycle – from advisory, planning, design and engineering to program and construction management. On projects spanning transportation, buildings, water, new energy and the environment, our public\- and private\-sector clients trust us to solve their most complex challenges. Our teams are driven by a common purpose to deliver a better world through our unrivaled technical and digital expertise, a culture of equity, diversity and inclusion, and a commitment to environmental, social and governance priorities. AECOM is a Fortune 500 firm and its Professional Services business had revenue of $16\.1 billion in fiscal year 2025\. See how we are delivering sustainable legacies for generations to come at aecom.com and @AECOM. **Freedom to Grow in a World of Opportunity** You will have the flexibility you need to do your best work with hybrid work options. Whether you’re working from an AECOM office, remote location or at a client site, you will be working in a dynamic environment where your integrity, entrepreneurial spirit and pioneering mindset are championed. You will help us foster a safe and respectful workplace, where we invite everyone to bring their whole selves to work using their unique talents, backgrounds and expertise to create transformational outcomes for our clients. AECOM provides a wide array of compensation, benefits and well\-being programs to meet the diverse needs of our employees and their families. We’re the world’s trusted global infrastructure firm, and we’re in this together – your growth and success are ours too. Join us, and you’ll get all the benefits of being a part of a global, publicly traded firm – access to industry\-leading technology and thinking and transformational work with big impact and work flexibility. As an Equal Opportunity Employer, we believe in each person’s potential, and we’ll help you reach yours. We are a Disability Confident Employer and will offer an interview to applicants who have a disability or long\-term condition, who meet the minimum/essential criteria for the role. Please let us know using this email address ReasonableAccommodations@aecom.com if you would like to apply through the Disability Confident Interview Scheme. All your information will be kept confidential according to EEO guidelines. **ReqID:** REF46059N **Business Line:** PCC **Business Group:** DCS **Strategic Business Unit:** Europe \& India **Career Area:** Survey \& Estimation **Work Location Model:** Hybrid",https://www.linkedin.com/jobs/view/4409388918
Junior Python Developer,Citi,"Dublin, D, IE",indeed,"Job Req Id: 26957941 Location(s): Dublin, Leinster, Ireland Job Type: Hybrid Posted: May. 08, 2026 **Discover your future at Citi** -------------------------------- Working at Citi is far more than just a job. A career with us means joining a team of more than 230,000 dedicated people from around the globe. At Citi, you’ll have the opportunity to grow your career, give back to your community and make a real impact. **Job Overview** ---------------- We are looking for a motivated and detail‑oriented **Junior Python / PySpark Developer** to join our data engineering team. The ideal candidate will assist in developing, maintaining, and optimizing data processing pipelines using Python and PySpark, working closely with senior engineers and stakeholders to support analytics and data\-driven applications. **Responsibilities:** --------------------- * Assist in the development, testing, and maintenance of Python applications and data pipelines * Work with Python data libraries such as Pandas and NumPy for data analysis, transformation, and validation * Support PySpark‑based data processing for large‑scale datasets under guidance from senior engineers * Write clean, efficient, and well‑documented Python code * Debug and fix issues in batch and data‑processing jobs * Participate in code reviews and follow best practices in performance and data handling * Collaborate with cross‑functional teams including data engineers, QA, and DevOps **Qualifications:** * 2\-5 years of relevant experience in the Financial Service industry * Intermediate level experience in Applications Development role * Consistently demonstrates clear and concise written and verbal communication * Demonstrated problem\-solving and decision\-making skills * Ability to work under pressure and manage deadlines or unexpected changes in expectations or requirements **Education:** * Bachelor’s degree/University degree or equivalent experience **What we can offer you:** By joining Citi Dublin, you will not only be part of a business casual workplace with a hybrid working model (up to 2 days working at home per week), but also receive a competitive base salary (which is annually reviewed) and enjoy a whole host of additional benefits that support you (and your family) to be well, live well and save well. Discover more here. Alongside these benefits Citi is committed to ensuring our workplace is where everyone feels comfortable coming to work as their whole self every day. We want the best talent around the world to be energized to join us, motivated to stay, and empowered to thrive. Sounds like Citi has everything you need? Then apply to discover the true extent of your capabilities. This job description provides a high\-level review of the types of work performed. Other job\-related duties may be assigned as required. \#LI\-MK2 This job description provides a high\-level review of the types of work performed. Other job\-related duties may be assigned as required. \- **Job Family Group:** --------------------- Technology \- **Job Family:** --------------- Applications Development \- **Time Type:** -------------- Full time \- **Primary Location Full Time Salary Range:** -------------------------------------------- 57 330,00 € \- 80 270,00 € \- **Most Relevant Skills** ------------------------ Please see the requirements listed above. \- **Other Relevant Skills** ------------------------- For complementary skills, please see above and/or contact the recruiter. \- **Automated Processing and AI** ------------------------------- We use automated processing, including artificial intelligence, for our legitimate business interests (or our reasonable and appropriate business purposes) to identify and align the candidate's skills and abilities with a specific job opening. Additionally, if you so choose, or consent, we can match your skills and abilities to other suitable roles at Citi. Importantly, all our hiring processes and decisions, including determining your suitability for a role, are conducted, checked, and decided by individuals. Our automated processing and AI do not involve relying on automatic or autonomous decision\-making. Please refer to any Jurisdictional Considerations, with specific provisions for your country (where relevant) for further details. \- *This job opening is for an existing job vacancy.* \- *Citi is an equal opportunity employer, and qualified candidates will receive consideration without regard to their race, color, religion, sex, sexual orientation, gender identity, national origin, disability, status as a protected veteran, or any other characteristic protected by law.* *If you are a person with a disability and need a reasonable accommodation to use our search tools and/or apply for a career opportunity review* *Accessibility at Citi**.* *View Citi’s* *EEO Policy Statement* *and the* *Know Your Rights* *poster.*",https://ie.indeed.com/viewjob?jk=68217b4fa8cedd62
Kubernetes Engineer,InterSystems,,linkedin,"**Overview** We are seeking a Kubernetes Engineer to join our global infrastructure team and help scale, automate, and secure our container orchestration environments across on\-premises and public cloud platforms. As a Kubernetes specialist, you’ll work closely with DevOps, SRE, and security teams to deliver reliable, self\-service, and production\-ready Kubernetes clusters that power mission\-critical applications. **Key Responsibilities** **Cluster Management** * Deploy, manage, and upgrade Kubernetes clusters using tools like kubeadm, EKS, AKS, GKE, or Rancher. * Implement robust RBAC, network policies, ingress controllers, and security frameworks in Kubernetes. **Automation \& IaC** * Automate cluster provisioning and application deployment pipelines using Terraform, Helm, and ArgoCD. * Build reusable modules for consistent infrastructure delivery across staging and production. **CI/CD Integration** * Integrate Kubernetes with modern CI/CD workflows for rapid, safe application delivery. * Support GitOps practices and continuous deployment automation. **Monitoring, Logging \& Troubleshooting** * Implement observability for Kubernetes using Prometheus, Grafana, Loki, and Fluentd/Fluent Bit. * Troubleshoot performance issues, failed pods, memory leaks, and cluster degradation events. **Cloud \& Hybrid Deployments** * Operate Kubernetes workloads across AWS, Azure, GCP, and hybrid/on\-prem environments. * Use tools like Velero, Kasten, or Stash for backup/restore strategies in Kubernetes. **Collaboration \& Support** * Partner with application developers, SREs, and security teams to implement best practices. * Serve as a technical advisor on cloud\-native architectures and containerization s **Experience/Qualification Required** * Certified Kubernetes Administrator (CKA) – Highly preferred * Certified Kubernetes Application Developer (CKAD) * Certified Kubernetes Security Specialist (CKS) * AWS Certified DevOps Engineer – Professional * Google Professional Cloud DevOps Engineer * HashiCorp Certified: Terraform Associate * Linux Foundation Certified System Administrator (LFCS) **Nice to have:** * Experience with GitOps tools (ArgoCD, Flux). * Observability tools like Prometheus, Grafana, ELK/EFK stack. * Experience with service mesh technologies (Istio, Linkerd). * Open\-source contributions in Kubernetes\-related projects * Spectro cloud, Incus, Cloud 9 etc… **About InterSystems** InterSystems, a creative data technology provider, delivers a unified foundation for next\-generation applications for healthcare, finance, manufacturing, and supply chain customers in more than 80 countries. Our data platforms solve interoperability, speed, and scalability problems for large organizations around the globe to unlock the power of data and allow people to perceive data in imaginative ways. Established in 1978, InterSystems is committed to excellence through its 24×7 support for customers and partners around the world. Privately held and headquartered in Boston, Massachusetts, InterSystems has 38 offices in 28 countries worldwide. For more information, please visit **InterSystems.com** .",https://www.linkedin.com/jobs/view/4369260458
