title,company,location,site,description,job_url
30hr Stylist,Levi Strauss & Co.,"Kildare, County Kildare, Ireland",linkedin,"**About Us** LS\&Co. is one of the most iconic companies in the world and a global leader in jeanswear. Here, you can be yourself and be part of something bigger. You can do what you love while staying true to who you are. Come find your fit — and your future — at LS\&Co. **What You’ll Be Doing** Our **Stylists** are at the heart of the Levi’s® store experience. You’re not just selling jeans — you’re helping fans express themselves, feel confident, and find their perfect fit. Without our Stylists, the Levi’s® story wouldn’t come to life in\-store. **Here’s How You’ll Make It Happen** * Creating genuine connections with customers and delivering exceptional 1:1 service * Sharing product knowledge and styling advice that inspires confidence * Supporting store operations including tills, fitting rooms, and stock management * Maintaining strong visual merchandising and store presentation standards * Working with your team to achieve and exceed sales goals while keeping the store a welcoming place to shop **What You’ll Bring** * A love for helping people express themselves through style and fashion * Strong communication skills and a positive, team\-first attitude * Curiosity, adaptability, and a passion for learning and development * Previous retail or customer\-facing experience is an advantage, but not essential * Pride in delivering high\-quality service that reflects the values of the Levi’s® brand * Flexibility to work evenings, weekends, and bank holidays **LOCATION** Kildare, Ireland **FULL TIME/PART TIME** Part time **Current LS\&Co Employees, apply via your Workday account.**",https://www.linkedin.com/jobs/view/4402703279
AI Applied Researcher,Accenture UK & Ireland,"Dublin, County Dublin, Ireland",linkedin,"**Job Description:** Join the Accenture Labs’ AI R\&D Team and work on core AI Models / technology that work across multiple domains. **The Opportunity** As an **Applied Scientist** , you will sit at the intersection of **advanced AI research and real\-world business impact** . You will translate state\-of\-the\-art machine learning and AI techniques into **practical, scalable solutions** that solve complex problems across real datasets, products, and client environments. This role is ideal for someone who enjoys moving beyond pure research to **own the end\-to\-end lifecycle** of AI solutions—from problem formulation and experimentation to validation, deployment, and measurable outcomes. **Key Responsibilities \& Impact** This role offers a unique mix of deep research and hands\-on development: **Research Synthesis** : Review, analyze, and strategically summarize the latest academic and industry research in technical domains (e.g., LLM domain adaptation, knowledge integration, reasoning techniques). **Adapt foundation and compact language models** to specialized domains using techniques such as fine\-tuning, continued pre\-training, distillation, and parameter\-efficient methods (e.g. LoRA). **Design and implement agentic LLM systems** that integrate external tools (APIs, databases, services, rule engines) to perform precision and verifiable tasks. **Hands\-on Prototype Development** : Collaborate directly with Senior Research Scientists to rapidly design, build, and test Proof\-of\-Concepts. **Research Dissemination** : Articulate complex research findings into clear, persuasive, and publishable papers and presentations for both academic and business audiences. **Strategic Storytelling** : Craft engaging narratives and technical demonstrations that translate research outcomes into clear, compelling value propositions. **Job Qualifications** : - Master’s plus 2\-3 years industry experience or PhD in Computer Science / AI (Area of Study: AI / ML / NLP) with 1\-2 years industry experience. - Strong foundation in machine learning, including supervised learning, embeddings, evaluation metrics, and data preprocessing. - Strong analytical and critical thinking skills. - Good written and verbal communication abilities, with the capacity to structure presentations for maximum clarity and impact. - Experimental design expertise, including the ability to design controlled experiments, define meaningful baselines, and interpret results using appropriate quantitative metrics. - Ability to collaborate effectively with researchers, engineers, and product stakeholders in cross\-functional environments. - Ability to track, evaluate, and apply relevant research literature. - Strong programming skills in Python, including experience with libraries such as PyTorch (preferred), TensorFlow. **Primary Skills:** - Ability to implement custom models (neural networks, transformers), layers, or loss functions. - Small Language Models (SLMs): hands\-on experience building, adapting, and evaluating compact language models; understanding of domain adaptation techniques, efficiency trade\-offs, and deployment constraints. - Agentic LLMs \& Tool Use: experience integrating LLMs with external tools and systems to execute structured, multi\-step tasks with high precision. - Experience integrating external knowledge sources into LLM/SLM systems, such as databases, document collections, knowledge graphs, or rule\-based systems. - Demonstrated ability to combine model reasoning, external knowledge, and tools into reliable end\-to\-end systems. - **Bonus Skills (Not Required But Valuable)** - Prior experience in an AI research lab, applied research group, or advanced R\&D environment. - Publications, preprints, or open\-source contributions. - Exposure to responsible AI, model risk, or safety\-related evaluations. - Domain expertise in a complex or regulated field (healthcare or finance). **Does this appeal to you? If so, we wish to hear from you.** Please advise if you have any particular requirements, so we can look into arranging reasonable adjustments to the recruitment process. You can contact us at accessIErecruitment@accenture.com **What’s in it for you:** At Accenture Ireland, in addition to a competitive base salary, you will also have an extensive benefits package which includes pension, private health insurance, discounted gym membership, emergency caring facilities, and 2 days’ leave per year for charitable work of your choice! Flexible working arrangements can be discussed depending on the position.",https://www.linkedin.com/jobs/view/4330281193
AI Engineer,Version 1,"Dublin, County Dublin, Ireland",linkedin,"**Company Description** Version 1 has celebrated 30 years in business and continues to be trusted by global brands to deliver technology and transformation solutions that drive customer success. Our deep expertise enables our customers to navigate the rapidly evolving technology landscape. We foster strong partnerships with global technology leaders including Microsoft, AWS, Oracle, Red Hat, OutSystems, Snowflake, ensuring that our customers are provided with the highest quality solutions and services. We’re an award\-winning employer reflecting how our employees are at the very heart of what we do: * UK \& Ireland's premier AWS, Microsoft \& Oracle partner * 3300\+ strong, €350/£300m revenue business * 10\+ years as a Great Place to Work in Ireland \& UK * Best Workplace for Women in the UK \& Ireland by GPTW * Best Workplace for Wellbeing in the UK by GPTW We’re a core values driven company, we hire people who share our values, and we reward those who display and foster them, it’s deeply embedded within our DNA. Invest in us and we’ll invest in you!. **Job Description** * Develop and maintain back\-end AI\-powered applications and services. * Build and integrate LLMs and multi\-agent systems using frameworks like Semantic Kernel, LangChain, or similar. * Design and implement front\-end interfaces for AI applications using modern frameworks (React, Vue.js, Angular). * Integrate front\-end components with AI APIs and backend services using REST and GraphQL. * Collaborate with data engineers, UX designers, product managers, and QA teams to deliver end\-to\-end AI solutions. * Apply MLOps practices for model deployment, monitoring, and lifecycle management. * Build intuitive, accessible, and standards\-compliant UIs for GenAI applications. * Support junior team members through knowledge sharing and mentoring. * Maintain comprehensive documentation on AI models, including strengths, limitations, and data\-driven justifications. * Ensure secure and compliant development of AI systems in line with GDPR, EU AI Act, and Responsible AI guidelines. **Qualifications** * 4\-6 years experience in Applications Development Lifecycle. * Proven experience in backend development for AI applications and orchestration of LLMs/multi\-agent systems. * Proficiency in Python and ML frameworks such as TensorFlow and PyTorch. * Experience with cloud ML services like Azure ML and AWS SageMaker. * Strong front\-end development skills in HTML, CSS, JavaScript, TypeScript, and frameworks like React, Vue.js, or Angular. * Experience with design tools and systems like Figma and Storybook. * Knowledge of API integration, REST, GraphQL, and backend service orchestration. * Demonstrated experience in prompt engineering and experimentation with multiple AI models. * Familiarity with Agile methodologies, Scrum practices, and Application Lifecycle Management in a .NET environment. * Experience in automated testing, including unit, integration, and end\-to\-end testing using modern frameworks. * Understanding of AI security best practices and regulatory compliance (GDPR, EU AI Act). * Strong communication skills in English, both written and verbal (IET or equivalent). **Additional Information** **Why Version 1?** At Version 1, we believe in providing our employees with a comprehensive benefits package that prioritises their wellbeing, professional growth, and financial stability. * Share in our success with our Quarterly Performance\-Related Profit Share Scheme, where employees collectively benefit from a share of our company's profits * Strong Career Progression \& mentorship coaching through our Strength in Balance \& Leadership schemes with a dedicated quarterly Pathways Career Development programme * Flexible/remote working, Version 1 is tremendously understanding of life events and people’s individual circumstances and offer flexibility to help achieve a healthy work life balance * Financial Wellbeing initiatives including; Pension, Private Healthcare Cover, Life Assurance, Financial advice and an Employee Discount scheme * Employee Wellbeing schemes including Gym Discounts, Bike to Work, Fitness classes, Mindfulness Workshops, Employee Assistance Programme and much more. Generous holiday allowance, enhanced maternity/paternity leave, marriage/civil partnership leave and special leave policies * Educational assistance, incentivised certifications, and accreditations, including AWS, Microsoft, Oracle, and Red Hat * Reward schemes including Version 1’s Annual Excellence Awards \& ‘Call\-Out’ platform. * Environment, Social and Community First initiatives allow you to get involved in local fundraising and development opportunities as part of fostering our diversity, inclusion and belonging schemes. And many more exciting benefits… drop us a note to find out more. Version 1 is an equal opportunities employer. We are committed to building a diverse, inclusive and respectful workplace where everyone feels valued and able to thrive. We welcome applications from people of all backgrounds, identities and lived experiences, and we value the different perspectives people bring. We want every candidate to have a positive and accessible recruitment experience. If you need reasonable adjustments at any stage of the process, please contact ekta.bahl@version1\.com at Version 1\. We will consider all requests carefully, respectfully and confidentially. **Video Links** https://www.youtube.com/watch?v\=F\_d3ELTH5zo",https://www.linkedin.com/jobs/view/4400844077
"Account Strategist, SMB Sales, GCS (Czech/Slovak, English)",Google,"Dublin, County Dublin, Ireland",linkedin,"**Minimum qualifications:** * Bachelor's degree or equivalent practical experience. * 2 years of experience in advertising sales, marketing, consulting or media. * Ability to communicate in Czech or Slovak and English fluently to support client relationships and drive sales in this region. **Preferred qualifications:** * Experience assessing and achieving client success via business techniques, including effective questioning, objection managing and engaged promotions. * Experience in managing digital advertising campaigns with a focus on performance marketing. * Knowledge of business, online marketing strategy and tactics. * Ability to build compelling narratives and utilize storytelling as a client engagement strategy. * Ability to consistently achieve business quotas to drive growth. * Ability to own a portfolio in an advertising or media sales context in Czech Republic and Slovakia. **About the job** Businesses of all shapes and sizes rely on Google’s unparalleled advertising solutions to help them grow in today's dynamic marketing environment. You bring a passion for sales, knowledge of online media, and commitment to maximize customer success. You act like an owner, move with velocity through change, finding innovative and strategic ways to consistently deliver extraordinary and incremental outcomes for both Google and your customers. You build trusted relationships with customers, uncovering their business needs and translating them into powerful solutions to achieve their most ambitious goals. You achieve as a team with sellers, shape the future of advertising in the AI\-era, and make a real impact on the millions of companies and billions of users that trust Google with their most important goals. Google Customer Solutions (GCS) sales teams are trusted advisors and competitive sellers who maintain a relentless focus on customer success by bringing the best Google has to offer to small\- and medium\-sized businesses (SMBs), which are the backbone of our communities. As a member of our team, you’ll have the opportunity to work with company owners and make a real difference in their businesses by helping them grow. Together, we help shape the future of innovation for customers, partners, and sellers...and we have fun doing it. **Responsibilities** * Deliver against ambitious quarterly business and product growth goals. * Establish relationships via phone calls or e\-mail marketing and conduct regular phone consultations and sales pitches with clients to advise them on how to get the best return on their Google Ads investment. * Own a portfolio of small businesses by thoroughly understanding growth drivers identifying opportunities for growth, managing risks and building quarterly plans for achievement. * Drive customer growth by delivering outstanding customer sales experience and achieving customer business and marketing objectives. * Build and manage relationships with stakeholders, the end customer, and agencies. Google is proud to be an equal opportunity workplace and is an affirmative action employer. We are committed to equal employment opportunity regardless of race, color, ancestry, religion, sex, national origin, sexual orientation, age, citizenship, marital status, disability, gender identity or Veteran status. We also consider qualified applicants regardless of criminal histories, consistent with legal requirements. See also Google's EEO Policy and EEO is the Law. If you have a disability or special need that requires accommodation, please let us know by completing our Accommodations for Applicants form .",https://www.linkedin.com/jobs/view/4390736660
Administrator,Mercury,"Dublin, County Dublin, Ireland",linkedin,"Administrator, Ballycoolin Business Park, Dublin Apply Now **Mercury is the European leader in construction solutions** . We build and manage complex engineering \& construction projects for the world’s leading corporations. Our solutions help deliver technologies and life changing advancements that connect people, communities and businesses, giving them the power to achieve incredible things. Our people have the courage to be innovative. Their determination and sharp focus enable us to deliver with certainty, time and time again. We deliver our clients’ visions through leading edge construction solutions across multiple sectors, including Enterprise Data Centres, Advanced Technology \& Life Sciences, Hyperscale Data Centres and Fire Protection.At Mercury, it is our duty to encourage and back our people to realise their vision of themselves. We place them at the heart of what we do, providing challenging opportunities to develop within a great team in a supportive environment that allows them to reach their full potential. **Scope of the Role** The Administrator will provide administrative and coordination support to the Fire Protection Operations Team to ensure the successful delivery of fire sprinkler system installations. Based in Mercury’s Head Office in Ballycoolin, the role supports the Ops. Managers in managing project documentation, coordinating communication between contractors and consultants, assisting with contract administration processes, and ensuring that fire protection works are delivered in accordance with project specifications, requirements, and company procedures. This role plays an important part in maintaining organised project records, supporting administration processes, and assisting with the smooth day\-to\-day running of fire protection installation projects from project award through to commissioning and final handover. **Key Responsibilities Of The Role** * Provide seamless administrative support to the Ops Manager , including coordinating travel arrangements, scheduling meetings, and assisting with general day\-to\-day project administration. * Maintain project documentation systems, ensuring drawings, technical submissions, RFIs, and correspondence relating to fire protection works are accurately recorded and updated. * Prepare and distribute meeting agendas, minutes, and action trackers for internal project meetings and coordination meetings with contractors and consultants. * Previous experience in administration, project administration, or contract administration, ideally within the construction, engineering, or mechanical services industry **Essential Criteria For The Role** * Min 2 years’ experience supporting project managers or project teams in a busy office or project environment. * Strong organisational skills with the ability to manage multiple tasks and maintain accurate project documentation. * Excellent communication and coordination skills when working with project teams and external stakeholders. **Desirable Skills** * Experience in the construction or engineering industry * Experience using SAP ***Mercury*** ***is an equal opportunities employer*** . Apply Now",https://www.linkedin.com/jobs/view/4391398518
Automation Engineer (Rockwell),NeoDyne,"Dublin, County Dublin, Ireland",linkedin,"NeoDyne is a leading engineering company specialising in industrial automation, digital manufacturing, and electrical engineering solutions. With a strong presence across multiple sectors, including Life Sciences, Food \& Beverage, and Energy, NeoDyne delivers leading\-edge solutions that drive efficiency, safety, and performance for its customers worldwide. With a team of 220\+ skilled engineers, our expertise spans the entire project lifecycle, from design and implementation to commissioning and operations. From our offices in Ireland, the UK, Romania, and the US, we operate on a global scale, combining technical expertise with local delivery. We support customers across Europe, North America, and Asia, delivering tailored engineering services that drive long\-term success. NeoDyne is seeking an experienced **Automation Engineer** to support one of our key client sites on a contract basis. The successful candidate will work closely with the NeoDyne team and play a critical role in delivering automation expertise across the Dublin based site. This role operates in a **System Owner capacity** , responsible for the **day\-to\-day support, reliability, and continuous improvement** of critical automation systems supporting **Formulation, Fill / Finish, Lyophilisation, Inspection and Packaging operations** within a **GMP\-regulated environment** . **Responsibilities** * Act as System Owner for critical automation systems in a GMP manufacturing environment * Own the lifecycle management of automation systems, including maintenance, upgrades, and validation * Provide hands\-on automation support to manufacturing during routine operations, shutdowns, and engineering activities * Lead and support troubleshooting, incident investigations, and root cause analysis for automation\-related issues * Manage Change Controls, Deviations, and CAPAs associated with automation systems * Maintain accurate system documentation, configuration control, and software versioning * Implement CAPAs through software changes, configuration updates, and documentation revisions * Review existing system designs and recommend improvements aligned with modern automation and regulatory standards * Support new product introductions, technology transfers, and system upgrades from an automation perspective * Work closely with Operations, Engineering, Quality, and vendors to deliver automation improvements * Support digitalisation and Industry 4\.0 initiatives, including data integration and system connectivity * Promote a strong safety and quality culture, ensuring adherence to GMP and EHS requirements **Requirements** * Degree in Automation, Electrical, Computer, Chemical, Biotech Engineering, or related discipline * 5\+ years' experience in a pharmaceutical or biopharmaceutical manufacturing environment * Strong experience supporting automation systems in a live GMP manufacturing setting * Rockwell Automation expertise, including:, Allen\-Bradley PLCs, FTView SCADA * Proven experience with system ownership, troubleshooting, and lifecycle management * Experience managing Change Controls, Deviations, and CAPAs * Good working knowledge of GAMP lifecycle, GMP, and data integrity requirements * Strong communication skills and ability to work cross\-functionally **Desired/Nice to Have** * Experience with biopharmaceutical Formulation or Fill / Finish systems * Exposure to Inspection or Packaging automation * Experience with FTBatch / batch or recipe\-driven systems * Knowledge of ISA\-88 / ISA\-95 standards * Experience with industrial networks (e.g. Ethernet/IP, ControlNet, DeviceNet, BACnet) * Exposure to digitalisation / Industry 4\.0 initiatives * Experience supporting technology transfers or new product introductions **Characteristics** We look for candidates who * Work well as part of a team. * Have excellent problem solving and diagnostic skills. * Can complete tasks independently, capable of self\-learning. * Can prioritise and coordinate work. * Have excellent customer service, interpersonal, communication and organisational skills. * Can multitask and work well under pressure. * Are a strategic business thinker. **What's On Offer** * Competitive hourly rate based on experience * Paid overtime available, depending on project demands * Flexible working hours may be accommodated in line with project requirements * Opportunity to work on a high\-profile biopharma site with a collaborative, technically strong team * Chance to be part of NeoDyne's network of engineering professionals, contributing to impactful automation solutions in the life sciences sector NeoDyne Ltd is an equal opportunity employer, and all applications will be treated in strictest confidence. Applicants must hold a valid EU passport or have the legal right to work in Ireland (e.g. Stamp 4\).",https://www.linkedin.com/jobs/view/4365258210
