title,company,location,site,description,job_url
"Seasonal Sales Associate, Tommy Hilfiger Liffey Valley",Tommy Hilfiger,"Dublin, D, IE",indeed,"### **Seasonal Sales Associate, Tommy Hilfiger Liffey Valley** * **R54073** * **Dublin, County Dublin, Ireland** * **Part Time** * **Tommy Hilfiger** **ADD TO FAVORITES** VIEW FAVORITES **Be part of an iconic story.** TOMMY HILFIGER is one of the world’s most recognized global lifestyle brands, confidently welcoming and inspiring consumers since 1985\. Originally established in New York City and infused with the vibrant spirit of Americana, to create the modern uniform of accessible luxury. The TOMMY HILFIGER brands consist of TOMMY HILFIGER and TOMMY JEANS, complemented by a range of licensed product categories that extend the brand lifestyle across generations, geographies, activities and occasions. Tommy Hilfiger’s global marketing approach and communications strategy taps into culture through the world of F.A.M.E.S.: the people, organizations and ideas boldly driving the future of Fashion, Art, Music, Entertainment and Sport. Major global campaigns, sponsorship platforms, and disruptive activations with world\-class athletes, musicians and entertainers bring a constant source of energy and inspiration to the brand. Immerse yourself in TOMMY HILFIGER here! (**YouTube**, **Instagram**, **TikTok**) About THE ROLE Our stores are the life and soul of our business. They act as our main touch points with our ever\-evolving consumer base. As the world of retail evolves, we, as a business, believe that for all other parts of the chain to work, our stores must set the tone of what our two brands are all about. Irrespective of where our consumers eventually make a purchase, our stores, are always a window to our great brands. As a result, our locations are paramount, first\-class experience must be a given and our in\-store standards should never be questionable. To deliver this, we strive to hire the individuals who live and breathe the values of our business; who are obsessed with delivering great service to our customers and who truly believe that to remain relevant in today’s world, we must be nimble and adapt to change and evolution. The Sales Associate plays a key role in achieving these high standards. Responsibilities include: * Ensuring high levels of customer satisfaction through excellent service * First point of contact for authorizing discounts and resolving customer queries * Being a brand ambassador, demonstrating in\-depth product knowledge. * Building and maintaining professional relationships with our customers. * Outfit building for customers and making further product recommendations. * Assessing customers’ needs and providing assistance and information on product features. * Driving store KPIs and suggesting ways to improve. * Ensuring shop and stock room maintenance, presentation and organization issues are addressed in an appropriate manner. About YOU * You'll connect to consumers and have a previous track record within hospitality or retail. * You'll be an effective communicator with the collaborate to win. * You'll inspire trust and recognize and celebrate the contributions and achievements of others. * You’ll adapt fast. * You’ll act with purpose, showing a clear presence on the shop floor. * You'll take ownership and make informed decisions to find in\-store solutions. **About PVH:** We are brand builders who focus our passion and creativity to build Calvin Klein and TOMMY HILFIGER into the most desirable lifestyle brands in the world and at the same time position PVH as one of the best\-performing brand groups in our sector. Guided by our values and enabled by our scale and global reach, we are driving fashion forward for good, as one team with one vision and one plan. That’s the Power of Us, that’s the Power of PVH\+. One of PVH’s greatest strengths is our people. Our collective desire is to create a workplace environment where every individual is valued, and every voice is heard, and we are committed to fostering an inclusive and diverse community of associates with a strong sense of belonging. Learn more about Inclusion \& Diversity at PVH **here**. *PVH Corp. or its subsidiary (""PVH"") is an equal opportunity employer and considers all applicants for employment on the basis of their individual capabilities and qualifications without regard to race, ethnicity, color, sex, gender identity or expression, age, religion, national origin, citizenship status, sexual orientation, genetic information, physical or mental disability, military status or any other characteristic protected under federal, state or local law. In addition to complying with all applicable laws, PVH is also committed to ensuring that all current and future PVH associates are compensated solely on job\-related factors such as skill, ability, educational background, work quality, experience and potential.*",https://ie.indeed.com/viewjob?jk=9919a41aa2fff6c1
Services Sr. Account Executive,SAP,"Dublin, D, IE",indeed,"**We help the world run better** At SAP, we keep it simple: you bring your best to us, and we'll bring out the best in you. We're builders touching over 20 industries and 80% of global commerce, and we need your unique talents to help shape what's next. The work is challenging – but it matters. You'll find a place where you can be yourself, prioritize your wellbeing, and truly belong. What's in it for you? Constant learning, skill growth, great benefits, and a team that wants you to grow and succeed. **What you'll do:** As a Services Account Executive (SAE), you will play a pivotal role in driving the development and growth of new Services business, managing strategic relationships, and representing the SAP Services organization from a sales and business development perspective. * Account \& Customer Relationship Management: + Develop and maintain effective relationships with senior executives in assigned accounts. + Act as the single point of contact for the customer, representing the SAP Services organization to establishing and expand Services footprint. + Contribute directly to the long\-term success of customer and partner relationships within the account. * Demand Generation, Pipeline, and Opportunity Management: + Generate qualified opportunities based on a holistic understanding of customer challenges. * Sales Excellence: + Develop and deliver best\-practice comprehensive Services account plans to address customer and prospects priorities and pain points. + Be accountable for booking and consumption targets for services in the assigned account(s). + Manage opportunities and bids, shaping deals in alignment with agreed governance processes, controls, and targets. * Leading a (Virtual) Account Team + Orchestrate resources to execute winning sales and support delivery teams. + Collaborate effectively within the SAP ecosystem. + Manage customers and partners while applying value selling and solution selling techniques. **What you bring:** * 5\+ years of direct quota carrying selling experience in enterprise software and services industry. * Demonstrated success in managing accounts, generating and managing opportunities, and deal closure. * Intimate knowledge of enterprise software projects and the overall lifecycle management of enterprise applications. * Experience working with large multinational customers and in other countries and regions. * Bachelor’s or master’s Degree * Proficiency in Business English and local language, additional languages a distinct advantage **Meet your team:** Join a collaborative team of seasoned professionals who are passionate about driving business growth and building lasting customer relationships. Work in a dynamic and diverse environment where respect, fairness, and collaboration are paramount. **Skills you’ll use:** **Professional Skills** Complex Problem Solving Business Acumen Influencing Skills Strategic Thinking Results Orientation **Tech Industry \& SAP General Skills** Key Performance Indicators (KPIs) Agile Methodology Technology Innovation Go\-to\-Market Strategy Process Improvement SAP Cloud Suite Portfolio **Role Specific Skills** Account Governance Complex Sales Customer Value Proposition Negotiation Sales Territory Management Sales Qualification Sales Forecasting Overcoming Objections Relationship Building **Bring out your best** SAP innovations help more than four hundred thousand customers worldwide work together more efficiently and use business insight more effectively. Originally known for leadership in enterprise resource planning (ERP) software, SAP has evolved to become a market leader in end\-to\-end business application software and related services for database, analytics, intelligent technologies, and experience management. As a cloud company with two hundred million users and more than one hundred thousand employees worldwide, we are purpose\-driven and future\-focused, with a highly collaborative team ethic and commitment to personal development. Whether connecting global industries, people, or platforms, we help ensure every challenge gets the solution it deserves. At SAP, you can bring out your best. **We win with inclusion** SAP’s culture of inclusion, focus on health and well\-being, and flexible working models help ensure that everyone – regardless of background – feels included and can run at their best. At SAP, we believe we are made stronger by the unique capabilities and qualities that each person brings to our company, and we invest in our employees to inspire confidence and help everyone realize their full potential. We ultimately believe in unleashing all talent and creating a better world. SAP is committed to the values of Equal Employment Opportunity and provides accessibility accommodations to applicants with physical and/or mental disabilities. If you are interested in applying for employment with SAP and are in need of accommodation or special assistance to navigate our website or to complete your application, please send an e\-mail with your request to Recruiting Operations Team: Careers@sap.com. For SAP employees: Only permanent roles are eligible for the SAP Employee Referral Program, according to the eligibility rules set in the SAP Referral Policy. Specific conditions may apply for roles in Vocational Training. Qualified applicants will receive consideration for employment without regard to their age, race, religion, national origin, ethnicity, gender (including pregnancy, childbirth, et al), sexual orientation, gender identity or expression, protected veteran status, or disability, in compliance with applicable federal, state, and local legal requirements. Successful candidates might be required to undergo a background verification with an external vendor. **AI Usage in the Recruitment Process** For information on the responsible use of AI in our recruitment process, please refer to our Guidelines for Ethical Usage of AI in the Recruiting Process. Please note that any violation of these guidelines may result in disqualification from the hiring process. Requisition ID: 451724 \| Work Area: Sales \| Expected Travel: 0 \- 10% \| Career Status: Professional \| Employment Type: Regular Full Time \| Additional Locations: \#LI\-Hybrid",https://ie.indeed.com/viewjob?jk=36a92199f31818d8
"Software Engineer, Payments and Risk",Stripe,"Dublin, County Dublin, Ireland",linkedin,"Note: if you are an intern, new grad, or staff applicant, please do not apply using this link and visit our jobs page for those specific postings. Who we are **About Stripe** Stripe is a financial infrastructure platform for businesses. Millions of companies \- from the world’s largest enterprises to the most ambitious startups \- use Stripe to accept payments, grow their revenue, and accelerate new business opportunities. Our mission is to increase the GDP of the internet, and we have a staggering amount of work ahead. That means you have an unprecedented opportunity to put the global economy within everyone's reach while doing the most important work of your career. **About The Organization** The Payments organization focuses on developing products and platforms that enable users to accept payments from customers efficiently. This includes building APIs for processing payments, enabling regional, non\-card payment options, and extending Stripe's capabilities to make it easy for businesses to accept in\-person payments. The Risk Engineering team develops products that minimize financial and regulatory risks while ensuring a seamless user experience, thereby safeguarding Stripe’s brand and financial stability. Team Matching: exact team matching for one of the subteams within this org will begin during final stages. Please note we may also consider you for different orgs based on your experience, location, etc. More information on our team matching process can be found here. What you’ll do We’re looking for software engineers who are interested in building software services and platforms that impact thousands of employees and millions of Stripe users, regardless of whether they’re an end user, developer, or partner. **Responsibilities** * Work with a wide range of systems, processes and technologies to own and solve problems from end\-to\-end. * Work closely with engineers, designers, and product managers to build new features and products. * Uphold our high engineering standards and bring consistency to the many codebases and processes you will encounter. * Build elegant APIs and user experiences that enable merchants to run and scale their businesses on top of Stripe. * Contribute to the design and architecture of the next generation of Stripe’s infrastructure, to meet the high growth needs of our company and customers for years to come. Who you are We're looking for someone who meets the minimum requirements to be considered for the role. If you meet these requirements, you are encouraged to apply. The preferred qualifications are a bonus, not a requirement. **Minimum Requirements** * 2\-12\+ years of industry software engineering experience (does not include internships nor includes co\-ops) * You can work effectively across the stack from top to bottom, comfortably navigating codebases with different languages and tools. * You’re equally as comfortable shipping user\-facing experiences as you are writing custom queries to analyze experiment results. * Strong coding skills in any programming language (we understand new languages can be learned on the job so our interview process is language agnostic) * Strong collaboration skills, can work across workstreams within your team and contribute to your peers’ success * Have the ability to thrive on a high level of autonomy, responsibility, and think of yourself as entrepreneurial * Interest in working as a generalist across varying technologies and stacks to solve problems and delight both internal and external users **Preferred Qualifications** * Experience working in high\-growth teams similar to Stripe. * Experience building financial systems or tools for financial experts. In\-office expectations Office\-assigned Stripes in most of our locations are currently expected to spend at least 50% of the time in a given month in their local office or with users. This expectation may vary depending on role, team and location. For example, Stripes in Stripe Delivery Center roles in Mexico City, Mexico, Bengaluru, India, and Dublin, Ireland work 100% from the office. Also, some teams have greater in\-office attendance requirements, to appropriately support our users and workflows, which the hiring manager will discuss. This approach helps strike a balance between bringing people together for in\-person collaboration and learning from each other, while supporting flexibility when possible. Pay and benefits The annual salary range for this role in the primary location is €85,000 \- €159,600\. This range may change if you are hired in another location. For sales roles, the range provided is the role’s On Target Earnings (“OTE”) range, meaning that the range includes both the sales commissions/sales bonuses target and annual base salary for the role. This salary range may be inclusive of several career levels at Stripe and will be narrowed during the interview process based on a number of factors, including the candidate’s experience, qualifications, and specific location. Applicants interested in this role and who are not located in the primary location may request the annual salary range for their location during the interview process. Specific benefits and details about what compensation is included in the salary range listed above will vary depending on the applicant’s location and can be discussed in more detail during the interview process. Benefits/additional compensation for this role may include: equity, company bonus or sales commissions/bonuses; retirement plans; health benefits; and wellness stipends.",https://www.linkedin.com/jobs/view/4413481664
Sous Chef Nove Malahide,Oliver Dunne Restaurants,"Malahide, D, IE",indeed,"**Job Title:** Sous Chef **Location:** Nove Restaurant, Malahide, Co. Dublin **Reports To:** Head Chef / Executive Chef **Job Summary** Nove Restaurant is seeking a passionate and experienced Sous Chef to support the Head Chef in the daily management of the kitchen. The Sous Chef will play a key leadership role in ensuring high standards of food quality, consistency, hygiene, and team performance. This position requires strong culinary skills, attention to detail, and the ability to lead and motivate a busy kitchen team in a fast\-paced restaurant environment. **Key Responsibilities** *Kitchen Operations* * Assist the Head Chef in managing the day\-to\-day kitchen operations. * Ensure all dishes are prepared and presented to the highest standard and in accordance with restaurant recipes and specifications. * Maintain consistency in quality, portioning, and presentation across all service periods. * Oversee kitchen service in the absence of the Head Chef. *Team Leadership* * Supervise, train, and mentor junior chefs and kitchen staff. * Support the Head Chef with staff scheduling and rota management. * Foster a positive, professional, and collaborative kitchen environment. * Ensure effective communication between kitchen and front\-of\-house teams. *Food Safety \& Compliance* * Ensure strict adherence to HACCP and food safety regulations. * Maintain high standards of cleanliness, organisation, and kitchen hygiene. * Monitor food storage, stock rotation, and labelling procedures. *Menu Development* * Assist the Head Chef with menu planning, seasonal dish development, and specials. * Contribute creative ideas while maintaining the restaurant's culinary style and standards. *Stock \& Cost Control* * Support inventory management, ordering, and supplier coordination. * Monitor stock levels and minimise waste. * Assist in controlling food costs while maintaining quality standards. **Requirements** * Minimum 3\-5 years of professional kitchen experience, including at least 1\-2 years in a senior chef or Sous Chef role. * Strong knowledge of modern cooking techniques and kitchen operations. * Experience in high\-volume, quality\-focused restaurants. * Solid understanding of HACCP and food safety standards. * Proven leadership and team management skills. * Excellent organisational and time\-management abilities. * Ability to work under pressure and maintain high standards during busy service periods. * Flexibility to work evenings, weekends, and holidays. **Preferred Qualifications** * Culinary qualification or professional cookery certification. * Experience contributing to menu design and seasonal menu planning. * Passion for fresh, locally sourced ingredients. **What We Offer** * Competitive salary based on experience. * Opportunity to work with a dynamic and creative culinary team. * Career development and progression opportunities. * Staff meals and employee benefits. * A supportive and professional working environment. **How to Apply** Interested candidates should submit their CV and a brief cover letter outlining their relevant experience and passion for hospitality.",https://ie.indeed.com/viewjob?jk=f02d230f91a5eb92
Sous Chef Nove Malahide,Oliver Dunne Restaurants,"Malahide, Ireland",linkedin,"**Job Title:** Sous Chef **Location:** Nove Restaurant, Malahide, Co. Dublin **Reports To:** Head Chef / Executive Chef **Job Summary** Nove Restaurant is seeking a passionate and experienced Sous Chef to support the Head Chef in the daily management of the kitchen. The Sous Chef will play a key leadership role in ensuring high standards of food quality, consistency, hygiene, and team performance. This position requires strong culinary skills, attention to detail, and the ability to lead and motivate a busy kitchen team in a fast\-paced restaurant environment. **Key Responsibilities** *Kitchen Operations* * Assist the Head Chef in managing the day\-to\-day kitchen operations. * Ensure all dishes are prepared and presented to the highest standard and in accordance with restaurant recipes and specifications. * Maintain consistency in quality, portioning, and presentation across all service periods. * Oversee kitchen service in the absence of the Head Chef. *Team Leadership* * Supervise, train, and mentor junior chefs and kitchen staff. * Support the Head Chef with staff scheduling and rota management. * Foster a positive, professional, and collaborative kitchen environment. * Ensure effective communication between kitchen and front\-of\-house teams. *Food Safety \& Compliance* * Ensure strict adherence to HACCP and food safety regulations. * Maintain high standards of cleanliness, organisation, and kitchen hygiene. * Monitor food storage, stock rotation, and labelling procedures. *Menu Development* * Assist the Head Chef with menu planning, seasonal dish development, and specials. * Contribute creative ideas while maintaining the restaurant's culinary style and standards. *Stock \& Cost Control* * Support inventory management, ordering, and supplier coordination. * Monitor stock levels and minimise waste. * Assist in controlling food costs while maintaining quality standards. **Requirements** * Minimum 3\-5 years of professional kitchen experience, including at least 1\-2 years in a senior chef or Sous Chef role. * Strong knowledge of modern cooking techniques and kitchen operations. * Experience in high\-volume, quality\-focused restaurants. * Solid understanding of HACCP and food safety standards. * Proven leadership and team management skills. * Excellent organisational and time\-management abilities. * Ability to work under pressure and maintain high standards during busy service periods. * Flexibility to work evenings, weekends, and holidays. **Preferred Qualifications** * Culinary qualification or professional cookery certification. * Experience contributing to menu design and seasonal menu planning. * Passion for fresh, locally sourced ingredients. **What We Offer** * Competitive salary based on experience. * Opportunity to work with a dynamic and creative culinary team. * Career development and progression opportunities. * Staff meals and employee benefits. * A supportive and professional working environment. **How To Apply** Interested candidates should submit their CV and a brief cover letter outlining their relevant experience and passion for hospitality.",https://www.linkedin.com/jobs/view/4415419007
