title,company,location,site,description,job_url
2026 Fall Co-Ops - Software Development - Demonware (Dublin),Activision,"Dublin, D, IE",indeed,"Category: Other reqId: R027550 Location: Dublin, Ireland **Job Title:** -------------- 2026 Fall Co\-Ops \- Software Development \- Demonware (Dublin) **Requisition ID:** ------------------- R027550 **Job Description:** -------------------- This role is based onsite at the Demonware Dublin office, **onsite**. About Demonware Demonware is a member of the Activision family of studios, partnering with engineers and creatives across AAA game studios to deliver the online and data services that power some of the world’s biggest franchises — including *Call of Duty* and *Crash Bandicoot*. We’re a technology company that values openness and collaboration. We believe the best ideas win, everyone should feel empowered to contribute, and while we take our work seriously, we don’t take ourselves too seriously. At Demonware, you’ll find big\-company challenges with a small\-company culture. We support millions of concurrent users and work with technologies such as Python, C\+\+, Java, Linux, MySQL, Erlang, and Kubernetes. Our co\-op students make real contributions — many see their code running in production within days of joining. Co\-op Program Requirements * Currently enrolled in a post\-secondary or graduate program * Expected graduation between January 2027 and May 2028 * Available for an **8\-month, in\-person co\-op starting September 2026** * Clear written and verbal communication * Strong debugging, analytical, and problem\-solving skills * Resume and transcript **required** * As part of the interview process, candidates will be required to complete an automated coding assessment Specific Role Requirements **Software Engineering** Software Engineering Co\-ops have touched many aspects of Demonware. Needs may shift across each team, but co\-ops in the past have helped build multiplayer features, develop core backend systems, and design tools for largescale distributed services. They gain hands\-on experience working with Kubernetes infrastructure, automation frameworks, and scalable data pipelines. Throughout the co\-op, they collaborate in design discussions, perform root cause analysis, and automate workflows to improve reliability, performance, and developer experience. Requirements: * Strong knowledge of Python, C\+\+, and/or Java * Solid understanding of algorithms and data structures * Familiarity with Linux and source control (Git preferred) * Knowledge of networking fundamentals (TCP, UDP, HTTP) Nice\-to\-Have Skills: * Experience with SQL\-based databases (MySQL preferred) * Familiarity with CI/CD concepts and tools for automating build, test, and deployment * Familiarity with Kubernetes * Exposure to security and scalability concepts * Experience building RESTful services or web applications * Clear passion for computer science showcased through personal projects, or extracurricular activities preferred **Site Reliability Engineering (SRE)** Site Reliability Engineering Co\-ops maintain and evolve Demonware’s platform while contributing to the design of highly reliable operational architecture. Co\-ops ensure services are scalable, maintainable, and built for players worldwide, working closely with cross disciplinary teams throughout the development lifecycle. They also collaborate with experienced engineers across global offices, gaining exposure to high impact, large scale systems engineering. Requirements: * Strong knowledge of Python, C\+\+, and/or Java * Solid understanding of algorithms and data structures * Experience with SQL\-based databases (MySQL preferred) * Knowledge of networking fundamentals (TCP, UDP, HTTP) * Familiarity with Linux and source control (Git preferred) * Scripting experience (Bash, and/or Groovy) * Knowledge of foundational technologies such as TCP/IP and Linux/Unix internals Nice\-to\-Have Skills * Familiarity with Kubernetes * Multi\-platform development experience * Exposure to security and scalability concepts * Experience building RESTful services or web applications How to Stand Out We encourage you to highlight: * Specific contributions on previous work/projects * Any Linux experience (school, personal, or home projects) * Programming\-related hobbies or personal projects * Notable school assignments * Open\-source contributions * Links to code repositories, portfolios, or technical blogs Office Perks * Complimentary breakfast, lunch, and drinks from a fully stocked kitchen * BBQs and Lunch \& Learns * City\-center office location * Vacation allowance * Competitive pay * Free games How to Apply You can apply directly at demonware.net. Applicants will hear back from a recruiter or WorkDay by August 2026\. The standard base pay range for this role is annually. Your Talent Professional can share additional details for this role during the hiring process. We love hearing from anyone who is enthusiastic about changing the games industry. Not sure you meet all qualifications? Let us decide! Research shows that women and members of other under\-represented groups tend to not apply to jobs when they think they may not meet every qualification, when, in fact, they often do! At Activision Blizzard, we are committed to creating a diverse and inclusive environment and strongly encourage you to apply. Our World At Activision, we strive to create the most iconic brands in gaming and entertainment. We’re driven by our mission to deliver unrivaled gaming experiences for the world to enjoy, together. We are home to some of the most beloved entertainment franchises including Call of Duty®, Crash Bandicoot™, Tony Hawk’s™ Pro Skater™, and Guitar Hero®. As a leading worldwide developer, publisher and distributor of interactive entertainment and products, our “press start” is simple: delight hundreds of millions of players around the world with innovative, fun, thrilling, and engaging entertainment experiences. We’re not just looking back at our decades\-long legacy; we’re forging ahead to keep advancing gameplay with some of the most popular titles and sophisticated technology in the world. We have bold ambitions to create the most inclusive company as we know our success comes from the passionate, creative, and diverse teams within our organization. We’re in the business of delivering fun and unforgettable entertainment for our player community to enjoy. And our future opportunities have never been greater — this could be your opportunity to level up. **Ready to Activate Your Future?** *The videogame industry and therefore our business is fast\-paced and will continue to evolve. As such, the duties and responsibilities of this role may be changed as directed by the Company at any time to promote and support our business and relationships with industry partners.* *We are committed to working with and providing reasonable**assistance**to individuals with physical and mental disabilities. If you are a disabled individual requiring an accommodation to apply for an open position, please email your request to*accommodationrequests@activisionblizzard.com*. General employment questions cannot be accepted or processed here. Thank you for your interest.*",https://ie.indeed.com/viewjob?jk=24968995f4413753
AI Data Specialist - Irish Gaelic,RWS Group,"Dublin, County Dublin, Ireland",linkedin,"We are looking for AI Data Specialists to support the improvement of AI\-generated content in Irish Gaelic. **Job Type:** Freelance **Location:** Work from home ***Work Schedule:*** Part\-time \- 10\+ hours per week. Flexible \- work whenever you want. **Start Date:** Immediately **Duration:** TBC **Rate:** 23 USD per hour (rates vary per country. If you are based elsewhere, the rates will be different) **Help Shape the Future of AI** Are you a student, recent graduate, stay\-at\-home parent, gig worker, or professional seeking flexible remote work? Are you interested in shaping the development and safety of today’s AI models? **What You’ll Do** The role involves performing diverse data\-related tasks, including: * Data collection, evaluation, and annotation * Pairwise comparisons * Counting tasks * Object tagging and labeling across different content types (audio, video, images, or collected data) **What we’re looking for:** * Native\-level fluency in Irish Gaelic * English Proficiency: Fluent or advanced proficiency in English (levels B2–C2\) * AI \& Data Capabilities (Preferred): Experience in one or more of the following areas: machine learning tasks, data collection and preprocessing, data evaluation and quality assurance, and data annotation and labeling **What We Offer** * Flexible schedule * Opportunity to earn extra income * Timely payments * The job is ideal for students, part\-timers, or stay\-at\-home parents Vendor Type When applying, please select the option that best describes your working status. **Are you a Freelancer or Private Individual?** A Freelancer is someone who has a business license and may have a VAT number or EIN for tax purposes. A VAT (Value Added Tax) number is a unique identifier assigned to registered businesses in many countries; an EIN (Employer Identification Number) is a similar identifier used in the US. A Private Individual does *not* have a business license. If you aren’t sure, you are probably a private individual. RWS embraces DEI and promotes equal opportunity, we are an Equal Opportunity Employer and prohibit discrimination and harassment of any kind. RWS is committed to the principle of equal employment opportunity for all employees and to providing employees with a work environment free of discrimination and harassment. All employment decisions at RWS are based on business needs, job requirements and individual qualifications, without regard to race, religion, nationality, ethnicity, sex, age, disability, or sexual orientation. RWS will not tolerate discrimination based on any of these characteristics.",https://www.linkedin.com/jobs/view/4418878980
AI Engineer (Salesforce & Customer Contact Platforms),CarTrawler,"Dublin, D, IE",indeed,"**Tech that takes you places** We’re CarTrawler, the global travel tech company behind seamless connections between people, places and possibilities. From powering car rental to creating smarter ways to move, we make travel smoother for millions worldwide. Our culture is built on curiosity, collaboration and craic where every idea counts and every journey matters. Ready to make an impact? Let’s go places together. Delivering smarter, safer and more scalable customer experiences sits at the heart of this AI Engineer role. Focused on Salesforce and customer contact platforms, this position turns GenAI and automation opportunities into real\-world impact across customer experience, agent effectiveness and cost\-to\-serve. Working closely with Customer Contact, Technology and Data teams, the role shapes how AI is designed, deployed and embedded across CarTrawler’s customer operations. **Your Journey starts here!** ### **What you’ll do as an AI Engineer** * Design, build and optimise AI\-powered features within Salesforce Service Cloud and Agentforce, including case summarisation, routing, agent assist and deflection flows. * Develop and iterate LLM\-powered prompts, workflows and guardrails for both customer\-facing and agent\-facing use cases. * Integrate Salesforce AI capabilities with the wider contact stack, including telephony, portals, automation tools and AI platforms. * Influence build\-vs\-buy decisions across AI, ensuring maximum leverage of Salesforce native capabilities before adding new vendors. * Run experiments and pilots, tracking impact across key metrics such as deflection, AHT, CSAT, containment and error rates. * Embed safety, governance and compliance best practices across AI solutions, including PII handling and auditability. * Partner with operations teams to ensure AI features land effectively and are fully adopted in day\-to\-day workflows. ### **What you’ll bring to the team** * 5\+ years’ experience in software engineering / platform development. * Strong hands\-on experience building solutions on Salesforce Service Cloud, including Apex, Flows and integrations. * Practical experience delivering GenAI or LLM\-based solutions in production environments. * Solid understanding of APIs, system integrations and event\-driven architectures. * A customer\- and agent\-first mindset, with a focus on measurable operational impact. * Confidence working cross\-functionally with technical and non\-technical stakeholders. * Curiosity and drive to stay ahead of evolving AI, automation and Salesforce capabilities. **Go on, give it a go!** We know that looking for a new job can feel a bit daunting but don’t let a touch of imposter syndrome hold you back. Even if you don’t tick every box, we’d still love to hear from you! Apply today to stay connected. At CarTrawler, we’re proud to be an equal opportunities employer. We celebrate diversity and are committed to creating an inclusive environment for everyone. No matter your background, identity, or life experience, if you’re passionate about what you do, you’ll be welcomed here. **Perks for the journey*** Competitive pay and benefits, including a performance\-based annual bonus, fully subsidised VHI health insurance and pension matching up to 4%. * Generous time off and flexible working, including 25 days’ annual leave, extra company days, monthly Friday Unplugged afternoons and the option to work abroad for up to 20 days a year. * Comprehensive wellbeing support, including access to health and mental health programmes (HeadsUp and EAP) and paid leave for marriage, volunteering and personal wellbeing including menstrual, menopause, and fertility leave. * Growth and recognition culture with development opportunities through training, coaching and study support plus programmes that celebrate individual and team achievements. * Everyday perks that make a difference \- subsidised canteen (KC Peaches), on\-site car parking, Bike to Work and TaxSaver schemes plus an active Sports \& Social Club. We may use artificial intelligence (AI) tools to support parts of the hiring process, such as reviewing applications, analyzing resumes, or assessing responses. These tools assist our recruitment team but do not replace human judgment. Final hiring decisions are ultimately made by humans. If you would like more information about how your data is processed, please contact us.",https://ie.indeed.com/viewjob?jk=4aff03818a402de1
AI Frameworks Engineer,Intel,"Leixlip, County Kildare, Ireland",linkedin,"**Job Details** Job Description: The Intel NPU organization is dedicated to the development of hardware accelerators for the future of AI, enabling unprecedented machine intelligence on billions of edge, desktop and mobile computers. Doing what's never been done before takes vision, innovation, and the world's best talent. You'll be immersed in a diverse, encouraging environment where everyone is encouraged to do their best work. Join the adventure of harnessing the potential of state\-of\-art deep neural networks and the most advanced AI hardware accelerator in the world. Intel is hiring software engineers for its deep learning compiler team. Our customers around the world are using NPUs to power a revolution in deep learning, enabling breakthroughs in problems from image classification, speech recognition to natural language processing. As deep learning models are becoming more versatile, using compiler technologies to achieve high performance becomes essential. We are looking for individuals who are interested in building the world's leading deep learning compiler for current and future Intel NPUs. This is a product development position with the end goal being high\-quality, high\-performance, secure product software. You will start optimizing pre\-silicon and have access to hardware shortly after it is powered on. You will be responsible for analyzing deep learning networks and developing compiler optimization algorithms. Collaborate with members of the deep learning software framework teams and the hardware architecture teams to accelerate the next generation of deep learning software. The scope of these efforts includes performance tuning and analysis, developing and implementing compiler and optimization techniques for neural networks, and other general software engineering work. You will conduct software development and optimizations in the following areas: * Develop MLIR based compiler technology for deep learning workloads on Intel NPUs. * Develop AI execution middleware based on Intel OpenVINO toolkit. * Develop large\-scale production software with validation and continuous integration in mind. * Collaborate with frameworks teams to develop compiler optimizations for the deep learning domain. * Collaborate and coordinate internally and externally with cross geographical teams such as execution runtime software, NPU hardware, infrastructure, and front\-end teams on the same project. **Qualifications** You must possess the below minimum qualifications to be initially considered for this position. Preferred qualifications are in addition to the minimum requirements and are considered a plus factor in identifying top candidates. **Minimal Qualifications** * BS/MS in Computer Science or a similar field. * At least 4 years of experience in C\+\+ programming, software design skills, including debugging, performance analysis, and test design. * Excellent data structure, algorithms and modern C\+\+ programming skills. * Strong interpersonal skills are required along with the ability to work in a multifaceted product\-oriented team. * Experience in one the following: compiler technologies, deep\-learning frameworks or algorithms, high\-performance computing, computer vision, numerical modelling. * Positive can\-do attitude, desire to deliver results and winning products. * Excellent written and oral communication skills. * You should have a passion for optimization and performance, close to hardware, as well as for good software engineering practice and usability. **Preferred Qualifications** * Experience in developing modern compilers, especially LLVM and MLIR. * Experience with formulating optimization problems and using ILP solvers (e.g. ORTOOLs, CPLEX, SCIP). * Experience in AI hardware accelerators, GPU, heterogeneous architectures software development. * A background in performance analysis and optimization, particularly in machine\-learning. * A solid understanding of modern machine\-learning primitives and LLMs. * A background in Python, modern AI frameworks and ecosystem (e.g., Torch, HuggingFace, llama.cpp, etc.). Requirements listed would be obtained through a combination of industry relevant job experience, internship experiences and or schoolwork/classes/research. **Job Type** Experienced Hire **Shift** Shift 1 (Ireland) Primary Location: Ireland, Leixlip Additional Locations: **Business Group** The Software Team drives customer value by enabling differentiated experiences through leadership AI technologies and foundational software stacks, products, and services. The group is responsible for developing the holistic strategy for client and data center software in collaboration with OSVs, ISVs, developers, partners and OEMs. The group delivers specialized NPU IP to enable the AI PC and GPU IP to support all of Intel's market segments. The group also has HW and SW engineering experts responsible for delivering IP, SOCs, runtimes, and platforms to support the CPU and GPU/accelerator roadmap, inclusive of integrated and discrete graphics. **Posting Statement** All qualified applicants will receive consideration for employment without regard to race, color, religion, religious creed, sex, national origin, ancestry, age, physical or mental disability, medical condition, genetic information, military and veteran status, marital status, pregnancy, gender, gender expression, gender identity, sexual orientation, or any other characteristic protected by local law, regulation, or ordinance. Position of Trust N/A **Work Model for this Role** This role will be eligible for our hybrid work model which allows employees to split their time between working on\-site at their assigned Intel site and off\-site. \* Job posting details (such as work model, location or time type) are subject to change.",https://www.linkedin.com/jobs/view/4418839550
"AI Research Engineer/Scientist (OpenVINO, NNCF)",Intel,"Leixlip, County Kildare, Ireland",linkedin,"**Job Details** Job Description: You will join the Neural Network Compression Tools team within the OpenVINO Developer Tools organization. As an AI Research Engineer/Scientist, you will drive the development of the Neural Network Compression Framework (NNCF). Your responsibilities will include the research and development of state\-of\-the\-art (SOTA) compression algorithms, specifically tailored for high\-performance neural network inference optimization within the OpenVINO ecosystem. **Qualifications** * Master's or PhD in Computer Science, Mathematics, or a related field (with a focus on AI/Deep Learning). \- Experienced in Python programming as well as understanding of modern programming paradigms and patterns. \- Proven experience in Deep Learning model optimization (specifically Quantization, Pruning, or Sparsity). \- Experienced in model training frameworks such as PyTorch or TensorFlow, and inference solutions such as OpenVINO. \- At least 3 years of software development. \- Spoken and written English: upper\-intermediate or advanced. Preferred (Nice\-to\-Have) Qualifications: \- Hardware Awareness: Understanding of how neural networks map to hardware (CPU, GPU, NPU) and why specific optimizations are necessary for memory\-constrained environments. \- Familiarity with modern Large Language Model architectures (Transformers, Diffusers, etc.). **Job Type** Experienced Hire **Shift** Shift 1 (Ireland) Primary Location: Ireland, Leixlip Additional Locations: **Business Group** The Software Team drives customer value by enabling differentiated experiences through leadership AI technologies and foundational software stacks, products, and services. The group is responsible for developing the holistic strategy for client and data center software in collaboration with OSVs, ISVs, developers, partners and OEMs. The group delivers specialized NPU IP to enable the AI PC and GPU IP to support all of Intel's market segments. The group also has HW and SW engineering experts responsible for delivering IP, SOCs, runtimes, and platforms to support the CPU and GPU/accelerator roadmap, inclusive of integrated and discrete graphics. **Posting Statement** All qualified applicants will receive consideration for employment without regard to race, color, religion, religious creed, sex, national origin, ancestry, age, physical or mental disability, medical condition, genetic information, military and veteran status, marital status, pregnancy, gender, gender expression, gender identity, sexual orientation, or any other characteristic protected by local law, regulation, or ordinance. Position of Trust N/A **Work Model for this Role** This role will be eligible for our hybrid work model which allows employees to split their time between working on\-site at their assigned Intel site and off\-site. \* Job posting details (such as work model, location or time type) are subject to change.",https://www.linkedin.com/jobs/view/4418828836
