title,company,location,site,description,job_url
2026 Software Dev Engineer Intern - Ireland,Amazon,"Dublin, County Dublin, Ireland",linkedin,"**Description** Do you want to solve real customer problems through innovative technology? Do you enjoy working on scalable services in a collaborative team environment? Do you want to see your code directly impact millions of customers worldwide? At Amazon, we hire the best minds in technology to innovate and build on behalf of our customers. Customer obsession is part of our company DNA, which has made us one of the world's most beloved brands. Our Software Development Engineer (SDE) interns use modern technology to solve complex problems while seeing their work's impact first\-hand. The challenges SDE interns solve at Amazon are meaningful and influence millions of customers, sellers, and products globally. We seek individuals passionate about creating new products, features, and services while managing ambiguity in an environment where development cycles are measured in weeks, not years. At Amazon, we believe in ownership at every level. As an SDE intern, you'll own the entire lifecycle of your code \- from design through deployment and ongoing operations. This ownership mindset, combined with our commitment to operational excellence, ensures we deliver the highest quality solutions for our customers. We're looking for curious minds who think big and want to define tomorrow's technology. At Amazon, you'll grow into the high impact engineer you know you can be, supported by a culture of learning and mentorship. Every day brings exciting new challenges and opportunities for personal growth. Amazon internships across all seasons are full\-time positions, and interns should expect to work in office, Monday\-Friday, up to 40 hours per week typically between 8am\-5pm. Specific team norms around working hours will be communicated by your manager. Interns should not have conflicts such as classes or other employment during the Amazon workday. Key job responsibilities * Collaborate and communicate effectively with experienced cross\-disciplinary Amazonians to design, build, and operate innovative products and services that delight our customers, while participating in technical discussions to drive solutions forward. * Design and develop scalable solutions using cloud\-native architectures and microservices in a large distributed computing environment. * Participate in code reviews and contribute to technical documentation. * Build and maintain resilient distributed systems that are scalable, fault\-tolerant, and cost\-effective. * Leverage and contribute to the development of GenAI and AI\-powered tools to enhance development productivity while staying current with emerging technologies. * Write clean, maintainable code following best practices and design patterns. * Demonstrate operational excellence through monitoring, troubleshooting, and resolving production issues. A day in the life As an intern, you will be matched to a manager and a mentor and will have the opportunity to influence the evolution of Amazon technology and lead critical projects early in your career. In addition to working on an impactful project, you will have the opportunity to engage with Amazonians for both personal and professional development, expand your network, and participate in activities with other interns throughout your internship. No matter the location of your internship, we give you the tools to own your project and learn in a real\-world setting. **Basic Qualifications** * Are enrolled in a Bachelor's degree or above in Computer Science, Computer Engineering, or related fields at time of application * Knowledge of programming languages such as C/C\+\+, Python, Java or Perl * Knowledge of computer science fundamentals such as object\-oriented design, operating systems, algorithms, data structures, and complexity analysis **Preferred Qualifications** * Experience from a technical internship * Experience with distributed, multi\-tiered systems, algorithms, and relational databases * Experience in optimization mathematics such as linear programming and nonlinear optimization * Ability to effectively articulate technical challenges and solutions * Adept at handling ambiguous or undefined problems as well as ability to think abstractly Amazon is an equal opportunities employer. We believe passionately that employing a diverse workforce is central to our success. We make recruiting decisions based on your experience and skills. We value your passion to discover, invent, simplify and build. Protecting your privacy and the security of your data is a longstanding top priority for Amazon. Please consult our Privacy Notice (https://www.amazon.jobs/en/privacy\_page) to know more about how we collect, use and transfer the personal data of our candidates. Amazon is an equal opportunity employer and does not discriminate on the basis of protected veteran status, disability, or other legally protected status. Our inclusive culture empowers Amazonians to deliver the best results for our customers. If you have a disability and need a workplace accommodation or adjustment during the application and hiring process, including support for the interview or onboarding process, please visit https://amazon.jobs/content/en/how\-we\-hire/accommodations for more information. If the country/region you’re applying in isn’t listed, please contact your Recruiting Partner. **Company** \- Amazon Development Centre Ireland Limited \- D94 Job ID: A3072042",https://www.linkedin.com/jobs/view/4392944927
AI & Data Security Engineer,The Clorox Company,"Dublin, D, IE",indeed,"Clorox is the place that’s committed to growth – for our people and our brands. Guided by our purpose and values, and with people at the center of everything we do, we believe every one of us can make a positive impact on consumers, communities, and teammates. Join our team. \#CloroxIsThePlace **Your role at Clorox:** Tech Lead – AI \& Data Security Engineer (GenAI, DLP \& DSPM) Location: Dublin, Ireland Department: ESIX Reports To: Product Owner / Tech Lead – Application \& Data Security**In this role, you will:** We are seeking a **Tech Lead – AI \& Data Security Engineer**, a high\-impact senior individual contributor who will help define and secure the future of the enterprise’s AI and data ecosystem. This role combines forward\-looking strategy, deep technical expertise, and operational ownership to deliver and scale modern security capabilities across application security, data protection, and GenAI platforms. You will own end\-to\-end outcomes from defining security strategy and influencing design decisions to ensuring controls are effectively deployed, continuously optimized, and delivering real business value. Operating within a Think / Act / Run model, this role requires deep technical expertise, strong cross\-functional partnership, and the ability to translate emerging risk into practical, scalable solutions. A critical component of this role is the leadership and governance of managed service providers (MSPs) supporting AI, data protection, and security operations. You will: * Provide technical direction, prioritization, and oversight to service providers delivering DLP, DSPM, and AI security capabilities * Establish clear operating models, SLAs, and performance expectations, ensuring services are aligned to enterprise risk priorities * Drive accountability for outcomes, including quality of findings, timeliness of remediation, and continuous control improvement * Partner with vendors to operationalize security tooling, tune controls, and enhance automation at scale * Act as the primary escalation and decision point for complex issues, ensuring risks are understood, communicated, and addressed effectively As a senior individual contributor, this position offers the opportunity to lead some of the most critical security domains through influence, technical authority, decisive execution, and strong vendor leadership, driving meaningful and measurable impact across the enterprise. **Key Responsibilities** **1\. Data Security, DLP \& DSPM** * Own technical direction and operationalization of enterprise data protection capabilities * Design and operate DLP controls across: + Endpoints + AI Platforms + Email and collaboration platforms + Cloud and SaaS environments * Lead DSPM implementation and operations, including: + Data discovery and classification + Exposure and risk analysis + Control validation and gap identification * Guide enterprise strategies for data access, sharing, retention, encryption, and key management * Partner with IAM to enable identity\-centric data protection models **2\. AI Security (Primary Focus Area)** * Lead security architecture and risk assessments for: + Microsoft Copilot \& Copilot Studio + Azure AI Foundry / Azure OpenAI + GCP Vertex AI + Third\-party and embedded SaaS AI capabilities + Identify and mitigate GenAI\-specific risks, including: - Data leakage and oversharing - Prompt injection and adversarial attacks - Insecure agent permissions, plugins, and connectors - Model, training data, and inference exposure * Define and operate AI security guardrails, including: + Data boundary enforcement + Sensitivity labeling and DLP integration + Role\-based access and least privilege + Logging, monitoring, and audit readiness **What we look for:** **Required Qualifications** * Bachelor’s degree in Computer Science, Information Security, or related field (or equivalent experience) * **7–10\+ years of experience** in application security, data security, cloud security, or AI security * Deep hands\-on expertise in: + Application and API security (OWASP Top 10\) + Cloud and SaaS security architectures + Data protection, DLP, DSPM, and encryption * Proven experience securing GenAI platforms or advanced data/analytics environments * Strong understanding of identity, access control, and governance models * Demonstrated ability to: + Lead through influence + Own operational outcomes + Drive measurable security improvements * Strong communication skills with ability to deliver executive\-ready insights and documentation **Preferred Qualifications** * Experience with Microsoft Purview (DLP, Information Protection, DSPM) * Hands\-on experience with: + Microsoft Copilot / Copilot Studio + Azure AI Foundry / Azure OpenAI + GCP Vertex AI * Familiarity with data protection and privacy regulations (e.g., GDPR, CCPA/CPRA) * Experience with DSPM tools or large\-scale data discovery platforms * Relevant certifications such as CISSP, CCSP, AZ\-500, SC\-400 **Workplace type:** \~LI\-Hybrid**Our values\-based culture connects to our purpose and empowers people to be their best, professionally and personally. We serve a diverse consumer base which is why we believe teams that reflect our consumers bring fresh perspectives, drive innovation, and help us stay attuned to the world around us. That’s why we foster an inclusive culture where every person can feel respected, valued, and fully able to participate, and ultimately able to thrive.** **Learn more****.** **Benefits we offer to help you be well and thrive:** ----------------------------------------------------- * Competitive compensation * Generous 401(k) program in the US and similar programs in international * Health benefits and programs that support both your physical and mental well\-being * Flexible work environment, depending on your role * Meaningful opportunities to keep learning and growing * Half\-day Fridays, depending on your location Please apply directly to our job postings and do not submit your resume to any person via text message. Clorox does not conduct text\-based interviews and encourages you to be cautious of anyone posing as a Clorox recruiter via unsolicited texts during these uncertain times. To all recruitment agencies: Clorox (and its brand families) does not accept agency resumes. Please do not forward resumes to Clorox employees, including any members of our leadership team. Clorox is not responsible for any fees related to unsolicited resumes.",https://ie.indeed.com/viewjob?jk=3384232024e7e2d3
AI Architect,Workhuman,,linkedin,"**Job Description** At Workhuman, we’re on a mission to make work more human by helping organisations celebrate, connect, and empower their people. We're seeking an experienced AI Architect to join our Architecture team and own the AI architecture vision for Workhuman. In this position, you'll work across Product, Data and Enterprise to architect and ensure the viability of AI Strategy across Product and Enterprise usecases. This role is ideal for a strategic technologist who thrives in a collaborative, cross\-functional environment and is passionate about building high\-quality systems that rely on rich, reliable data at scale as the foundation for intelligent products, trusted analytics, and transformative business outcomes. * This is a hybrid role requiring at least three days a week onsite in our Dublin HQ office.\*\* **What We Can Offer You** * Architect and oversee the implementation of AI/GenAI systems including LLM\-based applications, RAG pipelines, and agentic workflows. * Translate business requirements into scalable technical solutions using modern AI frameworks and cloud\-native technologies. * You will be tasked with a lot of the strategy, evangelising when and where AI should be used, what models can be used for where, how modern AI is fully integrated into the Workhuman ecosystem. * You will be big contributor in strategy for AI in the enterprise as a whole. * You will be comfortable speaking to internal and external stakeholders, being the voice for Workhuman's AI strategy going forward. * Ensure compliance with security, privacy, and responsible AI standards. * Collaborate with stakeholders across product, data science, and infrastructure to align architectural decisions with strategic goals. * As an AI architect will be responsible for making pragmatic decisions related to technologies and vendors \- taking a realistic perspective on the maturity of tools as well as the Workhuman organization when recommending tooling and patterns * Manage cost and performance trade\-offs, implementing caching strategies and selecting the right model mix. * The opportunity to set standards, best practices, and long\-term architectural direction. **The Skills You Will Bring** * Experience architecting AI agentic solutions that use LLMs and foundational models * Experience designing, documenting and governing state\-of\-the\-art agentic solutions and platforms * Ability to establish and execute an enterprise AI strategy that aligns technology investments with business priorities, governance requirements, and long\-term organizational value. * Understand governance frameworks to oversee the ethical use of AI, ensuring compliance with internal policies and external regulations. * Deep understanding of traditional AI/ML techniques: regression, classification, forecasting, clustering (e.g., Decision Trees, XGBoost, ARIMA, etc.) * Strong understanding of programmatic LLM risk controls: output format validation, output context validation, content moderation etc. * Strategic Thinking: Ability to balance short\-term delivery needs with long\-term architectural vision, anticipating future requirements and technical debt implications. * Cloud Platform Expertise: Deep experience with modern cloud\-based data ecosystems and the architectural patterns that enable scalability, resilience, and cost efficiency. * Communication \& Documentation: Strong written and verbal communication skills, with the ability to create clear architectural documentation, ADRs, RFCs, and technical strategy documents * Growth Mindset \& Innovation: curiosity and commitment to continuous learning, actively exploring new technologies, architectural patterns, and creative approaches to problem\-solving and driving innovation through experimentation and adaptation **Achievements** * Bachelor’s or Master’s degree in Computer Science, Software Engineering, Artificial Intelligence, or related field. * At least 10 years experience working in technology or relevant business * Stakeholder Engagement \& Technical Communication: Effectively communicated technical designs and trade\-offs to senior leadership and business stakeholders, building trust and securing buy\-in for architectural decisions * Delivered High\-Impact Data Platforms: Led the architecture and supported the delivery of major data platform capabilities across multiple teams, driving measurable business value alongside quality, performance and reliability. * Facilitated Cross\-Team Collaboration: Successfully brought together Business, Engineering, and Infrastructure teams to deliver complex technical initiatives, resolving technical blockers and ensuring architecture alignment throughout the delivery process. *Thank you for considering joining our team. We strive to create an inclusive and accessible application process for all candidates. If you encounter any difficulties or have specific accessibility requirements while applying for this position, please don't hesitate to reach out to us at* globalrecruitment@workhuman.com *for assistance. We are committed to ensuring equal access to opportunities for all individuals.* **The Company** *At Workhuman® our missi* *on is to bring more humanity to the workplace. We recognise and embrace individuals’ differences and believe that workforce diversity and inclusion are essential to our long\-term growth and success. Even if you don’t think you “check every single box” above, please still consider applying. We’re looking for a human who is collaborative, innovative with a growth mindset* We love what we do because we’re shaping the future of work through our people and our technology. Our human cloud\-based applications are helping some of the world’s leading global brands connect culture to shared purpose. The Workhuman Cloud empowers employees to thank, talk and celebrate each other, creating an environment that sparks gratitude and human connection while increasing employee engagement and productivity. Did you know we have an award\-winning culture across EMEA and North America: * We were named as \#5 Best Workplace in the Great Place to Work Awards in Ireland in 2022 in the large\-sized workplace category. We were also recognised as the Best Workplace for Women and the Best Workplace in Technology in 2020, 2021, and 2022\. * In 2021 we were named as \#2 Best Workplace in Europe in the medium\-sized workplace category. * We were also recognised as \#2 Best Large Places to Work in Boston by Built In for 2023 as well as the Best Place to Work in Boston, U.S. Best Large Places to Work, and U.S. Best Places to Work. * There are currently over 7\.5 million users on the Workhuman® cloud across 180 countries. * Our core values are Respect, Determination, Innovation, and Imagination. *Workhuman is an Equal Opportunity Employer and is committed to the principle of equal employment opportunity for all employees. We proudly provide a work environment free of discrimination and harassment. Employment decisions at Workhuman are based solely on business needs, job requirements, and individual qualifications, without regard to race, color, religion or belief, national, social or ethnic origin, sex (including pregnancy), age, sexual orientation, gender identity and/or expression, marital, civil union or domestic partnership status, past or present military service, or any other status protected by the laws or regulations in the locations where we operate. Workhuman believes that diversity and inclusion among our teammates is critical to our success as a global company, and we seek to recruit, develop and retain the most talented people from a diverse candidate pool.*",https://www.linkedin.com/jobs/view/4433255179
AI Operations Specialist,PE Global,,linkedin,"**PE Global is recruiting for an AI Operations Specialist** **on behalf of our pharmaceutical client in Dublin. This is an initial 12\-month contract, hybrid role.** **Onsite expectations; Dublin 2\-days a week.** **Position Summary** The AI Operations Specialist plays a central role in enabling effective, compliant, and scalable access to AI tools across Development, supporting day\-to\-day operations associated with self\-service AI license distribution and adoption. The role ensures colleagues can discover, request, and use approved AI capabilities efficiently, while helping to optimize license allocation, respond to demand, and support user onboarding in a global matrix environment. Working closely with the Director of Digital Innovation and AI as well as the AI Governance Lead, the role also supports governance activities related to AI in GxP assessments, documentation, and compliance tracking, while helping to enable key business roles to adopt AI effectively through targeted support, practical guidance, and role\-relevant use case activation. **Job Description** **AI license operations** * Manage and coordinate the distribution of self\-service AI licenses, including Copilot, Gamma, and other approved tools * Monitor usage patterns, demand signals, and access requests to help optimize license allocation across Development * Act as a central point of contact for AI license\-related queries, requests, and user support * Proactively identify teams or functions that would benefit from access to AI capabilities and support rollout planning **Cross\-functional engagement** * Work across a global matrix organization to engage stakeholders across functions and geographies * Build strong working relationships to understand business needs and support adoption of AI tools in line with demand and readiness * Partner with SMEs from key functions and roles to understand workflow needs and identify practical AI enablement opportunities * Support onboarding, awareness, and practical understanding of available AI capabilities for end users * Help surface user feedback, adoption barriers, and improvement opportunities to strengthen AI operations and experience **AI Governance and Compliance Support** * Support the AI Governance Lead in coordinating AI in GxP\-related assessments and associated governance activities * Assist in ensuring AI usage aligns with internal policies, governance expectations, and relevant regulatory requirements * Contribute to documentation, tracking, and coordination of governance actions, approvals, and supporting records **Adoption enablement and user support** * Promote awareness of available AI capabilities and encourage appropriate adoption through clear communication and user guidance * Provide responsive and practical support to colleagues using approved AI tools, helping to resolve routine queries and access issues * Support the AI enablement of key roles by helping users understand where AI can add value in their day\-to\-day work and how to use approved tools effectively * Help capture adoption insights and usage trends to inform future rollout decisions, role\-based enablement priorities, and support prioritisation **Governance enablement \& awareness** * Provide clear guidance to AI teams on compliance requirements, risk expectations, and Responsible AI practices * Promote a culture of responsible, compliant AI usage **Experience** 1. Demonstrated proficiency in AI tools including Copilot 2. Strong interest in applied AI and digital innovation 3. Strong communication and interpersonal skills, with the ability to operate effectively in a matrix environment 4. Ability to understand business workflows and translate AI capabilities into practical, role\-relevant support and guidance 5. Highly organized, with strong attention to detail and the ability to manage multiple priorities simultaneously 6. Confidence working with stakeholders to identify use cases, adoption barriers, and enablement opportunities across key roles 7. Proactive mindset with the ability to identify gaps, solve practical problems, and improve ways of working independently 8. Exposure to pharmaceutical, healthcare, or other regulated environments preferred 9. Experience working across cross\-functional or global teams preferred 10. Confident in supporting operational processes, documentation, stakeholder coordination, and user enablement in a fast\-evolving environment **Education** Degree in life sciences, data science, business, technology, or related field preferred **Interested candidates should submit an updated CV.** Please click the link below to apply, call Paul Wheatley on 083 094 0199 or alternatively send an up\-to\-date CV to paul.wheatley@peglobal.net \*\*\*Please note our client cannot assist with any visa sponsorship and candidates must have the correct visa to live and work in Ireland\*\*\*",https://www.linkedin.com/jobs/view/4433830055
